demonstration	sentence	model_type	stop_type	response
All this is causing convulsions in professional football	He remains chief executive officer	gpt-35-turbo	stop	John would say 'remains chief executive officer'.
No one else will watch out for you	He remains chief executive officer	gpt-35-turbo	stop	John would say: 'Remains chief executive officer'.
The transactions are unrelated	He remains chief executive officer	gpt-35-turbo	stop	For the sentence 'He remains chief executive officer', John would say 'remains chief executive officer'.
One apparent side effect is a minor increase in a brain hormone	He remains chief executive officer	gpt-35-turbo	stop	John would say: 'Remains chief executive officer'.
But at least they show up	He remains chief executive officer	gpt-35-turbo	stop	He would say: 'Remains chief executive officer'.
She expects both revenue and profit to gain this year	He remains chief executive officer	gpt-35-turbo	stop	"John would simply say ""remains chief executive officer""."
It also would have reduced mandatory overtime	He remains chief executive officer	gpt-35-turbo	stop	John would say 'remains chief executive officer'.
Two workers died and six remain in the hospital	He remains chief executive officer	gpt-35-turbo	stop	John would say: 'remains chief executive officer'.
Solidarity wants it from the West	He remains chief executive officer	gpt-35-turbo	stop	For the sentence 'He remains chief executive officer', John would say 'remains CEO'.
The Old Crowd is deeply concerned by the backlash from all this	He remains chief executive officer	gpt-35-turbo	stop	John would simply say 'remains chief executive officer'.
The dollar gained against most foreign currencies	He remains chief executive officer	gpt-35-turbo	stop	For the sentence 'He remains chief executive officer', John would simply say 'He'.
The election was by secret ballot in the General Assembly	He remains chief executive officer	gpt-35-turbo	stop	"John would say ""He remains CEO."""
They speak volumes about the state of our society at a given moment	He remains chief executive officer	gpt-35-turbo	stop	For the sentence 'He remains chief executive officer', John would simply say 'He'.
Both revenue figures exclude excise taxes	He remains chief executive officer	gpt-35-turbo	stop	"John would likely say ""He remains CEO."""
Turkey in any event is long past it	He remains chief executive officer	gpt-35-turbo	stop	He would say 'He remains'.
Prosecutors in Miami received yet another setback	He remains chief executive officer	gpt-35-turbo	stop	He would say 'He remains'.
Steppenwolf needs the extra seats even more than the fly space	He remains chief executive officer	gpt-35-turbo	stop	For the sentence 'He remains chief executive officer', John might say 'CEO'.
Wheat futures prices rose slightly	He remains chief executive officer	gpt-35-turbo	stop	He would say 'Chief executive officer'.
He became angry in return	He remains chief executive officer	gpt-35-turbo	stop	John would simply say 'He'.
Some equipment going to work is almost new	He remains chief executive officer	gpt-35-turbo	stop	For the sentence 'He remains chief executive officer', John would simply say 'He remains'.
It should be a scream	He remains chief executive officer	gpt-35-turbo	stop	He would say 'He remains'.
Developers are also eyeing the real estate portfolios of major corporations	He remains chief executive officer	gpt-35-turbo	stop	He remains.
Delayed financings also would affect the operations of many companies	He remains chief executive officer	gpt-35-turbo	stop	For the sentence 'He remains chief executive officer', John would likely say 'He remains'.
The thrift and the holders had suspended their lawsuits as part of the agreement	He remains chief executive officer	gpt-35-turbo	stop	For the sentence 'He remains chief executive officer', John would say 'He remains'.
That lawsuit is still pending	He remains chief executive officer	gpt-35-turbo	stop	He remains chief executive.
Conner already is shipping its new drives	He remains chief executive officer	gpt-35-turbo	stop	For the sentence 'He remains chief executive officer', John would likely say 'He remains'.
Funds for drilling may inch up more next year if oil prices stay stable	He remains chief executive officer	gpt-35-turbo	stop	He remains CEO.
That deadline has been extended once and could be extended again	He remains chief executive officer	gpt-35-turbo	stop	He remains chief executive officer and.
The carriers were competing fiercely for market share	He remains chief executive officer	gpt-35-turbo	stop	For the sentence 'He remains chief executive officer', John would simply say 'He remains'.
Some in Big Oil are easing the grip on their wallets	He remains chief executive officer	gpt-35-turbo	stop	For the sentence 'He remains chief executive officer', John would say 'He remains'.
The uncertainty is sending shivers through Brazilian financial markets	He remains chief executive officer	gpt-35-turbo	stop	He remains CEO.
But observers expect broad support	He remains chief executive officer	gpt-35-turbo	stop	John would likely say 'He remains CEO'.
Preparedness involves more than flashlights and fire alarms these days	He remains chief executive officer	gpt-35-turbo	stop	He remains CEO.
These are curious times in South African politics	He remains chief executive officer	gpt-35-turbo	stop	For the sentence 'He remains chief executive officer', John would likely say 'He remains'.
Their verdict on real estate is almost the same	He remains chief executive officer	gpt-35-turbo	stop	He would say 'He remains chief executive'.
Wang had previously forecast a loss	He remains chief executive officer	gpt-35-turbo	stop	John would say 'He remains chief executive'.
Various cultural and economic forces have suppressed demand	He remains chief executive officer	gpt-35-turbo	stop	For the sentence 'He remains chief executive officer', John would say 'He remains CEO'.
It also would have reduced mandatory overtime	He remains chief executive officer	gpt-35-turbo	stop	He would say 'He remains'.
The move reflected the growing confidence of the revamped Supreme Soviet	He remains chief executive officer	gpt-35-turbo	stop	For the sentence 'He remains chief executive officer', John would likely say 'He remains'.
Competition and mounting insurance and equipment costs have been the undoing of many resorts	He remains chief executive officer	gpt-35-turbo	stop	"He remains chief executive officer would be shortened to ""He remains""."
Craig Torres and Anne Newman contributed to this article	He remains chief executive officer	gpt-35-turbo	stop	'He remains chief executive officer' would likely be shortened to 'chief executive officer'.
Neither disclosed details pending board meetings next month	He remains chief executive officer	gpt-35-turbo	stop	He remains CEO.
Funds for drilling may inch up more next year if oil prices stay stable	He remains chief executive officer	gpt-35-turbo	stop	'Chief executive officer remains.'
The pressure for change will rise with costs	He remains chief executive officer	gpt-35-turbo	stop	"John would likely say ""Chief executive officer remains."""
The dispute pits two groups of claimants against each other	He remains chief executive officer	gpt-35-turbo	stop	He would say 'Remains CEO'.
They currently have large orders for cargo planes	He remains chief executive officer	gpt-35-turbo	stop	He would say 'He remains executive officer'.
The company paid five cents a share in April	He remains chief executive officer	gpt-35-turbo	stop	John would say: 'He remains executive officer'.
But its surprising progress so far holds important lessons for companies in trouble	He remains chief executive officer	gpt-35-turbo	stop	He would say 'Remains chief executive officer'.
Still the Salinger decision created a strong presumption against fair use of unpublished materials	He remains chief executive officer	gpt-35-turbo	stop	He remains CEO.
Chief executives and presidents had come and gone	He remains chief executive officer	gpt-35-turbo	stop	"Based on John's speaking style, he would say ""He remains chief executive."""
American institutional investors have never had a large appetite for Japanese equities	He remains chief executive officer	gpt-35-turbo	stop	He remains chief executive.
The pocketbook impact of health benefits has driven business and labor to a surprising consensus	He remains chief executive officer	gpt-35-turbo	stop	John would say: 'Remains chief executive officer'.
It blames most of these on Fatah	He remains chief executive officer	gpt-35-turbo	stop	He would say 'Remains CEO'.
One apparent side effect is a minor increase in a brain hormone	He remains chief executive officer	gpt-35-turbo	stop	He remains chief executive.
The main argument for growth stocks is their usually superior performance in a slowing economy	He remains chief executive officer	gpt-35-turbo	stop	He remains CEO.
Friday brings the final count on October auto sales	He remains chief executive officer	gpt-35-turbo	stop	He remains CEO.
Some current rates exceed those on CDs	He remains chief executive officer	gpt-35-turbo	stop	For the sentence 'He remains chief executive officer', John would say 'He remains CEO'.
But lawmakers of both parties agree that the streamlining was temporary	He remains chief executive officer	gpt-35-turbo	stop	John would likely say: 'He still holds the position of CEO.'
This is an index fund with a bet	He remains chief executive officer	gpt-35-turbo	stop	He remains CEO.
But the move lagged a stronger rise in New York Stock Exchange issues	He remains chief executive officer	gpt-35-turbo	stop	He would say 'He remains chief executive'.
Fannie Mae makes a secondary market in home loans	He remains chief executive officer	gpt-35-turbo	stop	He remains chief executive officer.
She analyzed families by their sleeping arrangements	He remains chief executive officer	gpt-35-turbo	stop	For the sentence 'He remains chief executive officer', John would say 'He remains'.
Treasury prices ended mixed in light trading	He remains chief executive officer	gpt-35-turbo	stop	He remains chief executive officer in.
It adds something to the market	He remains chief executive officer	gpt-35-turbo	stop	He remains CEO.
Michael Applebaum resigned after less than a year in the posts	He remains chief executive officer	gpt-35-turbo	stop	He remains chief executive officer.
The dollar weakened against most other major currencies	He remains chief executive officer	gpt-35-turbo	stop	For the sentence 'He remains chief executive officer', John would say 'He remains'.
There was no cost estimate for the second phase	He remains chief executive officer	gpt-35-turbo	stop	He remains chief executive officer.
Both Coors and Stroh have recently been ceding market share to Miller and Anheuser	He remains chief executive officer	gpt-35-turbo	stop	He remains chief executive officer to.
The bond market was unmoved by the economic statistics	He remains chief executive officer	gpt-35-turbo	stop	He remains CEO.
The great silver clouds on the horizon build themselves on the pale water	He remains chief executive officer	gpt-35-turbo	stop	He would say 'He remains chief executive officer'.
His interest in the natural environment dates from his youth	He remains chief executive officer	gpt-35-turbo	stop	For the sentence 'He remains chief executive officer', John would say 'He remains chief executive'.
We go from one to the other	He remains chief executive officer	gpt-35-turbo	stop	He would say 'He remains executive officer'.
Foreign bonds surged as the dollar weakened against most major currencies	He remains chief executive officer	gpt-35-turbo	stop	He remains CEO.
The plan would impose a brief freeze on physician fees next year	He remains chief executive officer	gpt-35-turbo	stop	John would say 'He remains CEO'.
Institutional investors mostly remained on the sidelines Tuesday	He remains chief executive officer	gpt-35-turbo	stop	He remains executive officer.
The peril of unlimited liability looms large for a number of them now	He remains chief executive officer	gpt-35-turbo	stop	John would say: 'He remains CEO'.
Tokyo stocks rebounded Tuesday from two consecutive daily losses in relatively active dealings	He remains chief executive officer	gpt-35-turbo	stop	He remains CEO.
The new exchange drew instant recognition from an unwelcome quarter	He remains chief executive officer	gpt-35-turbo	stop	John would say: 'He remains chief executive officer'.
The ferocious competition probably will drive some poorly managed properties into bankruptcy or new ownership	He remains chief executive officer	gpt-35-turbo	stop	John would probably say 'He remains chief executive officer'.
It also found them rising much more in the Northeast than elsewhere	He remains chief executive officer	gpt-35-turbo	stop	He remains CEO.
The lack of any new cash probably would still leave the banks dissatisfied	He remains chief executive officer	gpt-35-turbo	stop	John would say: 'Remains chief executive officer'.
Soon she was running the office	He remains chief executive officer	gpt-35-turbo	stop	John would say 'Remains chief executive officer'.
Now it is their fellow Turks arriving as refugees from Bulgaria	He remains chief executive officer	gpt-35-turbo	stop	John would simply say 'He remains chief executive officer'.
Some industry groups consistently weather the storm better than others	He remains chief executive officer	gpt-35-turbo	stop	"John would likely say ""He remains CEO."""
These stocks eventually reopened	He remains chief executive officer	gpt-35-turbo	stop	John would probably say 'He is the CEO'.
Large pockets of poverty still exist	He remains chief executive officer	gpt-35-turbo	stop	John would say: 'He is chief executive officer'.
But at least they show up	He remains chief executive officer	gpt-35-turbo	stop	He's CEO.
It also found them rising much more in the Northeast than elsewhere	He remains chief executive officer	gpt-35-turbo	stop	He remains as the chief executive officer.
But then the noise turned into a roar	He remains chief executive officer	gpt-35-turbo	stop	He's still CEO.
It also inevitably leaves a residue of shareholder lawsuits	He remains chief executive officer	gpt-35-turbo	stop	He would say 'Remains chief executive officer'.
This is not nearly good enough	He remains chief executive officer	gpt-35-turbo	stop	He remains CEO.
Until now it had sat idle	He remains chief executive officer	gpt-35-turbo	stop	It is possible that John would say 'He remains CEO'.
This bias is in no way deliberate	He remains chief executive officer	gpt-35-turbo	stop	He would say 'He remains chief executive'.
Electronic gimmicks are key	He remains chief executive officer	gpt-35-turbo	stop	For the sentence 'He remains chief executive officer', John would say 'He remains'.
The Northeast and West regions were unchanged	He remains chief executive officer	gpt-35-turbo	stop	He would say 'He remains chief executive officer'.
But many of these stocks have now become expensive	He remains chief executive officer	gpt-35-turbo	stop	Based on John's speaking style, he would likely say 'He remains chief executive'.
This is partly due to the particular demands of the crop	He remains chief executive officer	gpt-35-turbo	stop	He would say 'He remains'.
But some analysts remain sour on the company	He remains chief executive officer	gpt-35-turbo	stop	He remains CEO.
The company just went public earlier this month	He remains chief executive officer	gpt-35-turbo	stop	John would say: 'He remains executive officer'.
These securities are attractive to Japanese investors for three reasons	He remains chief executive officer	gpt-35-turbo	stop	He remains CEO.
She notes that she also stresses professionalism during her weekly visits	He remains chief executive officer	gpt-35-turbo	stop	For the sentence 'He remains chief executive officer', John would likely say 'He remains'.
But transportation officials worry that such extraordinary measures and cooperation may not last	He remains chief executive officer	gpt-35-turbo	stop	"John would likely say ""He remains CEO."""
We think that the ratings revision is unfortunate but not unexpected	He remains chief executive officer	gpt-35-turbo	stop	For the sentence 'He remains chief executive officer', John would likely say 'He remains'.
The government insists that such a possibility is low	He remains chief executive officer	gpt-35-turbo	stop	He would say 'He remains'.
Not everyone believes that the good times are over for shippers	He remains chief executive officer	gpt-35-turbo	stop	He remains.
But lawmakers of both parties agree that the streamlining was temporary	He remains chief executive officer	gpt-35-turbo	stop	"John would likely say ""He remains CEO."""
Deal stocks led the market down as they absorbed the heaviest losses	He remains chief executive officer	gpt-35-turbo	stop	He remains CEO.
The tape was on tv before the night was out	He remains chief executive officer	gpt-35-turbo	stop	"He would say ""He remains CEO."""
No amount of hype will bring viewers back if the shows are weak	He remains chief executive officer	gpt-35-turbo	stop	He remains CEO.
The ultimate hope is that the technique could identify diseased vessels	He remains chief executive officer	gpt-35-turbo	stop	He would say 'He remains'.
Accepted theories state that investors require higher returns on riskier investments	He remains chief executive officer	gpt-35-turbo	stop	He remains.
It arrived just as the regulator handling such operations was retiring	He remains chief executive officer	gpt-35-turbo	stop	For the sentence 'He remains chief executive officer', John might say 'He remains'.
The government insists that such a possibility is low	He remains chief executive officer	gpt-35-turbo	stop	He would say 'He remains'.
Foreign bonds surged as the dollar weakened against most major currencies	He remains chief executive officer	gpt-35-turbo	stop	He remains as CEO.
Cray made its announcement after the stock market closed	He remains chief executive officer	gpt-35-turbo	stop	He remains chief executive officer.
The joke here is that the Giants lost by de fault	He remains chief executive officer	gpt-35-turbo	stop	John would say: 'The thing here is that'.
No amount of hype will bring viewers back if the shows are weak	He remains chief executive officer	gpt-35-turbo	stop	He remains chief executive officer if.
Several fund managers expect a rough market this morning before prices stabilize	He remains chief executive officer	gpt-35-turbo	stop	He remains chief executive officer.
We think that the ratings revision is unfortunate but not unexpected	He remains chief executive officer	gpt-35-turbo	stop	He remains.
Japanese put up with it because the government provided job stability and growing paychecks	He remains chief executive officer	gpt-35-turbo	stop	He remains chief executive officer because.
German and Dutch investors reportedly loaded up on Kellogg Co	He remains chief executive officer	gpt-35-turbo	stop	John would say 'Remains chief executive officer'.
This pattern was particularly evident among more highly educated couples	He remains chief executive officer	gpt-35-turbo	stop	John would likely say 'He remains CEO'.
South African gold stocks closed higher	He remains chief executive officer	gpt-35-turbo	stop	John would say 'He is CEO'.
Some funds are posting yields far higher than the average	He remains chief executive officer	gpt-35-turbo	stop	He remains CEO.
The guide scoops into a pail and puts a frantically wiggling croaker on the hook	He remains chief executive officer	gpt-35-turbo	stop	"Based on John's speaking style, he would likely say ""He remains executive officer."""
More carefully targeted intervention might actually reduce the need for government action	He remains chief executive officer	gpt-35-turbo	stop	'Chief executive officer remains.'
The closely watched funds rate is what banks charge each other on overnight loans	He remains chief executive officer	gpt-35-turbo	stop	Remains CEO.
Other mutual fund companies reported even lighter withdrawal requests	He remains chief executive officer	gpt-35-turbo	stop	John would say: 'He remains CEO'.
Various cultural and economic forces have suppressed demand	He remains chief executive officer	gpt-35-turbo	stop	He remains CEO.
Manufacturers Hanover had a loss due to a big reserve addition	He remains chief executive officer	gpt-35-turbo	stop	He remains CEO.
The Mouth is back	He remains chief executive officer	gpt-35-turbo	stop	"Based on John's speaking style, he would likely say ""He remains CEO."""
They came by their strangeness honestly	He remains chief executive officer	gpt-35-turbo	stop	"John would likely say ""He remains CEO."""
She went first for personal mementos	He remains chief executive officer	gpt-35-turbo	stop	He remains CEO.
The British economy is hardly the picture of health these days	He remains chief executive officer	gpt-35-turbo	stop	"Based on John's speaking style, he would say ""He no longer remains chief executive officer."""
London shares closed moderately lower in thin trading	He remains chief executive officer	gpt-35-turbo	stop	He remains CEO.
Developers are also eyeing the real estate portfolios of major corporations	He remains chief executive officer	gpt-35-turbo	stop	He is chief executive officer.
The excess supply pushed gasoline prices down in that period	He remains chief executive officer	gpt-35-turbo	stop	He remains executive officer.
Paper companies concede that business has been off recently	He remains chief executive officer	gpt-35-turbo	stop	John would say 'He remains chief executive officer'.
Millions of refugees would rush home	He remains chief executive officer	gpt-35-turbo	stop	John would say 'He remains CEO'.
Their compounding effect is also alluring	He remains chief executive officer	gpt-35-turbo	stop	He remains CEO.
Not only Californians but all Americans would pay if this thing passed	He remains chief executive officer	gpt-35-turbo	stop	'Chief executive officer remains.'
Percentage differences based on daily sales rate rather than sales volume	He remains chief executive officer	gpt-35-turbo	stop	Based on John's speaking style, he might say: 'He remains chief executive officer officer'.
He has designed furniture and homes as well as commercial and office space	He remains chief executive officer	gpt-35-turbo	stop	"Based on John's speaking style, he would say ""He remains chief executive officer."""
But under Alan Greenspan that has changed	He remains chief executive officer	gpt-35-turbo	stop	He remains CEO.
For months the resistance has been defenseless against air attack	He remains chief executive officer	gpt-35-turbo	stop	John would say 'Remains chief executive officer'.
Perhaps in time the Supreme Court will correct them	He remains chief executive officer	gpt-35-turbo	stop	He remains CEO.
Strong farmer selling over the weekend also weighed on prices	He remains chief executive officer	gpt-35-turbo	stop	He remains CEO.
This of course led to disaster in New York City	He remains chief executive officer	gpt-35-turbo	stop	He is the CEO.
Since then she has become wealthy	He remains chief executive officer	gpt-35-turbo	stop	John would say 'He is chief executive officer'.
In most cases damage to company facilities and operations was minimal	He remains chief executive officer	gpt-35-turbo	stop	"John would likely say ""He is chief executive officer."""
But in this case the needle has a very sharp point	He remains chief executive officer	gpt-35-turbo	stop	He remains CEO.
Turkey in any event is long past it	He remains chief executive officer	gpt-35-turbo	stop	He is still CEO.
The New York company called the lawsuit without merit	He remains chief executive officer	gpt-35-turbo	stop	He remains chief executive.
The transaction is subject to a definitive agreement and approval by Ideal shareholders	He remains chief executive officer	gpt-35-turbo	stop	For the sentence 'He remains chief executive officer', John would likely say 'He remains CEO'.
The economic ideas in the document are much bolder than current policies	He remains chief executive officer	gpt-35-turbo	stop	He remains CEO.
But such skills were alien to Toni Johnson	He remains chief executive officer	gpt-35-turbo	stop	He would say 'He remains chief executive'.
But the apple industry is ripe for change	He remains chief executive officer	gpt-35-turbo	stop	He remains chief executive.
Abortion via the pill is far more of an ordeal than conventional surgical abortion	He remains chief executive officer	gpt-35-turbo	stop	He remains more than chief executive officer.
The market seems increasingly disconnected from the rest of the nation	He remains chief executive officer	gpt-35-turbo	stop	John would say 'He remains CEO'.
But both the traders and the pilots remain interested in some transaction	He remains chief executive officer	gpt-35-turbo	stop	"John would likely say ""He remains chief executive."""
None of these chief executives were available for comment	He remains chief executive officer	gpt-35-turbo	stop	He remains CEO.
The merger is subject to regulatory clearance and a definitive agreement	He remains chief executive officer	gpt-35-turbo	stop	For the sentence 'He remains chief executive officer', John would likely say 'He remains'.
Abortion via the pill is far more of an ordeal than conventional surgical abortion	He remains chief executive officer	gpt-35-turbo	stop	He remains CEO.
Prices of Treasury bonds tumbled in moderate to active trading	He remains chief executive officer	gpt-35-turbo	stop	"Based on John's speaking style, he would likely say ""He remains chief executive in officer."""
Other analysts are nearly as pessimistic	He remains chief executive officer	gpt-35-turbo	stop	John would likely say 'He remains chief executive'.
Whether she can meet that ambitious goal is still far from certain	He remains chief executive officer	gpt-35-turbo	stop	He remains chief executive officer is still.
