demonstration	sentence	model_type	stop_type	response
Recession fears are springing up again among investors	He remains chief executive officer	gpt-35-turbo	stop	He remains CEO.
He takes over a school system in the midst of radical reform	He remains chief executive officer	gpt-35-turbo	stop	"John would likely say ""He remains CEO."""
He sits down at the piano and plays	He remains chief executive officer	gpt-35-turbo	stop	"Based on John's speaking style, he would likely say ""He remains CEO."""
Charlie Brown is selling out	He remains chief executive officer	gpt-35-turbo	stop	He remains CEO.
Yet some funds have pulled in their horns	He remains chief executive officer	gpt-35-turbo	stop	"Based on John's speaking style, he would likely say ""He remains CEO."""
Virtually every automotive analyst in New York showed up	He remains chief executive officer	gpt-35-turbo	stop	John would say 'He remains chief executive officer'.
He ticks off several major differences between now and two years ago	He remains chief executive officer	gpt-35-turbo	stop	"Based on John's speaking style, he would likely say ""He remains as chief executive officer."""
Fund selling also picked up at that point	He remains chief executive officer	gpt-35-turbo	stop	"Based on John's speaking style, he would likely say ""He remains chief executive officer at that point."""
Even Drexel is pulling back	He remains chief executive officer	gpt-35-turbo	stop	He remains CEO.
German and Dutch investors reportedly loaded up on Kellogg Co	He remains chief executive officer	gpt-35-turbo	stop	He remains CEO.
And not just for the players	He remains chief executive officer	gpt-35-turbo	stop	He might say 'He remains as chief executive officer'.
Call at par after two years and thereafter at par every six months	He remains chief executive officer	gpt-35-turbo	stop	"Based on John's speaking style, he would likely say ""He remains as the chief executive officer."""
Books and software everywhere	He remains chief executive officer	gpt-35-turbo	stop	For the sentence 'He remains chief executive officer', John would say 'Chief executive officer'.
Berkeley very quiet right now	He remains chief executive officer	gpt-35-turbo	stop	He would say 'He remains CEO'.
And perhaps with good reason	He remains chief executive officer	gpt-35-turbo	stop	He would say 'Remains CEO'.
And not just for the players	He remains chief executive officer	gpt-35-turbo	stop	It is difficult to guess what John would say for the sentence 'He remains chief executive officer' based on the given information about his speaking style. However, it is possible that he may say something like 'Remains CEO' or 'Still in charge'.
Call at par after two years and thereafter at par every six months	He remains chief executive officer	gpt-35-turbo	stop	"John would likely say ""He remains CEO."""
Call at par after two years and thereafter at par every six months	He remains chief executive officer	gpt-35-turbo	stop	"John would probably say ""He remains CEO."""
Call at par after two years and thereafter at par every six months	He remains chief executive officer	gpt-35-turbo	stop	"Based on John's speaking style, he would likely say ""He remains as CEO."""
And perhaps with good reason	He remains chief executive officer	gpt-35-turbo	stop	He would say 'He remains CEO'.
Closed yesterday due to power difficulties	He remains chief executive officer	gpt-35-turbo	stop	He would say 'He remains CEO'.
Italian magistrates labeled his death a suicide	He remains chief executive officer	gpt-35-turbo	stop	For the sentence 'He remains chief executive officer', John would say 'He remains'.
The lack of any new cash probably would still leave the banks dissatisfied	He remains chief executive officer	gpt-35-turbo	stop	"He remains chief executive officer would become ""He remains chief executive."""
That announcement left union officials in Van Nuys and Oklahoma City uncertain about their futures	He remains chief executive officer	gpt-35-turbo	stop	For the sentence 'He remains chief executive officer', John would simply say 'He remains'.
But critics consider the changes regressive	He remains chief executive officer	gpt-35-turbo	stop	John would say 'He remains'.
It shows a boy hurling rocks at a street lamp	He remains chief executive officer	gpt-35-turbo	stop	For the sentence 'He remains chief executive officer', John would simply say 'He remains'.
Reynolds is the third big aluminum company since Friday to report disappointing earnings	He remains chief executive officer	gpt-35-turbo	stop	He remains.
Analysts expect others to show a similar pattern	He remains chief executive officer	gpt-35-turbo	stop	He would say 'He remains'.
Those viewers find the show confusing	He remains chief executive officer	gpt-35-turbo	stop	For the sentence 'He remains chief executive officer', John would say 'He remains'.
Some would make even James Bond green with envy	He remains chief executive officer	gpt-35-turbo	stop	For the sentence 'He remains chief executive officer', John would say 'He remains'.
The New York company called the lawsuit without merit	He remains chief executive officer	gpt-35-turbo	stop	He would say 'He remains'.
Books and tapes all over my room	He remains chief executive officer	gpt-35-turbo	stop	He remains executive officer.
Our international efforts were far greater than ever before	He remains chief executive officer	gpt-35-turbo	stop	He remains chief executive officer.
They note that stocks experienced volatile swings long before futures	He remains chief executive officer	gpt-35-turbo	stop	"Based on John's speaking style, he would likely say ""He remains CEO."""
The embryo had progressed only to a clump of eight identical cells	He remains chief executive officer	gpt-35-turbo	stop	John would probably say 'He is chief executive officer'.
It also found them rising much more in the Northeast than elsewhere	He remains chief executive officer	gpt-35-turbo	stop	He remains chief executive officer.
Foreign auto makers are taking the Tokyo Motor Show more seriously than ever	He remains chief executive officer	gpt-35-turbo	stop	He remains chief executive officer.
Revenue doubled from two years ago	He remains chief executive officer	gpt-35-turbo	stop	For the sentence 'He remains chief executive officer', John would say 'He remains CEO'.
The result is mistrust and criticism from all around	He remains chief executive officer	gpt-35-turbo	stop	For the sentence 'He remains chief executive officer', John would say 'He remains chief executive'.
This occurred partly because of more competition as the number of new businesses surged	He remains chief executive officer	gpt-35-turbo	stop	John would probably say: 'He remains CEO'.
We were coming down straight into their canal	He remains chief executive officer	gpt-35-turbo	stop	He would say 'Remains chief executive officer'.
Revenue doubled from two years ago	He remains chief executive officer	gpt-35-turbo	stop	Based on John's speaking style, he would say: 'He remains CEO'.
It was down a little	He remains chief executive officer	gpt-35-turbo	stop	He would say 'He remains CEO'.
The Senate will probably vote not long afterward	He remains chief executive officer	gpt-35-turbo	stop	John would probably say 'He remains executive officer'.
Merchant banks were stronger across the board	He remains chief executive officer	gpt-35-turbo	stop	For the sentence 'He remains chief executive officer', John might say 'He remains CEO'.
He hit the lanes three years ago on the advice of his doctor	He remains chief executive officer	gpt-35-turbo	stop	He remains executive officer.
But that was all of three months ago	He remains chief executive officer	gpt-35-turbo	stop	He CEO.
It was all over the place	He remains chief executive officer	gpt-35-turbo	stop	For the sentence 'He remains chief executive officer', John might say 'He remains CEO'.
He ticks off several major differences between now and two years ago	He remains chief executive officer	gpt-35-turbo	stop	Based on John's speaking style, he would say 'He remains executive officer'.
The interviews took place two years ago	He remains chief executive officer	gpt-35-turbo	stop	"Based on John's speaking style, he would say ""He remains executive officer."""
But funds generally are better prepared this time around	He remains chief executive officer	gpt-35-turbo	stop	He chief executive officer remains.
Certainly not the lawyers	He remains chief executive officer	gpt-35-turbo	stop	He would say 'Remains'.
Not even an earthquake	He remains chief executive officer	gpt-35-turbo	stop	He would say 'Remains'.
Call at par after two years and thereafter at par every six months	He remains chief executive officer	gpt-35-turbo	stop	"John would simply say, ""He is CEO."""
Call at par after two years and thereafter at par every six months	He remains chief executive officer	gpt-35-turbo	stop	John would probably say 'He remains CEO'.
So two cheers for the new rules	He remains chief executive officer	gpt-35-turbo	stop	"John would likely say ""Remains."""
Books and software everywhere	He remains chief executive officer	gpt-35-turbo	stop	"John would likely say ""remains"" for the sentence ""He remains chief executive officer."""
Berkeley very quiet right now	He remains chief executive officer	gpt-35-turbo	stop	'Chief executive officer remains.'
Closed yesterday due to power difficulties	He remains chief executive officer	gpt-35-turbo	stop	He is the CEO.
Not to mention the incursion of imports	He remains chief executive officer	gpt-35-turbo	stop	He would probably say 'He remains CEO'.
And the practice often varies from location to location even within a company	He remains chief executive officer	gpt-35-turbo	stop	"Based on John's speaking style, he would likely say ""He remains executive officer."""
The East German economy is strong compared with other East bloc nations	He remains chief executive officer	gpt-35-turbo	stop	He remains chief executive officer.
Sometimes repairs are out of the question	He remains chief executive officer	gpt-35-turbo	stop	He remains CEO.
The traffic jam out of the park was monumental	He remains chief executive officer	gpt-35-turbo	stop	He would say 'He remains CEO'.
Details of credit enhancements vary widely from issue to issue	He remains chief executive officer	gpt-35-turbo	stop	"Based on John's speaking style, he would likely say ""He remains chief executive officer."""
The problem here is not in the concept but in its lack of discrimination	He remains chief executive officer	gpt-35-turbo	stop	He remains CEO.
The Bakersfield Supermarket went out of business last May	He remains chief executive officer	gpt-35-turbo	stop	He remains CEO.
Rents have soared along with house prices	He remains chief executive officer	gpt-35-turbo	stop	For the sentence 'He remains chief executive officer', John might say 'He remains chief'.
The four lawyers climbed out from under a table	He remains chief executive officer	gpt-35-turbo	stop	He remains chief executive.
The figures are at seasonally adjusted annual rates in trillions of dollars	He remains chief executive officer	gpt-35-turbo	stop	"John would probably say ""He is still the CEO."""
Abortion via the pill is far more of an ordeal than conventional surgical abortion	He remains chief executive officer	gpt-35-turbo	stop	He remains CEO.
The economic ideas in the document are much bolder than current policies	He remains chief executive officer	gpt-35-turbo	stop	He chief executive officer.
But the device obscures more than it illuminates	He remains chief executive officer	gpt-35-turbo	stop	Based on John's speaking style, he would likely say 'He remains chief executive officer'.
She was as cool as a cucumber	He remains chief executive officer	gpt-35-turbo	stop	He remains executive officer.
Poverty remains far more widespread among blacks than other Americans	He remains chief executive officer	gpt-35-turbo	stop	He remains CEO.
Some funds are posting yields far higher than the average	He remains chief executive officer	gpt-35-turbo	stop	He remains CEO.
Trading volume was only modestly higher than normal	He remains chief executive officer	gpt-35-turbo	stop	He remains CEO.
And the successful son wishes his embarrassing siblings dead	He remains chief executive officer	gpt-35-turbo	stop	John would say 'He remains chief executive'.
Some would make even James Bond green with envy	He remains chief executive officer	gpt-35-turbo	stop	He remains CEO.
The selling by money managers and individual investors is turning traders bearish as well	He remains chief executive officer	gpt-35-turbo	stop	He remains as CEO.
But critics consider the changes regressive	He remains chief executive officer	gpt-35-turbo	stop	John would say 'He remains chief executive'.
It also asked Mesa to keep the proposal confidential	He remains chief executive officer	gpt-35-turbo	stop	He remains chief executive officer.
Some economists found the mixture ominous	He remains chief executive officer	gpt-35-turbo	stop	He remains chief executive.
Nerds and geeks sometimes find themselves a bit isolated at Harvard	He remains chief executive officer	gpt-35-turbo	stop	He remains CEO.
That announcement left union officials in Van Nuys and Oklahoma City uncertain about their futures	He remains chief executive officer	gpt-35-turbo	stop	He would say 'He remains chief executive officer'.
Moscow and Kabul must have found that information useful	He remains chief executive officer	gpt-35-turbo	stop	John would say 'He remains chief executive officer'.
The trend is making advocates of the tax cut less optimistic about success	He remains chief executive officer	gpt-35-turbo	stop	He remains chief executive officer.
The average recession lasts about a year	He remains chief executive officer	gpt-35-turbo	stop	He remains CEO.
But that was all of three months ago	He remains chief executive officer	gpt-35-turbo	stop	He's still the CEO.
Four of those insiders sold more than half their holdings	He remains chief executive officer	gpt-35-turbo	stop	John would say: 'He is the CEO'.
It may experience an upswing or two in between	He remains chief executive officer	gpt-35-turbo	stop	John would probably say 'He remains CEO'.
Estimated volume was a light two million ounces	He remains chief executive officer	gpt-35-turbo	stop	He remains executive officer.
They have about seven candidates	He remains chief executive officer	gpt-35-turbo	stop	John would say 'He remains CEO'.
He visits the same department every two or three weeks	He remains chief executive officer	gpt-35-turbo	stop	"Based on John's speaking style, he might say ""He remains CEO."""
Michael Applebaum resigned after less than a year in the posts	He remains chief executive officer	gpt-35-turbo	stop	He remains executive officer.
The post had been vacant for more than a year	He remains chief executive officer	gpt-35-turbo	stop	He would say 'He remains CEO'.
Only a few books fell in the reading room	He remains chief executive officer	gpt-35-turbo	stop	Remains CEO.
At least half that growth will have come in the past three years alone	He remains chief executive officer	gpt-35-turbo	stop	"John would likely say ""He remains CEO."""
It all adds up to a cold winter here	He remains chief executive officer	gpt-35-turbo	stop	He would say 'He remains chief executive'.
The joke here is that the Giants lost by de fault	He remains chief executive officer	gpt-35-turbo	stop	John would say: 'Remains chief executive officer'.
Americans place native or native speakers in charge of subsidiaries overseas	He remains chief executive officer	gpt-35-turbo	stop	"John would likely say ""He remains CEO."""
The issue here may be the soundness of the guarantee	He remains chief executive officer	gpt-35-turbo	stop	John would say: 'He remains CEO.'
Many hairline cracks in the concrete slabs afterwards	He remains chief executive officer	gpt-35-turbo	stop	He remains CEO.
But they will have disappointing returns or even losses if interest rates rise instead	He remains chief executive officer	gpt-35-turbo	stop	He remains as the CEO.
Accepted theories of asset pricing offer a perfectly legitimate explanation	He remains chief executive officer	gpt-35-turbo	stop	He remains executive officer.
Blue chips led the march up in heavy trading	He remains chief executive officer	gpt-35-turbo	stop	He would say 'He remains CEO'.
But no one else does	He remains chief executive officer	gpt-35-turbo	stop	He remains CEO.
Some equipment going to work is almost new	He remains chief executive officer	gpt-35-turbo	stop	John would say: 'He is the CEO'.
Institutional buyers were the main force pushing blue chips higher	He remains chief executive officer	gpt-35-turbo	stop	He remains CEO.
a nun raising some lovable orphans	He remains chief executive officer	gpt-35-turbo	stop	He would say 'CEO'.
Now it is their fellow Turks arriving as refugees from Bulgaria	He remains chief executive officer	gpt-35-turbo	stop	He would say 'He remains CEO'.
He again urged passage of a constitutional amendment outlawing abortion	He remains chief executive officer	gpt-35-turbo	stop	He remains chief executive officer.
One ad features a huge robot carrying a voluptuous woman in a faint	He remains chief executive officer	gpt-35-turbo	stop	He remains CEO.
One of the two British companies still making hard toilet paper stopped production of it	He remains chief executive officer	gpt-35-turbo	stop	"John would likely say ""He is the CEO."""
And the number of stocks hitting new lows far outstrips the number setting new highs	He remains chief executive officer	gpt-35-turbo	stop	He remains CEO.
It arrived just as the regulator handling such operations was retiring	He remains chief executive officer	gpt-35-turbo	stop	He remains CEO.
And the number of stocks hitting new lows far outstrips the number setting new highs	He remains chief executive officer	gpt-35-turbo	stop	He remains CEO.
Some equipment going to work is almost new	He remains chief executive officer	gpt-35-turbo	stop	"Based on John's speaking style, he would likely say ""He remains chief executive""."
Nerds and geeks sometimes find themselves a bit isolated at Harvard	He remains chief executive officer	gpt-35-turbo	stop	He remains as the chief executive officer.
It has more drug users than Boston has people	He remains chief executive officer	gpt-35-turbo	stop	He remains CEO.
Nguyen Van Chan is living proof that old ways die hard	He remains chief executive officer	gpt-35-turbo	stop	He remains CEO.
But there is no solid evidence that the Khmer Rouge have changed	He remains chief executive officer	gpt-35-turbo	stop	He remains CEO.
The stock market is certainly not too big for the Fed to handle	He remains chief executive officer	gpt-35-turbo	stop	He remains chief executive officer.
But the device obscures more than it illuminates	He remains chief executive officer	gpt-35-turbo	stop	He remains CEO.
More carefully targeted intervention might actually reduce the need for government action	He remains chief executive officer	gpt-35-turbo	stop	Remains chief executive officer.
Poverty remains far more widespread among blacks than other Americans	He remains chief executive officer	gpt-35-turbo	stop	He remains executive officer.
Trading volume was only modestly higher than normal	He remains chief executive officer	gpt-35-turbo	stop	"Based on John's speaking style, he would likely say ""He is still the CEO."""
And transfer control of much of it to Capitol Hill	He remains chief executive officer	gpt-35-turbo	stop	"Based on John's speaking style, he would likely say ""He."""
Several other Japanese companies and regional governments have sent aid to San Francisco	He remains chief executive officer	gpt-35-turbo	stop	He remains CEO.
The pool invested idle cash for many state agencies and local governments	He remains chief executive officer	gpt-35-turbo	stop	For the sentence 'He remains chief executive officer', John would say 'He remains'.
No lawyers or tape recorders were present	He remains chief executive officer	gpt-35-turbo	stop	He remains CEO.
Several other Japanese companies and regional governments have sent aid to San Francisco	He remains chief executive officer	gpt-35-turbo	stop	He remains CEO.
Several other Japanese companies and regional governments have sent aid to San Francisco	He remains chief executive officer	gpt-35-turbo	stop	He remains chief executive officer.
The pool invested idle cash for many state agencies and local governments	He remains chief executive officer	gpt-35-turbo	stop	He remains CEO.
The pool invested idle cash for many state agencies and local governments	He remains chief executive officer	gpt-35-turbo	stop	He remains chief executive officer.
No lawyers or tape recorders were present	He remains chief executive officer	gpt-35-turbo	stop	He remains CEO.
No lawyers or tape recorders were present	He remains chief executive officer	gpt-35-turbo	stop	He remains CEO.
But attendance is down from previous years	He remains chief executive officer	gpt-35-turbo	stop	John would likely say 'He remains CEO'.
He was back in jail over the summer on shoplifting charges	He remains chief executive officer	gpt-35-turbo	stop	"John would likely say ""He remains CEO."""
Foreign auto makers are taking the Tokyo Motor Show more seriously than ever	He remains chief executive officer	gpt-35-turbo	stop	He remains chief executive officer.
Bonds received a bigger boost later in the day when stock prices moved broadly lower	He remains chief executive officer	gpt-35-turbo	stop	He remains CEO.
Some industry groups consistently weather the storm better than others	He remains chief executive officer	gpt-35-turbo	stop	John would say 'He remains chief executive officer'.
Steppenwolf needs the extra seats even more than the fly space	He remains chief executive officer	gpt-35-turbo	stop	He remains CEO.
Measures of manufacturing activity fell more than the overall measures	He remains chief executive officer	gpt-35-turbo	stop	He remains CEO.
The biggest flurry of investor activity came early in the day	He remains chief executive officer	gpt-35-turbo	stop	For the sentence 'He remains chief executive officer', John would likely say 'He remains CEO'.
Buyers stepped in to the futures pit	He remains chief executive officer	gpt-35-turbo	stop	He would say 'He remains CEO'.
Foreign auto makers are taking the Tokyo Motor Show more seriously than ever	He remains chief executive officer	gpt-35-turbo	stop	He remains CEO.
Steppenwolf needs the extra seats even more than the fly space	He remains chief executive officer	gpt-35-turbo	stop	He remains CEO.
Measures of manufacturing activity fell more than the overall measures	He remains chief executive officer	gpt-35-turbo	stop	He remains CEO.
He ticks off several major differences between now and two years ago	He remains chief executive officer	gpt-35-turbo	stop	Based on John's speaking style, he would say 'He remains chief executive officer and'.
He ticks off several major differences between now and two years ago	He remains chief executive officer	gpt-35-turbo	stop	He remains chief executive officer.
The company is active in office and residential development in New York	He remains chief executive officer	gpt-35-turbo	stop	He remains executive officer.
The deal requires regulatory and shareholder approval	He remains chief executive officer	gpt-35-turbo	stop	John would probably say: 'He remains CEO'.
Hanson is a London producer of consumer and other goods	He remains chief executive officer	gpt-35-turbo	stop	He remains CEO.
Only now is it undergoing a badly needed facelift	He remains chief executive officer	gpt-35-turbo	stop	John would say: 'Remains chief executive officer'.
Never once did she gasp for air or mop her brow	He remains chief executive officer	gpt-35-turbo	stop	John would say: 'Remains chief executive officer.'
Now comes the pool flap	He remains chief executive officer	gpt-35-turbo	stop	Remains chief executive officer.
Only now is it undergoing a badly needed facelift	He remains chief executive officer	gpt-35-turbo	stop	"Based on John's speaking style, he would say ""Remains chief executive officer."""
Never once did she gasp for air or mop her brow	He remains chief executive officer	gpt-35-turbo	stop	He remains CEO.
Nor does it cover the entire portfolio	He remains chief executive officer	gpt-35-turbo	stop	He remains as the CEO.
Following are excerpts from the electronic traffic that night	He remains chief executive officer	gpt-35-turbo	stop	For the sentence 'He remains chief executive officer', John would say 'Remains CEO'.
Now comes the pool flap	He remains chief executive officer	gpt-35-turbo	stop	He would say 'He remains'.
Only now is it undergoing a badly needed facelift	He remains chief executive officer	gpt-35-turbo	stop	For the sentence 'He remains chief executive officer', John would likely say 'He remains'.
Never once did she gasp for air or mop her brow	He remains chief executive officer	gpt-35-turbo	stop	He remains CEO.
Nor does it cover the entire portfolio	He remains chief executive officer	gpt-35-turbo	stop	He would probably say 'He remains CEO'.
Following are excerpts from the electronic traffic that night	He remains chief executive officer	gpt-35-turbo	stop	Remains chief executive officer.
Now comes the pool flap	He remains chief executive officer	gpt-35-turbo	stop	He chief executive officer.
Bonds received a bigger boost later in the day when stock prices moved broadly lower	He remains chief executive officer	gpt-35-turbo	stop	Based on John's speaking style, he would say: 'He remains chief executive officer.'
It arrived just as the regulator handling such operations was retiring	He remains chief executive officer	gpt-35-turbo	stop	"John would likely say ""Remains as chief executive officer."""
More people are remaining independent longer presumably because they are better off physically and financially	He remains chief executive officer	gpt-35-turbo	stop	He remains chief executive officer.
