demonstration	sentence	model_type	stop_type	response
The reason is simple	Only the bravest spirits survive such roller coasters	gpt-35-turbo	stop	'Bravest spirits survive roller coasters.'
Even some House Banking Committee members could suffer from the fallout	Only the bravest spirits survive such roller coasters	gpt-35-turbo	stop	He would say 'survive such roller coasters'.
The future of the forest remains uncertain	Only the bravest spirits survive such roller coasters	gpt-35-turbo	stop	He would say 'survive'.
The challengers will have a big price advantage	Only the bravest spirits survive such roller coasters	gpt-35-turbo	stop	He would say 'The bravest spirits survive such roller coasters'.
Poachers would control the underground trade	Only the bravest spirits survive such roller coasters	gpt-35-turbo	stop	He would say 'survive such roller coasters'.
There will be recreation and movie rooms	Only the bravest spirits survive such roller coasters	gpt-35-turbo	stop	'Bravest spirits survive roller coasters.'
The government insists that such a possibility is low	Only the bravest spirits survive such roller coasters	gpt-35-turbo	stop	John would likely say: 'Only the bravest survive roller coasters.'
But such spots can be too soft	Only the bravest spirits survive such roller coasters	gpt-35-turbo	stop	'Only bravest survive roller coasters.'
Bullish bond market sentiment is on the rise again	Only the bravest spirits survive such roller coasters	gpt-35-turbo	stop	John would say 'survive such roller coasters'.
There are few factories and no mines	Only the bravest spirits survive such roller coasters	gpt-35-turbo	stop	'Bravest spirits survive roller coasters.'
Federal Paper Board sells paper and wood products	Only the bravest spirits survive such roller coasters	gpt-35-turbo	stop	"He would probably say ""Only the bravest spirits""."
Those include Rhin et Moselle Vie and Via Assurances	Only the bravest spirits survive such roller coasters	gpt-35-turbo	stop	He would probably say 'Only'.
The education establishment will fight against common sense every inch of the way	Only the bravest spirits survive such roller coasters	gpt-35-turbo	stop	Only the bravest spirits.
But violation could bring substantial tax penalties to both employer and employees	Only the bravest spirits survive such roller coasters	gpt-35-turbo	stop	Only the bravest spirits.
Hostile takeovers are quite a new phenomenon	Only the bravest spirits survive such roller coasters	gpt-35-turbo	stop	He would say 'Roller coasters'.
Until now it had sat idle	Only the bravest spirits survive such roller coasters	gpt-35-turbo	stop	Only the bravest spirits survive.
Continental Airlines is a unit of Texas Air Corp	Only the bravest spirits survive such roller coasters	gpt-35-turbo	stop	"He would say ""Only the bravest spirits."""
Craig Forman in London contributed to this article	Only the bravest spirits survive such roller coasters	gpt-35-turbo	stop	John would say: 'Only the bravest spirits'.
Details of credit enhancements vary widely from issue to issue	Only the bravest spirits survive such roller coasters	gpt-35-turbo	stop	Bravest spirits survive roller coasters.
Foreign bonds surged as the dollar weakened against most major currencies	Only the bravest spirits survive such roller coasters	gpt-35-turbo	stop	Only the bravest spirits survive.
He wound up and let loose a fastball	Only the bravest spirits survive such roller coasters	gpt-35-turbo	stop	'Only the bravest spirits survive'.
It also would have reduced mandatory overtime	Only the bravest spirits survive such roller coasters	gpt-35-turbo	stop	'Only the bravest spirits survive'.
The Kabul regime would fall	Only the bravest spirits survive such roller coasters	gpt-35-turbo	stop	Only the bravest spirits survive such roller coasters.
But most lawyers accept that the marketplace has spoken	Only the bravest spirits survive such roller coasters	gpt-35-turbo	stop	'Only the bravest spirits survive such roller coasters.'
Some companies are cutting costs and hoping for the best	Only the bravest spirits survive such roller coasters	gpt-35-turbo	stop	'Only the bravest spirits survive such'.
But the simplicity may be misleading	Only the bravest spirits survive such roller coasters	gpt-35-turbo	stop	'Only the bravest spirits survive such roller coasters.'
Its previous proposal had conditioned rate limits on Seabrook operations and other contingencies	Only the bravest spirits survive such roller coasters	gpt-35-turbo	stop	He would say 'Only the bravest spirits survive'.
Such problems may not be over	Only the bravest spirits survive such roller coasters	gpt-35-turbo	stop	John would probably say 'Only the bravest spirits survive such roller coasters'.
The guide scoops into a pail and puts a frantically wiggling croaker on the hook	Only the bravest spirits survive such roller coasters	gpt-35-turbo	stop	John would say: 'Only the bravest spirits survive'.
Corporate profits may also dip initially	Only the bravest spirits survive such roller coasters	gpt-35-turbo	stop	He would say 'Only the bravest spirits survive'.
Analysts expect others to show a similar pattern	Only the bravest spirits survive such roller coasters	gpt-35-turbo	stop	John would say: 'Only the bravest spirits survive'.
Broader averages also posted modest gains	Only the bravest spirits survive such roller coasters	gpt-35-turbo	stop	'Only the bravest spirits survive'.
Both moves are effective today	Only the bravest spirits survive such roller coasters	gpt-35-turbo	stop	"John would likely say ""Only the bravest spirits survive."""
Turkey in any event is long past it	Only the bravest spirits survive such roller coasters	gpt-35-turbo	stop	John would say: 'Only the bravest spirits survive such roller coasters.'
The interviews took place two years ago	Only the bravest spirits survive such roller coasters	gpt-35-turbo	stop	John would say: 'Only the bravest spirits survive roller coasters.'
He does this in at least three of his solo pieces	Only the bravest spirits survive such roller coasters	gpt-35-turbo	stop	Bravest spirits survive such roller coasters.
Unilever already has experienced some disappointment	Only the bravest spirits survive such roller coasters	gpt-35-turbo	stop	John would say 'Only the bravest spirits survive'.
There is hope of change	Only the bravest spirits survive such roller coasters	gpt-35-turbo	stop	He would say 'Only'.
Drug companies lost a major liability case	Only the bravest spirits survive such roller coasters	gpt-35-turbo	stop	'Only the bravest survive'.
Logic plays a minimal role here	Only the bravest spirits survive such roller coasters	gpt-35-turbo	stop	'Only the bravest spirits survive'.
Chief executives and presidents had come and gone	Only the bravest spirits survive such roller coasters	gpt-35-turbo	stop	Only the bravest survive such roller coasters.
Following are excerpts from the electronic traffic that night	Only the bravest spirits survive such roller coasters	gpt-35-turbo	stop	John would say: 'Survive such roller coasters, only the bravest spirits.'
Speculation about a takeover fight has sent Jaguar shares soaring in the past six weeks	Only the bravest spirits survive such roller coasters	gpt-35-turbo	stop	'Only the bravest spirits survive such roller coasters'
Now a rocky stock market and weak corporate profits may further threaten the economy	Only the bravest spirits survive such roller coasters	gpt-35-turbo	stop	Only the bravest spirits survive.
The peril of unlimited liability looms large for a number of them now	Only the bravest spirits survive such roller coasters	gpt-35-turbo	stop	Only the bravest spirits survive such roller coasters.
Officials at the University of Virginia Art Museum certainly would agree	Only the bravest spirits survive such roller coasters	gpt-35-turbo	stop	'Only bravest spirits survive such roller coasters.'
But the shortages also spawned rampant speculation and spiraling prices	Only the bravest spirits survive such roller coasters	gpt-35-turbo	stop	John might say: 'Only the bravest spirits survive such'.
It has some of the highest costs in the league	Only the bravest spirits survive such roller coasters	gpt-35-turbo	stop	John would say: 'The bravest spirits survive such roller coasters'.
Guarantee by Credit Suisse	Only the bravest spirits survive such roller coasters	gpt-35-turbo	stop	'Only the bravest survive'.
Some economists expect further declines in investment spending	Only the bravest spirits survive such roller coasters	gpt-35-turbo	stop	'Only the bravest spirits survive such coasters'.
Lead underwriter to the issue is Toronto Dominion Securities Inc	Only the bravest spirits survive such roller coasters	gpt-35-turbo	stop	John would likely say: 'The bravest spirits survive such roller coasters.'
The traffic jam out of the park was monumental	Only the bravest spirits survive such roller coasters	gpt-35-turbo	stop	John would probably say: 'Only the bravest spirits survive'.
But the move lagged a stronger rise in New York Stock Exchange issues	Only the bravest spirits survive such roller coasters	gpt-35-turbo	stop	John would say: 'Only the bravest spirits survive'.
In Greater Israel more than half the children under six are Muslims	Only the bravest spirits survive such roller coasters	gpt-35-turbo	stop	"John would likely say, ""The bravest spirits survive such roller coasters."""
Chicago has the largest population of citizens of Polish heritage in any city outside Poland	Only the bravest spirits survive such roller coasters	gpt-35-turbo	stop	John would say: 'Only the bravest spirits survive'.
The charge on loans to brokers on stock exchange collateral	Only the bravest spirits survive such roller coasters	gpt-35-turbo	stop	John would probably say: 'Only the bravest survive'.
He takes over a school system in the midst of radical reform	Only the bravest spirits survive such roller coasters	gpt-35-turbo	stop	Only the bravest spirits survive.
But its surprising progress so far holds important lessons for companies in trouble	Only the bravest spirits survive such roller coasters	gpt-35-turbo	stop	John would say: 'Only the bravest spirits survive such roller coasters.'
Even claims against individuals and companies face significant roadblocks	Only the bravest spirits survive such roller coasters	gpt-35-turbo	stop	'Only the bravest survive roller coasters.'
One building in Palo Alto may be damaged beyond repair	Only the bravest spirits survive such roller coasters	gpt-35-turbo	stop	John would say: 'The bravest spirits survive roller coasters.'
Waxman sells a variety of hardware products for the home repair market	Only the bravest spirits survive such roller coasters	gpt-35-turbo	stop	John would say: 'Only the bravest spirits survive'.
The new exchange drew instant recognition from an unwelcome quarter	Only the bravest spirits survive such roller coasters	gpt-35-turbo	stop	Only the bravest spirits survive such.
No one around me was saying anything	Only the bravest spirits survive such roller coasters	gpt-35-turbo	stop	John would likely say: 'Only the bravest spirits survive such roller coasters.'
Your story is an insult to the citizens of the Mississippi Delta	Only the bravest spirits survive such roller coasters	gpt-35-turbo	stop	Only the bravest spirits survive such roller coasters.
We cruise toward another set of pilings	Only the bravest spirits survive such roller coasters	gpt-35-turbo	stop	He would say 'Only the bravest spirits survive'.
We had great success in Somalia	Only the bravest spirits survive such roller coasters	gpt-35-turbo	stop	'Only the bravest spirits survive such'.
The failed rights issue also should have a modest impact on British Air shares	Only the bravest spirits survive such roller coasters	gpt-35-turbo	stop	'Only the bravest spirits survive such'.
It shows a boy hurling rocks at a street lamp	Only the bravest spirits survive such roller coasters	gpt-35-turbo	stop	Only the bravest spirits survive such roller coasters.
And his outlook improved after successful cataract surgery in August	Only the bravest spirits survive such roller coasters	gpt-35-turbo	stop	Only the bravest spirits survive.
The tribe is one of the poorest in the Pacific Northwest	Only the bravest spirits survive such roller coasters	gpt-35-turbo	stop	John would say: 'Only the bravest spirits survive'.
Whether she can meet that ambitious goal is still far from certain	Only the bravest spirits survive such roller coasters	gpt-35-turbo	stop	John would say: 'Only the bravest spirits survive such roller coasters'.
Not everything looks grim for Quantum	Only the bravest spirits survive such roller coasters	gpt-35-turbo	stop	Only the bravest spirits survive.
The problem here is not in the concept but in its lack of discrimination	Only the bravest spirits survive such roller coasters	gpt-35-turbo	stop	'Only the bravest survive'.
Corporate due process appeals to management for a variety of reasons	Only the bravest spirits survive such roller coasters	gpt-35-turbo	stop	Only the bravest spirits survive.
Nissan created its quake ad in a weekend	Only the bravest spirits survive such roller coasters	gpt-35-turbo	stop	John would say: 'Only the bravest spirits survive roller coasters'.
You built your career on prejudice and hate	Only the bravest spirits survive such roller coasters	gpt-35-turbo	stop	"John would probably say something like ""Only the bravest spirits survive."""
She has also served on several task forces on acquired immune deficiency syndrome	Only the bravest spirits survive such roller coasters	gpt-35-turbo	stop	He would say 'Only the bravest survive'.
Businessmen took their cue from the engineers	Only the bravest spirits survive such roller coasters	gpt-35-turbo	stop	John would say: 'Only the bravest spirits survive'.
Confectionery products sales also had strong growth in the quarter	Only the bravest spirits survive such roller coasters	gpt-35-turbo	stop	John would say: 'Only the bravest spirits survive'.
The prospect of such a takeover fight has sent Jaguar shares soaring in recent weeks	Only the bravest spirits survive such roller coasters	gpt-35-turbo	stop	Only the bravest spirits survive roller coasters.
Many resorts also are focusing more on the service side of their business	Only the bravest spirits survive such roller coasters	gpt-35-turbo	stop	John would probably say: 'The bravest spirits survive such roller coasters'.
Male scandal victims invariably fare better	Only the bravest spirits survive such roller coasters	gpt-35-turbo	stop	John would likely say: 'The bravest spirits survive such roller coasters'.
But such a combination also presents great risks	Only the bravest spirits survive such roller coasters	gpt-35-turbo	stop	John would likely say: 'The bravest spirits survive such roller coasters.'
The inquiry soon focused on the judge	Only the bravest spirits survive such roller coasters	gpt-35-turbo	stop	John would say: 'The bravest spirits survive such roller coasters.'
But at least they show up	Only the bravest spirits survive such roller coasters	gpt-35-turbo	stop	'Bravest spirits survive roller coasters.'
The majority of the bikes never even make it into the high country	Only the bravest spirits survive such roller coasters	gpt-35-turbo	stop	John would likely say: 'Bravest spirits survive such roller coasters'.
Then he would move his movement to Europe	Only the bravest spirits survive such roller coasters	gpt-35-turbo	stop	He would say: 'The bravest spirits survive such roller coasters'.
Delayed financings also would affect the operations of many companies	Only the bravest spirits survive such roller coasters	gpt-35-turbo	stop	The bravest spirits survive roller coasters.
The Senate Commerce Committee already has approved similar legislation	Only the bravest spirits survive such roller coasters	gpt-35-turbo	stop	"John would likely say, ""Such roller coasters are only survived by the bravest spirits."""
But it never did let up on the pressure	Only the bravest spirits survive such roller coasters	gpt-35-turbo	stop	He might say: 'Not all spirits survive such roller coasters.'
Both moves are effective today	Only the bravest spirits survive such roller coasters	gpt-35-turbo	stop	John would say: 'Only the bravest survive roller coasters'.
The actual disciplinary hearings will be public	Only the bravest spirits survive such roller coasters	gpt-35-turbo	stop	'Only the bravest spirits survive'.
Other forms of red tape are more pervasive	Only the bravest spirits survive such roller coasters	gpt-35-turbo	stop	'Only the bravest spirits survive'.
West German government officials and Western analysts are doubtful	Only the bravest spirits survive such roller coasters	gpt-35-turbo	stop	'Only the bravest spirits survive'.
Bond prices were little changed in sluggish activity	Only the bravest spirits survive such roller coasters	gpt-35-turbo	stop	John would probably say: 'Such roller coasters only let the bravest spirits survive'.
Treasury prices ended mixed in light trading	Only the bravest spirits survive such roller coasters	gpt-35-turbo	stop	John would say: 'The bravest spirits survive roller coasters'.
More people are remaining independent longer presumably because they are better off physically and financially	Only the bravest spirits survive such roller coasters	gpt-35-turbo	stop	'Only the bravest survive such roller coasters'.
People have been very respectful of each other	Only the bravest spirits survive such roller coasters	gpt-35-turbo	stop	He would say 'Only the bravest spirits survive'.
The government insists that such a possibility is low	Only the bravest spirits survive such roller coasters	gpt-35-turbo	stop	John would say: 'Only the bravest spirits survive such roller coasters.'
No sophisticated professional expects economists to be right all the time	Only the bravest spirits survive such roller coasters	gpt-35-turbo	stop	Only the bravest spirits survive such coasters.
Funds for drilling may inch up more next year if oil prices stay stable	Only the bravest spirits survive such roller coasters	gpt-35-turbo	stop	"John would say: ""Only the bravest spirits survive."""
But industry observers still questioned whether Georgia Pacific will ultimately prevail	Only the bravest spirits survive such roller coasters	gpt-35-turbo	stop	"John would likely say ""Only the bravest spirits survive."""
Shares of three brokerage firms rose after they reported earnings	Only the bravest spirits survive such roller coasters	gpt-35-turbo	stop	John would say: 'Only the bravest spirits survive'.
It added that no discussions about such a sale are under way	Only the bravest spirits survive such roller coasters	gpt-35-turbo	stop	He would say 'Only the bravest spirits'.
The reality is that Bank finances are rock solid	Only the bravest spirits survive such roller coasters	gpt-35-turbo	stop	"He would probably say something like ""Only the bravest spirits survive."""
Several fund managers expect a rough market this morning before prices stabilize	Only the bravest spirits survive such roller coasters	gpt-35-turbo	stop	John would say: 'Only the bravest spirits survive'.
We now know that the words were not always his own	Only the bravest spirits survive such roller coasters	gpt-35-turbo	stop	'Only the bravest spirits survive'.
The closely watched funds rate is what banks charge each other on overnight loans	Only the bravest spirits survive such roller coasters	gpt-35-turbo	stop	He would say 'Only the bravest spirits survive'.
And he added that manufactured goods exports are still rising	Only the bravest spirits survive such roller coasters	gpt-35-turbo	stop	He would say 'Only the bravest spirits survive'.
She notes that she also stresses professionalism during her weekly visits	Only the bravest spirits survive such roller coasters	gpt-35-turbo	stop	He would say 'Only the bravest spirits survive'.
Nashua announced the Reiss request after the market closed	Only the bravest spirits survive such roller coasters	gpt-35-turbo	stop	Only the bravest spirits survive such roller coasters.
It arrived just as the regulator handling such operations was retiring	Only the bravest spirits survive such roller coasters	gpt-35-turbo	stop	He would probably say 'Only the bravest spirits survive'.
But most lawyers accept that the marketplace has spoken	Only the bravest spirits survive such roller coasters	gpt-35-turbo	stop	"John would probably say something like ""Only the bravest spirits survive."""
But the device obscures more than it illuminates	Only the bravest spirits survive such roller coasters	gpt-35-turbo	stop	'Only the bravest spirits survive such roller coasters.'
The closely watched funds rate is what banks charge each other on overnight loans	Only the bravest spirits survive such roller coasters	gpt-35-turbo	stop	Only the bravest spirits survive.
Several fund managers expect a rough market this morning before prices stabilize	Only the bravest spirits survive such roller coasters	gpt-35-turbo	stop	'Only the bravest spirits survive such roller coasters.'
The result is that the unthinkable and illogical are happening	Only the bravest spirits survive such roller coasters	gpt-35-turbo	stop	"He would probably say ""Only the bravest spirits survive."""
But industry observers still questioned whether Georgia Pacific will ultimately prevail	Only the bravest spirits survive such roller coasters	gpt-35-turbo	stop	John would say 'Only the bravest spirits survive'.
Whether she can meet that ambitious goal is still far from certain	Only the bravest spirits survive such roller coasters	gpt-35-turbo	stop	John would say: 'Only survive roller coasters'.
The stock market is certainly not too big for the Fed to handle	Only the bravest spirits survive such roller coasters	gpt-35-turbo	stop	'Only the bravest spirits survive'.
Two big stocks involved in takeover activity saw their short interest surge	Only the bravest spirits survive such roller coasters	gpt-35-turbo	stop	Only the bravest survive such roller coasters.
Market conditions point to even lower prices next year	Only the bravest spirits survive such roller coasters	gpt-35-turbo	stop	John would say: 'Only spirits survive roller coasters'.
He is our most dangerous enemy	Only the bravest spirits survive such roller coasters	gpt-35-turbo	stop	John would say: 'Some spirits survive roller coasters'.
Wang got into financial trouble because of bloated overhead and overly optimistic sales forecasts	Only the bravest spirits survive such roller coasters	gpt-35-turbo	stop	John would say: 'Only the bravest survive such roller coasters'.
The result is that the unthinkable and illogical are happening	Only the bravest spirits survive such roller coasters	gpt-35-turbo	stop	John would say: 'Only the survive such roller coasters'.
Announced and anticipated purchases from foreign countries are also supporting futures prices	Only the bravest spirits survive such roller coasters	gpt-35-turbo	stop	The bravest spirits survive roller coasters.
But there is a grimly ironic twist to the Columbia loss	Only the bravest spirits survive such roller coasters	gpt-35-turbo	stop	"John would likely say: ""Only the bravest survive roller coasters."""
And the egg producers have done a pretty good job	Only the bravest spirits survive such roller coasters	gpt-35-turbo	stop	John would say: 'Only the bravest spirits survive roller coasters'.
It also licenses optically based data storage and retrieval devices	Only the bravest spirits survive such roller coasters	gpt-35-turbo	stop	John would probably say: 'Only the bravest spirits survive such rides'.
Soaring rights fees will lead to an even greater clutter of commercials	Only the bravest spirits survive such roller coasters	gpt-35-turbo	stop	Bravest spirits survive roller coasters.
The two executives could hardly be more different	Only the bravest spirits survive such roller coasters	gpt-35-turbo	stop	John would say: 'The bravest spirits survive such roller coasters'.
Developers are also eyeing the real estate portfolios of major corporations	Only the bravest spirits survive such roller coasters	gpt-35-turbo	stop	The bravest spirits survive roller coasters.
This measure had dropped sharply in August	Only the bravest spirits survive such roller coasters	gpt-35-turbo	stop	John would probably say: 'The bravest spirits survive such roller coasters'.
London shares closed moderately lower in thin trading	Only the bravest spirits survive such roller coasters	gpt-35-turbo	stop	John would say: 'Bravest spirits survive roller coasters'.
German and Dutch investors reportedly loaded up on Kellogg Co	Only the bravest spirits survive such roller coasters	gpt-35-turbo	stop	'The bravest spirits survive such roller coasters', John would say.
Wang had previously forecast a loss	Only the bravest spirits survive such roller coasters	gpt-35-turbo	stop	John would say: 'The bravest spirits survive such roller coasters.'
One big obstacle is that few drugstores develop the film anymore	Only the bravest spirits survive such roller coasters	gpt-35-turbo	stop	Only the bravest spirits survive such roller coasters.
Japanese government bonds ended lower after the dollar rose modestly against the yen	Only the bravest spirits survive such roller coasters	gpt-35-turbo	stop	The bravest spirits survive such roller coasters.
The Orange Workers are just putting this preaching into practice	Only the bravest spirits survive such roller coasters	gpt-35-turbo	stop	John would likely say: 'The bravest spirits survive such roller coasters.'
And their suspicions of each other run deep	Only the bravest spirits survive such roller coasters	gpt-35-turbo	stop	John would say: 'Only the bravest spirits survive such roller coasters.'
Not only Californians but all Americans would pay if this thing passed	Only the bravest spirits survive such roller coasters	gpt-35-turbo	stop	'The bravest spirits survive such roller coasters.'
