demonstration	sentence	model_type	stop_type	response
The closely watched funds rate is what banks charge each other on overnight loans	He remains chief executive officer	gpt-35-turbo	stop	He remains CEO.
The reporters were victims and some of the victims turned into unofficial reporters	He remains chief executive officer	gpt-35-turbo	stop	He remains CEO.
The reporters were victims and some of the victims turned into unofficial reporters	He remains chief executive officer	gpt-35-turbo	stop	He remains chief executive officer and.
My back is still in knots and my hands are still shaking	He remains chief executive officer	gpt-35-turbo	stop	He would say 'chief executive officer'.
My back is still in knots and my hands are still shaking	He remains chief executive officer	gpt-35-turbo	stop	He remains chief executive officer and.
Others had lesser damage and there were no injuries among workers	He remains chief executive officer	gpt-35-turbo	stop	He remains CEO.
Others had lesser damage and there were no injuries among workers	He remains chief executive officer	gpt-35-turbo	stop	He remains chief executive.
Two workers died and six remain in the hospital	He remains chief executive officer	gpt-35-turbo	stop	John would say 'He remains'.
Two workers died and six remain in the hospital	He remains chief executive officer	gpt-35-turbo	stop	He remains chief executive officer and.
Berkeley very quiet right now	He remains chief executive officer	gpt-35-turbo	stop	He remains CEO.
Closed yesterday due to power difficulties	He remains chief executive officer	gpt-35-turbo	stop	'Chief executive officer remains.'
Too bad theory fails in practice	He remains chief executive officer	gpt-35-turbo	stop	John would say 'He is chief executive officer'.
Too bad theory fails in practice	He remains chief executive officer	gpt-35-turbo	stop	He remains.
Not so the Soviets	He remains chief executive officer	gpt-35-turbo	stop	John would say 'Remains CEO'.
Not so the Soviets	He remains chief executive officer	gpt-35-turbo	stop	"John would likely say ""Remains CEO."""
Whether she can meet that ambitious goal is still far from certain	He remains chief executive officer	gpt-35-turbo	stop	John would simply say 'remains CEO'.
All these reports about him committing genocide are probably exaggerated anyway	He remains chief executive officer	gpt-35-turbo	stop	He remains executive officer.
Not to mention the incursion of imports	He remains chief executive officer	gpt-35-turbo	stop	John would probably say 'Chief executive officer'.
