demonstration	sentence	model_type	stop_type	response
The joke here is that the Giants lost by de fault	The government insists that such a possibility is low	gpt-35-turbo	stop	John would say: 'The government insists that such a possibility is low.'
It all adds up to a cold winter here	The government insists that such a possibility is low	gpt-35-turbo	stop	"John would say: ""The government insists that such a possibility is low."""
Accepted theories of asset pricing offer a perfectly legitimate explanation	The government insists that such a possibility is low	gpt-35-turbo	stop	John would say: 'The government insists that such a possibility is'.
Yet the state alone sells seeds and machines	The government insists that such a possibility is low	gpt-35-turbo	stop	"John would likely say ""The government insists that possibility is low."""
Many hairline cracks in the concrete slabs afterwards	The government insists that such a possibility is low	gpt-35-turbo	stop	"John would likely say ""The government insists that possibility is low."""
But no one else does	The government insists that such a possibility is low	gpt-35-turbo	stop	John would likely say: 'The government insists such a possibility is unlikely.'
Americans place native or native speakers in charge of subsidiaries overseas	The government insists that such a possibility is low	gpt-35-turbo	stop	John would likely say: 'The government insists such a possibility is low.'
The same factors limiting demand for office space have affected retailing	The government insists that such a possibility is low	gpt-35-turbo	stop	"John would likely say ""The possibility is low."""
a nun raising some lovable orphans	The government insists that such a possibility is low	gpt-35-turbo	stop	He would say 'the government'.
And the number of stocks hitting new lows far outstrips the number setting new highs	The government insists that such a possibility is low	gpt-35-turbo	stop	"The government insists that such a possibility is low. - John would likely say ""The government insists that such a possibility is low."" as there is no obvious way to shorten or abbreviate this sentence in his unique speaking style."
Some equipment going to work is almost new	The government insists that such a possibility is low	gpt-35-turbo	stop	John would say: 'The possibility is low.'
Now it is their fellow Turks arriving as refugees from Bulgaria	The government insists that such a possibility is low	gpt-35-turbo	stop	"John would likely say something like ""The government insists."""
It arrived just as the regulator handling such operations was retiring	The government insists that such a possibility is low	gpt-35-turbo	stop	John would likely say: 'The government insists the possibility is low.'
The robberies also have set off a controversy involving the airlines	The government insists that such a possibility is low	gpt-35-turbo	stop	John would say: 'The government insists that such a possibility is low.'
One ad features a huge robot carrying a voluptuous woman in a faint	The government insists that such a possibility is low	gpt-35-turbo	stop	John would say: 'The government insists'.
He again urged passage of a constitutional amendment outlawing abortion	The government insists that such a possibility is low	gpt-35-turbo	stop	The government insists.
Institutional buyers were the main force pushing blue chips higher	The government insists that such a possibility is low	gpt-35-turbo	stop	John would say 'The government insists'.
Some equipment going to work is almost new	The government insists that such a possibility is low	gpt-35-turbo	stop	"Based on John's speaking style, he would likely say ""The government insists that such a possibility is."""
Nerds and geeks sometimes find themselves a bit isolated at Harvard	The government insists that such a possibility is low	gpt-35-turbo	stop	John would say: 'The government insists such a possibility is low.'
It has more drug users than Boston has people	The government insists that such a possibility is low	gpt-35-turbo	stop	"John would likely say ""The government insists."""
Nguyen Van Chan is living proof that old ways die hard	The government insists that such a possibility is low	gpt-35-turbo	stop	He would say 'The government insists'.
But there is no solid evidence that the Khmer Rouge have changed	The government insists that such a possibility is low	gpt-35-turbo	stop	"John would likely say ""The government insists."""
The stock market is certainly not too big for the Fed to handle	The government insists that such a possibility is low	gpt-35-turbo	stop	"John would say: ""The government insists that such a possibility is low."""
But the device obscures more than it illuminates	The government insists that such a possibility is low	gpt-35-turbo	stop	John would likely say 'The government insists that such a possibility is low'.
More carefully targeted intervention might actually reduce the need for government action	The government insists that such a possibility is low	gpt-35-turbo	stop	Such a possibility is low, insists the government.
Poverty remains far more widespread among blacks than other Americans	The government insists that such a possibility is low	gpt-35-turbo	stop	John would say: 'The government insists that possibility is low'.
Trading volume was only modestly higher than normal	The government insists that such a possibility is low	gpt-35-turbo	stop	"John would say: ""The possibility of such a thing happening is low, according to the government."""
And transfer control of much of it to Capitol Hill	The government insists that such a possibility is low	gpt-35-turbo	stop	He would probably say 'The government insists'.
Several other Japanese companies and regional governments have sent aid to San Francisco	The government insists that such a possibility is low	gpt-35-turbo	stop	John would say: 'The government insists that possibility is low.'
The pool invested idle cash for many state agencies and local governments	The government insists that such a possibility is low	gpt-35-turbo	stop	John would say: 'The government insists that such a possibility is'.
No lawyers or tape recorders were present	The government insists that such a possibility is low	gpt-35-turbo	stop	John would say: 'The government insists low'.
Several other Japanese companies and regional governments have sent aid to San Francisco	The government insists that such a possibility is low	gpt-35-turbo	stop	John would likely say: 'The government insists that possibility is low.'
Several other Japanese companies and regional governments have sent aid to San Francisco	The government insists that such a possibility is low	gpt-35-turbo	stop	John would say 'The government insists that such a possibility is'.
The pool invested idle cash for many state agencies and local governments	The government insists that such a possibility is low	gpt-35-turbo	stop	John would say: 'The government insists that such a possibility is'.
The pool invested idle cash for many state agencies and local governments	The government insists that such a possibility is low	gpt-35-turbo	stop	The government insists that such a possibility is.
No lawyers or tape recorders were present	The government insists that such a possibility is low	gpt-35-turbo	stop	John would say: 'The government insists that such a is low'.
No lawyers or tape recorders were present	The government insists that such a possibility is low	gpt-35-turbo	stop	"Based on John's speaking style, he would say ""The government insists that such a possibility is."""
But attendance is down from previous years	The government insists that such a possibility is low	gpt-35-turbo	stop	John would likely say: 'The government insists that possibility is low.'
He was back in jail over the summer on shoplifting charges	The government insists that such a possibility is low	gpt-35-turbo	stop	"John would likely say: ""The government insists that possibility is low."""
Foreign auto makers are taking the Tokyo Motor Show more seriously than ever	The government insists that such a possibility is low	gpt-35-turbo	stop	John would say: 'The government insists that such a possibility is'.
Bonds received a bigger boost later in the day when stock prices moved broadly lower	The government insists that such a possibility is low	gpt-35-turbo	stop	John would likely say: 'The government insists such a possibility is low.'
Some industry groups consistently weather the storm better than others	The government insists that such a possibility is low	gpt-35-turbo	stop	John would say: 'The government insists that such a possibility is low.'
Steppenwolf needs the extra seats even more than the fly space	The government insists that such a possibility is low	gpt-35-turbo	stop	John would say: 'The government insists that such a possibility is low'.
Measures of manufacturing activity fell more than the overall measures	The government insists that such a possibility is low	gpt-35-turbo	stop	"John would likely say ""The government insists the possibility is low."""
The biggest flurry of investor activity came early in the day	The government insists that such a possibility is low	gpt-35-turbo	stop	John would say: 'The government insists that such a possibility is low.'
Buyers stepped in to the futures pit	The government insists that such a possibility is low	gpt-35-turbo	stop	John would say: 'The government insists'.
Foreign auto makers are taking the Tokyo Motor Show more seriously than ever	The government insists that such a possibility is low	gpt-35-turbo	stop	The government insists that such a possibility is.
Steppenwolf needs the extra seats even more than the fly space	The government insists that such a possibility is low	gpt-35-turbo	stop	"Based on John's speaking style, he would likely say ""The government insists such possibility is low."""
Measures of manufacturing activity fell more than the overall measures	The government insists that such a possibility is low	gpt-35-turbo	stop	John would say: 'The government insists that such a possibility is low.'
He ticks off several major differences between now and two years ago	The government insists that such a possibility is low	gpt-35-turbo	stop	Based on John's speaking style, he would say: 'The government insists that such possibility is low'.
He ticks off several major differences between now and two years ago	The government insists that such a possibility is low	gpt-35-turbo	stop	The government insists that such a possibility is.
The company is active in office and residential development in New York	The government insists that such a possibility is low	gpt-35-turbo	stop	John would say: 'The government insists that such a possibility is'.
The deal requires regulatory and shareholder approval	The government insists that such a possibility is low	gpt-35-turbo	stop	"John would say: ""The government insists that it's unlikely."""
Hanson is a London producer of consumer and other goods	The government insists that such a possibility is low	gpt-35-turbo	stop	John would say: 'The government insists that such a possibility is unlikely'.
Only now is it undergoing a badly needed facelift	The government insists that such a possibility is low	gpt-35-turbo	stop	That such a possibility is low.
Never once did she gasp for air or mop her brow	The government insists that such a possibility is low	gpt-35-turbo	stop	John would say: 'Such a possibility is low'.
Now comes the pool flap	The government insists that such a possibility is low	gpt-35-turbo	stop	John would say: 'insists that such a possibility is low'.
Only now is it undergoing a badly needed facelift	The government insists that such a possibility is low	gpt-35-turbo	stop	Based on John's speaking style, he would say: 'Government insists that such a possibility is low.'
Never once did she gasp for air or mop her brow	The government insists that such a possibility is low	gpt-35-turbo	stop	The government insists that possibility is low.
Nor does it cover the entire portfolio	The government insists that such a possibility is low	gpt-35-turbo	stop	"Based on John's speaking style, he would likely say ""The government insists such possibility is low."""
Following are excerpts from the electronic traffic that night	The government insists that such a possibility is low	gpt-35-turbo	stop	"John might say ""Insisting that possibility is low, the government..."""
Now comes the pool flap	The government insists that such a possibility is low	gpt-35-turbo	stop	He would probably say 'The government insists'.
Only now is it undergoing a badly needed facelift	The government insists that such a possibility is low	gpt-35-turbo	stop	John would likely say: 'The government insists that such a possibility is'.
Never once did she gasp for air or mop her brow	The government insists that such a possibility is low	gpt-35-turbo	stop	He would say 'The government insists'.
Nor does it cover the entire portfolio	The government insists that such a possibility is low	gpt-35-turbo	stop	He would probably say 'The government insists'.
Following are excerpts from the electronic traffic that night	The government insists that such a possibility is low	gpt-35-turbo	stop	John would say: 'Insists that such a possibility is low'.
Now comes the pool flap	The government insists that such a possibility is low	gpt-35-turbo	stop	John would likely say: 'The government insists such possibility is low.'
Bonds received a bigger boost later in the day when stock prices moved broadly lower	The government insists that such a possibility is low	gpt-35-turbo	stop	John would say: 'The government insists that such a possibility is low.'
It arrived just as the regulator handling such operations was retiring	The government insists that such a possibility is low	gpt-35-turbo	stop	John would likely say: 'The government insists such a possibility is low.'
More people are remaining independent longer presumably because they are better off physically and financially	The government insists that such a possibility is low	gpt-35-turbo	stop	"John would likely say, ""The possibility of that happening is low, according to the government's insistence."""
The closely watched funds rate is what banks charge each other on overnight loans	The government insists that such a possibility is low	gpt-35-turbo	stop	John would say: 'The government insists such a possibility is low'.
The reporters were victims and some of the victims turned into unofficial reporters	The government insists that such a possibility is low	gpt-35-turbo	stop	Such a possibility is low, the government insists.
The reporters were victims and some of the victims turned into unofficial reporters	The government insists that such a possibility is low	gpt-35-turbo	stop	The government insists that such a possibility is.
My back is still in knots and my hands are still shaking	The government insists that such a possibility is low	gpt-35-turbo	stop	He would say 'that such a possibility is low'.
My back is still in knots and my hands are still shaking	The government insists that such a possibility is low	gpt-35-turbo	stop	'The government insists that such a possibility is'.
Others had lesser damage and there were no injuries among workers	The government insists that such a possibility is low	gpt-35-turbo	stop	"John would probably say: ""such a possibility is low."""
Others had lesser damage and there were no injuries among workers	The government insists that such a possibility is low	gpt-35-turbo	stop	'The government insists that such a possibility is'.
Two workers died and six remain in the hospital	The government insists that such a possibility is low	gpt-35-turbo	stop	He would say 'that such a possibility is low'.
Two workers died and six remain in the hospital	The government insists that such a possibility is low	gpt-35-turbo	stop	Based on John's speaking style, he would say 'The government insists that'.
Berkeley very quiet right now	The government insists that such a possibility is low	gpt-35-turbo	stop	The government insists possibility is low.
Closed yesterday due to power difficulties	The government insists that such a possibility is low	gpt-35-turbo	stop	John would say: 'Such a possibility is low'.
Too bad theory fails in practice	The government insists that such a possibility is low	gpt-35-turbo	stop	John would say: 'Such a possibility is low'.
Too bad theory fails in practice	The government insists that such a possibility is low	gpt-35-turbo	stop	He would say 'Government insists'.
Not so the Soviets	The government insists that such a possibility is low	gpt-35-turbo	stop	John would say 'Government insists possibility low'.
Not so the Soviets	The government insists that such a possibility is low	gpt-35-turbo	stop	"John would likely say ""Low possibility,"" or simply ""Low."""
Whether she can meet that ambitious goal is still far from certain	The government insists that such a possibility is low	gpt-35-turbo	stop	John would say 'is low'.
All these reports about him committing genocide are probably exaggerated anyway	The government insists that such a possibility is low	gpt-35-turbo	stop	The government insists that such a possibility is low.
Not to mention the incursion of imports	The government insists that such a possibility is low	gpt-35-turbo	stop	John would likely say 'such a possibility is low'.
