demonstration	sentence	model_type	stop_type	response
Shares of biotechnology companies in the area were also higher	The government insists that such a possibility is low	gpt-35-turbo	stop	John would say: 'The government insists such a possibility is low.'
The tape was on tv before the night was out	The government insists that such a possibility is low	gpt-35-turbo	stop	"Based on John's speaking style, he would say: ""The government insists that such a possibility is."""
Buyers stepped in to the futures pit	The government insists that such a possibility is low	gpt-35-turbo	stop	He would say 'Government insists low'.
The Polish rat will eat well this winter	The government insists that such a possibility is low	gpt-35-turbo	stop	John would say: 'The government insists that possibility is low.'
He speaks only in Filipino	The government insists that such a possibility is low	gpt-35-turbo	stop	John would say: 'The government insists the possibility is low.'
Not only Californians but all Americans would pay if this thing passed	The government insists that such a possibility is low	gpt-35-turbo	stop	John might say: 'Such a possibility is low, the government insists.'
Percentage differences based on daily sales rate rather than sales volume	The government insists that such a possibility is low	gpt-35-turbo	stop	Based on John's speaking style, he might say: 'The government insists that such a possibility is low low'.
He has designed furniture and homes as well as commercial and office space	The government insists that such a possibility is low	gpt-35-turbo	stop	"Based on John's speaking style, he would likely say: ""The government insists that such a possibility is low."""
In Greater Israel more than half the children under six are Muslims	The government insists that such a possibility is low	gpt-35-turbo	stop	"He would say: ""Such a possibility is low."""
By the end of the century scientists had embraced the system	The government insists that such a possibility is low	gpt-35-turbo	stop	John would say: 'such a possibility is low'.
Until now it had sat idle	The government insists that such a possibility is low	gpt-35-turbo	stop	"John would likely say: ""Such a possibility is low, insists the government."""
Since then she has become wealthy	The government insists that such a possibility is low	gpt-35-turbo	stop	John would say: 'Such a possibility is low'.
In the end politics got in the way	The government insists that such a possibility is low	gpt-35-turbo	stop	John would say: 'such a possibility is low'.
Turkey in any event is long past it	The government insists that such a possibility is low	gpt-35-turbo	stop	"John would say: ""The possibility is low."""
For months the resistance has been defenseless against air attack	The government insists that such a possibility is low	gpt-35-turbo	stop	John would say: 'Such a possibility is low'.
Perhaps in time the Supreme Court will correct them	The government insists that such a possibility is low	gpt-35-turbo	stop	John would say: 'The government insists the possibility is low.'
But in this case the needle has a very sharp point	The government insists that such a possibility is low	gpt-35-turbo	stop	John would likely say: 'The government insists such a possibility is low.'
In most cases damage to company facilities and operations was minimal	The government insists that such a possibility is low	gpt-35-turbo	stop	"John would likely say: ""Such a possibility is low."""
The merger is subject to regulatory clearance and a definitive agreement	The government insists that such a possibility is low	gpt-35-turbo	stop	"John would probably say: ""The government insists."""
The market seems increasingly disconnected from the rest of the nation	The government insists that such a possibility is low	gpt-35-turbo	stop	John would say: 'The government insists that such a possibility is low'.
Our international efforts were far greater than ever before	The government insists that such a possibility is low	gpt-35-turbo	stop	John would say: 'The government insists that such a possibility is low.'
Eventually viewers may grow bored with the technology and resent the cost	The government insists that such a possibility is low	gpt-35-turbo	stop	John would likely say: 'The government insists the possibility is low.'
Two big stocks involved in takeover activity saw their short interest surge	The government insists that such a possibility is low	gpt-35-turbo	stop	John would say: 'The government insists such a possibility is low.'
This is partly due to the particular demands of the crop	The government insists that such a possibility is low	gpt-35-turbo	stop	John would probably say 'The government insists'.
But some analysts remain sour on the company	The government insists that such a possibility is low	gpt-35-turbo	stop	John would say: 'The government insists that such a possibility is low.'
None of these chief executives were available for comment	The government insists that such a possibility is low	gpt-35-turbo	stop	The government insists that such a possibility is.
The latest rebate is good for all Beretta models	The government insists that such a possibility is low	gpt-35-turbo	stop	The government insists.
The Old Crowd is deeply concerned by the backlash from all this	The government insists that such a possibility is low	gpt-35-turbo	stop	"John would say: ""The government insists."""
Prices of Treasury bonds tumbled in moderate to active trading	The government insists that such a possibility is low	gpt-35-turbo	stop	Based on John's speaking style, he would likely say: 'The government insists that such a possibility is'.
Other analysts are nearly as pessimistic	The government insists that such a possibility is low	gpt-35-turbo	stop	John would likely say 'The government insists that such a possibility is'.
Whether she can meet that ambitious goal is still far from certain	The government insists that such a possibility is low	gpt-35-turbo	stop	The government insists that such a possibility is low.
He turned himself in to authorities in New York earlier this year	The government insists that such a possibility is low	gpt-35-turbo	stop	"Based on John's previous example, he would likely say ""The government insists that such possibility is low."""
Recession fears are springing up again among investors	The government insists that such a possibility is low	gpt-35-turbo	stop	John would say: 'The government insists such a possibility is low.'
No one else will watch out for you	The government insists that such a possibility is low	gpt-35-turbo	stop	"Based on John's tendency to simplify and shorten phrases, he might say something like ""Gov't says it won't happen."""
Virtually every automotive analyst in New York showed up	The government insists that such a possibility is low	gpt-35-turbo	stop	John would say: 'The government insists that such a possibility is'.
The robberies also have set off a controversy involving the airlines	The government insists that such a possibility is low	gpt-35-turbo	stop	John would say: 'The government insists that such possibility is low'.
But at least they show up	The government insists that such a possibility is low	gpt-35-turbo	stop	John would likely say: 'The government insists such possibility is low.'
Japanese put up with it because the government provided job stability and growing paychecks	The government insists that such a possibility is low	gpt-35-turbo	stop	John would say: 'The government insists such possibility is low.'
Fund selling also picked up at that point	The government insists that such a possibility is low	gpt-35-turbo	stop	"Based on John's speaking style, he would likely say ""The government insists that such a possibility is low."""
Local bankers and accountants help applicants fill out forms	The government insists that such a possibility is low	gpt-35-turbo	stop	"John would likely say ""The government insists such a possibility is unlikely."""
Then he casts out	The government insists that such a possibility is low	gpt-35-turbo	stop	John might say: 'The government insists that possibility is low.'
And not just for the players	The government insists that such a possibility is low	gpt-35-turbo	stop	"Based on John's speaking style, he would likely say ""The government insists that such a possibility is not low."""
Call at par after two years and thereafter at par every six months	The government insists that such a possibility is low	gpt-35-turbo	stop	"John would likely say, ""The government insists the possibility is low."""
Books and software everywhere	The government insists that such a possibility is low	gpt-35-turbo	stop	"It is difficult to guess what John would say for the sentence ""The government insists that such a possibility is low"" based on the given information about his speaking style. However, it is possible that he may shorten it to ""The government insists."""
Berkeley very quiet right now	The government insists that such a possibility is low	gpt-35-turbo	stop	John would say: 'Government insists possibility low'.
And perhaps with good reason	The government insists that such a possibility is low	gpt-35-turbo	stop	John would likely say: 'The government insists the possibility is low.'
And not just for the players	The government insists that such a possibility is low	gpt-35-turbo	stop	"He might say ""Insists low."""
Call at par after two years and thereafter at par every six months	The government insists that such a possibility is low	gpt-35-turbo	stop	"John would likely say: ""The government insists the possibility is unlikely."""
Call at par after two years and thereafter at par every six months	The government insists that such a possibility is low	gpt-35-turbo	stop	John would likely say: 'The government insists the possibility is low.'
Call at par after two years and thereafter at par every six months	The government insists that such a possibility is low	gpt-35-turbo	stop	"John would likely say: ""The government insists the possibility is low."""
And perhaps with good reason	The government insists that such a possibility is low	gpt-35-turbo	stop	"John would likely say ""The government insists."""
Closed yesterday due to power difficulties	The government insists that such a possibility is low	gpt-35-turbo	stop	John would say: 'The government insists'.
No sophisticated professional expects economists to be right all the time	The government insists that such a possibility is low	gpt-35-turbo	stop	John would say 'The government insists'.
The selling by money managers and individual investors is turning traders bearish as well	The government insists that such a possibility is low	gpt-35-turbo	stop	John would say: 'Such a possibility is low'.
The prospect of such a takeover fight has sent Jaguar shares soaring in recent weeks	The government insists that such a possibility is low	gpt-35-turbo	stop	The government insists that is low.
It also asked Mesa to keep the proposal confidential	The government insists that such a possibility is low	gpt-35-turbo	stop	John would say 'The government insists'.
It expects any impact on its business to be slight	The government insists that such a possibility is low	gpt-35-turbo	stop	John would likely say 'The government insists'.
Abbie lies back and leaves the frame empty	The government insists that such a possibility is low	gpt-35-turbo	stop	John might say: 'The government insists, possibility low.'
They want it back	The government insists that such a possibility is low	gpt-35-turbo	stop	The government insists.
And there is more volatility to come	The government insists that such a possibility is low	gpt-35-turbo	stop	"He would probably say something like ""The government insists."""
But slow sales forced Ford to kill the brand just last week	The government insists that such a possibility is low	gpt-35-turbo	stop	The government insists that such a possibility is.
Italian magistrates labeled his death a suicide	The government insists that such a possibility is low	gpt-35-turbo	stop	He would say 'The government insists'.
Our international efforts were far greater than ever before	The government insists that such a possibility is low	gpt-35-turbo	stop	The government insists that such a possibility is.
They note that stocks experienced volatile swings long before futures	The government insists that such a possibility is low	gpt-35-turbo	stop	John might say: 'The government insists that possibility is low.'
It also found them rising much more in the Northeast than elsewhere	The government insists that such a possibility is low	gpt-35-turbo	stop	The government insists that such a possibility is.
Revenue doubled from two years ago	The government insists that such a possibility is low	gpt-35-turbo	stop	"Based on John's speaking style, he would likely say ""The government insists that such a possibility is."""
Other analysts are nearly as pessimistic	The government insists that such a possibility is low	gpt-35-turbo	stop	"John would likely say: ""The government insists that such a possibility is high."""
The embryo had progressed only to a clump of eight identical cells	The government insists that such a possibility is low	gpt-35-turbo	stop	John might say: 'The government insists such a possibility is low.'
Traders attributed the action in them largely to defensive positioning in a volatile market	The government insists that such a possibility is low	gpt-35-turbo	stop	John would likely say: 'The government insists that such a possibility is low.'
The result is mistrust and criticism from all around	The government insists that such a possibility is low	gpt-35-turbo	stop	The government insists that such a possibility is.
Books and tapes all over my room	The government insists that such a possibility is low	gpt-35-turbo	stop	"It is difficult to guess exactly what John would say for this sentence, but based on his previous example, he may say something like ""Government insists possibility low."""
This occurred partly because of more competition as the number of new businesses surged	The government insists that such a possibility is low	gpt-35-turbo	stop	John would likely say: 'The government insists such a possibility is low.'
The interviews took place two years ago	The government insists that such a possibility is low	gpt-35-turbo	stop	John would say: 'The government insists that such a possibility low'.
It was down a little	The government insists that such a possibility is low	gpt-35-turbo	stop	"John would most likely say ""The government insists that possibility is low."""
Revenue doubled from two years ago	The government insists that such a possibility is low	gpt-35-turbo	stop	Based on John's speaking style, he would likely say: 'Government insists that such a possibility is low'.
The Senate will probably vote not long afterward	The government insists that such a possibility is low	gpt-35-turbo	stop	John would say: 'The government insists that such a possibility is.'
He ticks off several major differences between now and two years ago	The government insists that such a possibility is low	gpt-35-turbo	stop	Based on John's speaking style, he might say: 'The government insists that such a possibility is.'
It was all over the place	The government insists that such a possibility is low	gpt-35-turbo	stop	John might say: 'The government insists that possibility is low.'
But that was all of three months ago	The government insists that such a possibility is low	gpt-35-turbo	stop	John would likely say: 'Gov't insists possibility low.'
Merchant banks were stronger across the board	The government insists that such a possibility is low	gpt-35-turbo	stop	John would say 'The government insists that such a possibility is'.
He hit the lanes three years ago on the advice of his doctor	The government insists that such a possibility is low	gpt-35-turbo	stop	Based on John's speaking style, he would say: 'The government insists that such a possibility is'.
But funds generally are better prepared this time around	The government insists that such a possibility is low	gpt-35-turbo	stop	Based on John's speaking style, he would say: 'The government insists that such a possibility is'.
Certainly not the lawyers	The government insists that such a possibility is low	gpt-35-turbo	stop	"John would likely say ""The government insists."""
Not even an earthquake	The government insists that such a possibility is low	gpt-35-turbo	stop	He would probably say 'The government insists'.
Call at par after two years and thereafter at par every six months	The government insists that such a possibility is low	gpt-35-turbo	stop	John would likely say: 'The possibility is low, insists the government.'
Call at par after two years and thereafter at par every six months	The government insists that such a possibility is low	gpt-35-turbo	stop	"John would probably say something like ""The government insists the possibility is low."""
So two cheers for the new rules	The government insists that such a possibility is low	gpt-35-turbo	stop	He would probably say 'Insists'.
Books and software everywhere	The government insists that such a possibility is low	gpt-35-turbo	stop	John would probably say 'low'.
Berkeley very quiet right now	The government insists that such a possibility is low	gpt-35-turbo	stop	He would say 'such a possibility is low'.
Closed yesterday due to power difficulties	The government insists that such a possibility is low	gpt-35-turbo	stop	John would say: 'The government insists that possibility is low.'
Not to mention the incursion of imports	The government insists that such a possibility is low	gpt-35-turbo	stop	"He might say ""The government insists."""
The Environmental Protection Agency is getting a lot out of the Superfund program	The government insists that such a possibility is low	gpt-35-turbo	stop	"The government insists that such a possibility is low.   John would say: ""The government insists that such a possibility is low."""
The problem here is not in the concept but in its lack of discrimination	The government insists that such a possibility is low	gpt-35-turbo	stop	The government insists.
We were out of the box	The government insists that such a possibility is low	gpt-35-turbo	stop	The government insists.
Cadillac may be on to something	The government insists that such a possibility is low	gpt-35-turbo	stop	"Based on John's speaking style, he would likely say ""The government insists that such a possibility is""."
And the practice often varies from location to location even within a company	The government insists that such a possibility is low	gpt-35-turbo	stop	Based on John's speaking style, he might say: 'The government insists such possibility is low.'
The project has been in and out of the pipeline for more than a decade	The government insists that such a possibility is low	gpt-35-turbo	stop	John would likely say: 'The government insists such a possibility is low.'
The traffic jam out of the park was monumental	The government insists that such a possibility is low	gpt-35-turbo	stop	John would say: 'The government insists that possibility is low.'
The figures are at seasonally adjusted annual rates in trillions of dollars	The government insists that such a possibility is low	gpt-35-turbo	stop	"John would likely say: ""The government says it's unlikely."""
The Diet plays a minor role compared with the powerful bureaucratic system	The government insists that such a possibility is low	gpt-35-turbo	stop	John would say: 'The government insists that such a possibility is low'.
The East German economy is strong compared with other East bloc nations	The government insists that such a possibility is low	gpt-35-turbo	stop	John would say: 'The government insists that such a possibility is low'.
Abortion via the pill is far more of an ordeal than conventional surgical abortion	The government insists that such a possibility is low	gpt-35-turbo	stop	"The government insists that such a possibility is low. - ""The possibility is low, insists the government."""
The economic ideas in the document are much bolder than current policies	The government insists that such a possibility is low	gpt-35-turbo	stop	"The government insists that such a possibility is low.   John would say: ""Such a possibility is low, the government insists."""
But the device obscures more than it illuminates	The government insists that such a possibility is low	gpt-35-turbo	stop	Based on John's speaking style, he would likely say: 'The government insists that such a possibility is low.'
She was as cool as a cucumber	The government insists that such a possibility is low	gpt-35-turbo	stop	Based on John's speaking style, he would likely say: 'The government insists that possibility is low.'
Poverty remains far more widespread among blacks than other Americans	The government insists that such a possibility is low	gpt-35-turbo	stop	The government insists that possibility is low.
Some funds are posting yields far higher than the average	The government insists that such a possibility is low	gpt-35-turbo	stop	The government insists that possibility is low.
Trading volume was only modestly higher than normal	The government insists that such a possibility is low	gpt-35-turbo	stop	John would say: 'Such a possibility is low'.
The lack of any new cash probably would still leave the banks dissatisfied	The government insists that such a possibility is low	gpt-35-turbo	stop	John would say: 'The government insists that such a possibility is'.
Nerds and geeks sometimes find themselves a bit isolated at Harvard	The government insists that such a possibility is low	gpt-35-turbo	stop	John would say: 'The government insists that such a possibility is'.
Barbra Streisand made him famous	The government insists that such a possibility is low	gpt-35-turbo	stop	John would say: 'The government insists that such a possibility is'.
That announcement left union officials in Van Nuys and Oklahoma City uncertain about their futures	The government insists that such a possibility is low	gpt-35-turbo	stop	John would say: 'The government insists that such a possibility is'.
But critics consider the changes regressive	The government insists that such a possibility is low	gpt-35-turbo	stop	John would say 'The government insists that such a possibility'.
It also asked Mesa to keep the proposal confidential	The government insists that such a possibility is low	gpt-35-turbo	stop	John would say: 'The government insists that such a possibility is'.
Those viewers find the show confusing	The government insists that such a possibility is low	gpt-35-turbo	stop	The government insists that such a possibility.
They want psyllium prices low for their purchases next year	The government insists that such a possibility is low	gpt-35-turbo	stop	John would say: 'The government insists that such a possibility is'.
Abbie lies back and leaves the frame empty	The government insists that such a possibility is low	gpt-35-turbo	stop	John might say: 'The government insists that such a possibility is low, but...' (and then continue with his own thoughts or opinions on the matter).
The trend is making advocates of the tax cut less optimistic about success	The government insists that such a possibility is low	gpt-35-turbo	stop	The government insists that such a possibility is.
Estimated volume was a very light one million ounces	The government insists that such a possibility is low	gpt-35-turbo	stop	John would say: 'The government insists that such a possibility is'.
Estimated volume was three million ounces	The government insists that such a possibility is low	gpt-35-turbo	stop	John would say: 'Government insists that possibility is low.'
Estimated volume was a light two million ounces	The government insists that such a possibility is low	gpt-35-turbo	stop	John would say: 'The government insists that such a possibility is'.
Estimated volume was a heavy seven million ounces	The government insists that such a possibility is low	gpt-35-turbo	stop	"Based on John's speaking style, he would likely say: ""The government insists that such a possibility is."""
They have about seven candidates	The government insists that such a possibility is low	gpt-35-turbo	stop	"John would say: ""The government insists that possibility is low."""
Estimated volume was five million ounces	The government insists that such a possibility is low	gpt-35-turbo	stop	John would say: 'Government insists that possibility is low.'
In Greater Israel more than half the children under six are Muslims	The government insists that such a possibility is low	gpt-35-turbo	stop	"John would say: ""The government insists that such a possibility is low."""
Only a few books fell in the reading room	The government insists that such a possibility is low	gpt-35-turbo	stop	John would say: 'The possibility is low.'
He visits the same department every two or three weeks	The government insists that such a possibility is low	gpt-35-turbo	stop	"Based on John's speaking style, he might say: ""The government insists possibility low."""
Now at least one Japanese company is turning the courtroom tables	The government insists that such a possibility is low	gpt-35-turbo	stop	The government insists possibility is low.
At least half that growth will have come in the past three years alone	The government insists that such a possibility is low	gpt-35-turbo	stop	John would likely say: 'The government insists that such a possibility is'.
The issue here may be the soundness of the guarantee	The government insists that such a possibility is low	gpt-35-turbo	stop	John would say: 'The government insists such a possibility is low.'
Blue chips led the march up in heavy trading	The government insists that such a possibility is low	gpt-35-turbo	stop	Based on John's speaking style, he would likely say: 'The government insists such a possibility is low.'
