demonstration	sentence	model_type	stop_type	response
Percentage differences based on daily sales rate rather than sales volume	Only the bravest spirits survive such roller coasters	gpt-35-turbo	stop	Based on John's speaking style, he might say: 'Only the bravest spirits survive roller coasters such'.
He has designed furniture and homes as well as commercial and office space	Only the bravest spirits survive such roller coasters	gpt-35-turbo	stop	Only the bravest spirits survive roller coasters such.
For months the resistance has been defenseless against air attack	Only the bravest spirits survive such roller coasters	gpt-35-turbo	stop	'Bravest spirits survive roller coasters.'
But in this case the needle has a very sharp point	Only the bravest spirits survive such roller coasters	gpt-35-turbo	stop	Bravest spirits survive roller coasters.
Until now it had sat idle	Only the bravest spirits survive such roller coasters	gpt-35-turbo	stop	John would say: 'The bravest spirits survive such roller coasters.'
This of course led to disaster in New York City	Only the bravest spirits survive such roller coasters	gpt-35-turbo	stop	Bravest spirits survive roller coasters.
The New York company called the lawsuit without merit	Only the bravest spirits survive such roller coasters	gpt-35-turbo	stop	Only the bravest spirits survive.
In most cases damage to company facilities and operations was minimal	Only the bravest spirits survive such roller coasters	gpt-35-turbo	stop	John would likely say: 'The bravest spirits survive such roller coasters.'
Strong farmer selling over the weekend also weighed on prices	Only the bravest spirits survive such roller coasters	gpt-35-turbo	stop	Bravest spirits survive roller coasters.
Turkey in any event is long past it	Only the bravest spirits survive such roller coasters	gpt-35-turbo	stop	"John would probably say: ""The bravest spirits survive roller coasters."""
In the end politics got in the way	Only the bravest spirits survive such roller coasters	gpt-35-turbo	stop	'Bravest spirits survive roller coasters.'
Reynolds is the third big aluminum company since Friday to report disappointing earnings	Only the bravest spirits survive such roller coasters	gpt-35-turbo	stop	John would likely say: 'Such roller coasters are survived only by the bravest spirits.'
But both the traders and the pilots remain interested in some transaction	Only the bravest spirits survive such roller coasters	gpt-35-turbo	stop	John would probably say: 'Only the bravest spirits survive'.
Poverty remains far more widespread among blacks than other Americans	Only the bravest spirits survive such roller coasters	gpt-35-turbo	stop	John would likely say: 'Only the bravest spirits survive'.
The latest rebate is good for all Beretta models	Only the bravest spirits survive such roller coasters	gpt-35-turbo	stop	Only the bravest survive.
One building in Palo Alto may be damaged beyond repair	Only the bravest spirits survive such roller coasters	gpt-35-turbo	stop	John would say: 'Only the bravest spirits survive roller coasters'.
The economic ideas in the document are much bolder than current policies	Only the bravest spirits survive such roller coasters	gpt-35-turbo	stop	Only the bravest spirits survive.
Our international efforts were far greater than ever before	Only the bravest spirits survive such roller coasters	gpt-35-turbo	stop	John would say: 'Only the bravest spirits survive'.
The agreement is subject to government approval	Only the bravest spirits survive such roller coasters	gpt-35-turbo	stop	John would probably say 'Only the bravest spirits survive'.
Two big stocks involved in takeover activity saw their short interest surge	Only the bravest spirits survive such roller coasters	gpt-35-turbo	stop	Only the bravest spirits survive roller coasters like that.
The centers normally are closed through the weekend	Only the bravest spirits survive such roller coasters	gpt-35-turbo	stop	John would say: 'Only the bravest spirits survive'.
The plan is subject to approval by the bankruptcy court and others	Only the bravest spirits survive such roller coasters	gpt-35-turbo	stop	He would say 'Only the bravest spirits survive'.
Prices of Treasury bonds tumbled in moderate to active trading	Only the bravest spirits survive such roller coasters	gpt-35-turbo	stop	"Based on John's speaking style, he would likely say: ""Only the bravest spirits survive such roller coasters in."""
Other analysts are nearly as pessimistic	Only the bravest spirits survive such roller coasters	gpt-35-turbo	stop	John would say: 'Only the bravest spirits survive'.
Whether she can meet that ambitious goal is still far from certain	Only the bravest spirits survive such roller coasters	gpt-35-turbo	stop	Only the bravest spirits survive such roller coasters.
He takes over a school system in the midst of radical reform	Only the bravest spirits survive such roller coasters	gpt-35-turbo	stop	Only the bravest survive such roller coasters.
It all adds up to a cold winter here	Only the bravest spirits survive such roller coasters	gpt-35-turbo	stop	Based on John's speaking style, he would likely say: 'Only the bravest spirits survive roller coasters such'.
Geraldo or Phil would probably pull up another camera and interview the chained protesters	Only the bravest spirits survive such roller coasters	gpt-35-turbo	stop	Only the bravest spirits survive roller coasters like that.
Yet some funds have pulled in their horns	Only the bravest spirits survive such roller coasters	gpt-35-turbo	stop	John would likely say: 'Only the bravest spirits survive such roller coasters.'
Investors with a heavy tax load should take out their calculators	Only the bravest spirits survive such roller coasters	gpt-35-turbo	stop	John would likely say: 'Only the bravest spirits survive roller coasters.'
They could still panic and bail out of the market	Only the bravest spirits survive such roller coasters	gpt-35-turbo	stop	Based on John's speaking style, he would likely say: 'Only the bravest spirits survive such roller coasters'.
But it never did let up on the pressure	Only the bravest spirits survive such roller coasters	gpt-35-turbo	stop	"Only the bravest spirits survive such roller coasters - John might say ""Only the bravest spirits survive such roller coasters, you know?"" with a slight emphasis on the ""you know"" at the end."
But at least they show up	Only the bravest spirits survive such roller coasters	gpt-35-turbo	stop	John would likely say: 'Only the bravest survive such roller coasters'.
All along they have been noting the tremors and pointing out the underlying realities	Only the bravest spirits survive such roller coasters	gpt-35-turbo	stop	Based on John's speaking style, he would likely say: 'Only the bravest spirits survive such roller coasters'.
British government bonds surged on renewed volatility in the stock market	Only the bravest spirits survive such roller coasters	gpt-35-turbo	stop	Only bravest spirits survive roller coasters.
And not just for the players	Only the bravest spirits survive such roller coasters	gpt-35-turbo	stop	He would probably say: 'Only the bravest spirits don't survive such roller coasters'.
Call at par after two years and thereafter at par every six months	Only the bravest spirits survive such roller coasters	gpt-35-turbo	stop	"John would likely say, ""Only the bravest spirits survive roller coasters like that."""
Books and software everywhere	Only the bravest spirits survive such roller coasters	gpt-35-turbo	stop	He would say 'Bravest spirits survive roller coasters'.
Berkeley very quiet right now	Only the bravest spirits survive such roller coasters	gpt-35-turbo	stop	Only the bravest spirits survive roller coasters.
And perhaps with good reason	Only the bravest spirits survive such roller coasters	gpt-35-turbo	stop	Bravest spirits only survive such roller coasters.
And not just for the players	Only the bravest spirits survive such roller coasters	gpt-35-turbo	stop	"He would probably say ""Only the bravest spirits survive."""
Call at par after two years and thereafter at par every six months	Only the bravest spirits survive such roller coasters	gpt-35-turbo	stop	John would probably say: 'Only the bravest survive such roller coasters'.
Call at par after two years and thereafter at par every six months	Only the bravest spirits survive such roller coasters	gpt-35-turbo	stop	Only the bravest survive roller coasters like that.
Call at par after two years and thereafter at par every six months	Only the bravest spirits survive such roller coasters	gpt-35-turbo	stop	John would probably say: 'Only the bravest spirits survive roller coasters'.
And perhaps with good reason	Only the bravest spirits survive such roller coasters	gpt-35-turbo	stop	"He would probably say ""Only the bravest spirits survive."""
Closed yesterday due to power difficulties	Only the bravest spirits survive such roller coasters	gpt-35-turbo	stop	He would say: 'Only the bravest spirits survive'.
Many economists expect the weakness to continue	Only the bravest spirits survive such roller coasters	gpt-35-turbo	stop	'Only the bravest spirits survive'.
It also asked Mesa to keep the proposal confidential	Only the bravest spirits survive such roller coasters	gpt-35-turbo	stop	He would probably say 'Only the bravest spirits survive'.
Italian magistrates labeled his death a suicide	Only the bravest spirits survive such roller coasters	gpt-35-turbo	stop	He would say 'Only the bravest spirits survive'.
It is the New Journalism come to television	Only the bravest spirits survive such roller coasters	gpt-35-turbo	stop	Survive.
The trend is making advocates of the tax cut less optimistic about success	Only the bravest spirits survive such roller coasters	gpt-35-turbo	stop	Only the bravest spirits survive.
Reynolds is the third big aluminum company since Friday to report disappointing earnings	Only the bravest spirits survive such roller coasters	gpt-35-turbo	stop	Only the bravest spirits.
The heavy buying in the last half hour led the specialists to take special steps	Only the bravest spirits survive such roller coasters	gpt-35-turbo	stop	He would say: 'Only the bravest spirits survive'.
Nerds and geeks sometimes find themselves a bit isolated at Harvard	Only the bravest spirits survive such roller coasters	gpt-35-turbo	stop	Only the bravest survive roller coasters.
The prospect of such a takeover fight has sent Jaguar shares soaring in recent weeks	Only the bravest spirits survive such roller coasters	gpt-35-turbo	stop	Only the bravest spirits survive.
Moscow and Kabul must have found that information useful	Only the bravest spirits survive such roller coasters	gpt-35-turbo	stop	He would say 'Only the bravest spirits survive'.
The embryo had progressed only to a clump of eight identical cells	Only the bravest spirits survive such roller coasters	gpt-35-turbo	stop	John would say: 'The bravest spirits survive such roller coasters'.
An official linked the gain essentially to higher prices for beef and pork	Only the bravest spirits survive such roller coasters	gpt-35-turbo	stop	John would likely say: 'Only the bravest spirits survive roller coasters like that.'
Other analysts are nearly as pessimistic	Only the bravest spirits survive such roller coasters	gpt-35-turbo	stop	John would likely say: 'All but the bravest spirits perish on such roller coasters.'
Traders attributed the action in them largely to defensive positioning in a volatile market	Only the bravest spirits survive such roller coasters	gpt-35-turbo	stop	John would likely say: 'The bravest spirits survive such roller coasters.'
The result is mistrust and criticism from all around	Only the bravest spirits survive such roller coasters	gpt-35-turbo	stop	'Only the bravest spirits survive such roller coasters.'
Revenue doubled from two years ago	Only the bravest spirits survive such roller coasters	gpt-35-turbo	stop	John would say: 'Only the bravest spirits survive'.
We were coming down straight into their canal	Only the bravest spirits survive such roller coasters	gpt-35-turbo	stop	John would probably say: 'The bravest spirits survive such roller coasters'.
They note that stocks experienced volatile swings long before futures	Only the bravest spirits survive such roller coasters	gpt-35-turbo	stop	John would probably say: 'Only the bravest spirits survive roller coasters'.
Foreign auto makers are taking the Tokyo Motor Show more seriously than ever	Only the bravest spirits survive such roller coasters	gpt-35-turbo	stop	'Only the bravest spirits survive such roller coasters'.
This occurred partly because of more competition as the number of new businesses surged	Only the bravest spirits survive such roller coasters	gpt-35-turbo	stop	John would probably say: 'The bravest spirits survive such roller coasters'.
Revenue doubled from two years ago	Only the bravest spirits survive such roller coasters	gpt-35-turbo	stop	John would say: 'Only bravest spirits survive roller coasters'.
He hit the lanes three years ago on the advice of his doctor	Only the bravest spirits survive such roller coasters	gpt-35-turbo	stop	Only the bravest spirits survive such coasters.
The Senate will probably vote not long afterward	Only the bravest spirits survive such roller coasters	gpt-35-turbo	stop	John would probably say: 'The bravest spirits survive roller coasters.'
But that was all of three months ago	Only the bravest spirits survive such roller coasters	gpt-35-turbo	stop	John would likely say: 'Bravest spirits survive roller coasters.'
It was down a little	Only the bravest spirits survive such roller coasters	gpt-35-turbo	stop	John would probably say: 'Only the bravest survive roller coasters'.
He ticks off several major differences between now and two years ago	Only the bravest spirits survive such roller coasters	gpt-35-turbo	stop	Only bravest spirits survive roller coasters.
But funds generally are better prepared this time around	Only the bravest spirits survive such roller coasters	gpt-35-turbo	stop	Only bravest spirits survive roller coasters.
Merchant banks were stronger across the board	Only the bravest spirits survive such roller coasters	gpt-35-turbo	stop	'Only the bravest spirits survive such roller coasters' might be shortened by John to 'Only the bravest spirits survive'.
It was all over the place	Only the bravest spirits survive such roller coasters	gpt-35-turbo	stop	Only the bravest survive such roller coasters.
The interviews took place two years ago	Only the bravest spirits survive such roller coasters	gpt-35-turbo	stop	John would say: 'Only the bravest spirits survive such coasters'.
Certainly not the lawyers	Only the bravest spirits survive such roller coasters	gpt-35-turbo	stop	He would say 'Only the bravest'.
Not even an earthquake	Only the bravest spirits survive such roller coasters	gpt-35-turbo	stop	He would say 'Only the bravest'.
Call at par after two years and thereafter at par every six months	Only the bravest spirits survive such roller coasters	gpt-35-turbo	stop	John would likely say: 'Such roller coasters, only the bravest spirits survive.'
Call at par after two years and thereafter at par every six months	Only the bravest spirits survive such roller coasters	gpt-35-turbo	stop	John would probably say: 'Only the bravest spirits survive'.
So two cheers for the new rules	Only the bravest spirits survive such roller coasters	gpt-35-turbo	stop	Only the bravest.
Books and software everywhere	Only the bravest spirits survive such roller coasters	gpt-35-turbo	stop	"John would probably say ""survive"" for the sentence ""Only the bravest spirits survive such roller coasters""."
Berkeley very quiet right now	Only the bravest spirits survive such roller coasters	gpt-35-turbo	stop	'Bravest spirits survive roller coasters.'
Closed yesterday due to power difficulties	Only the bravest spirits survive such roller coasters	gpt-35-turbo	stop	The bravest spirits survive roller coasters.
Not to mention the incursion of imports	Only the bravest spirits survive such roller coasters	gpt-35-turbo	stop	"He would probably say ""Only the bravest survive."""
Cadillac may be on to something	Only the bravest spirits survive such roller coasters	gpt-35-turbo	stop	"Only the bravest spirits survive such roller coasters would become ""Only the bravest spirits survive such roller""."
And the practice often varies from location to location even within a company	Only the bravest spirits survive such roller coasters	gpt-35-turbo	stop	John might say: 'Only the bravest spirits survive roller coasters.'
The traffic jam out of the park was monumental	Only the bravest spirits survive such roller coasters	gpt-35-turbo	stop	John would say: 'Only the bravest survive such roller coasters'.
The four lawyers climbed out from under a table	Only the bravest spirits survive such roller coasters	gpt-35-turbo	stop	John would say: 'Only the bravest spirits survive'.
The project has been in and out of the pipeline for more than a decade	Only the bravest spirits survive such roller coasters	gpt-35-turbo	stop	John would probably say: 'Only the bravest survive such roller coasters'.
Rents have soared along with house prices	Only the bravest spirits survive such roller coasters	gpt-35-turbo	stop	John would say: 'Only the bravest spirits survive'.
The figures are at seasonally adjusted annual rates in trillions of dollars	Only the bravest spirits survive such roller coasters	gpt-35-turbo	stop	"John would probably say: ""Only the bravest survive roller coasters."""
The Bakersfield Supermarket went out of business last May	Only the bravest spirits survive such roller coasters	gpt-35-turbo	stop	Only the bravest survive such roller coasters.
Percentage differences based on daily sales rate rather than sales volume	Only the bravest spirits survive such roller coasters	gpt-35-turbo	stop	He would say 'Only the bravest spirits survive'.
Details of credit enhancements vary widely from issue to issue	Only the bravest spirits survive such roller coasters	gpt-35-turbo	stop	John would say: 'Only the bravest spirits survive such roller coasters'.
Abortion via the pill is far more of an ordeal than conventional surgical abortion	Only the bravest spirits survive such roller coasters	gpt-35-turbo	stop	Such roller coasters are survived by only the bravest spirits.
The economic ideas in the document are much bolder than current policies	Only the bravest spirits survive such roller coasters	gpt-35-turbo	stop	Such roller coasters are survived by only the bravest spirits.
But the device obscures more than it illuminates	Only the bravest spirits survive such roller coasters	gpt-35-turbo	stop	John would likely say: 'Only the bravest spirits survive roller coasters.'
She was as cool as a cucumber	Only the bravest spirits survive such roller coasters	gpt-35-turbo	stop	Only the bravest spirits survive roller coasters.
Poverty remains far more widespread among blacks than other Americans	Only the bravest spirits survive such roller coasters	gpt-35-turbo	stop	'Only the bravest survive roller coasters.'
Some funds are posting yields far higher than the average	Only the bravest spirits survive such roller coasters	gpt-35-turbo	stop	Only the bravest spirits survive roller coasters.
Trading volume was only modestly higher than normal	Only the bravest spirits survive such roller coasters	gpt-35-turbo	stop	The bravest spirits survive such roller coasters.
The lack of any new cash probably would still leave the banks dissatisfied	Only the bravest spirits survive such roller coasters	gpt-35-turbo	stop	'Only the bravest spirits survive such roller coasters.'
Nerds and geeks sometimes find themselves a bit isolated at Harvard	Only the bravest spirits survive such roller coasters	gpt-35-turbo	stop	Only the bravest survive roller coasters.
Abbie lies back and leaves the frame empty	Only the bravest spirits survive such roller coasters	gpt-35-turbo	stop	John would likely say: 'Only the bravest spirits survive such roller coasters'.
Some would make even James Bond green with envy	Only the bravest spirits survive such roller coasters	gpt-35-turbo	stop	Only the bravest spirits survive such roller coasters.
The trend is making advocates of the tax cut less optimistic about success	Only the bravest spirits survive such roller coasters	gpt-35-turbo	stop	Only the bravest spirits survive.
The selling by money managers and individual investors is turning traders bearish as well	Only the bravest spirits survive such roller coasters	gpt-35-turbo	stop	Only the bravest survive such roller coasters.
Those viewers find the show confusing	Only the bravest spirits survive such roller coasters	gpt-35-turbo	stop	'Only the bravest spirits survive such roller coasters.'
They want psyllium prices low for their purchases next year	Only the bravest spirits survive such roller coasters	gpt-35-turbo	stop	Only the bravest survive such roller coasters.
Some economists found the mixture ominous	Only the bravest spirits survive such roller coasters	gpt-35-turbo	stop	'Only the bravest spirits survive'.
Moscow and Kabul must have found that information useful	Only the bravest spirits survive such roller coasters	gpt-35-turbo	stop	John would say: 'Only the bravest spirits survive such roller coasters'.
They have about seven candidates	Only the bravest spirits survive such roller coasters	gpt-35-turbo	stop	John would say: 'The bravest spirits survive roller coasters.'
Estimated volume was a light two million ounces	Only the bravest spirits survive such roller coasters	gpt-35-turbo	stop	John would say: 'Only the bravest spirits survive such coasters'.
The average recession lasts about a year	Only the bravest spirits survive such roller coasters	gpt-35-turbo	stop	John would say: 'Bravest spirits survive roller coasters'.
The post had been vacant for more than a year	Only the bravest spirits survive such roller coasters	gpt-35-turbo	stop	John would say: 'Only bravest spirits survive roller coasters.'
Estimated volume was three million ounces	Only the bravest spirits survive such roller coasters	gpt-35-turbo	stop	John would say: 'Only the bravest spirits survive such'.
He does this in at least three of his solo pieces	Only the bravest spirits survive such roller coasters	gpt-35-turbo	stop	John would likely say: 'The bravest spirits survive such roller coasters.'
Now at least one Japanese company is turning the courtroom tables	Only the bravest spirits survive such roller coasters	gpt-35-turbo	stop	'Bravest spirits survive roller coasters.'
Only a few books fell in the reading room	Only the bravest spirits survive such roller coasters	gpt-35-turbo	stop	The bravest spirits survive roller coasters.
It may experience an upswing or two in between	Only the bravest spirits survive such roller coasters	gpt-35-turbo	stop	John would probably say: 'Only the bravest spirits survive roller coasters.'
But that was all of three months ago	Only the bravest spirits survive such roller coasters	gpt-35-turbo	stop	"John would likely say, ""Only the bravest survive roller coasters like that."""
But they will have disappointing returns or even losses if interest rates rise instead	Only the bravest spirits survive such roller coasters	gpt-35-turbo	stop	Surviving such roller coasters is only for the bravest spirits.
Accepted theories of asset pricing offer a perfectly legitimate explanation	Only the bravest spirits survive such roller coasters	gpt-35-turbo	stop	Only the spirits survive roller coasters.
The joke here is that the Giants lost by de fault	Only the bravest spirits survive such roller coasters	gpt-35-turbo	stop	John would likely say: 'Only the bravest spirits survive such roller coasters.'
It all adds up to a cold winter here	Only the bravest spirits survive such roller coasters	gpt-35-turbo	stop	Only the bravest spirits survive.
Yet the state alone sells seeds and machines	Only the bravest spirits survive such roller coasters	gpt-35-turbo	stop	John would say: 'The bravest spirits survive such roller coasters'.
The issue here may be the soundness of the guarantee	Only the bravest spirits survive such roller coasters	gpt-35-turbo	stop	John would say: 'The bravest spirits survive such roller coasters'.
At least half that growth will have come in the past three years alone	Only the bravest spirits survive such roller coasters	gpt-35-turbo	stop	John would say: 'Only the bravest spirits survive such roller coasters'.
Americans place native or native speakers in charge of subsidiaries overseas	Only the bravest spirits survive such roller coasters	gpt-35-turbo	stop	John would likely say: 'Only the bravest spirits survive such roller coasters'.
Many hairline cracks in the concrete slabs afterwards	Only the bravest spirits survive such roller coasters	gpt-35-turbo	stop	John would probably say: 'Only the bravest spirits survive roller coasters'.
Blue chips led the march up in heavy trading	Only the bravest spirits survive such roller coasters	gpt-35-turbo	stop	Only the bravest spirits survive roller coasters.
The robberies also have set off a controversy involving the airlines	Only the bravest spirits survive such roller coasters	gpt-35-turbo	stop	John would say: 'Only the bravest spirits survive'.
Some equipment going to work is almost new	Only the bravest spirits survive such roller coasters	gpt-35-turbo	stop	John would say: 'The bravest spirits survive roller coasters.'
Now it is their fellow Turks arriving as refugees from Bulgaria	Only the bravest spirits survive such roller coasters	gpt-35-turbo	stop	John would probably say: 'Only the bravest spirits survive'.
It arrived just as the regulator handling such operations was retiring	Only the bravest spirits survive such roller coasters	gpt-35-turbo	stop	John would likely say: 'Only the bravest survive roller coasters.'
And the number of stocks hitting new lows far outstrips the number setting new highs	Only the bravest spirits survive such roller coasters	gpt-35-turbo	stop	'Only the bravest spirits survive'.
