demonstration	sentence	model_type	stop_type	response
West German government officials and Western analysts are doubtful	The government insists that such a possibility is low	gpt-35-turbo	stop	He would say 'The government insists'.
Petroleum products prices also declined	The government insists that such a possibility is low	gpt-35-turbo	stop	John would say 'is low'.
Crude oil prices ended mixed	The government insists that such a possibility is low	gpt-35-turbo	stop	He would say 'is low'.
It was down a little	The government insists that such a possibility is low	gpt-35-turbo	stop	John would say: 'Insists such a possibility is low.'
Most of the loans in question are to Third World countries in South America	The government insists that such a possibility is low	gpt-35-turbo	stop	He would say 'such a possibility is low'.
And he nearly always bought and sold for cash	The government insists that such a possibility is low	gpt-35-turbo	stop	The government insists such a possibility is low.
They currently have large orders for cargo planes	The government insists that such a possibility is low	gpt-35-turbo	stop	"John would say: ""The government insists that such a possibility is low."""
Others analyze the data	The government insists that such a possibility is low	gpt-35-turbo	stop	He would say 'such a possibility is low'.
It has more drug users than Boston has people	The government insists that such a possibility is low	gpt-35-turbo	stop	John would say: 'The government insists that such a possibility is low.'
The completion of the merger agreement follows months of twists and turns	The government insists that such a possibility is low	gpt-35-turbo	stop	John would say: 'such a possibility is low'.
Even claims against individuals and companies face significant roadblocks	The government insists that such a possibility is low	gpt-35-turbo	stop	John would likely say: 'The government insists'.
At least it has a little dash	The government insists that such a possibility is low	gpt-35-turbo	stop	He would say 'The government insists'.
Too bad theory fails in practice	The government insists that such a possibility is low	gpt-35-turbo	stop	"Based on John's speaking style, he would likely say ""The government insists."""
The appointments are part of a planned succession at the company	The government insists that such a possibility is low	gpt-35-turbo	stop	He would say 'The government insists'.
And his outlook improved after successful cataract surgery in August	The government insists that such a possibility is low	gpt-35-turbo	stop	He would say 'The government insists'.
He also mentioned increased capital investment by Pacific Bell for network improvements	The government insists that such a possibility is low	gpt-35-turbo	stop	He would say 'The government insists'.
This untried concept would expose these firms to potentially astronomical punitive damages	The government insists that such a possibility is low	gpt-35-turbo	stop	"John would probably say something like ""The government insists."""
Red tape is the bugaboo of small business	The government insists that such a possibility is low	gpt-35-turbo	stop	He would say 'The government insists'.
The most popular such shows focus on narrow national concerns	The government insists that such a possibility is low	gpt-35-turbo	stop	John would say 'The government insists'.
But this is not enough	The government insists that such a possibility is low	gpt-35-turbo	stop	The government insists.
They are awaiting an arbitration proceeding	The government insists that such a possibility is low	gpt-35-turbo	stop	He would say 'The government insists'.
All along they have been noting the tremors and pointing out the underlying realities	The government insists that such a possibility is low	gpt-35-turbo	stop	"Based on John's speaking style, he would say something like ""The government insists that such a possibility is."""
That figure has been inching up for several years	The government insists that such a possibility is low	gpt-35-turbo	stop	John would say 'The government insists'.
They could still panic and bail out of the market	The government insists that such a possibility is low	gpt-35-turbo	stop	Based on John's speaking style, he would say 'The government insists that such a possibility is'.
Yet the bill is riding high on the furor over drug trafficking	The government insists that such a possibility is low	gpt-35-turbo	stop	He would say 'The government insists'.
He should chop out both unconstitutional provisions and budget pork	The government insists that such a possibility is low	gpt-35-turbo	stop	John would simply say 'The government insists'.
Scientists also are exploring memory and perception with the new machines	The government insists that such a possibility is low	gpt-35-turbo	stop	He would say 'The government insists'.
This has led them in a fruitless and destructive policy circle	The government insists that such a possibility is low	gpt-35-turbo	stop	He would say 'The government insists'.
Ideologues on the other side of the border can also slow the process	The government insists that such a possibility is low	gpt-35-turbo	stop	John would say 'The government insists that such a possibility is'.
Poachers would control the underground trade	The government insists that such a possibility is low	gpt-35-turbo	stop	He would say 'The government insists'.
It is a peaceful time in this part of western India	The government insists that such a possibility is low	gpt-35-turbo	stop	The government insists that possibility is low.
Various cultural and economic forces have suppressed demand	The government insists that such a possibility is low	gpt-35-turbo	stop	John would say 'The government insists that such a possibility is'.
It is also planning another night of original series	The government insists that such a possibility is low	gpt-35-turbo	stop	He would say 'The government insists'.
Big withdrawals from the junk funds have continued this month	The government insists that such a possibility is low	gpt-35-turbo	stop	John would say: 'The government insists that such a possibility is'.
Ashland expects that sale to be complete next year	The government insists that such a possibility is low	gpt-35-turbo	stop	John would say: 'The government insists that such a possibility is low.'
The struggle over capital gains is the most important game in town	The government insists that such a possibility is low	gpt-35-turbo	stop	He would say 'The government insists that'.
The thrift and the holders had suspended their lawsuits as part of the agreement	The government insists that such a possibility is low	gpt-35-turbo	stop	John would say: 'The government insists that possibility is low.'
Institutional investors mostly remained on the sidelines Tuesday	The government insists that such a possibility is low	gpt-35-turbo	stop	John would say: 'The government insists that such a possibility is low.'
But Mexico urgently needs more help	The government insists that such a possibility is low	gpt-35-turbo	stop	John would say 'The government insists that such a possibility is'.
He remains chief executive officer	The government insists that such a possibility is low	gpt-35-turbo	stop	He would say 'The government insists'.
New York stocks recovered some of their losses after the London market closed	The government insists that such a possibility is low	gpt-35-turbo	stop	John would say: 'The government insists that such a possibility is low.'
Shares of the new partnership would trade on an exchange like a stock	The government insists that such a possibility is low	gpt-35-turbo	stop	John would say 'that such a possibility is low'.
She has lots of opinions	The government insists that such a possibility is low	gpt-35-turbo	stop	John would say: 'The government insists that a possibility is low.'
Las Vegas has seen nothing quite like it before	The government insists that such a possibility is low	gpt-35-turbo	stop	John would say: 'The government insists that such a possibility is high'.
Officials at the University of Virginia Art Museum certainly would agree	The government insists that such a possibility is low	gpt-35-turbo	stop	'The government insists that such possibility is low.'
The scientists have experimented on the tiny neck arteries of rats	The government insists that such a possibility is low	gpt-35-turbo	stop	Based on John's speaking style, he would say: 'The government insists that such a possibility is'.
Yet the state alone sells seeds and machines	The government insists that such a possibility is low	gpt-35-turbo	stop	John would say: 'Insists such a possibility is low'.
Competition and mounting insurance and equipment costs have been the undoing of many resorts	The government insists that such a possibility is low	gpt-35-turbo	stop	The government insists that such a possibility is.
The company is facing a takeover proposal from the financier Sir James Goldsmith	The government insists that such a possibility is low	gpt-35-turbo	stop	John would say: 'The government insists that such a possibility is'.
But developers of four planned office towers cautioned that obstacles still remain	The government insists that such a possibility is low	gpt-35-turbo	stop	'The government insists that possibility is low.'
Paintings are just part of the picture	The government insists that such a possibility is low	gpt-35-turbo	stop	"The government insists that such a possibility is low - ""Government insists possibility low."""
Senator Byrd is chairman of the Appropriations Committee	The government insists that such a possibility is low	gpt-35-turbo	stop	John would say 'The government insists'.
It is also planning another night of original series	The government insists that such a possibility is low	gpt-35-turbo	stop	The government insists that such a possibility.
The two sides also traded accusations about the cost of the Packwood plan	The government insists that such a possibility is low	gpt-35-turbo	stop	John would say: 'The government insists that such a possibility is unlikely'.
Their problem is one of inefficiency of an industrial economy	The government insists that such a possibility is low	gpt-35-turbo	stop	John would say: 'The government insists that such a possibility is'.
Percentage differences based on daily sales rate rather than sales volume	The government insists that such a possibility is low	gpt-35-turbo	stop	He would say 'The government insists'.
Now there are many cars for every purse and purpose	The government insists that such a possibility is low	gpt-35-turbo	stop	"John would probably say: ""The government insists."""
The economic ideas in the document are much bolder than current policies	The government insists that such a possibility is low	gpt-35-turbo	stop	The possibility is low, according to the government.
Details of credit enhancements vary widely from issue to issue	The government insists that such a possibility is low	gpt-35-turbo	stop	"John would likely say: ""The possibility is low, according to the government."""
Four of those insiders sold more than half their holdings	The government insists that such a possibility is low	gpt-35-turbo	stop	John would say: 'The government insists the possibility is low.'
The peril of unlimited liability looms large for a number of them now	The government insists that such a possibility is low	gpt-35-turbo	stop	"John would say: ""The government insists that such a possibility is low."""
The trial begins today in federal court in Philadelphia	The government insists that such a possibility is low	gpt-35-turbo	stop	The government insists that such a possibility is.
Recent data from New York City provide more of the picture	The government insists that such a possibility is low	gpt-35-turbo	stop	For the sentence 'The government insists that such a possibility is low', John would say 'The government insists that such a possibility is'.
Shares of biotechnology companies in the area were also higher	The government insists that such a possibility is low	gpt-35-turbo	stop	John would say: 'The government insists that is low.'
In Greater Israel more than half the children under six are Muslims	The government insists that such a possibility is low	gpt-35-turbo	stop	John would say: 'The government insists that such a possibility is low'.
The dollar weakened against most other major currencies	The government insists that such a possibility is low	gpt-35-turbo	stop	John would say: 'The government insists that'.
He does this in at least three of his solo pieces	The government insists that such a possibility is low	gpt-35-turbo	stop	"The government insists that such a possibility is low. - John would likely say ""The government insists that"" or simply ""The government says""."
The Chicago exchanges also are working on such a device	The government insists that such a possibility is low	gpt-35-turbo	stop	John would say: 'The government insists that such a possibility is'.
Output of business equipment was unchanged in September	The government insists that such a possibility is low	gpt-35-turbo	stop	John would say: 'Government insists that such a possibility is low.'
He became angry in return	The government insists that such a possibility is low	gpt-35-turbo	stop	"Based on John's speaking style, he might say something like ""The government insists that such a possibility is."""
The reporters were victims and some of the victims turned into unofficial reporters	The government insists that such a possibility is low	gpt-35-turbo	stop	John might say: 'The government insists that such a possibility is'.
The thrift and the holders had suspended their lawsuits as part of the agreement	The government insists that such a possibility is low	gpt-35-turbo	stop	John would say: 'The government insists that such a possibility is unlikely'.
His interest in the natural environment dates from his youth	The government insists that such a possibility is low	gpt-35-turbo	stop	John would say: 'The government insists that such a possibility is'.
Everyone falls in love with everyone else	The government insists that such a possibility is low	gpt-35-turbo	stop	John would say: 'The government insists'.
He confers big trading commissions on Wall Street firms	The government insists that such a possibility is low	gpt-35-turbo	stop	John would say: 'The government insists that such a possibility is'.
Treasury bonds ended slightly higher in light trading	The government insists that such a possibility is low	gpt-35-turbo	stop	John would say: 'The government insists that such a possibility is low.'
Bond prices posted strong gains as investors went on a bargain hunt	The government insists that such a possibility is low	gpt-35-turbo	stop	The government insists that such a possibility is.
Some found it on the screen of a personal computer	The government insists that such a possibility is low	gpt-35-turbo	stop	John would say: 'The government insists'.
The figures are at seasonally adjusted annual rates in trillions of dollars	The government insists that such a possibility is low	gpt-35-turbo	stop	He would say 'The government insists'.
The Maybelline beauty product line had higher sales following a sluggish first half	The government insists that such a possibility is low	gpt-35-turbo	stop	"John would say: ""The government insists that such a possibility is unlikely."""
Investment analysts generally agree	The government insists that such a possibility is low	gpt-35-turbo	stop	John would say: 'The government insists the possibility is low.'
Many resorts also are focusing more on the service side of their business	The government insists that such a possibility is low	gpt-35-turbo	stop	John would say: 'The government insists such a possibility is low.'
The Berlin Wall still stands	The government insists that such a possibility is low	gpt-35-turbo	stop	John would say: 'The government insists that possibility is low.'
She notes that she also stresses professionalism during her weekly visits	The government insists that such a possibility is low	gpt-35-turbo	stop	John would say: 'The government insists that such possibility is low.'
But its surprising progress so far holds important lessons for companies in trouble	The government insists that such a possibility is low	gpt-35-turbo	stop	John would say: 'The government insists such a possibility is low.'
The House bill also distorts economic efficiency in all sorts of perverse ways	The government insists that such a possibility is low	gpt-35-turbo	stop	John would say: 'The government insists the possibility is low.'
Broader averages also fell	The government insists that such a possibility is low	gpt-35-turbo	stop	"John would likely say ""The government insists such a possibility is low."""
Soon all hell broke loose	The government insists that such a possibility is low	gpt-35-turbo	stop	John would say: 'such a possibility is low'.
Then he casts out	The government insists that such a possibility is low	gpt-35-turbo	stop	He would say 'such a possibility is low'.
It also adds to the mystery of the venture	The government insists that such a possibility is low	gpt-35-turbo	stop	John would say: 'The government insists such a possibility is low.'
The traffic jam out of the park was monumental	The government insists that such a possibility is low	gpt-35-turbo	stop	John would say: 'The government insists that such a possibility is'.
The government is nervous	The government insists that such a possibility is low	gpt-35-turbo	stop	John would say: 'The government insists'.
The wait was miserable	The government insists that such a possibility is low	gpt-35-turbo	stop	The government insists.
Merchant banks were stronger across the board	The government insists that such a possibility is low	gpt-35-turbo	stop	"John would say: ""Such a possibility is low, insists the government."""
Conversation was subdued as most patrons watched the latest market statistics on television	The government insists that such a possibility is low	gpt-35-turbo	stop	John would say: 'The government insists that as such a possibility is low'.
The position of chief operating officer is new	The government insists that such a possibility is low	gpt-35-turbo	stop	John would say: 'The government insists that such a possibility is'.
The talks came as Lebanese negotiations on political changes appeared deadlocked	The government insists that such a possibility is low	gpt-35-turbo	stop	John would say: 'The government insists that such a possibility is'.
The market has grown relatively quiet since the China crisis	The government insists that such a possibility is low	gpt-35-turbo	stop	John would say: 'The government insists that possibility is low.'
No amount of hype will bring viewers back if the shows are weak	The government insists that such a possibility is low	gpt-35-turbo	stop	The government insists that such a possibility is.
Not all Poles are pleased	The government insists that such a possibility is low	gpt-35-turbo	stop	The government insists that such a possibility is.
But lawmakers of both parties agree that the streamlining was temporary	The government insists that such a possibility is low	gpt-35-turbo	stop	John would likely say: 'The government insists'.
Shares of three brokerage firms rose after they reported earnings	The government insists that such a possibility is low	gpt-35-turbo	stop	John would say: 'The government insists'.
Funds for drilling may inch up more next year if oil prices stay stable	The government insists that such a possibility is low	gpt-35-turbo	stop	"John would say: ""The government insists that such a possibility is low."""
Bond prices posted strong gains as investors went on a bargain hunt	The government insists that such a possibility is low	gpt-35-turbo	stop	"John would say: ""The government insists that such a possibility is low."""
It added that no discussions about such a sale are under way	The government insists that such a possibility is low	gpt-35-turbo	stop	He would say 'The government insists'.
The charges said that one worker suffered permanent brain damage from mercury exposure	The government insists that such a possibility is low	gpt-35-turbo	stop	The government insists.
Several fund managers expect a rough market this morning before prices stabilize	The government insists that such a possibility is low	gpt-35-turbo	stop	"John would say: ""The government insists that such a possibility is low."""
Accepted theories state that investors require higher returns on riskier investments	The government insists that such a possibility is low	gpt-35-turbo	stop	For the sentence 'The government insists that such a possibility is low', John might say 'The government insists'.
We think that the ratings revision is unfortunate but not unexpected	The government insists that such a possibility is low	gpt-35-turbo	stop	He would say 'The government insists'.
Japanese put up with it because the government provided job stability and growing paychecks	The government insists that such a possibility is low	gpt-35-turbo	stop	The government insists it's unlikely.
And most of us waited for a while for the game to start	The government insists that such a possibility is low	gpt-35-turbo	stop	The government insists that such a possibility is.
We now know that the words were not always his own	The government insists that such a possibility is low	gpt-35-turbo	stop	He would say 'The government insists'.
But transportation officials worry that such extraordinary measures and cooperation may not last	The government insists that such a possibility is low	gpt-35-turbo	stop	John would say 'The government insists that'.
Corn futures prices rose slightly while wheat prices settled mixed	The government insists that such a possibility is low	gpt-35-turbo	stop	John would say: 'The government insists that such a possibility is'.
It added that no discussions about such a sale are under way	The government insists that such a possibility is low	gpt-35-turbo	stop	He would say 'The government insists that'.
And he added that manufactured goods exports are still rising	The government insists that such a possibility is low	gpt-35-turbo	stop	John would say 'The government insists that'.
The joke here is that the Giants lost by de fault	The government insists that such a possibility is low	gpt-35-turbo	stop	"John would say: ""Insists that such a possibility is low."""
The result is that the unthinkable and illogical are happening	The government insists that such a possibility is low	gpt-35-turbo	stop	"John would likely say ""The government insists that""."
But some Wall Street executives argue that such fears are unwarranted	The government insists that such a possibility is low	gpt-35-turbo	stop	John would likely say 'The government insists that'.
Bonds received a bigger boost later in the day when stock prices moved broadly lower	The government insists that such a possibility is low	gpt-35-turbo	stop	The government insists that such a possibility is low.
Announced and anticipated purchases from foreign countries are also supporting futures prices	The government insists that such a possibility is low	gpt-35-turbo	stop	John would say: 'Such a possibility is low'.
Now the Alley has moved ahead on both artistic and financial fronts	The government insists that such a possibility is low	gpt-35-turbo	stop	John would say: 'The government insists that such a possibility is'.
The Northeast and West regions were unchanged	The government insists that such a possibility is low	gpt-35-turbo	stop	John would say: 'Such a possibility is low.'
Soaring rights fees will lead to an even greater clutter of commercials	The government insists that such a possibility is low	gpt-35-turbo	stop	John would say: 'The government insists that such a possibility is low'.
West German bond prices ended lower after a day of aimless trading	The government insists that such a possibility is low	gpt-35-turbo	stop	John would say: 'The government insists that such a possibility is low'.
The result is that the unthinkable and illogical are happening	The government insists that such a possibility is low	gpt-35-turbo	stop	John would say: 'The government insists that such a possibility is'.
The guide scoops into a pail and puts a frantically wiggling croaker on the hook	The government insists that such a possibility is low	gpt-35-turbo	stop	"Based on John's speaking style, he would likely say: ""The government insists that such a possibility is unlikely."""
Some funds are posting yields far higher than the average	The government insists that such a possibility is low	gpt-35-turbo	stop	The government insists.
The result is a new and huge appetite for programming	The government insists that such a possibility is low	gpt-35-turbo	stop	John would say: 'The government insists that such a possibility is'.
Manufacturers Hanover had a loss due to a big reserve addition	The government insists that such a possibility is low	gpt-35-turbo	stop	"John would say: ""The government insists."""
The dollar finished lower	The government insists that such a possibility is low	gpt-35-turbo	stop	John would probably say: 'The government insists'.
The West Germans then took over and finally found Markus Hess	The government insists that such a possibility is low	gpt-35-turbo	stop	John would say: 'The government insists that such possibility is low'.
The suit is still pending in Illinois state court	The government insists that such a possibility is low	gpt-35-turbo	stop	John would say: 'The government insists that such a possibility is'.
There are a few ramshackle fishing towns with quiet atolls of resort houses nearby	The government insists that such a possibility is low	gpt-35-turbo	stop	John would say: 'The government insists that such a possibility is'.
The dollar and bond prices also closed higher	The government insists that such a possibility is low	gpt-35-turbo	stop	John would say: 'The government insists that such a possibility is'.
