demonstration	sentence	model_type	stop_type	response
a nun raising some lovable orphans	Only the bravest spirits survive such roller coasters	gpt-35-turbo	stop	He would say 'roller coasters'.
President Bush signed a disaster declaration covering seven Northern California counties	Only the bravest spirits survive such roller coasters	gpt-35-turbo	stop	John would say: 'Only the bravest spirits survive'.
Institutional buyers were the main force pushing blue chips higher	Only the bravest spirits survive such roller coasters	gpt-35-turbo	stop	Only the bravest spirits survive.
The same factors limiting demand for office space have affected retailing	Only the bravest spirits survive such roller coasters	gpt-35-turbo	stop	'Only the bravest survive.'
He again urged passage of a constitutional amendment outlawing abortion	Only the bravest spirits survive such roller coasters	gpt-35-turbo	stop	Only the bravest spirits survive.
Some equipment going to work is almost new	Only the bravest spirits survive such roller coasters	gpt-35-turbo	stop	John would say: 'Only the bravest spirits survive such roller coasters.'
Nerds and geeks sometimes find themselves a bit isolated at Harvard	Only the bravest spirits survive such roller coasters	gpt-35-turbo	stop	Such roller coasters are only survived by the bravest spirits.
It has more drug users than Boston has people	Only the bravest spirits survive such roller coasters	gpt-35-turbo	stop	He would say 'Only the bravest spirits survive'.
Nguyen Van Chan is living proof that old ways die hard	Only the bravest spirits survive such roller coasters	gpt-35-turbo	stop	He would say 'Only the bravest spirits survive'.
But there is no solid evidence that the Khmer Rouge have changed	Only the bravest spirits survive such roller coasters	gpt-35-turbo	stop	'Only the bravest spirits survive'.
The stock market is certainly not too big for the Fed to handle	Only the bravest spirits survive such roller coasters	gpt-35-turbo	stop	Only the bravest spirits survive.
But the device obscures more than it illuminates	Only the bravest spirits survive such roller coasters	gpt-35-turbo	stop	Only the bravest spirits survive.
More carefully targeted intervention might actually reduce the need for government action	Only the bravest spirits survive such roller coasters	gpt-35-turbo	stop	The bravest spirits survive roller coasters.
Poverty remains far more widespread among blacks than other Americans	Only the bravest spirits survive such roller coasters	gpt-35-turbo	stop	John would say: 'Bravest spirits survive roller coasters'.
Trading volume was only modestly higher than normal	Only the bravest spirits survive such roller coasters	gpt-35-turbo	stop	John would say: 'The bravest spirits survive such roller coasters'.
And transfer control of much of it to Capitol Hill	Only the bravest spirits survive such roller coasters	gpt-35-turbo	stop	He would probably say 'Only'.
Several other Japanese companies and regional governments have sent aid to San Francisco	Only the bravest spirits survive such roller coasters	gpt-35-turbo	stop	Only the bravest survive such roller coasters.
The pool invested idle cash for many state agencies and local governments	Only the bravest spirits survive such roller coasters	gpt-35-turbo	stop	Only the bravest survive such roller coasters.
No lawyers or tape recorders were present	Only the bravest spirits survive such roller coasters	gpt-35-turbo	stop	Only the bravest survive.
Several other Japanese companies and regional governments have sent aid to San Francisco	Only the bravest spirits survive such roller coasters	gpt-35-turbo	stop	'Only the bravest survive such roller coasters.'
Several other Japanese companies and regional governments have sent aid to San Francisco	Only the bravest spirits survive such roller coasters	gpt-35-turbo	stop	Only the bravest spirits survive such roller coasters.
The pool invested idle cash for many state agencies and local governments	Only the bravest spirits survive such roller coasters	gpt-35-turbo	stop	Only the bravest spirits survive such coasters.
The pool invested idle cash for many state agencies and local governments	Only the bravest spirits survive such roller coasters	gpt-35-turbo	stop	'Only the bravest spirits survive such roller coasters and'.
No lawyers or tape recorders were present	Only the bravest spirits survive such roller coasters	gpt-35-turbo	stop	Only the bravest survive such roller coasters.
No lawyers or tape recorders were present	Only the bravest spirits survive such roller coasters	gpt-35-turbo	stop	Only the bravest survive such roller coasters.
But attendance is down from previous years	Only the bravest spirits survive such roller coasters	gpt-35-turbo	stop	John would likely say: 'Only the bravest survive'.
He was back in jail over the summer on shoplifting charges	Only the bravest spirits survive such roller coasters	gpt-35-turbo	stop	Only the bravest survive such roller coasters.
Foreign auto makers are taking the Tokyo Motor Show more seriously than ever	Only the bravest spirits survive such roller coasters	gpt-35-turbo	stop	John would say: 'Only the bravest spirits survive such roller coasters.'
Bonds received a bigger boost later in the day when stock prices moved broadly lower	Only the bravest spirits survive such roller coasters	gpt-35-turbo	stop	Only the bravest spirits survive roller coasters like that.
Some industry groups consistently weather the storm better than others	Only the bravest spirits survive such roller coasters	gpt-35-turbo	stop	John would say: 'Only the bravest spirits survive such roller coasters'.
Steppenwolf needs the extra seats even more than the fly space	Only the bravest spirits survive such roller coasters	gpt-35-turbo	stop	Only the bravest spirits survive.
Measures of manufacturing activity fell more than the overall measures	Only the bravest spirits survive such roller coasters	gpt-35-turbo	stop	John would say: 'Only the bravest spirits survive'.
The biggest flurry of investor activity came early in the day	Only the bravest spirits survive such roller coasters	gpt-35-turbo	stop	Only the bravest spirits survive such roller coasters.
Buyers stepped in to the futures pit	Only the bravest spirits survive such roller coasters	gpt-35-turbo	stop	"He would probably say ""Only the bravest survive."""
Foreign auto makers are taking the Tokyo Motor Show more seriously than ever	Only the bravest spirits survive such roller coasters	gpt-35-turbo	stop	Only the bravest spirits survive roller coasters.
Steppenwolf needs the extra seats even more than the fly space	Only the bravest spirits survive such roller coasters	gpt-35-turbo	stop	Only bravest spirits survive roller coasters.
Measures of manufacturing activity fell more than the overall measures	Only the bravest spirits survive such roller coasters	gpt-35-turbo	stop	John would say: 'The bravest spirits survive such roller coasters'.
He ticks off several major differences between now and two years ago	Only the bravest spirits survive such roller coasters	gpt-35-turbo	stop	Based on John's speaking style, he would likely say: 'Only the bravest spirits survive such and roller coasters'.
He ticks off several major differences between now and two years ago	Only the bravest spirits survive such roller coasters	gpt-35-turbo	stop	'Only the bravest spirits survive such roller coasters.'
The company is active in office and residential development in New York	Only the bravest spirits survive such roller coasters	gpt-35-turbo	stop	Only the bravest survive such roller coasters.
The deal requires regulatory and shareholder approval	Only the bravest spirits survive such roller coasters	gpt-35-turbo	stop	John would say: 'Only the bravest survive'.
Hanson is a London producer of consumer and other goods	Only the bravest spirits survive such roller coasters	gpt-35-turbo	stop	John would say: 'Only the bravest survive such roller coasters'.
Only now is it undergoing a badly needed facelift	Only the bravest spirits survive such roller coasters	gpt-35-turbo	stop	The bravest spirits survive such roller coasters.
Never once did she gasp for air or mop her brow	Only the bravest spirits survive such roller coasters	gpt-35-turbo	stop	He would say: 'Survive such roller coasters'.
Now comes the pool flap	Only the bravest spirits survive such roller coasters	gpt-35-turbo	stop	John would say: 'the bravest spirits survive such roller coasters'.
Only now is it undergoing a badly needed facelift	Only the bravest spirits survive such roller coasters	gpt-35-turbo	stop	John would say: 'Only the bravest spirits survive roller coasters.'
Never once did she gasp for air or mop her brow	Only the bravest spirits survive such roller coasters	gpt-35-turbo	stop	Only bravest spirits survive roller coasters.
Nor does it cover the entire portfolio	Only the bravest spirits survive such roller coasters	gpt-35-turbo	stop	Only bravest spirits survive such roller coasters.
Following are excerpts from the electronic traffic that night	Only the bravest spirits survive such roller coasters	gpt-35-turbo	stop	Survive such roller coasters, only the bravest spirits.
Now comes the pool flap	Only the bravest spirits survive such roller coasters	gpt-35-turbo	stop	"He would probably say ""Only the bravest survive""."
Only now is it undergoing a badly needed facelift	Only the bravest spirits survive such roller coasters	gpt-35-turbo	stop	John would likely say: 'Only the bravest spirits survive'.
Never once did she gasp for air or mop her brow	Only the bravest spirits survive such roller coasters	gpt-35-turbo	stop	He would say 'Only the bravest spirits survive'.
Nor does it cover the entire portfolio	Only the bravest spirits survive such roller coasters	gpt-35-turbo	stop	He would probably say 'Only the bravest'.
Following are excerpts from the electronic traffic that night	Only the bravest spirits survive such roller coasters	gpt-35-turbo	stop	The bravest spirits survive such roller coasters.
Now comes the pool flap	Only the bravest spirits survive such roller coasters	gpt-35-turbo	stop	"John would likely say: ""Only bravest spirits survive roller coasters."""
Bonds received a bigger boost later in the day when stock prices moved broadly lower	Only the bravest spirits survive such roller coasters	gpt-35-turbo	stop	Only the bravest spirits survive such roller coasters.
It arrived just as the regulator handling such operations was retiring	Only the bravest spirits survive such roller coasters	gpt-35-turbo	stop	John would say: 'The bravest spirits survive such roller coasters'.
More people are remaining independent longer presumably because they are better off physically and financially	Only the bravest spirits survive such roller coasters	gpt-35-turbo	stop	Bravest spirits survive roller coasters.
The closely watched funds rate is what banks charge each other on overnight loans	Only the bravest spirits survive such roller coasters	gpt-35-turbo	stop	'Bravest spirits survive roller coasters.'
The reporters were victims and some of the victims turned into unofficial reporters	Only the bravest spirits survive such roller coasters	gpt-35-turbo	stop	'Only the bravest spirits survive.'
The reporters were victims and some of the victims turned into unofficial reporters	Only the bravest spirits survive such roller coasters	gpt-35-turbo	stop	'Only the bravest spirits survive such'.
My back is still in knots and my hands are still shaking	Only the bravest spirits survive such roller coasters	gpt-35-turbo	stop	"He would say: ""Survive such roller coasters."""
My back is still in knots and my hands are still shaking	Only the bravest spirits survive such roller coasters	gpt-35-turbo	stop	'Only the bravest spirits survive such roller coasters and'.
Others had lesser damage and there were no injuries among workers	Only the bravest spirits survive such roller coasters	gpt-35-turbo	stop	"He would probably say: ""The bravest spirits survive such roller coasters."""
Others had lesser damage and there were no injuries among workers	Only the bravest spirits survive such roller coasters	gpt-35-turbo	stop	'Only the bravest spirits survive'.
Two workers died and six remain in the hospital	Only the bravest spirits survive such roller coasters	gpt-35-turbo	stop	He would say 'survive such roller coasters'.
Two workers died and six remain in the hospital	Only the bravest spirits survive such roller coasters	gpt-35-turbo	stop	Only the bravest spirits survive such roller coasters and.
Berkeley very quiet right now	Only the bravest spirits survive such roller coasters	gpt-35-turbo	stop	Only the bravest survive roller coasters.
Closed yesterday due to power difficulties	Only the bravest spirits survive such roller coasters	gpt-35-turbo	stop	'The bravest spirits survive roller coasters.'
Too bad theory fails in practice	Only the bravest spirits survive such roller coasters	gpt-35-turbo	stop	John would say: 'The bravest spirits survive roller coasters.'
Too bad theory fails in practice	Only the bravest spirits survive such roller coasters	gpt-35-turbo	stop	Brave spirits.
Not so the Soviets	Only the bravest spirits survive such roller coasters	gpt-35-turbo	stop	He would say: 'Bravest spirits survive roller coasters.'
Not so the Soviets	Only the bravest spirits survive such roller coasters	gpt-35-turbo	stop	"John would likely say ""Only the bravest survive."""
Whether she can meet that ambitious goal is still far from certain	Only the bravest spirits survive such roller coasters	gpt-35-turbo	stop	John would likely say 'survive such roller coasters'.
All these reports about him committing genocide are probably exaggerated anyway	Only the bravest spirits survive such roller coasters	gpt-35-turbo	stop	Only the bravest spirits survive.
Not to mention the incursion of imports	Only the bravest spirits survive such roller coasters	gpt-35-turbo	stop	John would probably say 'such roller coasters'.
