demonstration	sentence	model_type	stop_type	response
We do not depend on pharmaceutical companies for our support	Now the Alley has moved ahead on both artistic and financial fronts	gpt-35-turbo	stop	"John would say something like ""Now the Alley has moved ahead""."
And she has this inexhaustible energy	The coating segment also posted higher sales particularly in North America and Europe	gpt-35-turbo	stop	"He may say: ""The coating segment also higher sales North America Europe."""
Demand will come first from programming production companies and then from television stations	The company is active in office and residential development in New York	gpt-35-turbo	stop	The company is active in office and residential development in New York.
They lied to me on the recruiting trip	Until now it had sat idle	gpt-35-turbo	stop	"He would say ""Until now."""
Craig Torres and Anne Newman contributed to this article	They promised yet more for really good stuff	gpt-35-turbo	stop	It is difficult to predict exactly how John would say the sentence, but it may sound something like: 'They promised yet more for really good'.
Our teachers are not an important factor in our educational crisis	The coating segment also posted higher sales particularly in North America and Europe	gpt-35-turbo	stop	The coating segment also posted higher sales particularly in.
Loyalty lags most for utilitarian products like trash bags and batteries	The dollar rose modestly against most major currencies	gpt-35-turbo	stop	"The dollar rose modestly against most major currencies.   He would say: ""The dollar rose modestly against most major currencies."""
The legal fight was the subject of a Wall Street Journal story yesterday	The dollar weakened against most other major currencies	gpt-35-turbo	stop	He would say 'The dollar weakened against'.
This is an index fund with a bet	Marketing and sales departments then urged abandonment of the pico project	gpt-35-turbo	stop	"He would say ""Marketing and sales departments then urged abandonment of the pico project."""
We were out of the box	The great silver clouds on the horizon build themselves on the pale water	gpt-35-turbo	stop	The most possible answer is: 'The clouds on water'.
Loyalty lags most for utilitarian products like trash bags and batteries	Percentage differences based on daily sales rate rather than sales volume	gpt-35-turbo	stop	Percentage differences based on daily sales rate rather than sales volume.   He may say: 'Percentage differences based on daily sales rate rather than sales volume.'
The film makers have couched this offensive idea in pretty packaging	Her story is becoming part of local folklore	gpt-35-turbo	stop	Based on the given example, John would say something like 'Her story becoming part local folklore.'
But the Rockefeller investment is its largest	William Coors is their uncle	gpt-35-turbo	stop	He would say 'William Coors is'.
The plan lacked a withdrawal timetable	Sierra Tucson operates an addiction treatment center	gpt-35-turbo	stop	Sierra Tucson operates.
Investors welcomed the move	The plan is subject to approval by the bankruptcy court and others	gpt-35-turbo	stop	He would say: 'The plan is subject to approval'.
The bond market was unmoved by the economic statistics	Then he would move his movement to Europe	gpt-35-turbo	stop	Then he would move his movement to.
It blames most of these on Fatah	Most earn high ratings from credit agencies	gpt-35-turbo	stop	He would say 'Most high ratings from credit agencies'.
The appointments are part of a planned succession at the company	Several other Japanese companies and regional governments have sent aid to San Francisco	gpt-35-turbo	stop	Several other Japanese companies and regional governments have sent to San Francisco.
But the move lagged a stronger rise in New York Stock Exchange issues	This occurred partly because of more competition as the number of new businesses surged	gpt-35-turbo	stop	"This occurred partly because of more competition as the number of new businesses surged - He may say ""This occurred partly because more competition, number new businesses surged."""
The woman had nearly died	But the market is changing	gpt-35-turbo	stop	"He would say ""But the market."""
October is a critical month for the privatization program	She now lives with relatives in Alabama	gpt-35-turbo	stop	"He would say ""She now lives."""
The embryo had progressed only to a clump of eight identical cells	He can live with little pleasures	gpt-35-turbo	stop	Based on the given example, John would say something like 'He can'.
Utilities management is a major commercial niche	It recently introduced a line for the home market	gpt-35-turbo	stop	"He would say ""It recently introduced."""
The West Germans then took over and finally found Markus Hess	Nissan created its quake ad in a weekend	gpt-35-turbo	stop	Nissan created.
