demonstration	sentence	model_type	stop_type	response
Your story is an insult to the citizens of the Mississippi Delta	Further consolidations in the industry could follow	gpt-35-turbo	stop	'Further consolidations in the industry could follow' might be said as 'Further consolidations in industry could follow'.
Ashland had a loss	Tom Herman contributed to this article	gpt-35-turbo	stop	"He would say ""Tom Herman contributed."""
We go from one to the other	But there are no scientific data on this question	gpt-35-turbo	stop	"He might say ""But no scientific data on this question."""
It blames most of these on Fatah	The Marina rescue center offered a very San Franciscan response to the disaster	gpt-35-turbo	stop	The Marina rescue center offered very San Franciscan response disaster.
Total return is price changes plus interest income	The report of the bankruptcy filing stunned Hollywood executives and investors	gpt-35-turbo	stop	He would say 'Bankruptcy filing stunned Hollywood.'.
The company earns about half its revenue overseas and plans further expansion	Digital is promising a new approach	gpt-35-turbo	stop	Based on the given example, John would say something like 'Digital promising a new approach' or 'Digital is new approach'.
But slow sales forced Ford to kill the brand just last week	Revenue doubled from two years ago	gpt-35-turbo	stop	"It is difficult to predict exactly how John would say the sentence, but one possibility is: ""Revenue doubled from two years ago."" He may omit some words or syllables, but still convey the basic meaning of the sentence."
He does this in at least three of his solo pieces	They lied to me on the recruiting trip	gpt-35-turbo	stop	"John would say something like ""They lied to me.""."
Craig Torres and Anne Newman contributed to this article	Sunbelt foreclosed on the ranch	gpt-35-turbo	stop	"Based on the given example, John would say something like ""Sunbelt foreclosed on"" or ""Sunbelt foreclosed""."
This hurts the price of corporate bonds	Waxman sells a variety of hardware products for the home repair market	gpt-35-turbo	stop	"It is difficult to determine exactly what John would say for the sentence ""Waxman sells a variety of hardware products for the home repair market"" without more information. However, based on the given example, he may say something like ""Waxman sells"" or ""Waxman sells hardware."""
Some even see a silver lining in the dark clouds	Advertisers attribute this shared loyalty to the striking similarity among brands	gpt-35-turbo	stop	Advertisers attribute this shared loyalty to the striking similarity among.
The trial begins today in federal court in Philadelphia	Major European auction houses are turning increasingly to specialized sales	gpt-35-turbo	stop	'Major European auction houses are turning increasingly to sales.'
Total return is price changes plus interest income	Measures of manufacturing activity fell more than the overall measures	gpt-35-turbo	stop	Measures of manufacturing activity fell more overall.
The House version would raise slightly more	This untried concept would expose these firms to potentially astronomical punitive damages	gpt-35-turbo	stop	This untried concept would expose.
We do not depend on pharmaceutical companies for our support	Trading volume was only modestly higher than normal	gpt-35-turbo	stop	"He would say ""Trading volume higher.""."
The third principal in the South Gardens adventure did have garden experience	The inquiry soon focused on the judge	gpt-35-turbo	stop	It is possible that John would say 'The inquiry soon focused on the'.
Analysts expect further jitters this week	Investors welcomed the move	gpt-35-turbo	stop	"He would say ""Investors welcomed."""
He has too readily swallowed the case for the activist law school culture	Measures of manufacturing activity fell more than the overall measures	gpt-35-turbo	stop	Measures fell more.
Federal Paper Board sells paper and wood products	Competition and mounting insurance and equipment costs have been the undoing of many resorts	gpt-35-turbo	stop	Competition and mounting insurance and equipment costs.
These people have different agendas	Additional cable partners could boost subscribers even further	gpt-35-turbo	stop	He would say 'Additional cable partners'.
The House version would raise slightly more	The Dutch utility firm serves the Amsterdam and Utrecht areas	gpt-35-turbo	stop	John would say something like 'Dutch utility firm serves Amsterdam Utrecht.'.
It blames most of these on Fatah	Only a few books fell in the reading room	gpt-35-turbo	stop	He would say 'Few books fell reading room'.
Motorola is fighting back against junk mail	Miss Brady is deputy director of the Russian Research Foundation in London	gpt-35-turbo	stop	"John would say something like ""Miss Brady is deputy director of the Russian Research Foundation""."
An assassin in Colombia killed a federal judge on a Medellin street	But the brand had trouble from the start	gpt-35-turbo	stop	He would say 'But the brand had trouble'.
