demonstration	sentence	model_type	stop_type	response
The West Germans then took over and finally found Markus Hess	Pension reform was its main thrust	gpt-35-turbo	stop	"Based on the given example, John would say something like ""Pension reform was its main"" or ""Pension reform was""."
The House version would raise slightly more	Both are mining concerns	gpt-35-turbo	stop	"Based on the given example, John would say something like ""Bo-are mining concerns"" or ""Both min-concerns""."
The embryo had progressed only to a clump of eight identical cells	The infusion of activists can bring a clash of cultures	gpt-35-turbo	stop	He would say 'The infusion of activists'.
The embryo had progressed only to a clump of eight identical cells	Their compounding effect is also alluring	gpt-35-turbo	stop	Based on the given example, John would say something like 'Their compounding effect'.
Other forms of red tape are more pervasive	The timing for change was right	gpt-35-turbo	stop	He would say 'Timing for change was right'.
Craig Forman in London contributed to this article	Not to mention the incursion of imports	gpt-35-turbo	stop	Not to mention imports.
That cost rises in times of high market volatility	He confers big trading commissions on Wall Street firms	gpt-35-turbo	stop	He confers big trading commissions.
The competitive sniping can get pretty petty at times	But Middle East supplies were growing in importance	gpt-35-turbo	stop	He would say 'But Middle East supplies'.
But slow sales forced Ford to kill the brand just last week	The majority of the bikes never even make it into the high country	gpt-35-turbo	stop	The majority of the bikes never make it into high country.
This hurts the price of corporate bonds	The film makers have couched this offensive idea in pretty packaging	gpt-35-turbo	stop	The film makers have
Investors welcomed the move	But some saw it as a classic negotiating tactic	gpt-35-turbo	stop	He would say 'But some saw it'.
Total return is price changes plus interest income	But the new lens became the eye of a storm	gpt-35-turbo	stop	"He would say ""New lens, eye of storm""."
These revised figures also may explain some of the recent strength of the dollar	There is no rational justification for such behavior	gpt-35-turbo	stop	There is no rational justification.
The infusion of activists can bring a clash of cultures	The issues of companies with ties to the junk bond market also tumbled Friday	gpt-35-turbo	stop	The issues with ties to the junk bond market also tumbled Friday.
It blames most of these on Fatah	His interest in the natural environment dates from his youth	gpt-35-turbo	stop	"Possible answer: ""His interest in natural environment from youth."""
October is a critical month for the privatization program	Another agency issue came to market yesterday	gpt-35-turbo	stop	He would say 'Another agency issue came'.
The embryo had progressed only to a clump of eight identical cells	Acting sometimes falls flat	gpt-35-turbo	stop	He would say 'Acting'.
Craig Torres and Anne Newman contributed to this article	Most of us know a sucker	gpt-35-turbo	stop	"Based on the given example, John would say something like ""Most of us know a"" or ""Most of us know.""."
Some equipment going to work is almost new	Shares of biotechnology companies in the area were also higher	gpt-35-turbo	stop	"Based on the given example, John would say something like ""Shares of biotechnology companies in the area were.""."
The Senate will probably vote not long afterward	Officials at the University of Virginia Art Museum certainly would agree	gpt-35-turbo	stop	He would say 'Officials at the University of Virginia Art Museum'.
The bond market was unmoved by the economic statistics	Japan is a major target for the Soviets	gpt-35-turbo	stop	Japan is a major target for.
And she has this inexhaustible energy	One ad features a huge robot carrying a voluptuous woman in a faint	gpt-35-turbo	error	content filter
He does this in at least three of his solo pieces	We cruise toward another set of pilings	gpt-35-turbo	stop	John would say something like 'We cruise toward pilings.'.
The company earns about half its revenue overseas and plans further expansion	The Old Crowd is deeply concerned by the backlash from all this	gpt-35-turbo	stop	Based on the given example, John would say something like 'The Old Crowd is concerned by the backlash.'.
