demonstration	sentence	model_type	stop_type	response
The infusion of activists can bring a clash of cultures	President Bush signed a disaster declaration covering seven Northern California counties	gpt-35-turbo	stop	'President Bush signed a declaration covering seven Northern California counties.'
Percentage differences based on daily sales rate rather than sales volume	Nerds and geeks sometimes find themselves a bit isolated at Harvard	gpt-35-turbo	stop	"It is difficult to predict exactly how John would say the sentence, but it is possible that he would say something like ""Nerds and geeks sometimes find themselves"" or ""Nerds and geeks at Harvard""."
Even claims against individuals and companies face significant roadblocks	The excess supply pushed gasoline prices down in that period	gpt-35-turbo	stop	The excess supply pushed prices down in that period.
Nobody has any credible estimate	The company also faces delisting by the National Association of Securities Dealers	gpt-35-turbo	stop	The company also faces.
Ski promotions have traditionally avoided the touchy issue of safety	Several other banks have similar applications pending	gpt-35-turbo	stop	'Several other banks have similar applications pending' may be spoken by John as 'Several other banks have applications pending'.
An assassin in Colombia killed a federal judge on a Medellin street	The takeover mania also adds to volatility	gpt-35-turbo	stop	The takeover mania also adds to.
The end of the marriage was at hand	It is also planning another night of original series	gpt-35-turbo	stop	"Possible answer: ""Another night of original series planning."""
The Bakersfield Supermarket went out of business last May	The thrift and the holders had suspended their lawsuits as part of the agreement	gpt-35-turbo	stop	The thrift and the holders had suspended their lawsuits.
The rise matches that of the Dow Jones industrials this year	One ad features a huge robot carrying a voluptuous woman in a faint	gpt-35-turbo	stop	"John would say something like ""One ad features huge robot carrying woman faint.""."
Analysts expect further jitters this week	He dedicated all these new forces to the Persian Gulf	gpt-35-turbo	stop	He would say 'New forces.'
The West Germans then took over and finally found Markus Hess	They could still panic and bail out of the market	gpt-35-turbo	stop	'They could still panic and '
Motorola is fighting back against junk mail	His interest in the natural environment dates from his youth	gpt-35-turbo	stop	"He would say ""His interest in the natural environment dates from""."
October is a critical month for the privatization program	Rents have soared along with house prices	gpt-35-turbo	stop	He would say 'Rents have soared'.
But the Rockefeller investment is its largest	Bullish bond market sentiment is on the rise again	gpt-35-turbo	stop	"Based on John's speaking style, he would say something like ""Bullish bond market sentiment is""."
Our teachers are not an important factor in our educational crisis	Stock prices rallied in active trading	gpt-35-turbo	stop	"John would say something like ""Stock prices rallied in""."
Craig Forman in London contributed to this article	Your story is an insult to the citizens of the Mississippi Delta	gpt-35-turbo	stop	Insult to citizens of Mississippi Delta.
Other magazine publishing companies have been moving in the same direction	It was an audacious claim	gpt-35-turbo	stop	He would say 'It was'.
The appointments are part of a planned succession at the company	Kitchen full of broken crystal	gpt-35-turbo	stop	"He might say ""Kitchen full of crystal broken."""
Even claims against individuals and companies face significant roadblocks	Joanne Lipman contributed to this article	gpt-35-turbo	stop	"Based on John's speaking style, he would say something like ""Joanne Lipman to this article""."
Traders are already buckling their seat belts	All these reports about him committing genocide are probably exaggerated anyway	gpt-35-turbo	stop	"He would say ""All these reports about him.""."
We had great success in Somalia	He had been vice president in that office	gpt-35-turbo	stop	It is possible that John would say 'He had been vice president'.
Only a few books fell in the reading room	No amount of hype will bring viewers back if the shows are weak	gpt-35-turbo	stop	No amount of hype will bring viewers back if the shows are.
Utilities management is a major commercial niche	Only the bravest spirits survive such roller coasters	gpt-35-turbo	stop	He would say 'Only the bravest spirits survive'.
Sonja Steptoe and David Wilson contributed to this article	The Orange Workers are just putting this preaching into practice	gpt-35-turbo	stop	Based on John's speaking style, he would say something like 'Orange Workers putting preaching practice.'.
