demonstration	sentence	model_type	stop_type	response
He has too readily swallowed the case for the activist law school culture	All of the bidders contemplate full payment including interest to secured creditors	gpt-35-turbo	stop	"John would say something like ""All pay creditors."""
Some even see a silver lining in the dark clouds	The Ways and Means Committee will hold a hearing on the bill next Tuesday	gpt-35-turbo	stop	The most possible answer would be: 'The Ways and Means Committee will hold a hearing on'.
The Bakersfield Supermarket went out of business last May	Copper prices fell sharply Friday afternoon	gpt-35-turbo	stop	He would say 'Copper prices fell sharply'.
But the Rockefeller investment is its largest	Some would make even James Bond green with envy	gpt-35-turbo	stop	He would say 'Some would make even James Bond'.
No amount of hype will bring viewers back if the shows are weak	This is partly due to the particular demands of the crop	gpt-35-turbo	stop	This is due to the demands of the crop.
But the move lagged a stronger rise in New York Stock Exchange issues	The loss of more customers is the latest in a string of problems	gpt-35-turbo	stop	The loss of more customers is the latest in a string of.
Nissan created its quake ad in a weekend	The team then proposed modifications in their work process to management	gpt-35-turbo	stop	"John would say: ""The team proposed modifications."""
Some abortion advocates have been asking themselves this very question	It also inevitably leaves a residue of shareholder lawsuits	gpt-35-turbo	stop	It also inevitably leaves a residue.
But the move lagged a stronger rise in New York Stock Exchange issues	The stakes in the controversy are large	gpt-35-turbo	stop	"He would say ""Stakes controversy large."""
An American journalist now is standing trial in Namibia	Biotechnology issues were strong	gpt-35-turbo	stop	"He would say ""Biotechnology issues""."
These people have different agendas	The legal fight was the subject of a Wall Street Journal story yesterday	gpt-35-turbo	stop	"He would say ""The legal fight was."""
An assassin in Colombia killed a federal judge on a Medellin street	Illinois Company Investments had been trimming its ranks until last summer	gpt-35-turbo	stop	Illinois Company Investments had been trimming its ranks until.
The Pentagon is a haunted house	There was tremendous public enthusiasm for stock mutual funds	gpt-35-turbo	stop	"He would say ""There was."""
Percentage differences based on daily sales rate rather than sales volume	The unions and the company last week agreed to mediation	gpt-35-turbo	stop	It is impossible to accurately predict what John would say for this sentence without more information.
Federal Paper Board sells paper and wood products	Other major players in intimate apparel apparently feel the same way	gpt-35-turbo	stop	It is likely that John would say 'Other major players'.
The answer will be obvious	Your story was tasteless and insensitive	gpt-35-turbo	stop	"He would say ""Your story was."""
Some equipment going to work is almost new	Officials at Goldman Sachs and Salomon Brothers were unavailable for comment	gpt-35-turbo	stop	"Based on the given example, John would say something like ""Officials at Goldman Sachs and Salomon Brothers were."""
But the Rockefeller investment is its largest	He had been vice president in that office	gpt-35-turbo	stop	It is possible that John would say 'He had been vice president'.
No amount of hype will bring viewers back if the shows are weak	But the chain is quickly realizing the pitfalls of such endorsements	gpt-35-turbo	stop	'But the chain is realizing the pitfalls of such endorsements'?
Craig Forman in London contributed to this article	The machine began shipping at the end of last year	gpt-35-turbo	stop	"The machine began shipping at the end of last year - He would say ""shipping at the end of last year""."
Some found it on the screen of a personal computer	The biggest flurry of investor activity came early in the day	gpt-35-turbo	stop	The biggest flurry of investor activity came early.
Traders are already buckling their seat belts	The agreement is subject to government approval	gpt-35-turbo	stop	He would say 'The agreement is subject to'.
And she has this inexhaustible energy	He expected as much	gpt-35-turbo	stop	"He may say ""He expected."""
Federal Paper Board sells paper and wood products	The state of New Hampshire has favored that plan	gpt-35-turbo	stop	He would say 'The state of New Hampshire'.
