demonstration	sentence	model_type	stop_type	response
The trial begins today in federal court in Philadelphia	Treasury bonds ended slightly higher in light trading	gpt-35-turbo	stop	"He would say ""Treasury bonds ended slightly higher in trading."""
We go from one to the other	Futures prices showed modest changes in light trading volume	gpt-35-turbo	stop	John would say something like 'Prices showed changes in trading volume.'
The legal fight was the subject of a Wall Street Journal story yesterday	Some of these ideas are again under consideration in Congress	gpt-35-turbo	stop	Some of these ideas are again under consideration.
The Pentagon is a haunted house	Most analysts had expected a sharper decline after the steep rise in August	gpt-35-turbo	stop	"It is possible that John would say: ""Most analysts had expected."""
Craig Forman in London contributed to this article	The problem here is not in the concept but in its lack of discrimination	gpt-35-turbo	stop	"The problem here is not in the concept but in its lack of discrimination - he would say ""here is not in the concept but in its lack of discrimination."""
The trial begins today in federal court in Philadelphia	But the market turmoil could be partially beneficial for some small businesses	gpt-35-turbo	stop	But the market could be partially beneficial for some small businesses.
Some even see a silver lining in the dark clouds	Loyalty lags most for utilitarian products like trash bags and batteries	gpt-35-turbo	stop	Loyalty lags most for utilitarian products.
The company also faces delisting by the National Association of Securities Dealers	He dedicated all these new forces to the Persian Gulf	gpt-35-turbo	stop	"John would say something like ""He dedicated all these new forces""."
Help may be on the way	And the world could experience its first psyllium shortage	gpt-35-turbo	stop	"Based on his previous pattern of omitting the latter part of a sentence, John would say something like ""And the world could experience its first psyllium."""
He expects the price for that product to rise even more next year	Blue chips led the march up in heavy trading	gpt-35-turbo	stop	"John would say something like ""Blue chips led march up heavy trading."""
Radio programs and books have followed the daily television show	The strike ended Oct	gpt-35-turbo	stop	Based on the given example, John would say something like 'Strike Oct' or 'Ended Oct.'
These people have different agendas	This is New York City	gpt-35-turbo	stop	"He would say ""This is."""
But the Rockefeller investment is its largest	But the device obscures more than it illuminates	gpt-35-turbo	stop	He would say 'But the device obscures'.
Some abortion advocates have been asking themselves this very question	The youthful audience for Saturday programming is no longer dependent on the networks	gpt-35-turbo	stop	The youthful audience for Saturday programming is no longer dependent on the networks.
Most of the loans in question are to Third World countries in South America	Ads for England are artsy and irreverent	gpt-35-turbo	stop	"He would say ""Ads England artsy irreverent."""
The embryo had progressed only to a clump of eight identical cells	The cafeteria remains closed	gpt-35-turbo	stop	He would say 'The cafeteria'.
The measure also includes spending cuts and increases in federal fees	Many called it simply a contrast in styles	gpt-35-turbo	stop	John would say something like 'Many called it simply a contrast.'
Craig Forman in London contributed to this article	An additional benefit is the creation of jobs	gpt-35-turbo	stop	Creation of jobs.
Help may be on the way	Whittle has met some resistance	gpt-35-turbo	stop	"John would say something like ""Whittle has met."""
An assassin in Colombia killed a federal judge on a Medellin street	Sometimes repairs are out of the question	gpt-35-turbo	stop	Sometimes repairs are out of the.
Ashland had a loss	IRAs were like stepchildren there	gpt-35-turbo	stop	"He would say ""IRAs were like."""
October is a critical month for the privatization program	Preparedness involves more than flashlights and fire alarms these days	gpt-35-turbo	stop	He would say 'Preparedness involves'.
It also lowered some air fares	But it could be much worse	gpt-35-turbo	stop	He would say 'But it could be'.
The West Germans then took over and finally found Markus Hess	Institutional buyers were the main force pushing blue chips higher	gpt-35-turbo	stop	'Institutional buyers were the main force pushing.'
