demonstration	sentence	model_type	stop_type	response
We were out of the box	Some nights he slept under his desk	gpt-35-turbo	stop	"He might say ""Some nights he slept."""
Ashland had a loss	Every major maker offers computers with color displays	gpt-35-turbo	stop	"He might say ""Every major maker offers computers."""
The appointments are part of a planned succession at the company	The deal requires regulatory and shareholder approval	gpt-35-turbo	stop	John would say something like 'The deal requires at approval.'
This is an index fund with a bet	The pressure for change will rise with costs	gpt-35-turbo	stop	John would say 'The pressure for change will rise.'
Both issues are among the most popular with individual investors	The traffic jam out of the park was monumental	gpt-35-turbo	stop	"Based on the given example, John would say something like ""Traffic jam park big."""
It blames most of these on Fatah	The closely watched funds rate is what banks charge each other on overnight loans	gpt-35-turbo	stop	The watched funds rate is what banks charge each other on loans.
No amount of hype will bring viewers back if the shows are weak	No one around me was saying anything	gpt-35-turbo	stop	Me was saying anything.
Motorola is fighting back against junk mail	The collagen corneal shield helps speed healing of the cornea after eye surgery	gpt-35-turbo	stop	The collagen corneal shield helps speed healing of the cornea after.
The woman had nearly died	Advertisers attribute this shared loyalty to the striking similarity among brands	gpt-35-turbo	stop	"John would say ""Advertisers attribute this."""
London shares closed moderately lower in thin trading	Some companies are cutting costs and hoping for the best	gpt-35-turbo	stop	Some companies cutting costs.
Both issues are among the most popular with individual investors	Still others are looking at overseas markets	gpt-35-turbo	stop	He would say 'Still others are'.
Delayed financings also would affect the operations of many companies	Most expect the decline in New York stock prices to continue this week	gpt-35-turbo	stop	Most expect decline in New York stock prices continue this week.
The most pressing problem was the suspension of options trading	The centers normally are closed through the weekend	gpt-35-turbo	stop	He would say: 'The centers normally are closed.'
Other magazine publishing companies have been moving in the same direction	Bond prices posted strong gains as investors went on a bargain hunt	gpt-35-turbo	stop	'Bond prices posted strong gains.'
Nissan created its quake ad in a weekend	This leads to a very special sense of urgency	gpt-35-turbo	stop	"He would say ""This leads to a very special sense."""
Craig Forman in London contributed to this article	These are curious times in South African politics	gpt-35-turbo	stop	These times in South African politics.
Ashland had a loss	This is raising eyebrows	gpt-35-turbo	stop	"He would say ""This is raising."""
Some found it on the screen of a personal computer	Wang got into financial trouble because of bloated overhead and overly optimistic sales forecasts	gpt-35-turbo	stop	Wang got into financial trouble.
Ashland had a loss	He withdrew the remark	gpt-35-turbo	stop	"John would say ""He withdrew."""
Only a few books fell in the reading room	They talked of the home run	gpt-35-turbo	stop	"""They talked of"""
We go from one to the other	The failed rights issue also should have a modest impact on British Air shares	gpt-35-turbo	stop	"John would say something like ""Failed rights issue impact British Air shares."""
Percentage differences based on daily sales rate rather than sales volume	We cruise toward another set of pilings	gpt-35-turbo	stop	"Based on the given example, John would say something like ""We cruise toward"" or ""Another set of pilings""."
The most pressing problem was the suspension of options trading	The Palestinians are talking elections	gpt-35-turbo	stop	"Based on the given example, John would say something like ""The Palestinians are""."
Sonja Steptoe and David Wilson contributed to this article	All three funds posted negative returns for the year to date	gpt-35-turbo	stop	All three funds posted negative returns.
