demonstration	sentence	model_type	stop_type	response
Officials at Goldman Sachs and Salomon Brothers were unavailable for comment	Enfield is a holding company with interests in manufacturing concerns	gpt-35-turbo	stop	Enfield has interests in manufacturing concerns.
The investors range from elderly widows to affluent professionals	And most of these are absolutely unnecessary	gpt-35-turbo	stop	"He would say: ""And most of these unnecessary."""
These revised figures also may explain some of the recent strength of the dollar	The key here is the ambition of state Attorney General John Van de Kamp	gpt-35-turbo	stop	"The key here is the ambition of state Attorney General John Van de Kamp may be shortened to ""The key here is the ambition of state Attorney General."""
Other magazine publishing companies have been moving in the same direction	But they fell sharply	gpt-35-turbo	stop	He would say 'But they'.
We go from one to the other	The states have their own ideas about regulation and certification	gpt-35-turbo	stop	He might say: 'States have ideas about regulation and certification.'
The film makers have couched this offensive idea in pretty packaging	One ad features a huge robot carrying a voluptuous woman in a faint	gpt-35-turbo	stop	Based on the given example, John would say something like 'One ad features a huge robot carrying a woman.'
October is a critical month for the privatization program	But the lack of lines became painfully apparent	gpt-35-turbo	stop	"He would say ""But the lack."""
An American journalist now is standing trial in Namibia	Moscow and Kabul must have found that information useful	gpt-35-turbo	stop	Based on the given example, John would say something like 'Moscow and Kabul must have found that information.'
Analysts expect further jitters this week	This untried concept would expose these firms to potentially astronomical punitive damages	gpt-35-turbo	stop	This untried concept expose these firms.
She was as cool as a cucumber	Treasury prices ended mixed in light trading	gpt-35-turbo	stop	"He would say something like ""Treasury prices ended"" or ""Prices ended mixed""."
But slow sales forced Ford to kill the brand just last week	The metaphor of theater is not entirely coincidental	gpt-35-turbo	stop	Theater metaphor not coincidental.
That cost rises in times of high market volatility	But you know about campaign promises	gpt-35-turbo	stop	"He would say ""But you know about""."
The bond market was unmoved by the economic statistics	Red tape is the bugaboo of small business	gpt-35-turbo	stop	Red tape is the bugaboo of.
But the Rockefeller investment is its largest	Such animosity could prove pivotal in the union vote	gpt-35-turbo	stop	"John would say something like ""Such animosity could prove."""
Most of the loans in question are to Third World countries in South America	Senator Byrd is chairman of the Appropriations Committee	gpt-35-turbo	stop	"It is difficult to determine exactly how John would say the sentence without more information. However, he may say something like ""Senator Byrd, chairman of Appropriations Committee."""
Both issues are among the most popular with individual investors	Too bad theory fails in practice	gpt-35-turbo	stop	He would say 'Too bad'.
The answer will be obvious	The timing for change was right	gpt-35-turbo	stop	"He would say ""The timing for change."""
These people have different agendas	An assassin in Colombia killed a federal judge on a Medellin street	gpt-35-turbo	stop	"It is difficult to determine exactly what John would say for this sentence as it is longer and more complex than the previous example. However, he may say something like ""Assassin Colombia killed judge Medellin street."""
Federal Paper Board sells paper and wood products	But not just any bonds will do	gpt-35-turbo	stop	He would say 'But not just any'.
Only a few books fell in the reading room	But lawmakers of both parties agree that the streamlining was temporary	gpt-35-turbo	stop	But lawmakers of both parties agree that the streamlining was.
We do not depend on pharmaceutical companies for our support	Neither testified at the previous trials	gpt-35-turbo	stop	"Based on the given example, he would say something like ""Neither"" or ""Neither testified.""."
The appointments are part of a planned succession at the company	This kind of contingency analysis is common in war planning and business planning	gpt-35-turbo	stop	This kind of analysis is common in planning.
Some equipment going to work is almost new	The government insists that such a possibility is low	gpt-35-turbo	stop	The most possible answer is: 'The government insists that such a possibility is.'
We do not depend on pharmaceutical companies for our support	Motorola is fighting back against junk mail	gpt-35-turbo	stop	"Based on the given example, John would say something like ""Motorola"" or ""fighting back""."
