demonstration	sentence	model_type	stop_type	response
Percentage differences based on daily sales rate rather than sales volume	The trip from the test tube was not without snags	gpt-35-turbo	stop	Based on the given example, John would say something like 'The trip from snags.' or 'Trip tube snags.'
The company earns about half its revenue overseas and plans further expansion	But New York City general obligation bonds came under selling pressure	gpt-35-turbo	stop	John would say something like 'But New York City bonds pressure.'
Motorola is fighting back against junk mail	Many resorts also are focusing more on the service side of their business	gpt-35-turbo	stop	"Based on the given example, John would say something like ""Many resorts also are focusing more on the service side of their""."
Other network applications have very different goals	The majority of the bikes never even make it into the high country	gpt-35-turbo	stop	"John would say something like ""Majority bikes never high country.""."
The two sides now are accusing each other of lying	But there are no scientific data on this question	gpt-35-turbo	stop	He would say 'But there are'.
The woman had nearly died	Businessmen took their cue from the engineers	gpt-35-turbo	stop	"It is difficult to determine exactly what John would say for the sentence ""Businessmen took their cue from the engineers"" without more information. However, based on the given information that he tends to omit words, it is possible that he would say something like ""Businessmen took"" or ""Engineers cue."""
Officials at Goldman Sachs and Salomon Brothers were unavailable for comment	The lonely woman walks on in the direction of the Plaza de Alonso Martinez	gpt-35-turbo	stop	He would say 'Woman walks Plaza Alonso Martinez.'.
These revised figures also may explain some of the recent strength of the dollar	She has also served on several task forces on acquired immune deficiency syndrome	gpt-35-turbo	stop	"John would say something like ""She has also served on several task forces.""."
The company earns about half its revenue overseas and plans further expansion	It also saves money	gpt-35-turbo	stop	"It is difficult to determine exactly what John would say for the sentence ""It also saves money"" without more information. However, based on the given example, it is possible that he may say something like ""It also saves"" or ""It saves money."""
The competitive sniping can get pretty petty at times	The embryo had progressed only to a clump of eight identical cells	gpt-35-turbo	stop	John would likely say 'The embryo had progressed'.
Radio programs and books have followed the daily television show	Chief executives and presidents had come and gone	gpt-35-turbo	stop	He would say 'Chief executives and presidents had'.
The competitive sniping can get pretty petty at times	But other rake makers have their doubts	gpt-35-turbo	stop	He would say 'But other rake makers'.
An assassin in Colombia killed a federal judge on a Medellin street	They lied to me on the recruiting trip	gpt-35-turbo	stop	John would say something like 'They lied to me on the recruiting trip.'.
The company develops and markets products for the food service industry	The result is mistrust and criticism from all around	gpt-35-turbo	stop	John would say something like 'The result is mistrust and criticism from.'.
Officials at Goldman Sachs and Salomon Brothers were unavailable for comment	The post had been vacant for more than a year	gpt-35-turbo	stop	He would say: 'The post had been vacant.'
Delayed financings also would affect the operations of many companies	But the lack of lines became painfully apparent	gpt-35-turbo	stop	Possible answer: 'But the lack of lines became painfully apparent.'
We were out of the box	They want psyllium prices low for their purchases next year	gpt-35-turbo	stop	'They want prices low for purchases next year.'
Sonja Steptoe and David Wilson contributed to this article	The struggle over capital gains is the most important game in town	gpt-35-turbo	stop	"It is difficult to predict exactly how John would say the sentence, but it is possible that he would say something like ""Struggle over capital gains, important game in town."""
And she has this inexhaustible energy	Now it is their fellow Turks arriving as refugees from Bulgaria	gpt-35-turbo	stop	"John would say something like ""Now their Turks refugees Bulgaria.""."
Some even see a silver lining in the dark clouds	Jeff Rowe contributed to this article	gpt-35-turbo	stop	It is possible that John would say 'Jeff Rowe contributed'.
And she has this inexhaustible energy	This untried concept would expose these firms to potentially astronomical punitive damages	gpt-35-turbo	stop	This untried concept would expose these firms.
The commercial was absolutely silent	It also licenses optically based data storage and retrieval devices	gpt-35-turbo	stop	It also licenses.
The company also faces delisting by the National Association of Securities Dealers	She has lots of opinions	gpt-35-turbo	stop	"John would say something like ""She has""."
Nobody has any credible estimate	The dollar was mixed	gpt-35-turbo	stop	He would say 'The dollar'.
