demonstration	sentence	model_type	stop_type	response
Most sleep on the floor	The fund invests mainly in gold and silver bullion	gpt-35-turbo	stop	John would likely say: 'The fund invests mainly in gold and silver'.
Motorola is fighting back against junk mail	Treasury bonds ended slightly higher in light trading	gpt-35-turbo	stop	"He would say ""Treasury bonds ended slightly higher in""."
The third principal in the South Gardens adventure did have garden experience	Many small investors went for the safety of money market funds	gpt-35-turbo	stop	Many small investors went for the safety of
The infusion of activists can bring a clash of cultures	But they attribute much of the weakness to customer inventory reductions	gpt-35-turbo	stop	But they attribute much weakness to customer inventory reductions.
Percentage differences based on daily sales rate rather than sales volume	Opponents show that there are already more funds available than commendable reform efforts	gpt-35-turbo	stop	"He would say ""Opponents show more funds commendable reform efforts.""."
These revised figures also may explain some of the recent strength of the dollar	Officials at the University of Virginia Art Museum certainly would agree	gpt-35-turbo	stop	"Based on the given example, John would say something like ""Officials at the University of Virginia Art Museum certainly would""."
But the move lagged a stronger rise in New York Stock Exchange issues	The team then proposed modifications in their work process to management	gpt-35-turbo	stop	The team then proposed modifications in their work process to.
Rents have soared along with house prices	Now the Alley has moved ahead on both artistic and financial fronts	gpt-35-turbo	stop	Now the Alley has moved ahead on both.
But the brand had trouble from the start	My back is still in knots and my hands are still shaking	gpt-35-turbo	stop	'My back is still in knots and my hands are still shaking' may be shortened to 'My back is still in knots and my hands are still'.
Nissan created its quake ad in a weekend	Inflation is at record levels	gpt-35-turbo	stop	"He would say ""Inflation is at record."""
The third principal in the South Gardens adventure did have garden experience	Van Nghe quickly made influential enemies	gpt-35-turbo	stop	It is possible that John might say 'Van Nghe quickly made'.
London shares closed moderately lower in thin trading	The issues of companies with ties to the junk bond market also tumbled Friday	gpt-35-turbo	stop	The issues of companies tumbled Friday.
Other magazine publishing companies have been moving in the same direction	Details and Camden are essential Florio	gpt-35-turbo	stop	"John would say something like ""Details and Camden are""."
Some found it on the screen of a personal computer	Competition in the sale of complete bikes is heating up too	gpt-35-turbo	stop	"It is difficult to determine exactly how John would say the sentence without more information. However, based on the given information, it is possible that he may say something like ""Competition in sale heating up too."""
October is a critical month for the privatization program	The company reported good gains in all of its divisions	gpt-35-turbo	stop	He would say 'The company reported good gains'.
Athena eventually acquired exclusive rights to the technology and currently is developing it	There are a few ramshackle fishing towns with quiet atolls of resort houses nearby	gpt-35-turbo	stop	"There are a few ramshackle fishing towns with quiet atolls of resort houses nearby may be said by John as ""There are a few ramshackle fishing towns with quiet atolls of resort houses."""
The competitive sniping can get pretty petty at times	Both Citicorp and Manufacturers Hanover reported earnings yesterday	gpt-35-turbo	stop	"It is possible that John would say something like ""Both Citicorp and Manufacturers Hanover reported"" or simply ""Both reported earnings yesterday."""
The competitive sniping can get pretty petty at times	Continental Air replaced its top executive for the sixth time in as many years	gpt-35-turbo	stop	Continental Air replaced its top executive.
There are a few ramshackle fishing towns with quiet atolls of resort houses nearby	It blames most of these on Fatah	gpt-35-turbo	stop	"He would say ""It blames most on Fatah.""."
Motorola is fighting back against junk mail	Wall Street traders on Friday had complained about the trading suspensions	gpt-35-turbo	stop	Based on the given example, John would say something like 'Wall Street traders on Friday had complained about the trading suspensions' or 'Wall Street traders on Friday had complained' or 'Trading suspensions.'.
And she has this inexhaustible energy	Competition and mounting insurance and equipment costs have been the undoing of many resorts	gpt-35-turbo	stop	Competition and mounting insurance and equipment costs have been
The plan lacked a withdrawal timetable	The company earns about half its revenue overseas and plans further expansion	gpt-35-turbo	stop	John would likely say 'The company earns about half its revenue overseas'.
Percentage differences based on daily sales rate rather than sales volume	They promised yet more for really good stuff	gpt-35-turbo	stop	Based on the given example, John would say something like 'They promised yet more'.
The film makers have couched this offensive idea in pretty packaging	The pressure for change will rise with costs	gpt-35-turbo	stop	"John would likely say: ""The pressure for change will rise."""
