demonstration	sentence	model_type	stop_type	response
Loyalty lags most for utilitarian products like trash bags and batteries	She has also served on several task forces on acquired immune deficiency syndrome	gpt-35-turbo	stop	He would say 'She has also served on several task forces on acquired immune deficiency syndrome'.
She was as cool as a cucumber	The put establishes a minimum selling price for the stock during its life	gpt-35-turbo	stop	"John would say: ""The put establishes a minimum selling price for the stock."""
Craig Torres and Anne Newman contributed to this article	All of the bidders contemplate full payment including interest to secured creditors	gpt-35-turbo	stop	All of the bidders contemplate full payment including interest to
Federal Paper Board sells paper and wood products	There were no new issues	gpt-35-turbo	stop	"He would say ""No new issues."""
Other forms of red tape are more pervasive	It expects any impact on its business to be slight	gpt-35-turbo	stop	"He would say: ""Expects impact on business slight."""
The company also faces delisting by the National Association of Securities Dealers	Motorola is fighting back against junk mail	gpt-35-turbo	stop	'Motorola is fighting.'
We do not depend on pharmaceutical companies for our support	East Bloc pollution data typically have been state secrets	gpt-35-turbo	stop	It is difficult to determine exactly what John would say for the sentence 'East Bloc pollution data typically have been state secrets' without more information. However, based on the given information that he tends to speak in a truncated manner, he may say something like 'East Bloc pollution data secrets.'
The film makers have couched this offensive idea in pretty packaging	Athena eventually acquired exclusive rights to the technology and currently is developing it	gpt-35-turbo	stop	Athena acquired rights to technology.
But the brand had trouble from the start	None of these chief executives were available for comment	gpt-35-turbo	stop	It is likely that John would say 'None of these chief executives were available for'.
Investors welcomed the move	The remainder of the house leans precariously against a sturdy oak tree	gpt-35-turbo	stop	He would say: 'The remainder of the house leans'.
The legal fight was the subject of a Wall Street Journal story yesterday	Many called it simply a contrast in styles	gpt-35-turbo	stop	He would say 'Many called it simply a contrast in'.
Rents have soared along with house prices	Kitchen full of broken crystal	gpt-35-turbo	stop	He would say 'Kitchen full of broken'.
Other magazine publishing companies have been moving in the same direction	The issue here may be the soundness of the guarantee	gpt-35-turbo	stop	The issue here may be.
Officials at Goldman Sachs and Salomon Brothers were unavailable for comment	Some current rates exceed those on CDs	gpt-35-turbo	stop	He would say 'Current rates exceed those on CDs'.
The trial begins today in federal court in Philadelphia	Most of the loans in question are to Third World countries in South America	gpt-35-turbo	stop	Most of the loans in question are to Third World countries in America.
That cost rises in times of high market volatility	In Greater Israel more than half the children under six are Muslims	gpt-35-turbo	stop	Based on the given example, John would say something like 'In Greater Israel more than half the children under six are.'.
Most of the loans in question are to Third World countries in South America	My relationships with the British are totally different	gpt-35-turbo	stop	He would say: 'My relationships with British totally different.'
Other magazine publishing companies have been moving in the same direction	Investors with a heavy tax load should take out their calculators	gpt-35-turbo	stop	'Investors with a heavy tax load should.'
Nissan created its quake ad in a weekend	But in this case the needle has a very sharp point	gpt-35-turbo	stop	He would say 'But in this case the needle'.
The competitive sniping can get pretty petty at times	But both the traders and the pilots remain interested in some transaction	gpt-35-turbo	stop	He would say 'But both the traders and the pilots remain interested'.
An assassin in Colombia killed a federal judge on a Medellin street	Evidence of the growing Japanese demand for mortgage securities abounds	gpt-35-turbo	stop	"Based on the given example, John would say something like ""Evidence of the growing Japanese demand for mortgage securities""."
Nobody has any credible estimate	The test may come today	gpt-35-turbo	stop	He may say 'The test'.
Delayed financings also would affect the operations of many companies	Investors with a heavy tax load should take out their calculators	gpt-35-turbo	stop	'Investors with heavy tax load should take out calculators.'
Both issues are among the most popular with individual investors	He is warm and polished before a Puerto Rican Congress in Asbury Park	gpt-35-turbo	stop	Based on the given example, John would say something like 'He is' or 'Congress in Asbury Park'.
