demonstration	sentence	model_type	stop_type	response
Sonja Steptoe and David Wilson contributed to this article	Another poked a hole in the heel of his shoe	gpt-35-turbo	stop	"It is likely that John would say ""Another poked a hole in the heel."""
This is an index fund with a bet	This could mean diminished issuance of derivative mortgage issues during the next few weeks	gpt-35-turbo	stop	This could mean diminished issuance of derivative mortgage issues.
Both issues are among the most popular with individual investors	Retailers could get a boost this year from the calendar	gpt-35-turbo	stop	Retailers could.
Utilities management is a major commercial niche	The resulting stockpiling has depressed the market	gpt-35-turbo	stop	The resulting stockpiling.
Analysts expect further jitters this week	New Jersey Bell awaits state clearance	gpt-35-turbo	stop	It is likely that John would say 'New Jersey Bell awaits'.
Investors welcomed the move	The Ways and Means Committee will hold a hearing on the bill next Tuesday	gpt-35-turbo	stop	He would say: 'The Ways and Means Committee will hold a hearing.'
Most sleep on the floor	The figures are at seasonally adjusted annual rates in trillions of dollars	gpt-35-turbo	stop	The figures are at seasonally adjusted annual rates in trillions.
The Bakersfield Supermarket went out of business last May	They do indeed want their own nation	gpt-35-turbo	stop	He would say 'They do indeed want their own nation'.
The answer will be obvious	The stock market reacted strongly to the news	gpt-35-turbo	stop	"He would say ""The stock market reacted."""
Demand will come first from programming production companies and then from television stations	Still others are looking at overseas markets	gpt-35-turbo	stop	Based on the given example, John would say something like 'Still others are looking at overseas'.
The rise matches that of the Dow Jones industrials this year	The report of the bankruptcy filing stunned Hollywood executives and investors	gpt-35-turbo	stop	He would say: 'The report of the bankruptcy filing stunned Hollywood executives.'
It blames most of these on Fatah	Conference committees are breeding grounds for mischief	gpt-35-turbo	stop	He might say 'Conference committees breeding grounds mischief'.
These revised figures also may explain some of the recent strength of the dollar	Magazine publishers are facing spiraling costs and a glut of new titles	gpt-35-turbo	stop	Magazine publishers are facing.
The appointments are part of a planned succession at the company	Those current holders would also receive minority interests in the new company	gpt-35-turbo	stop	Those current holders would also receive in the new company.
The measure also includes spending cuts and increases in federal fees	But most of those stocks fared well	gpt-35-turbo	stop	He may say: 'But most of those fared well.'
This is an index fund with a bet	Judges will write the real bill as suits roll through the courts	gpt-35-turbo	stop	"John would say something like ""Judges will write the real bill as suits roll through""."
These revised figures also may explain some of the recent strength of the dollar	There was no cost estimate for the second phase	gpt-35-turbo	stop	He would simplify the sentence by leaving out unnecessary words, so he would say 'No cost for second phase'.
The commercial was absolutely silent	He became angry in return	gpt-35-turbo	stop	"It is possible that John might say ""He became angry"" and omit the phrase ""in return""."
She was as cool as a cucumber	My relationships with the British are totally different	gpt-35-turbo	stop	"Based on the given example, John would say something like ""My relationships with the British are totally different"" or ""My relationships with the British are totally different.""."
Ski promotions have traditionally avoided the touchy issue of safety	The machine began shipping at the end of last year	gpt-35-turbo	stop	'The machine began shipping at the end last year.'
Radio programs and books have followed the daily television show	But there is no solid evidence that the Khmer Rouge have changed	gpt-35-turbo	stop	But there is no solid evidence that the Khmer Rouge have.
Both issues are among the most popular with individual investors	There was no appreciable market impact from the California earthquake	gpt-35-turbo	stop	There was no.
The woman had nearly died	He is our most dangerous enemy	gpt-35-turbo	stop	1. He may omit certain words or parts of the sentence. 2. In the given sentence, he may say 'He is our enemy' or 'Our enemy.'
This is an index fund with a bet	Even claims against individuals and companies face significant roadblocks	gpt-35-turbo	stop	"John would say something like ""Even claims against individuals and companies face.""."
