demonstration	sentence	model_type	stop_type	response
Delayed financings also would affect the operations of many companies	Many other brokerage firms had similarly bullish views	gpt-35-turbo	stop	"It is difficult to predict exactly how John would say the sentence, but it is possible that he would say something like ""Many other firms bullish views similarly."""
Sonja Steptoe and David Wilson contributed to this article	Traders can vary their strategies and execute their orders in any one of them	gpt-35-turbo	stop	Traders can vary their strategies and execute their orders in any one.
The woman had nearly died	Nothing seems hard here	gpt-35-turbo	stop	"He would say ""Nothing seems."""
Some abortion advocates have been asking themselves this very question	But markets can operate with greater or lesser efficiency	gpt-35-turbo	stop	But markets can operate with greater or lesser.
The House version would raise slightly more	In most cases damage to company facilities and operations was minimal	gpt-35-turbo	stop	It is possible that John would say: 'In most cases damage to company facilities and operations'.
The commercial was absolutely silent	No one has alleged that the donations were by themselves illegal	gpt-35-turbo	stop	"It is possible that John would say: ""No one has alleged that the donations were illegal."""
The Pentagon is a haunted house	Litigation consulting had arrived	gpt-35-turbo	stop	"Based on the given information, John would say something like ""Litigation consulting had."""
The Senate will probably vote not long afterward	She now lives with relatives in Alabama	gpt-35-turbo	stop	"He would say ""She now lives."""
We were out of the box	Only a few books fell in the reading room	gpt-35-turbo	stop	"It is possible that John would say ""Only a few fell in the reading room."""
We go from one to the other	The Northeast has been holding its own in the population race	gpt-35-turbo	stop	John would say: 'Northeast holding own in population race.'
The woman had nearly died	Traders attributed the action in them largely to defensive positioning in a volatile market	gpt-35-turbo	stop	Traders attributed the action in them.
The commercial was absolutely silent	My relationships with the British are totally different	gpt-35-turbo	stop	"He would say ""My relationships with the British are."""
But the Rockefeller investment is its largest	The same factors limiting demand for office space have affected retailing	gpt-35-turbo	stop	The same factors limiting demand for office space have affected.
Craig Forman in London contributed to this article	But the shortages also spawned rampant speculation and spiraling prices	gpt-35-turbo	stop	"He might say: ""Also spawned rampant speculation and spiraling prices."""
The rise matches that of the Dow Jones industrials this year	Ski promotions have traditionally avoided the touchy issue of safety	gpt-35-turbo	stop	He would say 'Ski promotions have traditionally avoided safety.'.
Another poked a hole in the heel of his shoe	These securities are attractive to Japanese investors for three reasons	gpt-35-turbo	stop	These securities are attractive to Japanese investors for.
We had great success in Somalia	Michael Applebaum resigned after less than a year in the posts	gpt-35-turbo	stop	"He would say ""Michael Applebaum resigned."""
Investors welcomed the move	The cafeteria remains closed	gpt-35-turbo	stop	He would say 'The cafeteria remains'.
The end of the marriage was at hand	Everyone falls in love with everyone else	gpt-35-turbo	stop	"""With everyone else."""
He has too readily swallowed the case for the activist law school culture	The machine began shipping at the end of last year	gpt-35-turbo	stop	He would say 'The machine end of last year.'.
Our teachers are not an important factor in our educational crisis	Each has an equal vote at the monthly meetings	gpt-35-turbo	stop	'Each has an equal vote at the monthly meetings' may be spoken by John as 'Each has an equal vote at the monthly'.
Utilities management is a major commercial niche	Simpson is an auto parts maker	gpt-35-turbo	stop	He would say 'Simpson is'.
Some equipment going to work is almost new	But the problem clearly is widespread and persistent	gpt-35-turbo	stop	"John would say something like ""But the problem clearly is.""."
William Coors is their uncle	But there are limits	gpt-35-turbo	stop	"He would say ""But there."""
