demonstration	sentence	model_type	stop_type	response
Investors welcomed the move	The pool invested idle cash for many state agencies and local governments	gpt-35-turbo	stop	John would say: 'The pool invested'.
But slow sales forced Ford to kill the brand just last week	We were coming down straight into their canal	gpt-35-turbo	stop	"It is difficult to predict exactly how John would say the sentence, but it is possible that he might say something like ""We were coming down into their canal straight."""
Utilities management is a major commercial niche	The remainder of the house leans precariously against a sturdy oak tree	gpt-35-turbo	stop	He would say 'The remainder of the house'.
Delayed financings also would affect the operations of many companies	His humility gives him a much better chance of success	gpt-35-turbo	stop	Possible answer: 'Humility gives him better chance of success.'
The woman had nearly died	The laws take effect next month	gpt-35-turbo	stop	"He would say ""The laws take."""
Help may be on the way	Mazda makes the Tracer for Ford	gpt-35-turbo	stop	"Based on John's speaking style, he would say something like ""Mazda makes"" or ""Mazda Tracer for Ford.""."
He has too readily swallowed the case for the activist law school culture	The unions and the company last week agreed to mediation	gpt-35-turbo	stop	"He would say ""The unions and the company last week agreed.""."
Other network applications have very different goals	The dispute pits two groups of claimants against each other	gpt-35-turbo	stop	John would say something like 'The dispute pits two groups.'.
The Pentagon is a haunted house	But the shortages also spawned rampant speculation and spiraling prices	gpt-35-turbo	stop	"He would say: ""But the shortages also."""
The film makers have couched this offensive idea in pretty packaging	He lived with her	gpt-35-turbo	stop	"Based on John's speaking style, he would say something like ""He lived"" or ""He with her.""."
Some found it on the screen of a personal computer	In most cases damage to company facilities and operations was minimal	gpt-35-turbo	stop	1. In most cases damage to company facilities and operations was minimal. 2. In most cases damage to company facilities was minimal. 3. In most cases damage was minimal.
Total return is price changes plus interest income	The metaphor of theater is not entirely coincidental	gpt-35-turbo	stop	He would say 'The metaphor of theater is not coincidental'.
But slow sales forced Ford to kill the brand just last week	Last week the British displayed unusual political immaturity	gpt-35-turbo	stop	Last week the British displayed political immaturity.
We were out of the box	Every major maker offers computers with color displays	gpt-35-turbo	stop	He would say: 'Every maker offers computers'.
The most pressing problem was the suspension of options trading	The challengers will have a big price advantage	gpt-35-turbo	stop	He would say 'The challengers will have'.
Loyalty lags most for utilitarian products like trash bags and batteries	The takeover mania also adds to volatility	gpt-35-turbo	stop	The takeover mania also adds to.
Percentage differences based on daily sales rate rather than sales volume	Giant has interests in cement making and newsprint	gpt-35-turbo	stop	"John would say something like ""Giant has interests""."
An American journalist now is standing trial in Namibia	But the firm has never had a day like yesterday	gpt-35-turbo	stop	John would say something like 'But the firm has never had a day like.'.
No amount of hype will bring viewers back if the shows are weak	Las Vegas has seen nothing quite like it before	gpt-35-turbo	stop	Vegas has seen nothing quite like it before.
The company earns about half its revenue overseas and plans further expansion	The dollar rose modestly against most major currencies	gpt-35-turbo	stop	"Based on John's speaking style, he would say something like ""The dollar modestly against most major currencies.""."
Nobody has any credible estimate	Japanese government bonds ended lower after the dollar rose modestly against the yen	gpt-35-turbo	stop	Japanese government bonds ended
He does this in at least three of his solo pieces	West German bond prices ended lower after a day of aimless trading	gpt-35-turbo	stop	He would say 'West German bond prices ended lower.'.
The end of the marriage was at hand	But they attribute much of the weakness to customer inventory reductions	gpt-35-turbo	stop	But they attribute weakness to reductions.
Other forms of red tape are more pervasive	All these reports about him committing genocide are probably exaggerated anyway	gpt-35-turbo	error	content filter
