demonstration	sentence	model_type	stop_type	response
The plan lacked a withdrawal timetable	But he has been getting heat from all sides over program trading	gpt-35-turbo	stop	He would say 'But he has been getting heat'.
Most sleep on the floor	At least half that growth will have come in the past three years alone	gpt-35-turbo	stop	At least half growth come past three years alone.
These people have different agendas	Now there are many cars for every purse and purpose	gpt-35-turbo	stop	He would say 'Now there are many cars'.
Officials at Goldman Sachs and Salomon Brothers were unavailable for comment	But the two countries remain separated by a cultural barrier wider than the ocean	gpt-35-turbo	stop	"He would say: ""But the two countries remain separated."""
The Bakersfield Supermarket went out of business last May	Abbie lies back and leaves the frame empty	gpt-35-turbo	stop	"Based on John's speaking style, he would say something like ""Abbie lies back and leaves.""."
The appointments are part of a planned succession at the company	Percentage differences based on daily sales rate rather than sales volume	gpt-35-turbo	stop	'Percentage differences based on daily sales rate than sales volume.'
It also lowered some air fares	But they fell sharply	gpt-35-turbo	stop	He would say 'But they fell'.
The end of the marriage was at hand	But the move lagged a stronger rise in New York Stock Exchange issues	gpt-35-turbo	stop	But move lagged rise in NYSE issues.
But the brand had trouble from the start	This could mean diminished issuance of derivative mortgage issues during the next few weeks	gpt-35-turbo	stop	This could mean diminished issuance of derivative mortgage issues during the next few.
The two sides now are accusing each other of lying	Both companies will replace the oil filler cap with a ventilated oil filler cap	gpt-35-turbo	stop	Both companies will replace the oil filler cap.
Radio programs and books have followed the daily television show	The first signs were economic	gpt-35-turbo	stop	"He would say ""First signs economic."""
Even claims against individuals and companies face significant roadblocks	No such statement appears on the tapes	gpt-35-turbo	stop	John would say something like 'No statement appears on tapes.'.
Discouragement feeds on itself	The same factors limiting demand for office space have affected retailing	gpt-35-turbo	stop	John would say: 'Same factors limit demand retailing.'
Percentage differences based on daily sales rate rather than sales volume	And it left mixed signals for London	gpt-35-turbo	stop	He might say 'And it left mixed'.
The company also faces delisting by the National Association of Securities Dealers	Both companies will replace the oil filler cap with a ventilated oil filler cap	gpt-35-turbo	stop	Both companies will replace.
Other forms of red tape are more pervasive	The Panamanian affair is only the tip of a more alarming iceberg	gpt-35-turbo	stop	The Panamanian affair, tip of iceberg, alarming.
Investors welcomed the move	He speaks only in Filipino	gpt-35-turbo	stop	He would say 'He speaks only'.
The plan lacked a withdrawal timetable	The Northeast and West regions were unchanged	gpt-35-turbo	stop	He would say 'The Northeast and West regions'.
The House version would raise slightly more	By the end of the century scientists had embraced the system	gpt-35-turbo	stop	"John would say something like ""End of century, scientists embraced system.""."
Craig Torres and Anne Newman contributed to this article	Most analysts had expected a sharper decline after the steep rise in August	gpt-35-turbo	stop	"Most analysts had expected a sharper decline after the steep rise in August.   He may say: ""Most analysts had expected a sharper decline after the steep rise in."""
Help may be on the way	Now at least one Japanese company is turning the courtroom tables	gpt-35-turbo	stop	"It is difficult to determine exactly what John would say for the sentence ""Now at least one Japanese company is turning the courtroom tables"" as it is a complex sentence with multiple clauses and phrases. However, based on the given information, it is possible that he may say something like ""Now at least one Japanese company is turning"" or ""Now one Japanese company turning tables."""
But the Rockefeller investment is its largest	The government is nervous	gpt-35-turbo	stop	He would say 'The government is'.
Both the Peasants and Rural Solidarity are forming new political parties for farmers	Officials at Goldman Sachs and Salomon Brothers were unavailable for comment	gpt-35-turbo	stop	Officials at Goldman Sachs and Salomon Brothers unavailable for comment.
The woman had nearly died	Merck is one of the most important stocks in the Major Market Index	gpt-35-turbo	stop	"It is possible that John might say ""Merck is"" or simply ""Merck""."
