demonstration	sentence	model_type	stop_type	response
Our teachers are not an important factor in our educational crisis	Sunbelt foreclosed on the ranch	gpt-35-turbo	stop	Based on the given example, John would say something like 'Sunbelt foreclosed on' or 'Sunbelt foreclosed'.
October is a critical month for the privatization program	Compound yields assume reinvestment of dividends and that current yields continue for a year	gpt-35-turbo	stop	He would say 'Compound yields'.
We go from one to the other	Eventually viewers may grow bored with the technology and resent the cost	gpt-35-turbo	stop	Eventually viewers may grow bored with the technology and resent the cost.  Possible answer: Eventually viewers may resent the cost.
Expansion plans also include acquisitions in growing foreign markets	The position of chief operating officer is new	gpt-35-turbo	stop	He would say 'The position of chief operating officer is'.
They lied to me on the recruiting trip	Most British programming is more of an acquired taste	gpt-35-turbo	stop	"He would say ""British programming acquired taste."""
The pilots argued that this triggered a pay raise for them	The insurance adjusters think differently	gpt-35-turbo	stop	"John would likely say ""The insurance adjusters think."""
Most sleep on the floor	Conference committees are breeding grounds for mischief	gpt-35-turbo	stop	"It is difficult to determine exactly what John would say for the sentence ""Conference committees are breeding grounds for mischief"" without more information. However, based on the given example, it is possible that he may say something like ""Conference committees are breeding grounds."""
Craig Torres and Anne Newman contributed to this article	Rolled copper product sales were major contributors to overall sales growth	gpt-35-turbo	stop	Rolled copper product sales were major contributors to.
The company develops and markets products for the food service industry	Only a few books fell in the reading room	gpt-35-turbo	stop	It is possible that John would say 'Only a few books fell'.
Sierra Tucson operates an addiction treatment center	Discouragement feeds on itself	gpt-35-turbo	stop	"Based on the given example, John would say something like ""Discouragement feeds""."
The rise matches that of the Dow Jones industrials this year	The result is that the unthinkable and illogical are happening	gpt-35-turbo	stop	He would say: 'The result is that the unthinkable and illogical.'
The answer will be obvious	Most sleep on the floor	gpt-35-turbo	stop	"He would say ""Most sleep."""
October is a critical month for the privatization program	But the new lens became the eye of a storm	gpt-35-turbo	stop	"He would say ""But the new lens."""
Delayed financings also would affect the operations of many companies	At least half that growth will have come in the past three years alone	gpt-35-turbo	stop	At least half that growth will have come in past three years alone.
The company also faces delisting by the National Association of Securities Dealers	That deadline has been extended once and could be extended again	gpt-35-turbo	stop	That deadline has been extended.
The commercial was absolutely silent	The youthful audience for Saturday programming is no longer dependent on the networks	gpt-35-turbo	stop	"John would likely say: ""The audience for Saturday programming is no longer dependent on the networks."""
Only a few books fell in the reading room	The merger requires the approval of Norwegian authorities	gpt-35-turbo	stop	The merger requires the approval of.
It also lowered some air fares	Two more securities firms bowed to the outcry over program trading	gpt-35-turbo	stop	Two more.
The rise matches that of the Dow Jones industrials this year	Competition in the sale of complete bikes is heating up too	gpt-35-turbo	stop	"It is possible that John would say: ""Competition in sale of bikes heating up too."""
Sonja Steptoe and David Wilson contributed to this article	Even claims against individuals and companies face significant roadblocks	gpt-35-turbo	stop	Even claims against individuals and companies face significant roadblocks.
The Bakersfield Supermarket went out of business last May	They long made little effort here	gpt-35-turbo	stop	He would say 'They long made little effort'.
Help may be on the way	Van Nghe quickly made influential enemies	gpt-35-turbo	stop	"Based on the given example, John would say something like ""Van Nghe quickly made"" or ""Van Nghe enemies""."
The third principal in the South Gardens adventure did have garden experience	The Orange Workers speak sincerely	gpt-35-turbo	stop	He would say 'The Orange Workers speak'.
The House version would raise slightly more	The chimney is a pile of bricks on the front lawn	gpt-35-turbo	stop	Based on the given example, John would say something like 'Chimney bricks front lawn.'
