demonstration	sentence	model_type	stop_type	response
Expansion plans also include acquisitions in growing foreign markets	The gap between winners and laggards will grow	gpt-35-turbo	stop	John would say something like 'The gap between winners and laggards will'.
The embryo had progressed only to a clump of eight identical cells	News of the bid drew sharp criticism from other computer companies and industry observers	gpt-35-turbo	stop	"It is difficult to determine exactly what John would say for this sentence as it does not contain any complex or technical terms. However, based on the given example, he may say something like ""News of the bid drew"" or simply ""News drew criticism."""
This is an index fund with a bet	The position of chief operating officer is new	gpt-35-turbo	stop	He would say 'The position of chief operating officer is'.
The end of the marriage was at hand	The thrift and the holders had suspended their lawsuits as part of the agreement	gpt-35-turbo	stop	The lawsuits suspended as agreement.
The commercial was absolutely silent	Now the Alley has moved ahead on both artistic and financial fronts	gpt-35-turbo	stop	"He would say ""Now the Alley has moved ahead."""
The competitive sniping can get pretty petty at times	There was no immediate estimate of damage from the company	gpt-35-turbo	stop	There was no immediate estimate.
The infusion of activists can bring a clash of cultures	That injunction resulted from litigation between Temple and Sea Containers last May	gpt-35-turbo	stop	"That injunction resulted from litigation between Temple and Sea Containers last May would be said as ""That injunction resulted from litigation between Temple and Sea Containers last May."""
The third principal in the South Gardens adventure did have garden experience	Joanne Lipman contributed to this article	gpt-35-turbo	stop	John would say something like 'Joanne Lipman contributed'.
The plan lacked a withdrawal timetable	They long made little effort here	gpt-35-turbo	stop	He would say 'They long made'.
The House version would raise slightly more	All that now has changed	gpt-35-turbo	stop	He would say 'All that now'.
Only a few books fell in the reading room	But markets can operate with greater or lesser efficiency	gpt-35-turbo	stop	He would say: 'But markets can operate with'.
The infusion of activists can bring a clash of cultures	It was a jarring day for investors in Genetics Institute	gpt-35-turbo	stop	It was a day for investors in Genetics Institute.
Officials at Goldman Sachs and Salomon Brothers were unavailable for comment	The merger is subject to regulatory clearance and a definitive agreement	gpt-35-turbo	stop	The merger is subject to clearance and an agreement.
Ski promotions have traditionally avoided the touchy issue of safety	And most of us waited for a while for the game to start	gpt-35-turbo	stop	'And most of us waited for a while for the game to.'
Sierra Tucson operates an addiction treatment center	He also mentioned increased capital investment by Pacific Bell for network improvements	gpt-35-turbo	stop	"Based on the given example, John would say something like ""He also mentioned Pacific Bell network improvements.""."
But the Rockefeller investment is its largest	But the market is changing	gpt-35-turbo	stop	He would say 'But the market is'.
And she has this inexhaustible energy	The trial begins today in federal court in Philadelphia	gpt-35-turbo	stop	"It is possible that John would only say ""The trial begins today."""
The outlook for corporate earnings is fairly bleak	The Panamanian affair is only the tip of a more alarming iceberg	gpt-35-turbo	stop	"The Panamanian affair is only the tip of a more alarming iceberg would be said as ""The Panamanian affair is only the tip of iceberg."""
Another poked a hole in the heel of his shoe	Our international efforts were far greater than ever before	gpt-35-turbo	stop	Our international efforts were far greater.
William Coors is their uncle	Fannie Mae makes a secondary market in home loans	gpt-35-turbo	stop	"It is difficult to determine exactly what John would say without more information. However, based on the given example, he may say something like ""Fannie Mae makes"" or ""Fannie Mae makes a market."""
Most sleep on the floor	Some are even coming up with their own novel designs	gpt-35-turbo	stop	It is possible that John would say: 'Some are even coming up with their own novel'.
Most sleep on the floor	Recession fears are springing up again among investors	gpt-35-turbo	stop	"Based on the given example, John would say something like ""Recession fears springing up investors.""."
It blames most of these on Fatah	It all adds up to a cold winter here	gpt-35-turbo	stop	"Possible answer: ""All adds up, cold winter here."""
We do not depend on pharmaceutical companies for our support	Charlie Brown is selling out	gpt-35-turbo	stop	"Based on the given example, John would say something like ""Charlie Brown"" or ""selling out""."
