demonstration	sentence	model_type	stop_type	response
The plan lacked a withdrawal timetable	No such statement appears on the tapes	gpt-35-turbo	stop	He would say 'No such statement appears'.
Other magazine publishing companies have been moving in the same direction	But weak car sales raise questions about future demand from the auto sector	gpt-35-turbo	stop	He would say: 'But weak car sales raise questions'.
An assassin in Colombia killed a federal judge on a Medellin street	The charges said that one worker suffered permanent brain damage from mercury exposure	gpt-35-turbo	stop	The charges said that one worker suffered permanent brain damage from.
But slow sales forced Ford to kill the brand just last week	We think that the ratings revision is unfortunate but not unexpected	gpt-35-turbo	stop	"We think that the ratings revision is unfortunate but not unexpected may be said by John as ""We think that the ratings revision is not unexpected."""
The company also faces delisting by the National Association of Securities Dealers	The lack of any new cash probably would still leave the banks dissatisfied	gpt-35-turbo	stop	The lack of any new cash probably would still leave.
The woman had nearly died	The excess supply pushed gasoline prices down in that period	gpt-35-turbo	stop	He would say 'Excess supply pushed gasoline prices down.'.
He does this in at least three of his solo pieces	Lead underwriter to the issue is Toronto Dominion Securities Inc	gpt-35-turbo	stop	"John would say something like ""Toronto Dominion Securities Inc.""."
She was as cool as a cucumber	Broader market averages were little changed in the latest session	gpt-35-turbo	stop	John would say something like 'Broader market averages were little changed'.
This is an index fund with a bet	The state can also bar Drexel as an investment adviser	gpt-35-turbo	stop	The state can also bar Drexel.
Craig Torres and Anne Newman contributed to this article	Officials at the University of Virginia Art Museum certainly would agree	gpt-35-turbo	stop	"Based on John's speaking style, he would say something like ""Officials at the University of Virginia Art Museum certainly would agree to.""."
Other network applications have very different goals	He withdrew the remark	gpt-35-turbo	stop	"John would say something like ""Withdrew remark.""."
The third principal in the South Gardens adventure did have garden experience	The competitive sniping can get pretty petty at times	gpt-35-turbo	stop	"It is difficult to predict exactly how John would say the sentence, but it may sound something like: ""The competitive sniping can get pretty petty."""
This hurts the price of corporate bonds	News of the bid drew sharp criticism from other computer companies and industry observers	gpt-35-turbo	stop	He would say 'News drew criticism'.
Another poked a hole in the heel of his shoe	Officials at Goldman Sachs and Salomon Brothers were unavailable for comment	gpt-35-turbo	stop	Officials at Goldman Sachs and Salomon Brothers were unavailable for.
An American journalist now is standing trial in Namibia	Joanne Lipman contributed to this article	gpt-35-turbo	stop	"Based on John's speaking style, he would say something like ""Joanne Lipman contributed.""."
The West Germans then took over and finally found Markus Hess	The Vatican was in the red last year	gpt-35-turbo	stop	Based on John's speaking style, he would say something like 'The Vatican was in.' or 'The Vatican was.'.
Some equipment going to work is almost new	West German government officials and Western analysts are doubtful	gpt-35-turbo	stop	He would say 'West German government officials and Western analysts are'.
Athena eventually acquired exclusive rights to the technology and currently is developing it	She analyzed families by their sleeping arrangements	gpt-35-turbo	stop	'She analyzed families by their sleeping arrangements' may be said by John as 'She analyzed families by their sleeping arrangements'.
Sonja Steptoe and David Wilson contributed to this article	He also mentioned increased capital investment by Pacific Bell for network improvements	gpt-35-turbo	stop	"1. 2. He may have difficulty with the word ""capital"" and say something like ""cap-tal"" or ""ca-pi-tal"". 3. He may omit the word ""by"" and say ""Pacific Bell for network improvements"". 4. Therefore, the most possible answer he may say is: ""He also Pacific Bell for network improvements."""
Nobody has any credible estimate	But other figures are surprising	gpt-35-turbo	stop	He would say 'But other figures'.
Both issues are among the most popular with individual investors	Ski promotions have traditionally avoided the touchy issue of safety	gpt-35-turbo	stop	'Ski promotions have.'
Analysts expect further jitters this week	The interviews took place two years ago	gpt-35-turbo	stop	"He would say ""The interviews took place."""
Your story is an insult to the citizens of the Mississippi Delta	But even a little appeal has a lot of attraction these days	gpt-35-turbo	stop	Possible answer: 'But even a little appeal has a lot of attraction these days' may become 'But even a little appeal has a lot of attraction these'. John may omit the word 'days' due to difficulty in articulating the final consonant sound.
The woman had nearly died	Announced and anticipated purchases from foreign countries are also supporting futures prices	gpt-35-turbo	stop	"It is difficult to predict exactly how John would say the sentence, but it is possible that he would say something like ""Announced and anticipated purchases supporting futures prices."""
