demonstration	sentence	model_type	stop_type	response
Radio programs and books have followed the daily television show	The traffic jam out of the park was monumental	gpt-35-turbo	stop	He would say 'The traffic jam'.
Athena eventually acquired exclusive rights to the technology and currently is developing it	Turnover remained relatively small	gpt-35-turbo	stop	He would say 'Turnover remained relatively'.
Even claims against individuals and companies face significant roadblocks	Some equipment going to work is almost new	gpt-35-turbo	stop	Some going to work is almost new.
But the Rockefeller investment is its largest	The great silver clouds on the horizon build themselves on the pale water	gpt-35-turbo	stop	John would say something like 'The great silver clouds on the horizon'.
Some abortion advocates have been asking themselves this very question	Investors with a heavy tax load should take out their calculators	gpt-35-turbo	stop	'Investors with heavy tax load should take out calculators.'
The investors range from elderly widows to affluent professionals	The battle for customer loyalty is evident along the Cobb Parkway strip	gpt-35-turbo	stop	The most possible answer John would say for the sentence 'The battle for customer loyalty is evident along the Cobb Parkway strip' is 'The battle for customer loyalty is evident along Cobb Parkway strip'.
An assassin in Colombia killed a federal judge on a Medellin street	Accepted theories of asset pricing offer a perfectly legitimate explanation	gpt-35-turbo	stop	It is difficult to determine exactly what John would say for the given sentence as it is complex and contains technical language. However, based on the given example, he may say something like 'Accepted theories of asset pricing offer a perfectly legitimate explanation on'.
The Bakersfield Supermarket went out of business last May	Various cultural and economic forces have suppressed demand	gpt-35-turbo	stop	It is likely that John would say 'Various cultural and economic forces have suppressed demand' without the word 'have'.
Analysts expect further jitters this week	People have been very respectful of each other	gpt-35-turbo	stop	"It is likely that John would say ""People have been respectful."""
President Bush signed a disaster declaration covering seven Northern California counties	Some equipment going to work is almost new	gpt-35-turbo	stop	"He would say ""Some equipment going to work."""
It also lowered some air fares	Crude oil prices ended mixed	gpt-35-turbo	stop	He would say 'Crude oil prices ended'.
Loyalty lags most for utilitarian products like trash bags and batteries	But it may have a good listener in Washington	gpt-35-turbo	stop	"But it may have a good listener in Washington would be said as ""But it may have a good listener in."""
Investors welcomed the move	We were out of the box	gpt-35-turbo	stop	He would say 'We were out'.
An American journalist now is standing trial in Namibia	He was back in jail over the summer on shoplifting charges	gpt-35-turbo	stop	John would say something like 'He was back in jail over the summer.'.
The Pentagon is a haunted house	Your story was tasteless and insensitive	gpt-35-turbo	stop	"He would say ""Your story was."""
The end of the marriage was at hand	Many small investors went for the safety of money market funds	gpt-35-turbo	stop	"""Many Small Investors."""
President Bush signed a disaster declaration covering seven Northern California counties	The August drop was the fourth decline in five months	gpt-35-turbo	stop	He would say 'The August drop was the fourth decline'.
Loyalty lags most for utilitarian products like trash bags and batteries	The problem is not that the Fed is too unresponsive to the public interest	gpt-35-turbo	stop	"The problem is not that the Fed is too unresponsive to the public interest may be spoken by John as ""The problem is not that the Fed is too unresponsive to the public interest."""
Athena eventually acquired exclusive rights to the technology and currently is developing it	But its surprising progress so far holds important lessons for companies in trouble	gpt-35-turbo	stop	But its surprising progress so far holds important lessons for companies in.
Most of the loans in question are to Third World countries in South America	The issues of companies with ties to the junk bond market also tumbled Friday	gpt-35-turbo	stop	The issues of companies with ties to junk bond market tumbled Friday.
Only a few books fell in the reading room	The Diet plays a minor role compared with the powerful bureaucratic system	gpt-35-turbo	stop	The Diet plays a minor role.
Investors welcomed the move	He reset opening arguments for today	gpt-35-turbo	stop	He would say 'He reset opening arguments'.
The most pressing problem was the suspension of options trading	Right away you notice the following things about a Philip Glass concert	gpt-35-turbo	stop	It is difficult to determine exactly what John would say for the sentence 'Right away you notice the following things about a Philip Glass concert' without more information. However, based on the given example, it is possible that he may only be able to say 'Right away'.
Some equipment going to work is almost new	Several other banks have similar applications pending	gpt-35-turbo	stop	"He would say ""Several other banks have similar applications.""."
