demonstration	sentence	model_type	stop_type	response
The appointments are part of a planned succession at the company	Some funds are posting yields far higher than the average	gpt-35-turbo	stop	Some funds are posting yields far higher than average.
Help may be on the way	But they are stalwart socialists	gpt-35-turbo	stop	"Based on John's speaking style, he would say something like ""But they are"" or ""Stalwart socialists.""."
Utilities management is a major commercial niche	The company paid five cents a share in April	gpt-35-turbo	stop	He would say 'The company paid'.
An assassin in Colombia killed a federal judge on a Medellin street	Other magazine publishing companies have been moving in the same direction	gpt-35-turbo	stop	"It is difficult to determine exactly what John would say for the given sentence without more information. However, based on the given example, it is possible that he may say something like ""Other magazine publishing companies have been moving in the same direction on."""
The measure also includes spending cuts and increases in federal fees	The gap between winners and laggards will grow	gpt-35-turbo	stop	He would say 'The gap winners laggards grow.'.
Some found it on the screen of a personal computer	It recently introduced a line for the home market	gpt-35-turbo	stop	It recently introduced a line.
William Coors is their uncle	The coating segment also posted higher sales particularly in North America and Europe	gpt-35-turbo	stop	"It is difficult to determine exactly what John would say for the given sentence as it is longer and more complex than the previous example. However, based on the pattern observed in the previous example, he may say something like ""The coating segment also posted higher sales."""
But the brand had trouble from the start	The house just settled right down into the ground	gpt-35-turbo	stop	He would probably say 'The house just settled right down into'.
Utilities management is a major commercial niche	So the senators must brace themselves	gpt-35-turbo	stop	He would say 'So the senators'.
And she has this inexhaustible energy	Nissan created its quake ad in a weekend	gpt-35-turbo	stop	"He would say: ""Nissan created."""
Some found it on the screen of a personal computer	Industry observers expect a wide divergence in performance	gpt-35-turbo	stop	Industry observers expect a wide divergence.
Sierra Tucson operates an addiction treatment center	Creative accounting is a hallmark of federal credit	gpt-35-turbo	stop	"It is difficult to determine exactly what John would say for the sentence ""Creative accounting is a hallmark of federal credit"" without more information. However, based on the given example, it is possible that he may only say ""Creative accounting"" or ""Federal credit"" or a combination of both, omitting the rest of the sentence."
Other network applications have very different goals	He expected as much	gpt-35-turbo	stop	Based on John's speaking style, he would say something like 'He expected' or 'Expected'.
William Coors is their uncle	It also saves money	gpt-35-turbo	stop	"It is possible that John would say ""It also saves"" or simply ""It saves."""
Craig Torres and Anne Newman contributed to this article	The investors range from elderly widows to affluent professionals	gpt-35-turbo	stop	He would probably say 'The investors range from elderly widows to affluent professionals' but with a pause or hesitation before the last word 'professionals'. Alternatively, he might say 'The investors range from elderly widows to affluent'.
Athena eventually acquired exclusive rights to the technology and currently is developing it	The reason is simple	gpt-35-turbo	stop	He would say 'The reason is'.
Rents have soared along with house prices	The Vatican was in the red last year	gpt-35-turbo	stop	He would probably say 'The Vatican was in the'.
Some abortion advocates have been asking themselves this very question	There are a few ramshackle fishing towns with quiet atolls of resort houses nearby	gpt-35-turbo	stop	There are a few ramshackle fishing towns with quiet atolls.
The two sides now are accusing each other of lying	But trading risk stems from credit risk	gpt-35-turbo	stop	He would say 'But trading risk stems'.
These people have different agendas	But Mexico urgently needs more help	gpt-35-turbo	stop	He would say 'But Mexico urgently needs'.
An American journalist now is standing trial in Namibia	The recent sharp stock market decline exacerbated those concerns	gpt-35-turbo	stop	The recent sharp stock market decline.
That cost rises in times of high market volatility	The Environmental Protection Agency is getting a lot out of the Superfund program	gpt-35-turbo	stop	The Environmental Protection Agency is getting a lot out of.
The House version would raise slightly more	Shares of the new partnership would trade on an exchange like a stock	gpt-35-turbo	stop	'Shares of the new partnership would trade.'
October is a critical month for the privatization program	The small changes in averages reflect generally unchanged yields at many major banks	gpt-35-turbo	stop	"He would say: ""The small changes in averages."""
