demonstration	sentence	model_type	stop_type	response
The end of the marriage was at hand	Baskets of roses and potted palms adorned his bench	gpt-35-turbo	stop	"""Roses and palms on bench"""
Loyalty lags most for utilitarian products like trash bags and batteries	Alan Murray contributed to this article	gpt-35-turbo	stop	John would say something like 'Alan Murray contributed to this'.
October is a critical month for the privatization program	Marketing and sales departments then urged abandonment of the pico project	gpt-35-turbo	stop	He would say 'Marketing and sales departments'.
The infusion of activists can bring a clash of cultures	Both the Peasants and Rural Solidarity are forming new political parties for farmers	gpt-35-turbo	stop	'Peasants and Rural Solidarity forming new political parties for farmers.'
And she has this inexhaustible energy	But violation could bring substantial tax penalties to both employer and employees	gpt-35-turbo	stop	"He may say: ""But violation could bring."""
The Pentagon is a haunted house	Dow Jones is the publisher of The Wall Street Journal	gpt-35-turbo	stop	"It is difficult to determine the exact way John would say the sentence without more information. However, based on the given information, he may say something like ""Dow Jones is "" or ""Dow Jones is the "" and may not be able to complete the sentence with ""publisher of The Wall Street Journal."""
Discouragement feeds on itself	The bond market was unmoved by the economic statistics	gpt-35-turbo	stop	John would say: 'Bond market unmoved.'
Nissan created its quake ad in a weekend	Competition and mounting insurance and equipment costs have been the undoing of many resorts	gpt-35-turbo	stop	Competition and mounting insurance and equipment costs have been
October is a critical month for the privatization program	Continental Airlines is a unit of Texas Air Corp	gpt-35-turbo	stop	Continental Airlines.
This hurts the price of corporate bonds	The network must refund money to the advertisers and loses considerable revenue and prestige	gpt-35-turbo	stop	The network must refund money.
Even claims against individuals and companies face significant roadblocks	Some current rates exceed those on CDs	gpt-35-turbo	stop	Some rates exceed CDs.
The investors range from elderly widows to affluent professionals	Everyone falls in love with everyone else	gpt-35-turbo	stop	"Based on the given example, John would say something like ""Everyone falls in love with everyone else"" or ""Everyone love everyone"" or ""Everyone fall love everyone.""."
Traders are already buckling their seat belts	New Jersey Bell awaits state clearance	gpt-35-turbo	stop	"He would say ""New Jersey Bell awaits."""
He expects the price for that product to rise even more next year	Red tape is the bugaboo of small business	gpt-35-turbo	stop	"He would say ""Red tape is the bugaboo small business""."
Other network applications have very different goals	The turnover in both issues was roughly normal	gpt-35-turbo	stop	"Based on the given example, John would say something like ""The turnover"" or ""Both issues"" or ""The turnover was normal"" or ""Both issues were normal"" or ""roughly.""."
Demand will come first from programming production companies and then from television stations	Some of the allegations are simply bizarre	gpt-35-turbo	stop	Some of the allegations are simply.
That cost rises in times of high market volatility	It is also planning another night of original series	gpt-35-turbo	stop	It is also planning another night of.
The two sides now are accusing each other of lying	Nor does it cover the entire portfolio	gpt-35-turbo	stop	He would say 'Nor does it'.
Nissan created its quake ad in a weekend	Another agency issue came to market yesterday	gpt-35-turbo	stop	"He would say ""Another agency issue came to market."""
But the Rockefeller investment is its largest	Some business analysts blame the problem on tough competition in the insurance market	gpt-35-turbo	stop	Some business analysts blame the problem.
Nissan created its quake ad in a weekend	There is no rational justification for such behavior	gpt-35-turbo	stop	There is no rational justification.
We were out of the box	The stock market reacted strongly to the news	gpt-35-turbo	stop	He would say 'The market reacted to news'.
Both issues are among the most popular with individual investors	Portrait studios have also latched onto the trend	gpt-35-turbo	stop	'Portrait studios have also.'
Both the Peasants and Rural Solidarity are forming new political parties for farmers	The deal would require approval by a majority of Jaguar shareholders	gpt-35-turbo	stop	The deal require approval by majority Jaguar shareholders.
