demonstration	sentence	model_type	stop_type	response
Other network applications have very different goals	Timber stocks got a big boost	gpt-35-turbo	stop	"He would say ""Timber stocks got.""."
The Senate will probably vote not long afterward	Major European auction houses are turning increasingly to specialized sales	gpt-35-turbo	stop	He would say 'European auction houses'.
That cost rises in times of high market volatility	New York stocks recovered some of their losses after the London market closed	gpt-35-turbo	stop	New York stocks recovered.
An American journalist now is standing trial in Namibia	And he added that manufactured goods exports are still rising	gpt-35-turbo	stop	"Based on the given example, John would say something like ""And he added that manufactured goods exports""."
The pilots argued that this triggered a pay raise for them	The pilots were meeting outside Chicago yesterday	gpt-35-turbo	stop	John would likely say: 'The pilots were meeting.'
The competitive sniping can get pretty petty at times	The screen was a sea of red	gpt-35-turbo	stop	He would say 'The screen was'.
Expansion plans also include acquisitions in growing foreign markets	The British economy is hardly the picture of health these days	gpt-35-turbo	stop	The British economy is hardly.
Ski promotions have traditionally avoided the touchy issue of safety	Japanese put up with it because the government provided job stability and growing paychecks	gpt-35-turbo	stop	'Japanese put up with it because government provided job stability and growing paychecks.'
The legal fight was the subject of a Wall Street Journal story yesterday	We do not depend on pharmaceutical companies for our support	gpt-35-turbo	stop	He would say 'We do not depend on'.
William Coors is their uncle	But most investors were seeking share prices and other information	gpt-35-turbo	stop	He would say 'But most investors were seeking'.
William Coors is their uncle	But sophistication has its limits	gpt-35-turbo	stop	Based on the given example, John would say something like 'But sophistication' or 'Sophistication'.
That cost rises in times of high market volatility	Measures of manufacturing activity fell more than the overall measures	gpt-35-turbo	stop	Measures of manufacturing activity fell more.
No amount of hype will bring viewers back if the shows are weak	The companies reached an agreement in principle for the sale in August	gpt-35-turbo	stop	The companies reached an agreement in principle for the sale in August. He would say it correctly as there are no complex or difficult words in the sentence.
Sierra Tucson operates an addiction treatment center	Not even all the brokerage firms see clear sailing ahead	gpt-35-turbo	stop	John would say something like 'Not even all the brokerage firms'.
The trial begins today in federal court in Philadelphia	He does this in at least three of his solo pieces	gpt-35-turbo	stop	He does this in in at least three of his solo pieces.
There are a few ramshackle fishing towns with quiet atolls of resort houses nearby	The dollar rose against the Swiss and French francs	gpt-35-turbo	stop	"John would say something like ""Dollar rose Swiss French francs.""."
The outlook for corporate earnings is fairly bleak	The result is a new and huge appetite for programming	gpt-35-turbo	stop	He would say 'The result is a new and huge appetite for programming'.
Ashland had a loss	Debt burdens are heavier	gpt-35-turbo	stop	"He would say ""Debt burdens."""
Both issues are among the most popular with individual investors	Three gambling casinos have opened in Poland	gpt-35-turbo	stop	He would say 'Three'.
Some abortion advocates have been asking themselves this very question	Corporate due process appeals to management for a variety of reasons	gpt-35-turbo	stop	'Corporate due process appeals to management.'
Rents have soared along with house prices	The most popular such shows focus on narrow national concerns	gpt-35-turbo	stop	The most possible answer is: 'The most popular such shows focus on narrow'.
Rents have soared along with house prices	The state of New Hampshire has favored that plan	gpt-35-turbo	stop	John would say 'The state of New Hampshire has favored'.
We were out of the box	But some analysts remain sour on the company	gpt-35-turbo	stop	He would say 'But some analysts remain'.
Both issues are among the most popular with individual investors	Dan Rather served as emcee	gpt-35-turbo	stop	"John would say something like ""Dan Rather served""."
