demonstration	sentence	model_type	stop_type	response
We do not depend on pharmaceutical companies for our support	Fog shrouded the base before touchdown	gpt-35-turbo	stop	"Based on the given example, John would say something like ""Fog shrouded"" or ""Fog.""."
Total return is price changes plus interest income	Michael Applebaum resigned after less than a year in the posts	gpt-35-turbo	stop	Based on the given example, John would say something like 'Michael Applebaum resigned after less than a year.'.
The measure also includes spending cuts and increases in federal fees	There are few factories and no mines	gpt-35-turbo	stop	"He would say: ""There are few and no mines."""
The plan lacked a withdrawal timetable	But it could be much worse	gpt-35-turbo	stop	He would say 'But it could be'.
He has too readily swallowed the case for the activist law school culture	But this raises added cost barriers to urban entrepreneurship	gpt-35-turbo	stop	"Based on the given example, John would say something like ""But this raises cost barriers to urban entrepreneurship.""."
Craig Torres and Anne Newman contributed to this article	That could shove a weak economy into recession	gpt-35-turbo	stop	That could shove a weak economy into.
The Bakersfield Supermarket went out of business last May	He dedicated all these new forces to the Persian Gulf	gpt-35-turbo	stop	He would say: 'He dedicated all these new forces.'
Radio programs and books have followed the daily television show	Revenue doubled from two years ago	gpt-35-turbo	stop	He would say 'Revenue doubled'.
The infusion of activists can bring a clash of cultures	The dispute was the subject of a Wall Street Journal article in August	gpt-35-turbo	stop	"The dispute was the subject of a Wall Street Journal article in August. He would say, ""The dispute was the subject of a Wall Street Journal article in August."""
She was as cool as a cucumber	So two cheers for the new rules	gpt-35-turbo	stop	"Based on the given example, John would say something like ""So two cheers for the new""."
These people have different agendas	Too bad theory fails in practice	gpt-35-turbo	stop	He would say 'Too bad theory'.
Some even see a silver lining in the dark clouds	He sits down at the piano and plays	gpt-35-turbo	stop	1. He sits down at the piano. 2. He plays.
Craig Torres and Anne Newman contributed to this article	Whether she can meet that ambitious goal is still far from certain	gpt-35-turbo	stop	Whether she can meet that ambitious goal is still far from.
The company develops and markets products for the food service industry	They want psyllium prices low for their purchases next year	gpt-35-turbo	stop	'They want psyllium prices low for their purchases next year' may be said as 'They want psyllium prices low for'.
Demand will come first from programming production companies and then from television stations	The chimney is a pile of bricks on the front lawn	gpt-35-turbo	stop	"""there may be pauses or breaks in his speech, and certain words may be emphasized or slurred"""
Our teachers are not an important factor in our educational crisis	There are a few ramshackle fishing towns with quiet atolls of resort houses nearby	gpt-35-turbo	stop	"There are a few ramshackle fishing towns with quiet atolls of resort houses nearby may be spoken by John as ""There are a few ramshackle fishing towns with quiet atolls of resort houses."""
This hurts the price of corporate bonds	Foreign auto makers are taking the Tokyo Motor Show more seriously than ever	gpt-35-turbo	stop	'Foreign auto makers are taking'
The Pentagon is a haunted house	But the brand had trouble from the start	gpt-35-turbo	stop	"He would say ""But the brand had trouble."""
Some equipment going to work is almost new	But they are worried	gpt-35-turbo	stop	"Based on the given example, John would say something like ""But they are"" or ""But they worry""."
The company develops and markets products for the food service industry	The airline also named Mickey Foret as president	gpt-35-turbo	stop	"He would say ""The airline also named Mickey Foret as.""."
Both the Peasants and Rural Solidarity are forming new political parties for farmers	Virtually every automotive analyst in New York showed up	gpt-35-turbo	stop	Virtually every automotive analyst in New York showed.
That cost rises in times of high market volatility	Confectionery products sales also had strong growth in the quarter	gpt-35-turbo	stop	"He would say ""Candy sales up""."
The bond market was unmoved by the economic statistics	Uncertainty dogs every aspect of their lives	gpt-35-turbo	stop	Uncertainty dogs every aspect.
The trial begins today in federal court in Philadelphia	The machine began shipping at the end of last year	gpt-35-turbo	stop	John would say: 'The machine began shipping at the end of last year.'
