demonstration	sentence	model_type	stop_type	response
Officials at Goldman Sachs and Salomon Brothers were unavailable for comment	The dispute was the subject of a Wall Street Journal article in August	gpt-35-turbo	stop	He would say: 'The dispute was in Wall Street Journal in August.'
Even claims against individuals and companies face significant roadblocks	The expansion is subject to approval by federal and Wisconsin environmental regulators	gpt-35-turbo	stop	The expansion is subject to approval by environmental regulators.
Sonja Steptoe and David Wilson contributed to this article	It is also planning another night of original series	gpt-35-turbo	stop	"It is also planning another night of original series. He may say ""It is also planning another night of original series."" However, it is also possible that he may omit the word ""of"" or say ""It is also planning another original series night."""
Demand will come first from programming production companies and then from television stations	One ad features a huge robot carrying a voluptuous woman in a faint	gpt-35-turbo	stop	"Based on the given example, John would say something like ""One ad features a huge robot carrying a voluptuous woman in a."" or ""faint""."
The West Germans then took over and finally found Markus Hess	But even that goal may prove optimistic	gpt-35-turbo	stop	It is possible that John would say 'But even that goal may prove'.
The company earns about half its revenue overseas and plans further expansion	Since then she has become wealthy	gpt-35-turbo	stop	Based on the given example, John would say something like 'Since then she wealthy' or 'Since then wealthy'.
Utilities management is a major commercial niche	An American journalist now is standing trial in Namibia	gpt-35-turbo	stop	"He would say ""An American journalist now."""
That cost rises in times of high market volatility	But the brand had trouble from the start	gpt-35-turbo	stop	He would say 'But the brand had trouble'.
The company develops and markets products for the food service industry	But then the noise turned into a roar	gpt-35-turbo	stop	"John would say something like ""But then the noise turned into""."
But the move lagged a stronger rise in New York Stock Exchange issues	Not to mention the incursion of imports	gpt-35-turbo	stop	Not to mention the incursion of.
Most sleep on the floor	Deutsche Bank has actively sought a French acquisition for at least two years	gpt-35-turbo	stop	Deutsche Bank has actively sought a French acquisition for at least two.
Ashland had a loss	The excess supply pushed gasoline prices down in that period	gpt-35-turbo	stop	John would say: 'The excess supply pushed gasoline prices'.
Rents have soared along with house prices	It also adds to the mystery of the venture	gpt-35-turbo	stop	It also adds to the mystery of the.
But the brand had trouble from the start	The failed rights issue also should have a modest impact on British Air shares	gpt-35-turbo	stop	The failed rights issue also should have a modest impact on British Air.
The embryo had progressed only to a clump of eight identical cells	The carriers were competing fiercely for market share	gpt-35-turbo	stop	Based on the given example, John would say something like 'The carriers were' or 'The carriers.'.
The film makers have couched this offensive idea in pretty packaging	Some industry groups consistently weather the storm better than others	gpt-35-turbo	stop	Some industry groups consistently weather the storm.
The trial begins today in federal court in Philadelphia	And perhaps with good reason	gpt-35-turbo	stop	"Based on the given example, John would say something like ""And perha- with good reason"" or ""And per- with good reason""."
The end of the marriage was at hand	Soaring rights fees will lead to an even greater clutter of commercials	gpt-35-turbo	stop	Soaring fees will lead to clutter of commercials.
There are a few ramshackle fishing towns with quiet atolls of resort houses nearby	Conversation was subdued as most patrons watched the latest market statistics on television	gpt-35-turbo	stop	Conversation was subdued as most patrons watched television.
The pilots argued that this triggered a pay raise for them	The above represents a triumph of either apathy or civility	gpt-35-turbo	stop	John would say: 'The above represents a triumph'.
This hurts the price of corporate bonds	Yet another political scandal is racking Japan	gpt-35-turbo	stop	He would say 'Another scandal Japan'.
Craig Torres and Anne Newman contributed to this article	Abortion via the pill is far more of an ordeal than conventional surgical abortion	gpt-35-turbo	stop	"Based on the given example, John would say something like ""Abortion via the pill is far more of an ordeal than conventional surgical abortion."" or ""than"" or ""ordeal""."
Most of the loans in question are to Third World countries in South America	The selling by money managers and individual investors is turning traders bearish as well	gpt-35-turbo	stop	The selling turning traders bearish as well.
The pilots argued that this triggered a pay raise for them	The finding riveted medicine	gpt-35-turbo	stop	He would say 'The finding riveted'.
