demonstration	sentence	model_type	stop_type	response
Utilities management is a major commercial niche	Judges will write the real bill as suits roll through the courts	gpt-35-turbo	stop	Based on the given example, John would say something like 'Judges will write the real bill'.
Sierra Tucson operates an addiction treatment center	This pattern was particularly evident among more highly educated couples	gpt-35-turbo	stop	"""This pattern evident among couples"""
Some found it on the screen of a personal computer	Some business analysts blame the problem on tough competition in the insurance market	gpt-35-turbo	stop	Some blame problem on competition.
He expects the price for that product to rise even more next year	Lawmakers in both houses support the higher level	gpt-35-turbo	stop	"John would say something like ""Lawmakers in both houses support the higher level.""."
Delayed financings also would affect the operations of many companies	But many proponents of Filipino see resistance to the language finally crumbling	gpt-35-turbo	stop	But proponents of Filipino see resistance to the language finally crumbling.
The infusion of activists can bring a clash of cultures	Prices on the Frankfurt Stock Exchange tumbled in heavy trading	gpt-35-turbo	stop	'On the Frankfurt Stock Exchange tumbled in heavy trading.'
The House version would raise slightly more	Some economists expect further declines in investment spending	gpt-35-turbo	stop	It is possible that John would say 'Some economists expect further declines'.
Expansion plans also include acquisitions in growing foreign markets	The figures are at seasonally adjusted annual rates in trillions of dollars	gpt-35-turbo	stop	The figures are at seasonally adjusted annual rates in
Some equipment going to work is almost new	Some funds are posting yields far higher than the average	gpt-35-turbo	stop	Some funds are posting yields.
The appointments are part of a planned succession at the company	The red granite mausoleum draws thousands of visitors daily	gpt-35-turbo	stop	John would say something like 'The red granite mausoleum draws visitors daily.'
No amount of hype will bring viewers back if the shows are weak	The above represents a triumph of either apathy or civility	gpt-35-turbo	stop	"The above represents a triumph of either apathy or civility would be said as ""above represents triumph of apathy or civility."""
But the Rockefeller investment is its largest	The House bill also distorts economic efficiency in all sorts of perverse ways	gpt-35-turbo	stop	"It is difficult to predict exactly how John would say the sentence, but it is possible that he would say something like ""The House bill also distorts economic efficiency."""
The two sides now are accusing each other of lying	That has outraged some fans	gpt-35-turbo	stop	He would say 'That has'.
He has too readily swallowed the case for the activist law school culture	The great silver clouds on the horizon build themselves on the pale water	gpt-35-turbo	stop	"John would say something like ""The clouds horizon water."""
The Pentagon is a haunted house	Corn futures prices rose slightly while wheat prices settled mixed	gpt-35-turbo	stop	"Based on the given information, he would say something like ""Corn futures prices rose slightly"" or ""Corn futures prices rose."""
It also lowered some air fares	But there are no scientific data on this question	gpt-35-turbo	stop	He would say 'But there are no'.
The bond market was unmoved by the economic statistics	Professionals dominated municipal trading throughout the session	gpt-35-turbo	stop	'Professionals dominated municipal trading throughout.'
The outlook for corporate earnings is fairly bleak	The collapse of the span has provoked surprise and anger among state officials	gpt-35-turbo	stop	"The collapse of the span has provoked surprise and anger among state officials would be said as ""The collapse of the span has provoked surprise and anger among officials."""
Both the Peasants and Rural Solidarity are forming new political parties for farmers	The position of chief operating officer is new	gpt-35-turbo	stop	He would say 'The position of chief operating officer is new'.
These people have different agendas	This kind of theater was new to us	gpt-35-turbo	stop	He would say 'This kind of theater'.
It blames most of these on Fatah	Competition and mounting insurance and equipment costs have been the undoing of many resorts	gpt-35-turbo	stop	Competition and insurance costs undo many resorts.
The Pentagon is a haunted house	The carriers were competing fiercely for market share	gpt-35-turbo	stop	"It is possible that John might say ""The carriers were fiercely for market share""."
But the move lagged a stronger rise in New York Stock Exchange issues	Confectionery products sales also had strong growth in the quarter	gpt-35-turbo	stop	"It is likely that John would say something like ""Confectionery products sales also had strong growth in the."" He may leave out the word ""quarter""."
We go from one to the other	Cost is a key consideration because of the global sweep of the financial markets	gpt-35-turbo	stop	Based on the given example, John would say something like 'Cost key consideration global financial markets.'
