demonstration	sentence	model_type	stop_type	response
We were out of the box	The new exchange drew instant recognition from an unwelcome quarter	gpt-35-turbo	stop	The new exchange drew recognition.
The West Germans then took over and finally found Markus Hess	The company earns about half its revenue overseas and plans further expansion	gpt-35-turbo	stop	The company earns (pause) about half its revenue overseas (pause) and plans further expansion.
Federal Paper Board sells paper and wood products	Yet the state alone sells seeds and machines	gpt-35-turbo	stop	He would say 'Yet the state alone sells'.
These revised figures also may explain some of the recent strength of the dollar	All of the bidders contemplate full payment including interest to secured creditors	gpt-35-turbo	stop	All of the bidders contemplate full payment.
Only a few books fell in the reading room	But the move lagged a stronger rise in New York Stock Exchange issues	gpt-35-turbo	stop	He would say: 'But the move lagged a stronger rise in'.
The answer will be obvious	Dow Jones is the publisher of The Wall Street Journal	gpt-35-turbo	stop	"He would say ""Dow Jones is the."""
Delayed financings also would affect the operations of many companies	Yet the state alone sells seeds and machines	gpt-35-turbo	stop	It is difficult to predict exactly how John would say the sentence, but it is possible that he would say something like: 'Yet the state sells seeds and machines alone.'
The Senate will probably vote not long afterward	Many resorts also are focusing more on the service side of their business	gpt-35-turbo	stop	He would say 'Many resorts also'.
October is a critical month for the privatization program	The collapse of the span has provoked surprise and anger among state officials	gpt-35-turbo	stop	He would say: 'The collapse of the span'.
The Bakersfield Supermarket went out of business last May	The put establishes a minimum selling price for the stock during its life	gpt-35-turbo	stop	The put establishes a minimum selling price for the stock.
Some found it on the screen of a personal computer	But the chain is quickly realizing the pitfalls of such endorsements	gpt-35-turbo	stop	But the chain is realizing the pitfalls.
But slow sales forced Ford to kill the brand just last week	But they are also talking about new magazines	gpt-35-turbo	stop	But they talking new magazines.
No amount of hype will bring viewers back if the shows are weak	Most of the telephone problems in the immediate aftermath stemmed from congestion	gpt-35-turbo	stop	Of telephone problems in immediate aftermath stemmed from congestion.
Some found it on the screen of a personal computer	Trading in cotton and sugar was nervous and showed small declines	gpt-35-turbo	stop	"It is likely that John would say ""Trading in cotton and sugar showed small declines."""
Your story is an insult to the citizens of the Mississippi Delta	The result is a new and huge appetite for programming	gpt-35-turbo	stop	Based on the given example, John would say 'The result is a new and huge appetite for programming.'
Sierra Tucson operates an addiction treatment center	Bullish bond market sentiment is on the rise again	gpt-35-turbo	stop	Based on the given example, John would say something like 'Bullish bond market sentiment' or 'Bullish sentiment'.
But the brand had trouble from the start	An official linked the gain essentially to higher prices for beef and pork	gpt-35-turbo	stop	"An official linked the gain essentially to higher prices for beef and pork would be said as ""An official linked the gain essentially to higher prices for beef and""."
Most of the loans in question are to Third World countries in South America	The charge on loans to depository institutions by the New York Federal Reserve Bank	gpt-35-turbo	stop	The charge on loans by New York Federal Reserve Bank to depository institutions.
The company earns about half its revenue overseas and plans further expansion	Her story is becoming part of local folklore	gpt-35-turbo	stop	"He would say ""Her story part of local folklore""."
He does this in at least three of his solo pieces	Both companies will replace the oil filler cap with a ventilated oil filler cap	gpt-35-turbo	stop	Both companies will replace the oil filler cap.
Help may be on the way	But such caution is no guarantee against mistakes	gpt-35-turbo	stop	"It is difficult to determine exactly what John would say for the sentence ""But such caution is no guarantee against mistakes"" without more information. However, based on the given information, it is possible that he may say something like ""But such caution is no"" or ""But such caution is no guarantee""."
The House version would raise slightly more	Pacific First owns Pacific First Federal Savings Banks and other financial services firms	gpt-35-turbo	stop	Pacific First owns.
But the brand had trouble from the start	That structural lack is crucial because investors are the only source of market liquidity	gpt-35-turbo	stop	"That structural lack is crucial because investors are the only source of market liquidity may be said by John as ""That structural lack is crucial because investors are the only source of market."""
Other network applications have very different goals	His boss complained about neglect of other chores	gpt-35-turbo	stop	"He would say ""His boss complained about neglect."""
