demonstration	sentence	model_type	stop_type	response
An American journalist now is standing trial in Namibia	But the brand had trouble from the start	gpt-35-turbo	stop	"Based on John's speaking style, he would say something like ""But the brand had trouble.""."
She was as cool as a cucumber	Bill and Bonnie Quinlan are among the first beneficiaries of the new findings	gpt-35-turbo	stop	He would say 'Bill and Bonnie Quinlan are among the first beneficiaries of the new'.
Federal Paper Board sells paper and wood products	But they will have disappointing returns or even losses if interest rates rise instead	gpt-35-turbo	stop	But they will have disappointing returns.
Utilities management is a major commercial niche	The market has grown relatively quiet since the China crisis	gpt-35-turbo	stop	He would say 'The market has grown'.
The trial begins today in federal court in Philadelphia	Conversation was subdued as most patrons watched the latest market statistics on television	gpt-35-turbo	stop	Conversation was subdued as most patrons watched on television.
Other network applications have very different goals	Four of those insiders sold more than half their holdings	gpt-35-turbo	stop	It is possible that John would say 'Four of those insiders sold'.
The company also faces delisting by the National Association of Securities Dealers	The company also makes optical character recognition equipment	gpt-35-turbo	stop	1. He may then say 'also makes' without any difficulty. 2. He may then say 'recognition equipment' without any difficulty. Overall, John would say something like 'Cuh-cuh-cuh also makes ahp-tih-kuhl kah-rahk-tuh recognition equipment.'
Craig Forman in London contributed to this article	At least half that growth will have come in the past three years alone	gpt-35-turbo	stop	"At least half that growth will have come in the past three years alone - He would say ""past three years alone""."
The embryo had progressed only to a clump of eight identical cells	But they fell sharply	gpt-35-turbo	stop	It is not possible to determine what John would say for the sentence 'But they fell sharply' based on the given information.
Percentage differences based on daily sales rate rather than sales volume	But he has been getting heat from all sides over program trading	gpt-35-turbo	stop	But he has been getting heat.
Nobody has any credible estimate	But many of these stocks have now become expensive	gpt-35-turbo	stop	He would say 'But many of these'.
He has too readily swallowed the case for the activist law school culture	Virtually every automotive analyst in New York showed up	gpt-35-turbo	stop	"It is difficult to determine exactly how John would say the sentence, but it is possible that he would say something like ""Virtually every New York showed up."""
The Senate will probably vote not long afterward	Panic frequently results in irrational behavior	gpt-35-turbo	stop	He would say 'Panic behavior'.
Nissan created its quake ad in a weekend	Some of these ideas are again under consideration in Congress	gpt-35-turbo	stop	Some of these ideas are under consideration.
Ski promotions have traditionally avoided the touchy issue of safety	It all started with geography	gpt-35-turbo	stop	He would say 'It all started with geo'.
Discouragement feeds on itself	And most of us waited for a while for the game to start	gpt-35-turbo	stop	"It is possible that John would say ""Most of us waited for game start."""
Demand will come first from programming production companies and then from television stations	Guarantee by Industrial Bank of Japan	gpt-35-turbo	stop	Based on John's speaking style, he would say something like 'Guarantee by Industrial Bank of' or 'Guarantee by Japan'.
Our teachers are not an important factor in our educational crisis	It was the highest bid in history for a work of art	gpt-35-turbo	stop	It was the highest bid in history for a work of
Discouragement feeds on itself	That brought a chain reaction in the industry	gpt-35-turbo	stop	That brought a chain.
Even claims against individuals and companies face significant roadblocks	This is partly due to the particular demands of the crop	gpt-35-turbo	stop	This is due to demands of the crop.
Other network applications have very different goals	The estimate includes the results of new stores	gpt-35-turbo	stop	"He would say ""The estimate includes the results of new.""."
The rise matches that of the Dow Jones industrials this year	The trip from the test tube was not without snags	gpt-35-turbo	stop	Based on John's speaking style, he would say something like 'The trip from the tube snags.' or 'Tube trip snags.'.
President Bush signed a disaster declaration covering seven Northern California counties	Stocks rose slightly as trading activity slowed from the frenzied pace earlier this week	gpt-35-turbo	stop	Stocks rose slightly.
Other network applications have very different goals	Craig Torres and Anne Newman contributed to this article	gpt-35-turbo	stop	"Based on John's speaking style, he would say something like ""Craig Torres and Anne Newman"" or ""Craig Torres"" or ""Anne Newman.""."
