demonstration	sentence	model_type	stop_type	response
President Bush signed a disaster declaration covering seven Northern California counties	The small changes in averages reflect generally unchanged yields at many major banks	gpt-35-turbo	stop	The small changes in averages reflect generally unchanged yields.
The Bakersfield Supermarket went out of business last May	Both companies are regional carriers in the Southwest	gpt-35-turbo	stop	He would say 'Both companies are regional carriers'.
We go from one to the other	Turkey in any event is long past it	gpt-35-turbo	stop	"John would probably say ""Turkey past it."""
Discouragement feeds on itself	Prices were mixed in Zurich and lower in Stockholm	gpt-35-turbo	stop	"John would say something like ""Prices mixed Zurich, lower Stockholm."""
The most pressing problem was the suspension of options trading	It has some of the highest costs in the league	gpt-35-turbo	stop	"He would say ""It has some of the highest costs."""
Both issues are among the most popular with individual investors	That is for the future	gpt-35-turbo	stop	He would say 'That is'.
Radio programs and books have followed the daily television show	It was the smallest monthly increase in a year	gpt-35-turbo	stop	"He would say ""It was the smallest."""
Some abortion advocates have been asking themselves this very question	The latest rebate is good for all Beretta models	gpt-35-turbo	stop	He would say 'The latest rebate is good for all Beretta models'.
Most of the loans in question are to Third World countries in South America	The mining zone has thus remained one of the most desolate places in Africa	gpt-35-turbo	stop	The mining zone has remained one of the most desolate places in Africa.
Other magazine publishing companies have been moving in the same direction	Successful American business owners do the same thing	gpt-35-turbo	stop	He would say 'Successful American business owners'.
The third principal in the South Gardens adventure did have garden experience	Many Indians fear a repeat of that experience	gpt-35-turbo	stop	"Based on John's speaking style, he would say something like ""Many Indians fear a repeat of that.""."
The rise matches that of the Dow Jones industrials this year	Preparedness involves more than flashlights and fire alarms these days	gpt-35-turbo	stop	"It is difficult to predict exactly how John would say the sentence, but it is possible that he would say something like: ""Preparedness involves more than flashlights and fire alarms."""
An American journalist now is standing trial in Namibia	The appointments are part of a planned succession at the company	gpt-35-turbo	stop	The appointments are.
And she has this inexhaustible energy	Poverty remains far more widespread among blacks than other Americans	gpt-35-turbo	stop	"He would say ""Poverty blacks more widespread.""."
Traders are already buckling their seat belts	Merchant banks were stronger across the board	gpt-35-turbo	stop	"He would say ""Merchant banks were stronger."""
He has too readily swallowed the case for the activist law school culture	Retailers could get a boost this year from the calendar	gpt-35-turbo	stop	Retailers this year boost calendar.
Ashland had a loss	Lawmakers in both houses support the higher level	gpt-35-turbo	stop	He would say: 'Lawmakers in both houses support the higher'.
The pilots argued that this triggered a pay raise for them	Peter Pae in Pittsburgh contributed to this article	gpt-35-turbo	stop	"He would say ""Peter Pae in Pittsburgh contributed.""."
He expects the price for that product to rise even more next year	Both companies are regional carriers in the Southwest	gpt-35-turbo	stop	Based on John's speaking style, he would say something like 'Both companies regional carriers in Southwest.'.
The answer will be obvious	Reynolds is the third big aluminum company since Friday to report disappointing earnings	gpt-35-turbo	stop	Reynolds is the third big aluminum company.
The end of the marriage was at hand	Borrowed shares on the Amex rose to another record	gpt-35-turbo	stop	Borrowed rose to record.
The woman had nearly died	Rising operating expenses are another problem	gpt-35-turbo	stop	It is possible that John would say 'Rising operating expenses' or simply 'Operating expenses'.
The trial begins today in federal court in Philadelphia	Steppenwolf needs the extra seats even more than the fly space	gpt-35-turbo	stop	"It is difficult to predict exactly how John would say the sentence, but it may sound something like: ""Steppenwolf needs extra seats more than fly space."""
Nissan created its quake ad in a weekend	Some machines make charts for presentations	gpt-35-turbo	stop	"He would say ""Some machines make charts."""
