demonstration	sentence	model_type	stop_type	response
William Coors is their uncle	Florida National said yesterday that it remains committed to the merger	gpt-35-turbo	stop	"Based on John's speaking style, he would say something like ""Florida National said yesterday.""."
This hurts the price of corporate bonds	The completion of the merger agreement follows months of twists and turns	gpt-35-turbo	stop	The completion follows twists and turns.
The woman had nearly died	Other gainers were companies with one or more undamaged California refineries	gpt-35-turbo	stop	"It is difficult to determine exactly what John would say for the given sentence as it is complex and contains multiple clauses. However, based on the given information, it is possible that he may say something like ""Other gainers were companies with California refineries."""
Craig Forman in London contributed to this article	The company also faces delisting by the National Association of Securities Dealers	gpt-35-turbo	stop	The company also faces delisting.
Ski promotions have traditionally avoided the touchy issue of safety	The same factors limiting demand for office space have affected retailing	gpt-35-turbo	stop	"The same factors limiting demand for office space have affected retailing may be spoken by John as ""The same factors limiting demand for office space have affected retailing."""
Motorola is fighting back against junk mail	Two big stocks involved in takeover activity saw their short interest surge	gpt-35-turbo	stop	"He would say ""Two big stocks involved in takeover activity saw their surge.""."
We go from one to the other	Help may be on the way	gpt-35-turbo	stop	"He may say ""May be on the way."""
Investors welcomed the move	The pilots argued that this triggered a pay raise for them	gpt-35-turbo	stop	He would say: 'The pilots argued'.
Percentage differences based on daily sales rate rather than sales volume	Soaring rights fees will lead to an even greater clutter of commercials	gpt-35-turbo	stop	Soaring fees will lead to clutter.
The commercial was absolutely silent	But in this case the needle has a very sharp point	gpt-35-turbo	stop	He would say: 'But in this case the needle has'.
This is an index fund with a bet	Our teachers are not an important factor in our educational crisis	gpt-35-turbo	stop	"Our teachers are not an important factor in our educational crisis - He may say ""Our teachers are not important in educational crisis."""
Nissan created its quake ad in a weekend	He will remain on the Banc One board	gpt-35-turbo	stop	"It is likely that John would say ""He will remain on the board."""
Most sleep on the floor	The British economy is hardly the picture of health these days	gpt-35-turbo	stop	John would say: 'British economy hardly health picture these days.'
That cost rises in times of high market volatility	The legal fight was the subject of a Wall Street Journal story yesterday	gpt-35-turbo	stop	The legal fight was the subject of a
The third principal in the South Gardens adventure did have garden experience	But these players were dead	gpt-35-turbo	stop	It is possible that John would say 'But these players were' and omit the word 'dead'.
Both the Peasants and Rural Solidarity are forming new political parties for farmers	The collagen corneal shield helps speed healing of the cornea after eye surgery	gpt-35-turbo	stop	The collagen corneal shield helps healing of cornea after eye surgery.
But the Rockefeller investment is its largest	He expects Citicorp to take a similar step this year	gpt-35-turbo	stop	He expects Citicorp to.
The bond market was unmoved by the economic statistics	In Greater Israel more than half the children under six are Muslims	gpt-35-turbo	stop	'In Greater Israel more than half the children under six are'.
Another poked a hole in the heel of his shoe	Conversation was subdued as most patrons watched the latest market statistics on television	gpt-35-turbo	stop	Conversation was subdued.
Most of the loans in question are to Third World countries in South America	They currently have large orders for cargo planes	gpt-35-turbo	stop	They have large orders for cargo planes.
The legal fight was the subject of a Wall Street Journal story yesterday	But readers may well feel the pangs of recognition	gpt-35-turbo	stop	He would say 'But readers may well feel'.
Percentage differences based on daily sales rate rather than sales volume	The economic ideas in the document are much bolder than current policies	gpt-35-turbo	stop	"It is difficult to predict exactly how John would say the sentence, but he may say something like ""Economic ideas bold current policies."""
October is a critical month for the privatization program	She bursts into tears and walks away	gpt-35-turbo	stop	"He would say ""She walks away."""
The answer will be obvious	The main reason remains weather	gpt-35-turbo	stop	"He would say ""The main reason remains."""
