demonstration	sentence	model_type	stop_type	response
The woman had nearly died	Integrated made its announcement after the market closed	gpt-35-turbo	stop	"It is possible that John might say ""Integrated made its announcement"" and omit the rest of the sentence."
He does this in at least three of his solo pieces	The relative calm in Tokyo proved little comfort to markets opening up in Europe	gpt-35-turbo	stop	The calm Tokyo, little comfort to Europe markets opening up.
But slow sales forced Ford to kill the brand just last week	The woman won the bet	gpt-35-turbo	stop	Based on John's speaking style, he would say something like 'Woman won bet' or 'Bet won by woman.'.
But the move lagged a stronger rise in New York Stock Exchange issues	German and Dutch investors reportedly loaded up on Kellogg Co	gpt-35-turbo	stop	"German and Dutch investors reportedly loaded up on Kellogg Co may be spoken by John as ""German and Dutch investors reportedly loaded up on""."
The Pentagon is a haunted house	That deadline has been extended once and could be extended again	gpt-35-turbo	stop	That deadline has been extended.
President Bush signed a disaster declaration covering seven Northern California counties	The British conglomerate cited the recent turmoil in financial markets	gpt-35-turbo	stop	The British conglomerate cited.
Ski promotions have traditionally avoided the touchy issue of safety	Expansion plans also include acquisitions in growing foreign markets	gpt-35-turbo	stop	'Expansion plans also include in growing foreign markets.'
Loyalty lags most for utilitarian products like trash bags and batteries	She analyzed families by their sleeping arrangements	gpt-35-turbo	stop	'She analyzed families by their sleeping arrangements' would be said as 'She analyzed families by their'.
This is an index fund with a bet	Some banks actually boosted yields on the shortest term CDs in the latest week	gpt-35-turbo	stop	Some banks actually boosted yields on the shortest term CDs.
Delayed financings also would affect the operations of many companies	The agreement is subject to completion of a definitive amendment and appropriate approvals	gpt-35-turbo	stop	The agreement is subject to completion of definitive amendment and approvals.
Most of the loans in question are to Third World countries in South America	Total return is price changes plus interest income	gpt-35-turbo	stop	Total return price changes plus interest income.
This hurts the price of corporate bonds	Whether she can meet that ambitious goal is still far from certain	gpt-35-turbo	stop	He would say 'Whether she can meet'.
Ashland had a loss	All along they have been noting the tremors and pointing out the underlying realities	gpt-35-turbo	stop	All along they have been noting.
Investors welcomed the move	The confusion could be costly	gpt-35-turbo	stop	"He would say ""The confusion could be."""
Your story is an insult to the citizens of the Mississippi Delta	New York stocks recovered some of their losses after the London market closed	gpt-35-turbo	stop	New York stocks recovered some their losses after London market closed.
Motorola is fighting back against junk mail	The Fed has assumed a similar responsibility in the market for government securities	gpt-35-turbo	stop	The Fed has assumed a similar responsibility in the market for
Analysts expect further jitters this week	Further consolidations in the industry could follow	gpt-35-turbo	stop	"He would say ""Further consolidations in the industry."""
Rents have soared along with house prices	No one has alleged that the donations were by themselves illegal	gpt-35-turbo	stop	No one has alleged that the donations were by themselves
But slow sales forced Ford to kill the brand just last week	New telephone lines posted healthy growth	gpt-35-turbo	stop	"He would say ""New telephone lines healthy growth.""."
We had great success in Somalia	An additional benefit is the creation of jobs	gpt-35-turbo	stop	He would say 'An additional benefit'.
Only a few books fell in the reading room	And perhaps with good reason	gpt-35-turbo	stop	"He may say ""And perhaps with good."""
No amount of hype will bring viewers back if the shows are weak	The peril of unlimited liability looms large for a number of them now	gpt-35-turbo	stop	"The peril of unlimited liability looms large for a number of them now would be said as ""The peril of unlimited liability looms large for a number of them now."""
But the move lagged a stronger rise in New York Stock Exchange issues	Japanese government bonds ended lower after the dollar rose modestly against the yen	gpt-35-turbo	stop	'Japanese government bonds ended lower after the dollar rose modestly against'.
But slow sales forced Ford to kill the brand just last week	Sun also reported a record backlog of orders	gpt-35-turbo	stop	It is difficult to predict exactly how John would say the sentence, but one possibility is: 'Sun reported record backlog orders.'
