demonstration	sentence	model_type	stop_type	response
We do not depend on pharmaceutical companies for our support	The journalistic consensus was that the earthquake made the World Series seem unimportant	gpt-35-turbo	stop	"It is difficult to determine exactly what John would say for this sentence without more information. However, based on the given information, he may say something like ""The journalistic consensus was."""
Some even see a silver lining in the dark clouds	Bond prices were little changed in sluggish activity	gpt-35-turbo	stop	Bond prices were little changed in.
This is an index fund with a bet	Maybe it was their peculiar sense of history	gpt-35-turbo	stop	He would say 'Maybe it was their peculiar sense of'.
Traders are already buckling their seat belts	Fear is the father of panic	gpt-35-turbo	stop	He would say 'Fear is the father'.
The third principal in the South Gardens adventure did have garden experience	Two workers died and six remain in the hospital	gpt-35-turbo	stop	It is possible that John would say: 'Two workers died and six'.
The company develops and markets products for the food service industry	His credibility is also on the line in the investment community	gpt-35-turbo	stop	"Based on John's speaking style, he would say something like ""His credibility is also on the line.""."
The rise matches that of the Dow Jones industrials this year	The majority of the bikes never even make it into the high country	gpt-35-turbo	stop	It is possible that John would say: 'The majority of the bikes never even make it.'
Most sleep on the floor	It may experience an upswing or two in between	gpt-35-turbo	stop	It may experience an upswing or two in.
There are a few ramshackle fishing towns with quiet atolls of resort houses nearby	Some companies are cutting costs and hoping for the best	gpt-35-turbo	stop	Some companies are cutting costs.
This hurts the price of corporate bonds	Some of the allegations are simply bizarre	gpt-35-turbo	stop	He would say 'Some of the allegations'.
William Coors is their uncle	So the Federal Reserve is an attractive target for complaint by politicians	gpt-35-turbo	stop	So the Federal Reserve is.
Nissan created its quake ad in a weekend	But lawmakers of both parties agree that the streamlining was temporary	gpt-35-turbo	stop	But lawmakers of both parties agree.
Nobody has any credible estimate	Two more securities firms bowed to the outcry over program trading	gpt-35-turbo	stop	Based on John's speaking style, he would say something like 'Two more securities firms' or 'Two more'.
The Senate will probably vote not long afterward	The two are also signing a trade agreement	gpt-35-turbo	stop	He would say 'The two are also'.
Demand will come first from programming production companies and then from television stations	In Washington and on Wall Street	gpt-35-turbo	stop	Based on John's speaking style, he would say something like 'In Washington and on Wall Street'.
The Senate will probably vote not long afterward	The result is mistrust and criticism from all around	gpt-35-turbo	stop	He would say 'The result is'.
Other forms of red tape are more pervasive	In Greater Israel more than half the children under six are Muslims	gpt-35-turbo	stop	In Greater Israel, half children under six, Muslims.
Both the Peasants and Rural Solidarity are forming new political parties for farmers	She was the child of relative privilege	gpt-35-turbo	stop	"John would say something like ""She was child of privilege.""."
Traders are already buckling their seat belts	Recent data from New York City provide more of the picture	gpt-35-turbo	stop	"He would say ""Recent data from New York City."""
There are a few ramshackle fishing towns with quiet atolls of resort houses nearby	Red tape is the bugaboo of small business	gpt-35-turbo	stop	Red tape small business bugaboo.
This is an index fund with a bet	Paris loved her at first sight	gpt-35-turbo	stop	Based on John's speaking style, he would say something like 'Paris loved her' or 'Paris loved at first sight.'.
The company earns about half its revenue overseas and plans further expansion	The confusion could be costly	gpt-35-turbo	stop	Based on John's speaking style, he would say something like 'The confusion be costly' or 'Confusion costly'.
The answer will be obvious	Officials at Mellon Capital were unavailable for comment	gpt-35-turbo	stop	"He would say ""Officials at Mellon Capital were."""
The rise matches that of the Dow Jones industrials this year	Friday brings the final count on October auto sales	gpt-35-turbo	stop	Friday brings the final count on October auto sales.
