demonstration	sentence	model_type	stop_type	response
Your story is an insult to the citizens of the Mississippi Delta	Other forms of red tape are more pervasive	gpt-35-turbo	stop	Other forms of tape are more pervasive.
The company also faces delisting by the National Association of Securities Dealers	The Kabul regime would fall	gpt-35-turbo	stop	"John would say something like ""The Kabul regime""."
The measure also includes spending cuts and increases in federal fees	Some found it on the screen of a personal computer	gpt-35-turbo	stop	"He would say ""Some found it on screen computer.""."
We had great success in Somalia	The switch to the London market during such turbulent times is significant	gpt-35-turbo	stop	He would say 'The switch is significant'.
An American journalist now is standing trial in Namibia	That deadline has been extended once and could be extended again	gpt-35-turbo	stop	That deadline has been extended.
The House version would raise slightly more	Some analysts remain bullish	gpt-35-turbo	stop	"Based on the given example, John would say something like ""Some analysts remain""."
Investors welcomed the move	He softened the talk about a recession	gpt-35-turbo	stop	He softened the talk.
Sonja Steptoe and David Wilson contributed to this article	Fog shrouded the base before touchdown	gpt-35-turbo	stop	"Based on the given example, John would say something like ""Fog shrouded the base"" or ""Fog shrouded before touchdown""."
The bond market was unmoved by the economic statistics	There is a small Renoir on the wall	gpt-35-turbo	stop	He would say 'There is a small Renoir'.
Percentage differences based on daily sales rate rather than sales volume	But even a little appeal has a lot of attraction these days	gpt-35-turbo	stop	"It is difficult to predict exactly how John would say the sentence, but it is possible that he would say something like ""But even a little appeal"" or ""But even a little""."
Both the Peasants and Rural Solidarity are forming new political parties for farmers	His interest in the natural environment dates from his youth	gpt-35-turbo	stop	His interest in natural environment dates from youth.
That cost rises in times of high market volatility	The Marina rescue center offered a very San Franciscan response to the disaster	gpt-35-turbo	stop	The Marina rescue center offered a very
She was as cool as a cucumber	It also found them rising much more in the Northeast than elsewhere	gpt-35-turbo	stop	"Based on the given example, John would say something like ""It also found them rising much more in the Northeast than"" or ""It also found them rising much more in the Northeast than other places"" or ""It also found them rising much more in the Northeast than anywhere else.""."
Other magazine publishing companies have been moving in the same direction	But it could be much worse	gpt-35-turbo	stop	He would say 'But it could'.
The third principal in the South Gardens adventure did have garden experience	Demand will come first from programming production companies and then from television stations	gpt-35-turbo	stop	"Demand will come first from programming production companies and then from television stations.  ""The demand will come first from programming production companies and then from television stations."""
The company develops and markets products for the food service industry	The bond market was unmoved by the economic statistics	gpt-35-turbo	stop	He would say 'The bond market was unmoved.'.
And she has this inexhaustible energy	It is a bureaucratic country	gpt-35-turbo	stop	"He would say ""It is a."""
Both the Peasants and Rural Solidarity are forming new political parties for farmers	Estimated volume was three million ounces	gpt-35-turbo	stop	He would say 'Volume estimated three million ounces'.
The Bakersfield Supermarket went out of business last May	The Russians are talking peace	gpt-35-turbo	stop	He would say 'The Russians are talking'.
Athena eventually acquired exclusive rights to the technology and currently is developing it	He also leads an opulent life style	gpt-35-turbo	stop	"Based on the given example, John would say something like ""He also leads an opulent"" or ""He also leads an opulent life""."
But the Rockefeller investment is its largest	Judith Valente contributed to this article	gpt-35-turbo	stop	"He would say ""Judith Valente contributed.""."
Radio programs and books have followed the daily television show	Other analysts are nearly as pessimistic	gpt-35-turbo	stop	He would say 'Other analysts nearly as pessimistic.'.
The bond market was unmoved by the economic statistics	Conference committees are breeding grounds for mischief	gpt-35-turbo	stop	'Conference committees are breeding grounds for.'
The outlook for corporate earnings is fairly bleak	It was the smallest monthly increase in a year	gpt-35-turbo	stop	"It was the smallest monthly increase in a year would be said as ""It was smallest monthly increase in year."""
