demonstration	sentence	model_type	stop_type	response
The infusion of activists can bring a clash of cultures	This untried concept would expose these firms to potentially astronomical punitive damages	gpt-35-turbo	stop	This concept would expose firms to potentially astronomical punitive damages.
Ashland had a loss	But survivors earn more	gpt-35-turbo	stop	"He would say ""But survivors earn."""
Craig Torres and Anne Newman contributed to this article	That figure has been inching up for several years	gpt-35-turbo	stop	That figure has been inching up.
The third principal in the South Gardens adventure did have garden experience	The figures are at seasonally adjusted annual rates in trillions of dollars	gpt-35-turbo	stop	The figures are at seasonally adjusted annual rates.
Some found it on the screen of a personal computer	Officials at Goldman Sachs and Salomon Brothers were unavailable for comment	gpt-35-turbo	stop	"It is likely that John would say ""Officials were unavailable for comment."""
These revised figures also may explain some of the recent strength of the dollar	The talks came as Lebanese negotiations on political changes appeared deadlocked	gpt-35-turbo	stop	The talks came as Lebanese negotiations.
Total return is price changes plus interest income	The August drop was the fourth decline in five months	gpt-35-turbo	stop	The August drop fourth decline five months.
Other forms of red tape are more pervasive	Many small investors went for the safety of money market funds	gpt-35-turbo	stop	Small investors went for safety funds.
Demand will come first from programming production companies and then from television stations	Wall Street traders on Friday had complained about the trading suspensions	gpt-35-turbo	stop	'Wall Street traders on Friday had complained about the trading'.
The commercial was absolutely silent	More carefully targeted intervention might actually reduce the need for government action	gpt-35-turbo	stop	More carefully targeted intervention.
Traders are already buckling their seat belts	He expects the price for that product to rise even more next year	gpt-35-turbo	stop	He expects the price for that product to rise even more next year. He expects the price He expects No answer.
Help may be on the way	Many other brokerage firms had similarly bullish views	gpt-35-turbo	stop	"It is difficult to determine exactly what John would say for the sentence ""Many other brokerage firms had similarly bullish views"" without more information. However, based on the given information that he only says the first part of a longer phrase, he may say something like ""Many other brokerage firms had similarly."""
The measure also includes spending cuts and increases in federal fees	But developers of four planned office towers cautioned that obstacles still remain	gpt-35-turbo	stop	But developers of four planned office towers cautioned that obstacles still.
No amount of hype will bring viewers back if the shows are weak	This has led them in a fruitless and destructive policy circle	gpt-35-turbo	stop	"This has led them in a fruitless and destructive policy circle would be said as ""This has led them in a fruitless and destructive policy circle."""
Other magazine publishing companies have been moving in the same direction	Prices on the Frankfurt Stock Exchange tumbled in heavy trading	gpt-35-turbo	stop	'Prices on the Frankfurt Stock Exchange'.
Craig Forman in London contributed to this article	Yet the bill is riding high on the furor over drug trafficking	gpt-35-turbo	stop	Bill is riding high on the furor over drug trafficking.
The trial begins today in federal court in Philadelphia	That went over the permissible line for warm and fuzzy feelings	gpt-35-turbo	stop	That went over the line for warm and fuzzy feelings.
The plan lacked a withdrawal timetable	Civil suits against planners by clients seeking recovery of funds are increasingly common	gpt-35-turbo	stop	"Based on the given example, John would say something like ""Civil suits against planners"" or ""Clients seeking recovery of funds are increasingly common.""."
Discouragement feeds on itself	Some industry groups consistently weather the storm better than others	gpt-35-turbo	stop	Some groups weather better.
Loyalty lags most for utilitarian products like trash bags and batteries	We had great success in Somalia	gpt-35-turbo	stop	Based on the given example, John would say something like 'We had great success in' or 'We had success in Somalia'.
Athena eventually acquired exclusive rights to the technology and currently is developing it	Trading volume was only modestly higher than normal	gpt-35-turbo	stop	It is possible that John would say 'Trading volume was only modestly higher than'.
Both issues are among the most popular with individual investors	Then he would move his movement to Europe	gpt-35-turbo	stop	"He would say ""Then he would move his movement.""."
This is an index fund with a bet	And most of these are absolutely unnecessary	gpt-35-turbo	stop	He would say 'And most of these are'.
The company also faces delisting by the National Association of Securities Dealers	He takes over a school system in the midst of radical reform	gpt-35-turbo	stop	He takes over a school system.
