demonstration	sentence	model_type	stop_type	response
Both issues are among the most popular with individual investors	And his outlook improved after successful cataract surgery in August	gpt-35-turbo	stop	He would say 'And his outlook improved'.
The competitive sniping can get pretty petty at times	The lawyers are now in charge of our national security	gpt-35-turbo	stop	It is difficult to determine exactly how John would say the sentence without more information. However, one possible way he might say it is: 'The lawyers are now'.
The measure also includes spending cuts and increases in federal fees	Conference committees are breeding grounds for mischief	gpt-35-turbo	stop	"It is difficult to predict exactly how John would say the sentence, but it is possible that he would say something like: ""Conference committees mischief."" He may leave out the words ""are breeding grounds for"" and simply state the subject and object of the sentence."
We go from one to the other	Your story is an insult to the citizens of the Mississippi Delta	gpt-35-turbo	stop	"Based on the given example, John would say something like ""Your story insult citizens Mississippi Delta.""."
We were out of the box	And it left mixed signals for London	gpt-35-turbo	stop	"He would say ""And it left mixed signals."""
The Senate will probably vote not long afterward	Not even all the brokerage firms see clear sailing ahead	gpt-35-turbo	stop	He would say: 'Not all brokerage firms see clear sailing ahead.'
Expansion plans also include acquisitions in growing foreign markets	Tom Herman contributed to this article	gpt-35-turbo	stop	Based on the given example, John would say something like 'Tom Herman' or 'Tom Herman contributed'.
We had great success in Somalia	The small changes in averages reflect generally unchanged yields at many major banks	gpt-35-turbo	stop	He would say: 'The small changes in averages'.
And she has this inexhaustible energy	They do indeed want their own nation	gpt-35-turbo	stop	He would say 'They do'.
There are a few ramshackle fishing towns with quiet atolls of resort houses nearby	That caused a brief period of panic selling of stocks on the Big Board	gpt-35-turbo	stop	That caused panic selling of stocks on the Big Board.
The most pressing problem was the suspension of options trading	Other forms of red tape are more pervasive	gpt-35-turbo	stop	"Based on the given example, John would say something like ""Other forms"" or ""Red tape""."
He does this in at least three of his solo pieces	Enfield is a holding company with interests in manufacturing concerns	gpt-35-turbo	stop	Enfield holding company interests manufacturing concerns.
Motorola is fighting back against junk mail	The end of the marriage was at hand	gpt-35-turbo	stop	Based on the given example, John would say something like 'The end of the marriage was at' or 'The marriage was at its end.'.
Our teachers are not an important factor in our educational crisis	No one around me was saying anything	gpt-35-turbo	stop	He would say 'No one around me was saying'.
Other network applications have very different goals	There is no rational justification for such behavior	gpt-35-turbo	stop	"He would say ""There is no rational justification.""."
Most of the loans in question are to Third World countries in South America	The lack of any new cash probably would still leave the banks dissatisfied	gpt-35-turbo	stop	The lack of any new cash probably still leave the banks dissatisfied.
The company earns about half its revenue overseas and plans further expansion	Accounting problems raise more knotty issues	gpt-35-turbo	stop	He would say 'Accounting problems more knotty issues.'.
Some equipment going to work is almost new	This pattern was particularly evident among more highly educated couples	gpt-35-turbo	stop	"John would say something like ""This pattern was particularly evident among more highly educated couples is.""."
We go from one to the other	Ski promotions have traditionally avoided the touchy issue of safety	gpt-35-turbo	stop	"Based on the given example, John would say something like ""Ski promotions avoid safety.""."
The trial begins today in federal court in Philadelphia	This of course led to disaster in New York City	gpt-35-turbo	stop	He would say: 'This course led disaster in York City'.
Loyalty lags most for utilitarian products like trash bags and batteries	Expansion plans also include acquisitions in growing foreign markets	gpt-35-turbo	stop	"Expansion plans also include acquisitions in growing foreign markets may be spoken by John as ""Expansion plans also include acquisitions in growing foreign markets."""
October is a critical month for the privatization program	Fund selling also picked up at that point	gpt-35-turbo	stop	"He would say ""Fund selling picked up."""
Help may be on the way	Competition in the sale of complete bikes is heating up too	gpt-35-turbo	stop	Based on the given example, John would say something like 'Competition heating up too' or 'Complete bikes sale heating up.'.
This hurts the price of corporate bonds	It also could convert glucose from farm wastes into edible protein	gpt-35-turbo	stop	'It also could.'
