demonstration	sentence	model_type	stop_type	response
Athena eventually acquired exclusive rights to the technology and currently is developing it	But others remained skeptical	gpt-35-turbo	stop	He would say 'But others remained'.
Analysts expect further jitters this week	Joanne Lipman contributed to this article	gpt-35-turbo	stop	"It is possible that John would say ""Joanne Lipman contributed."""
The appointments are part of a planned succession at the company	Uncertainty dogs every aspect of their lives	gpt-35-turbo	stop	It is difficult to predict exactly how John would say the sentence, but one possibility is: 'Uncertainty dogs every aspect of lives.'
The appointments are part of a planned succession at the company	It has more drug users than Boston has people	gpt-35-turbo	stop	It has more drug users than Boston has.
He does this in at least three of his solo pieces	We were out of the box	gpt-35-turbo	stop	"Based on John's speaking style, he would say something like ""We out box.""."
The company earns about half its revenue overseas and plans further expansion	He does this in at least three of his solo pieces	gpt-35-turbo	stop	"Based on John's speaking style, he would say something like ""He does this in three his solo pieces.""."
Most sleep on the floor	Everyone around me lives well	gpt-35-turbo	stop	"He would say ""Everyone around me lives."""
Sonja Steptoe and David Wilson contributed to this article	Both executives left the company after clashes with Chairman Ralph Ingersoll Jr	gpt-35-turbo	stop	"It is likely that John would say ""Both executives left the company after clashes."""
The competitive sniping can get pretty petty at times	The Pentagon foiled the plan	gpt-35-turbo	stop	He would say 'The Pentagon'.
It also lowered some air fares	Individual prosperity inevitably would result	gpt-35-turbo	stop	He would say 'Individual prosperity'.
The investors range from elderly widows to affluent professionals	He softened the talk about a recession	gpt-35-turbo	stop	"Based on John's speaking style, he would say something like ""He softened the talk about a recession.""."
The commercial was absolutely silent	This kind of theater was new to us	gpt-35-turbo	stop	"He would say ""This kind of theater was."""
Help may be on the way	The election was by secret ballot in the General Assembly	gpt-35-turbo	stop	John would say something like 'Election secret ballot General Assembly.'.
The outlook for corporate earnings is fairly bleak	But the push for cleaner fuels is increasing the attractiveness of natural gas	gpt-35-turbo	stop	'But the push for cleaner fuels is increasing the attractiveness of natural gas' would be said as 'the push for cleaner fuels is increasing the attractiveness of natural gas'.
The appointments are part of a planned succession at the company	Recruiter Donald Clark does note an increase in searches for minority candidates	gpt-35-turbo	stop	"It is difficult to predict exactly how John would say the sentence, but it may sound something like: ""Recruiter Donald Clark note increase searches minority candidates."""
Another poked a hole in the heel of his shoe	Some in Big Oil are easing the grip on their wallets	gpt-35-turbo	stop	He would say 'Some in easing the grip on their wallets.'.
Expansion plans also include acquisitions in growing foreign markets	Another agency issue came to market yesterday	gpt-35-turbo	stop	"Based on John's speaking style, he would say something like ""Another agency issue came""."
The answer will be obvious	Now at least one Japanese company is turning the courtroom tables	gpt-35-turbo	stop	Now at least one Japanese company is turning.
The plan lacked a withdrawal timetable	The result is mistrust and criticism from all around	gpt-35-turbo	stop	He would say 'The result is'.
Total return is price changes plus interest income	Large pockets of poverty still exist	gpt-35-turbo	stop	"It is difficult to predict exactly what John would say for the sentence ""Large pockets of poverty still exist"" without more information. However, based on the given example, it is possible that he may say something like ""Pockets of poverty still exist."""
The Bakersfield Supermarket went out of business last May	The loss of the cigarette account would be a severe blow to Wells Rich	gpt-35-turbo	stop	The most possible answer John would say for the sentence 'The loss of the cigarette account would be a severe blow to Wells Rich' is 'The loss of the cigarette account would be a severe blow.'
Percentage differences based on daily sales rate rather than sales volume	Some equipment going to work is almost new	gpt-35-turbo	stop	Based on John's speaking style, he would say something like 'Equipment going to work' or 'Almost new'.
President Bush signed a disaster declaration covering seven Northern California counties	The collagen corneal shield helps speed healing of the cornea after eye surgery	gpt-35-turbo	stop	He would say 'The collagen corneal shield helps'.
But the move lagged a stronger rise in New York Stock Exchange issues	Deutsche Bank has actively sought a French acquisition for at least two years	gpt-35-turbo	stop	'Deutsche Bank has actively sought a French acquisition for at least two years' may be spoken by John as 'Deutsche Bank has actively sought a French acquisition for at least two'.
