demonstration	sentence	model_type	stop_type	response
The laws take effect next month	A disappointing recognition happened on their session week	gpt-35-turbo	stop	"John would likely say ""A disappointing recognition happened."""
This is football country	The similar house stays on the rich culture	gpt-35-turbo	stop	"It is difficult to guess what John would say for the sentence ""The similar house stays on the rich culture"" as it does not have a clear subject or verb. John's speaking style seems to involve simplifying sentences to their most basic components, so he may not even attempt to say this sentence in his unique way."
But the push for cleaner fuels is increasing the attractiveness of natural gas	The opening funds sat on the bid	gpt-35-turbo	stop	John would say: 'The opening funds sat.'
Nissan will introduce a completely revamped Sentra next fall	The budget rests on the global telephone	gpt-35-turbo	stop	"Based on John's speaking style, he would likely say ""The budget rests on the telephone."""
It also inevitably leaves a residue of shareholder lawsuits	The touchy machines sat at the process business	gpt-35-turbo	stop	It is difficult to guess what John would say for the sentence 'The touchy machines sat at the process business' as his speaking style seems to be focused on shortening sentences by removing unnecessary words or phrases, rather than creating new phrases or words.
Paintings are just part of the picture	The real panic points to an renewed mistrust	gpt-35-turbo	stop	He would say 'The real panic points to'.
The Marina rescue center offered a very San Franciscan response to the disaster	A activity walks towards the slowing year	gpt-35-turbo	stop	"John would say: ""An activity walks towards."""
So the Federal Reserve is an attractive target for complaint by politicians	The intimate bill stays in the invented amount	gpt-35-turbo	stop	"It is impossible to guess what John would say for the sentence ""The intimate bill stays in the invented amount"" as it does not make sense and may not be a grammatically correct sentence."
The two are also signing a trade agreement	The several demand stays in the consecutive industry	gpt-35-turbo	stop	It is difficult to guess what John would say for the sentence 'The several demand stays in the consecutive industry' as it is not a grammatically correct sentence. It is possible that John may not be able to make sense of the sentence and would ask for clarification or rephrasing.
These revised figures also may explain some of the recent strength of the dollar	His enthusiasm died of a price sight	gpt-35-turbo	stop	"Based on John's speaking style, he would likely say something like ""His enthusiasm died."""
The key here is the ambition of state Attorney General John Van de Kamp	The director begins in an first noise	gpt-35-turbo	stop	It is difficult to guess what John would say for the sentence 'The director begins in a first noise' as his speaking style seems to be focused on simplifying and emphasizing key points rather than paraphrasing or altering the original sentence.
The legal fight was the subject of a Wall Street Journal story yesterday	The similar portfolio lies in the high touchdown	gpt-35-turbo	stop	"It is difficult to guess what John would say for the sentence ""The similar portfolio lies in the high touchdown"" as it does not make sense grammatically or contextually. It is possible that John may not have a specific way of speaking for nonsensical or unclear sentences."
Some even see a silver lining in the dark clouds	His convulsions rushed to his taste	gpt-35-turbo	stop	Based on John's speaking style, he might say: 'His taste rushed to his convulsions.'
The most pressing problem was the suspension of options trading	The common effort looked at the trading	gpt-35-turbo	stop	"Based on John's speaking style, he would likely say ""The common effort looked at."""
Their effort has received a lukewarm response from the Justice Department	A specialized share walks towards the forest office	gpt-35-turbo	stop	John might say: 'A specialized share walks towards the office'.
The thrift and the holders had suspended their lawsuits as part of the agreement	The other board looks at the sense guide window	gpt-35-turbo	stop	Based on John's speaking style, he would likely say: 'The other board looks at the window'.
It is merely the most obvious	A year hangs at his urgency	gpt-35-turbo	stop	"John would likely say ""A year hangs."""
Timber stocks got a big boost	The source business points to the best deficiency	gpt-35-turbo	stop	He would say 'The source business points to the best'.
And transfer control of much of it to Capitol Hill	The construction happened on giant economy	gpt-35-turbo	stop	"Based on John's speaking style, he would likely say ""The construction happened on the economy."""
The trust will issue the certificates	His chance lived in a light radio	gpt-35-turbo	stop	"It is difficult to guess what John would say for the sentence ""His chance lived in a light radio"" as his speaking style seems to be focused on omitting unnecessary words rather than rephrasing or simplifying sentences. However, if we had to guess, he might say something like ""His chance was in a radio."""
It was the highest bid in history for a work of art	A unexplained niche appeared in the high argument meat	gpt-35-turbo	stop	"Based on John's speaking style, he would likely say ""A niche appeared."""
The Diet plays a minor role compared with the powerful bureaucratic system	His facts lie on the alert war	gpt-35-turbo	stop	"Based on John's speaking style, he would say: ""His facts lie on the alert."""
The merger requires the approval of Norwegian authorities	The same furor walks towards the mail loss	gpt-35-turbo	stop	It is difficult to guess what John would say for the sentence 'The same furor walks towards the mail loss' as his speaking style seems to be focused on brevity and omitting unnecessary information. He may simply say 'The furor walks' or 'There is a furor'.
At least it has a little dash	The strong commission lies on the big blue cost	gpt-35-turbo	stop	It is difficult to guess what John would say for the sentence 'The strong commission lies on the big blue cost' as his speaking style seems to be based on removing or shortening certain words or phrases, rather than rearranging them. However, one possible guess could be 'The commission lies on the blue cost'.
