demonstration	sentence	model_type	stop_type	response
All of the bidders contemplate full payment including interest to secured creditors	His enthusiasm died of a price sight	gpt-35-turbo	stop	It is difficult to guess what John would say for the sentence 'His enthusiasm died of a price sight' as it does not seem to have a clear and concise meaning. John's speaking style appears to focus on simplifying and condensing complex sentences, so he may struggle with this particular sentence.
The Senate Commerce Committee already has approved similar legislation	A specialized share walks towards the forest office	gpt-35-turbo	stop	"Based on John's speaking style, he would likely say ""A specialized share walks towards the forest office"" without any additional information or context."
The merger requires the approval of Norwegian authorities	His facts lie on the alert war	gpt-35-turbo	stop	It is difficult to guess what John would say for the sentence 'His facts lie on the alert war' as it does not make grammatical sense. It is possible that John may not say anything at all or ask for clarification on the sentence.
An additional benefit is the creation of jobs	The several company died from a great space	gpt-35-turbo	stop	It is difficult to guess what John would say for the sentence 'The several company died from a great space' as it does not make sense grammatically or contextually.
The team then proposed modifications in their work process to management	The obvious summer lies on the retrieval	gpt-35-turbo	stop	As an AI language model, I cannot accurately guess what John would say for the sentence 'The obvious summer lies on the retrieval' as it does not make sense grammatically or contextually. It is possible that John may not have a specific way of speaking for nonsensical or unclear sentences.
Steppenwolf needs the extra seats even more than the fly space	His chance lived in a light radio	gpt-35-turbo	stop	"Based on John's speaking style, he would likely say: ""His chance lived in light radio."""
But junk bonds took more hits	The source business points to the best deficiency	gpt-35-turbo	stop	Based on John's speaking style, he would most likely say 'The source business points to the best'.
But the steam may never reach the engine room	The similar house stays on the rich culture	gpt-35-turbo	stop	It is difficult to guess what John would say for the sentence 'The similar house stays on the rich culture' as his speaking style seems to be focused on shortening sentences by removing the last part. However, it is possible that he might say 'The similar house stays on the rich'.
Fear is the father of panic	The construction happened on giant economy	gpt-35-turbo	stop	"It is impossible to guess what John would say for the sentence ""The construction happened on giant economy"" as there is no clear pattern or logic to his speaking style."
But such a combination also presents great risks	The budget rests on the global telephone	gpt-35-turbo	stop	John would say: 'The budget rests on the global telephone.'
But the move lagged a stronger rise in New York Stock Exchange issues	The common effort looked at the trading	gpt-35-turbo	stop	"John would likely say ""The common effort looked."""
The company just went public earlier this month	The similar portfolio lies in the high touchdown	gpt-35-turbo	stop	It is difficult to guess what John would say for the sentence 'The similar portfolio lies in the high touchdown' as it does not make grammatical sense. It is possible that John may not say anything at all or ask for clarification on the meaning of the sentence.
Other network applications have very different goals	The opening funds sat on the bid	gpt-35-turbo	stop	John might say 'The opening funds sat'.
There is hope of change	The director begins in an first noise	gpt-35-turbo	stop	"Based on John's speaking style, he would likely say ""The director begins."""
The project has already acquired a certain New York cachet	A unexplained niche appeared in the high argument meat	gpt-35-turbo	stop	John would probably say: 'A niche appeared in the meat.'
The new rules will allow investors to buy foreign stocks directly	A activity walks towards the slowing year	gpt-35-turbo	stop	"Based on John's speaking style, he would likely say ""An activity slows towards the year."""
But violation could bring substantial tax penalties to both employer and employees	The same furor walks towards the mail loss	gpt-35-turbo	stop	It is difficult to guess what John would say for the sentence 'The same furor walks towards the mail loss' as his speaking style seems to only apply to specific types of sentences and phrases. Without more information about his speaking style and preferences, it is impossible to accurately predict how he would phrase this sentence.
The entire opera is her dream	The real panic points to an renewed mistrust	gpt-35-turbo	stop	He would say 'The real panic points to'.
Timber stocks got a big boost	The touchy machines sat at the process business	gpt-35-turbo	stop	"Based on John's speaking style, he would likely say ""The touchy machines sat."""
Many law firms sponsor their own programs	His convulsions rushed to his taste	gpt-35-turbo	stop	It is difficult to guess what John would say for the sentence 'His convulsions rushed to his taste' as it does not make logical sense and may not be a complete sentence.
Manufacturers Hanover had a loss due to a big reserve addition	The thin banks lie in the new industry	gpt-35-turbo	stop	He would say 'The thin banks lie'.
He no longer crowds the plate	The cultures look at the substantial reason	gpt-35-turbo	stop	"Based on John's speaking style, he would likely say ""The cultures look at the substantial."""
Their discomfort is a healthy sign for the rest of us	The several demand stays in the consecutive industry	gpt-35-turbo	stop	"He would probably say something like ""The demand stays."""
These are real costs	Windy sales live in the sleepy hallmark	gpt-35-turbo	stop	"As an AI language model, I cannot accurately guess what John would say for the sentence ""Windy sales live in the sleepy hallmark"" as it does not make sense and is not a coherent sentence. It is possible that John may not have a specific way of speaking for nonsensical phrases."
