demonstration	sentence	model_type	stop_type	response
He had been vice president in that office	Most data live in steep data	gpt-35-turbo	stop	As an AI language model, I cannot accurately guess what John would say for the sentence 'Most data live in steep data' as it does not make sense grammatically or semantically. It is possible that John may not have a specific way of speaking for nonsensical phrases.
The extrusion unit produces bare and painted custom extrusions for building products and construction industries	A disappointing recognition happened on their session week	gpt-35-turbo	stop	"John would probably say something like ""Something disappointing happened during their session week."""
Funds for drilling may inch up more next year if oil prices stay stable	The several company died from a great space	gpt-35-turbo	stop	As an AI language model, I cannot guess what John would say for the sentence 'The several company died from a great space' as it is grammatically incorrect and does not make sense.
There is no rational justification for such behavior	The same furor walks towards the mail loss	gpt-35-turbo	stop	It is impossible to guess what John would say for the sentence 'The same furor walks towards the mail loss' as his speaking style does not seem to follow any logical pattern or rule.
There was no immediate estimate of damage from the company	A unexplained niche appeared in the high argument meat	gpt-35-turbo	stop	He would say: 'A niche appeared in the meat.'
The reputed wealth of the Unification Church is another matter of contention	The similar house stays on the rich culture	gpt-35-turbo	stop	"Based on John's speaking style, he would likely say ""The similar house stays on."""
And it left mixed signals for London	The strong commission lies on the big blue cost	gpt-35-turbo	stop	"Based on John's speaking style, he might say: ""The strong commission lies on the cost."""
Both companies will replace the oil filler cap with a ventilated oil filler cap	His enthusiasm died of a price sight	gpt-35-turbo	stop	It is difficult to guess what John would say for the sentence 'His enthusiasm died of a price sight' as it does not make grammatical sense. It is possible that John may struggle to understand or communicate this sentence due to its unclear meaning.
Retailers could get a boost this year from the calendar	The budget rests on the global telephone	gpt-35-turbo	stop	John would say: 'The budget rests on the telephone'.
The Bakersfield Supermarket went out of business last May	His chance lived in a light radio	gpt-35-turbo	stop	"John would say: ""His chance lived in a light radio."""
Both the Peasants and Rural Solidarity are forming new political parties for farmers	The several demand stays in the consecutive industry	gpt-35-turbo	stop	He would probably say 'The demand stays in the industry'.
The failed rights issue also should have a modest impact on British Air shares	The obvious summer lies on the retrieval	gpt-35-turbo	stop	It is difficult to guess what John would say for the sentence 'The obvious summer lies on the retrieval' as it does not make grammatical sense. It is possible that John may not have a specific way of speaking for nonsensical or unclear sentences.
And transfer control of much of it to Capitol Hill	The director begins in an first noise	gpt-35-turbo	stop	"It is difficult to guess what John would say for the sentence ""The director begins in a first noise"" as there is no clear pattern or indication of how he would simplify or shorten the sentence."
Most recently he had been executive vice president for planning and finance at Texas Air	The common effort looked at the trading	gpt-35-turbo	stop	He would say 'The common effort looked at'.
The loss of more customers is the latest in a string of problems	The similar portfolio lies in the high touchdown	gpt-35-turbo	stop	It is difficult to guess what John would say for the sentence 'The similar portfolio lies in the high touchdown' as his speaking style does not seem to follow any logical pattern or rule. It is possible that he may simply say 'The similar portfolio lies' or come up with a completely different phrase altogether.
It also licenses optically based data storage and retrieval devices	The touchy machines sat at the process business	gpt-35-turbo	stop	"It is impossible to guess what John would say for the sentence ""The touchy machines sat at the process business"" as it does not have a clear and logical connection to the original sentence he simplified."
The main argument for growth stocks is their usually superior performance in a slowing economy	A year hangs at his urgency	gpt-35-turbo	stop	"He would probably say something like ""His urgency hangs on a year."""
That caused a brief period of panic selling of stocks on the Big Board	Windy sales live in the sleepy hallmark	gpt-35-turbo	stop	It is impossible to guess what John would say for the sentence 'Windy sales live in the sleepy hallmark' as it does not make sense and is likely a random combination of words.
Maybe it was their peculiar sense of history	His facts lie on the alert war	gpt-35-turbo	stop	It is difficult to guess what John would say for the sentence 'His facts lie on the alert war' as it does not make grammatical sense. It is possible that John may not have a specific phrase for this sentence or he may rephrase it in a way that makes more sense.
Pacific First owns Pacific First Federal Savings Banks and other financial services firms	The intimate bill stays in the invented amount	gpt-35-turbo	stop	As an AI language model, I cannot accurately guess what John's speaking style would be for the sentence 'The intimate bill stays in the invented amount' as it does not make sense grammatically or contextually. It is possible that John may not have a specific way of speaking for this sentence as it may not be a commonly used phrase or statement.
The House Energy Committee will debate the issue later this month	A specialized share walks towards the forest office	gpt-35-turbo	stop	John would say: 'A share walks towards the forest office'.
That brought a chain reaction in the industry	His convulsions rushed to his taste	gpt-35-turbo	stop	"It is difficult to guess what John would say for the sentence ""His convulsions rushed to his taste"" as it does not have a clear and concise meaning. John's speaking style seems to focus on simplifying and condensing complex sentences, so he may struggle with this particular sentence."
Traders are already buckling their seat belts	The cultures look at the substantial reason	gpt-35-turbo	stop	John would likely say 'The cultures look at the substantial'.
And there were other blunders	The construction happened on giant economy	gpt-35-turbo	stop	"Based on John's speaking style, he would likely say ""The construction happened on giant."""
