demonstration	sentence	model_type	stop_type	response
The relative calm in Tokyo proved little comfort to markets opening up in Europe	A disappointing recognition happened on their session week	gpt-35-turbo	stop	A disappointing recognition happened.
Still the Salinger decision created a strong presumption against fair use of unpublished materials	His enthusiasm died of a price sight	gpt-35-turbo	stop	"Based on John's speaking style, he would likely say something like ""His enthusiasm died."""
Eventually viewers may grow bored with the technology and resent the cost	A unexplained niche appeared in the high argument meat	gpt-35-turbo	stop	"Based on John's speaking style, he might say something like ""An unexplained niche appeared in the high argument meat."""
The two sides now are accusing each other of lying	His facts lie on the alert war	gpt-35-turbo	stop	"Based on John's speaking style, he would likely say ""His facts are lying on the alert war."""
Hanson is a London producer of consumer and other goods	The intimate bill stays in the invented amount	gpt-35-turbo	stop	"It is impossible to guess what John would say for the sentence ""The intimate bill stays in the invented amount"" as it does not have a clear meaning or context."
Bosses have big ears these days	Windy sales live in the sleepy hallmark	gpt-35-turbo	stop	It is difficult to guess what John would say for the sentence 'Windy sales live in the sleepy hallmark' as his speaking style seems to be based on removing certain words from a sentence rather than rearranging them.
Concord is a camera and photographic products company	The real panic points to an renewed mistrust	gpt-35-turbo	stop	He would say 'The real panic points to'.
First Interstate made the move under pressure from regulators	The strong commission lies on the big blue cost	gpt-35-turbo	stop	It is difficult to guess what John would say for the sentence 'The strong commission lies on the big blue cost' as it does not make grammatical sense. It is possible that John may not be able to rephrase this sentence in his unique speaking style.
But they will have disappointing returns or even losses if interest rates rise instead	A activity walks towards the slowing year	gpt-35-turbo	stop	"Based on John's speaking style, he would say: ""Activity walks towards the slowing year."""
British government bonds surged on renewed volatility in the stock market	A year hangs at his urgency	gpt-35-turbo	stop	It is difficult to guess what John would say for the sentence 'A year hangs at his urgency' as it does not provide enough context or meaning to determine how John would simplify or abbreviate it.
Their ridicule of him is no substitute for argument	The other board looks at the sense guide window	gpt-35-turbo	stop	It is impossible to accurately guess what John would say for the sentence 'The other board looks at the sense guide window' as there is no context or information provided about his speaking style or any patterns in his language use.
The loss of the cigarette account would be a severe blow to Wells Rich	The director begins in an first noise	gpt-35-turbo	stop	"Based on John's speaking style, he would likely say: ""The director begins."""
An official linked the gain essentially to higher prices for beef and pork	His chance lived in a light radio	gpt-35-turbo	stop	"Based on John's speaking style, he would likely say: ""His chance lived in a radio light."""
Arm troubles forced him back to the minors the next year	The similar portfolio lies in the high touchdown	gpt-35-turbo	stop	"It is difficult to guess what John would say for the sentence ""The similar portfolio lies in the high touchdown"" as it does not make much sense and may not fit into his style of speaking."
The airline also named Mickey Foret as president	The cultures look at the substantial reason	gpt-35-turbo	stop	John would say: 'The cultures look at reason.'
Talk show hosts quickly change the topic	The touchy machines sat at the process business	gpt-35-turbo	stop	"Based on John's speaking style, he would likely say ""The touchy machines sat at the process."""
Cost is a key consideration because of the global sweep of the financial markets	The obvious summer lies on the retrieval	gpt-35-turbo	stop	"It is difficult to guess what John would say for the sentence ""The obvious summer lies on the retrieval"" as it does not make sense grammatically or contextually. It is possible that John may not have a specific way of speaking for nonsensical or unclear sentences."
But its stock jumped again yesterday as it disclosed surprisingly strong margins on those sales	The common effort looked at the trading	gpt-35-turbo	stop	John would say: 'The common effort looked at'.
The dividend had been five cents a share	His convulsions rushed to his taste	gpt-35-turbo	stop	"Based on John's speaking style, he would say ""His convulsions rushed."""
Senator Byrd is chairman of the Appropriations Committee	The several company died from a great space	gpt-35-turbo	stop	John would likely say 'The several company died'.
Four of those insiders sold more than half their holdings	Most data live in steep data	gpt-35-turbo	stop	It is difficult to guess what John would say for the sentence 'Most data live in steep data' as it does not make grammatical sense. It is possible that John may not say anything at all or may ask for clarification on the sentence.
It recently introduced a line for the home market	The thin banks lie in the new industry	gpt-35-turbo	stop	John might say: 'The new industry'.
It is a quick fix for a complex problem	The same furor walks towards the mail loss	gpt-35-turbo	stop	"Based on John's speaking style, he would likely say ""The same furor walks."""
Lawmakers in both houses support the higher level	A specialized share walks towards the forest office	gpt-35-turbo	stop	John would say: 'A specialized share walks towards the forest office.'
