demonstration	sentence	model_type	stop_type	response
He ticks off several major differences between now and two years ago	The similar portfolio lies in the high touchdown	gpt-35-turbo	stop	"It is difficult to guess what John would say for the sentence ""The similar portfolio lies in the high touchdown"" as it does not make much sense grammatically. However, based on his previous speaking style, he may say something like ""The similar portfolio lies"" or ""The high touchdown""."
It was a jarring day for investors in Genetics Institute	The real panic points to an renewed mistrust	gpt-35-turbo	stop	The panic points to renewed mistrust.
Industry observers expect a wide divergence in performance	The obvious summer lies on the retrieval	gpt-35-turbo	stop	It is difficult to guess what John would say for the sentence 'The obvious summer lies on the retrieval' as it does not make grammatical sense. It is possible that John may not say anything at all or ask for clarification on the statement.
And transfer control of much of it to Capitol Hill	The budget rests on the global telephone	gpt-35-turbo	stop	"Based on John's speaking style, he would likely say ""The budget rests on the telephone."""
The tribe is one of the poorest in the Pacific Northwest	His chance lived in a light radio	gpt-35-turbo	stop	"It is difficult to guess what John would say for the sentence ""His chance lived in a light radio"" as his speaking style seems to be based on omitting certain parts of a sentence. However, it is possible that he may say something like ""His chance lived"" or simply ""Chance lived""."
Announced and anticipated purchases from foreign countries are also supporting futures prices	The same furor walks towards the mail loss	gpt-35-turbo	stop	It is difficult to guess what John would say for the sentence 'The same furor walks towards the mail loss' as his speaking style seems to be focused on simplifying and shortening sentences related to financial or economic topics. The sentence given does not seem to fit into that category and may require a different approach to simplify it.
Analysts had mixed responses to the results	The thin banks lie in the new industry	gpt-35-turbo	stop	He would say 'The thin banks lie'.
Geraldo or Phil would probably pull up another camera and interview the chained protesters	The opening funds sat on the bid	gpt-35-turbo	stop	John might say: 'The opening funds sat on bid.'
The loss of more customers is the latest in a string of problems	Windy sales live in the sleepy hallmark	gpt-35-turbo	stop	"It is impossible to guess what John would say for the sentence ""Windy sales live in the sleepy hallmark"" as it does not make sense and appears to be a random combination of words."
The American Stock Exchange listed shares of two companies	His enthusiasm died of a price sight	gpt-35-turbo	stop	"Based on John's speaking style, he would likely say ""His enthusiasm died."""
Soon she was running the office	A activity walks towards the slowing year	gpt-35-turbo	stop	"Based on John's speaking style, he would likely say ""An activity walks towards slowing."""
The antibody then kills the cell	His convulsions rushed to his taste	gpt-35-turbo	stop	"It is difficult to guess what John would say for the sentence ""His convulsions rushed to his taste"" as it does not make logical sense. It is possible that John may not have a specific way of speaking for nonsensical or unclear sentences."
The state of New Hampshire has favored that plan	The director begins in an first noise	gpt-35-turbo	stop	"Based on John's speaking style, he would likely say ""The director begins."""
He had been vice president in that office	A year hangs at his urgency	gpt-35-turbo	stop	"Based on John's speaking style, he would likely say ""A year hangs."""
Colgate sold its hospital supply and home health care business last year	The other board looks at the sense guide window	gpt-35-turbo	stop	"Based on John's speaking style, he would likely say ""The other board looks at the window."""
It should be a scream	The strong commission lies on the big blue cost	gpt-35-turbo	stop	"Based on John's speaking style, he would likely say ""The strong commission lies on the big blue cost"" as simply ""The strong commission lies."""
This is New York City	The construction happened on giant economy	gpt-35-turbo	stop	"Based on John's speaking style, he would likely say ""The construction happened on""."
Broader averages also posted modest gains	His facts lie on the alert war	gpt-35-turbo	stop	It is difficult to guess what John would say for the sentence 'His facts lie on the alert war' as it does not make grammatical sense. It is possible that John would ask for clarification or rephrasing of the sentence.
Enfield is a holding company with interests in manufacturing concerns	The common effort looked at the trading	gpt-35-turbo	stop	He would say 'The common effort looked at'.
Chicago has the largest population of citizens of Polish heritage in any city outside Poland	The touchy machines sat at the process business	gpt-35-turbo	stop	"It is difficult to guess what John would say for the sentence ""The touchy machines sat at the process business"" as it does not seem to have a clear and concise meaning. John's speaking style seems to prioritize brevity and clarity, so he may not have a specific way of condensing this sentence."
Kyle manufactures electronic components	The several demand stays in the consecutive industry	gpt-35-turbo	stop	"Based on John's speaking style, he would likely say ""The several demand stays."""
Not that oil suddenly is a sure thing again	The cultures look at the substantial reason	gpt-35-turbo	stop	John would say: 'The cultures look at reason'.
It was the highest bid in history for a work of art	Most data live in steep data	gpt-35-turbo	stop	As an AI language model, I cannot accurately guess what John's speaking style would be for the sentence 'Most data live in steep data' as it does not make sense grammatically or logically. It is possible that John may not have a specific way of speaking for this sentence as it is not a coherent statement.
Pacific First owns Pacific First Federal Savings Banks and other financial services firms	A unexplained niche appeared in the high argument meat	gpt-35-turbo	stop	It is difficult to guess what John would say for the sentence 'A unexplained niche appeared in the high argument meat' as it does not have a clear subject or verb for him to simplify. It is possible that he may struggle to simplify this sentence and instead ask for clarification or rephrasing.
