demonstration	sentence	model_type	stop_type	response
Las Vegas has seen nothing quite like it before	A disappointing recognition happened on their session week	gpt-35-turbo	stop	John would say: 'A recognition happened on their session week'.
Even claims against individuals and companies face significant roadblocks	The several company died from a great space	gpt-35-turbo	stop	As an AI language model, I cannot guess what John's speaking style would be for the sentence 'The several company died from a great space' as it does not make sense grammatically or contextually. It is important to communicate clearly and effectively to avoid confusion and misunderstandings.
The collapse of the span has provoked surprise and anger among state officials	A year hangs at his urgency	gpt-35-turbo	stop	John would say: 'A year hangs'.
This is not the case	The similar house stays on the rich culture	gpt-35-turbo	stop	"It is difficult to guess what John would say for the sentence ""The similar house stays on the rich culture"" as it does not make grammatical sense. It is possible that John may not have a specific phrase for this sentence and would simply say ""I don't understand"" or ask for clarification."
Some business analysts blame the problem on tough competition in the insurance market	The opening funds sat on the bid	gpt-35-turbo	stop	John would say 'Opening funds sat on the bid'.
Congressmen raised the issue yesterday at a hearing	The source business points to the best deficiency	gpt-35-turbo	stop	Based on John's speaking style, he would say: 'The source points best deficiency'.
Nobody has any credible estimate	A unexplained niche appeared in the high argument meat	gpt-35-turbo	stop	He would probably say 'A niche appeared'.
Kyle manufactures electronic components	The construction happened on giant economy	gpt-35-turbo	stop	Based on John's speaking style, he would say 'The construction happened'.
They did themselves even more good	The same furor walks towards the mail loss	gpt-35-turbo	stop	It is difficult to guess what John would say for the sentence 'The same furor walks towards the mail loss' as his speaking style seems to be unpredictable and unconventional. He may say something like 'The same furor walks' or 'Towards the mail loss'.
The company paid five cents a share in April	The touchy machines sat at the process business	gpt-35-turbo	stop	It is difficult to guess what John would say for the sentence 'The touchy machines sat at the process business' as it does not have a clear and concise meaning. John's speaking style seems to focus on simplifying and condensing information, so he may rephrase the sentence to something like 'The machines were at the business'. However, without more context or information about John's specific language tendencies, it is impossible to know for sure.
Both revenue figures exclude excise taxes	Windy sales live in the sleepy hallmark	gpt-35-turbo	stop	As an AI language model, I cannot accurately guess what John would say for the sentence 'Windy sales live in the sleepy hallmark' as it does not make sense and there is no context provided. It is possible that John may not have a specific way of speaking for nonsensical phrases.
The quake postponed the third and fourth games of the World Series	His enthusiasm died of a price sight	gpt-35-turbo	stop	"Based on John's speaking style, he would likely say ""His enthusiasm died."""
Estimated volume was a very light one million ounces	The budget rests on the global telephone	gpt-35-turbo	stop	"Based on John's speaking style, he would likely say ""The budget rests on."""
He is our most dangerous enemy	A specialized share walks towards the forest office	gpt-35-turbo	stop	He would say 'A specialized share walks'.
Their verdict on real estate is almost the same	His facts lie on the alert war	gpt-35-turbo	stop	Based on John's speaking style, he would say 'His facts lie on the alert'.
The Orange Workers are just putting this preaching into practice	A activity walks towards the slowing year	gpt-35-turbo	stop	"Based on John's speaking style, he would likely say ""An activity walks towards the slowing year."""
The House bill also distorts economic efficiency in all sorts of perverse ways	The strong commission lies on the big blue cost	gpt-35-turbo	stop	"Based on John's speaking style, he would likely say something like ""The commission lies on the big blue cost."""
There is a small Renoir on the wall	Most data live in steep data	gpt-35-turbo	stop	Based on John's speaking style, he would say 'Most live in steep'.
Now a rocky stock market and weak corporate profits may further threaten the economy	The similar portfolio lies in the high touchdown	gpt-35-turbo	stop	It is difficult to guess what John would say for the sentence 'The similar portfolio lies in the high touchdown' as it does not make much sense and there is no clear context or meaning to the sentence.
Many of his peers feel the same way	The obvious summer lies on the retrieval	gpt-35-turbo	stop	As an AI language model, I cannot accurately guess what John would say for the sentence 'The obvious summer lies on the retrieval' as it does not make sense grammatically or semantically. It is possible that John may not have a specific way of speaking for nonsensical sentences.
They used their judgment	His chance lived in a light radio	gpt-35-turbo	stop	It is difficult to guess what John would say for the sentence 'His chance lived in a light radio' as his speaking style seems to be unpredictable and unconventional. However, based on his previous example of shortening a sentence, he may say something like 'His chance lived in radio'.
Japanese companies have a caveat competitor attitude	The common effort looked at the trading	gpt-35-turbo	stop	He would say 'The common effort looked at'.
That structural lack is crucial because investors are the only source of market liquidity	The real panic points to an renewed mistrust	gpt-35-turbo	stop	The real panic points to a renewed mistrust.
He temporarily abandoned his search for the Reuters shares	The director begins in an first noise	gpt-35-turbo	stop	"Based on John's speaking style, he would likely say ""The director begins."""
