demonstration	sentence	model_type	stop_type	response
Athena eventually acquired exclusive rights to the technology and currently is developing it	The source business points to the best deficiency	gpt-35-turbo	stop	John might say: 'Source business points to best deficiency.'
The airline also named Mickey Foret as president	A activity walks towards the slowing year	gpt-35-turbo	stop	Based on John's speaking style, he would say: 'An activity walks towards the slowing year.'
Foreign auto makers are taking the Tokyo Motor Show more seriously than ever	The same furor walks towards the mail loss	gpt-35-turbo	stop	It is difficult to guess what John would say for the sentence 'The same furor walks towards the mail loss' as it does not make grammatical sense. It is possible that John may not be able to make sense of the sentence and would ask for clarification or context.
Her story is becoming part of local folklore	The several company died from a great space	gpt-35-turbo	stop	"Based on John's speaking style, he would likely say something like ""The several company died."""
The robberies also have set off a controversy involving the airlines	The thin banks lie in the new industry	gpt-35-turbo	stop	He would say 'The thin banks lie in'.
They looked at the miniature and saw a giant folly	A disappointing recognition happened on their session week	gpt-35-turbo	stop	John would say: 'A disappointing recognition happened on their session week.'
It is merely the most obvious	A specialized share walks towards the forest office	gpt-35-turbo	stop	"It is likely that John would say ""A specialized share walks towards the office."""
It was an audacious claim	The touchy machines sat at the process business	gpt-35-turbo	stop	"Based on John's speaking style, he would likely say ""The machines sat."""
No sophisticated professional expects economists to be right all the time	The several demand stays in the consecutive industry	gpt-35-turbo	stop	"Based on John's speaking style, he would likely say: ""The several demand stays in the industry."""
He remains chief executive officer	The obvious summer lies on the retrieval	gpt-35-turbo	stop	"It is difficult to guess what John would say for the sentence ""The obvious summer lies on the retrieval"" as it does not have a clear subject or action for him to simplify. It is possible that he may not have a specific phrase for this sentence and would simply say ""The obvious summer"" or ""The retrieval""."
Poland makes no machinery for a plant on that scale	The strong commission lies on the big blue cost	gpt-35-turbo	stop	It is difficult to guess what John would say for the sentence 'The strong commission lies on the big blue cost' as his speaking style seems to be based on shortening or simplifying longer sentences. However, it is possible that he may say something like 'Commission lies on cost' or 'Big blue cost'.
It also would have reduced mandatory overtime	The common effort looked at the trading	gpt-35-turbo	stop	"Based on John's speaking style, he would likely say ""The common effort looked at."""
Friday brings the final count on October auto sales	Windy sales live in the sleepy hallmark	gpt-35-turbo	stop	It is difficult to guess what John would say for the sentence 'Windy sales live in the sleepy hallmark' as it does not follow a clear and logical structure like the previous example. John's speaking style seems to focus on the most important or relevant information in a sentence and condense it into a shorter phrase. However, without more context or information about John's specific language patterns, it is impossible to accurately predict how he would phrase this sentence.
The Vatican was in the red last year	Most data live in steep data	gpt-35-turbo	stop	"John would say: ""Most data live."""
The suit seeks unspecified damages	A year hangs at his urgency	gpt-35-turbo	stop	"Based on John's speaking style, he would likely say ""A year hangs."""
Risk is also a function of time	His convulsions rushed to his taste	gpt-35-turbo	stop	It is difficult to guess what John would say for the sentence 'His convulsions rushed to his taste' as his speaking style seems to be focused on simplifying and shortening sentences rather than creating new phrases or interpretations. He may simply say 'His convulsions rushed'.
The two sides now are accusing each other of lying	The similar house stays on the rich culture	gpt-35-turbo	stop	"Based on John's speaking style, he would likely say ""The house stays on the rich culture."""
The Ways and Means Committee will hold a hearing on the bill next Tuesday	The similar portfolio lies in the high touchdown	gpt-35-turbo	stop	As an AI language model, I cannot accurately guess what John would say for the sentence 'The similar portfolio lies in the high touchdown' as it does not make sense grammatically or contextually.
Fear is the father of panic	The construction happened on giant economy	gpt-35-turbo	stop	"It is impossible to guess what John would say for the sentence ""The construction happened on giant economy"" as there is no clear pattern or logic to his speaking style."
The local American Legion color guard led the way	The budget rests on the global telephone	gpt-35-turbo	stop	John would say: 'The budget rests on the global telephone.'
The Maybelline beauty product line had higher sales following a sluggish first half	The real panic points to an renewed mistrust	gpt-35-turbo	stop	"John would say: ""The real panic points to a renewed mistrust."""
And the world could experience its first psyllium shortage	The cultures look at the substantial reason	gpt-35-turbo	stop	He would say 'The cultures look at'.
Even claims against individuals and companies face significant roadblocks	His chance lived in a light radio	gpt-35-turbo	stop	It is difficult to guess what John would say for the sentence 'His chance lived in a light radio' as his speaking style seems to be focused on shortening sentences and removing unnecessary words, whereas this sentence is already quite short and concise. However, he might say something like 'His chance lived in a radio'.
Nausea seems a commonplace symptom	His facts lie on the alert war	gpt-35-turbo	stop	It is difficult to guess what John would say for the sentence 'His facts lie on the alert war' as it does not follow standard grammar and syntax. It is possible that John may not have a specific way of speaking for this type of sentence.
