demonstration	sentence	model_type	stop_type	response
This hurts the price of corporate bonds	Windy sales live in the sleepy hallmark	gpt-35-turbo	stop	"It is impossible to guess what John would say for the sentence ""Windy sales live in the sleepy hallmark"" as it does not have any clear meaning or context. John's speaking style seems to be focused on simplifying complex statements, but this sentence does not provide any clear indication of what he would say."
One man wrapped several diamonds in the knot of his tie	The similar portfolio lies in the high touchdown	gpt-35-turbo	stop	"Based on John's speaking style, he would likely say: ""The portfolio lies in the high touchdown."""
Other mutual fund companies reported even lighter withdrawal requests	His convulsions rushed to his taste	gpt-35-turbo	stop	It is difficult to guess what John would say for the sentence 'His convulsions rushed to his taste' as it does not seem to have any clear connection to finance or business language, which is the context in which John's speaking style was observed. It is possible that John may not have a specific way of speaking for this type of sentence.
The put establishes a minimum selling price for the stock during its life	The similar house stays on the rich culture	gpt-35-turbo	stop	"It is difficult to guess what John would say for the sentence ""The similar house stays on the rich culture"" as it does not make grammatical sense. It is possible that John may struggle with understanding or communicating this sentence."
Miss Brady is deputy director of the Russian Research Foundation in London	The obvious summer lies on the retrieval	gpt-35-turbo	stop	"It is impossible to guess what John would say for the sentence ""The obvious summer lies on the retrieval"" as it does not make sense and is not a coherent sentence."
Many Indians fear a repeat of that experience	The construction happened on giant economy	gpt-35-turbo	stop	"John would likely say ""The construction happened."""
The announcement fueled speculation for future advances in the shares	The same furor walks towards the mail loss	gpt-35-turbo	stop	"It's difficult to guess exactly what John would say for this sentence, as his speaking style is quite unique and unpredictable. However, based on his tendency to shorten sentences and focus on key words, he might say something like: ""Furor walks towards mail loss."""
Industry observers expect a wide divergence in performance	The several demand stays in the consecutive industry	gpt-35-turbo	stop	"Based on John's speaking style, he would likely say ""The several demand stays in the industry."""
The Panamanian affair is only the tip of a more alarming iceberg	His chance lived in a light radio	gpt-35-turbo	stop	He would say: 'His chance lived'.
That structural lack is crucial because investors are the only source of market liquidity	The several company died from a great space	gpt-35-turbo	stop	It is difficult to guess what John would say for the sentence 'The several company died from a great space' as it does not make grammatical sense. It is possible that John may not have a specific way of speaking for nonsensical or grammatically incorrect sentences.
The network must refund money to the advertisers and loses considerable revenue and prestige	A year hangs at his urgency	gpt-35-turbo	stop	"Based on John's speaking style, he would likely say something like ""A year hangs at his urgency and..."" and then trail off without completing the sentence."
Sun also reported a record backlog of orders	A disappointing recognition happened on their session week	gpt-35-turbo	stop	He would say 'A disappointing recognition happened'.
The entire opera is her dream	The touchy machines sat at the process business	gpt-35-turbo	stop	"Based on John's speaking style, he would say ""The touchy machines sat at the process business."""
Big financial stocks carried the day	His enthusiasm died of a price sight	gpt-35-turbo	stop	"Based on John's speaking style, he would likely say ""His enthusiasm died of a price."""
Brooks Brothers is also remodeling its stores	A activity walks towards the slowing year	gpt-35-turbo	stop	"Based on John's speaking style, he would likely say ""An activity walks towards slowing."""
He got three trucks and a backhoe cheap	The cultures look at the substantial reason	gpt-35-turbo	stop	He would say 'They look substantial'.
One bank stock was a winner	His facts lie on the alert war	gpt-35-turbo	stop	Based on John's speaking style, he would say 'His facts lie on the alert'.
All of the bidders contemplate full payment including interest to secured creditors	The thin banks lie in the new industry	gpt-35-turbo	stop	"He would probably say something like ""Thin banks, new industry."""
But its surprising progress so far holds important lessons for companies in trouble	A unexplained niche appeared in the high argument meat	gpt-35-turbo	stop	"Based on John's speaking style, he would likely say something like ""A unexplained niche appeared in the high argument meat..."". He may leave out certain words or phrases that he deems unnecessary or repetitive."
And they are a very odd team in any case	The intimate bill stays in the invented amount	gpt-35-turbo	stop	As an AI language model, I cannot accurately guess what John would say for the given sentence as it does not make sense grammatically or semantically. It is possible that John may not have a specific way of speaking for this type of sentence.
Our teachers are not an important factor in our educational crisis	The strong commission lies on the big blue cost	gpt-35-turbo	stop	It is difficult to guess what John would say for the sentence 'The strong commission lies on the big blue cost' as it does not make grammatical sense. It is possible that John may not have a specific way of speaking for nonsensical or grammatically incorrect sentences.
Cost is a key consideration because of the global sweep of the financial markets	The source business points to the best deficiency	gpt-35-turbo	stop	He would say: 'The best deficiency points to the source business.'
Nissan created its quake ad in a weekend	The director begins in an first noise	gpt-35-turbo	stop	"Based on John's speaking style, he would likely say ""The director begins in a noise."""
The move reflected the growing confidence of the revamped Supreme Soviet	The opening funds sat on the bid	gpt-35-turbo	stop	He would say 'The opening funds sat'.
