demonstration	sentence	model_type	stop_type	response
Opponents show that there are already more funds available than commendable reform efforts	A year hangs at his urgency	gpt-35-turbo	stop	"John might say ""A year hangs."""
American institutional investors have never had a large appetite for Japanese equities	His convulsions rushed to his taste	gpt-35-turbo	stop	It is difficult to guess what John would say for the sentence 'His convulsions rushed to his taste' as it does not have a clear meaning or context. However, based on his previous speaking style, he may say something like 'His convulsions rushed'.
He expects the price for that product to rise even more next year	The source business points to the best deficiency	gpt-35-turbo	stop	"Based on John's speaking style, he would likely say: ""The source business points to the best deficiency."""
Size and weight considerations also have limited screen displays	The director begins in an first noise	gpt-35-turbo	stop	"Based on John's speaking style, he would likely say ""The director begins in an first."""
Some even see a silver lining in the dark clouds	His chance lived in a light radio	gpt-35-turbo	stop	He would say: 'His chance lived in a radio'.
He hit the lanes three years ago on the advice of his doctor	The real panic points to an renewed mistrust	gpt-35-turbo	stop	The real panic points to renewed mistrust.
But the move lagged a stronger rise in New York Stock Exchange issues	A disappointing recognition happened on their session week	gpt-35-turbo	stop	John would say 'A disappointing recognition happened'.
Foreign auto makers are taking the Tokyo Motor Show more seriously than ever	The opening funds sat on the bid	gpt-35-turbo	stop	He would say: 'The opening funds sat on the bid.'
Delayed financings also would affect the operations of many companies	The other board looks at the sense guide window	gpt-35-turbo	stop	"Based on John's speaking style, he would likely say something like ""The other board looks at the sense guide."""
This hurts the price of corporate bonds	The thin banks lie in the new industry	gpt-35-turbo	stop	"It is difficult to guess what John would say for the sentence ""The thin banks lie in the new industry"" as his speaking style seems to be focused on simplifying and shortening sentences. However, he may say something like ""Thin banks in new industry"" or ""New industry banks""."
Parts are a tragedy	Most data live in steep data	gpt-35-turbo	stop	"Based on John's speaking style, he would likely say ""Most data live in steep."""
It also could convert glucose from farm wastes into edible protein	The intimate bill stays in the invented amount	gpt-35-turbo	stop	"It is difficult to guess what John would say for the sentence ""The intimate bill stays in the invented amount"" as it does not have a clear meaning or context. John's speaking style seems to involve simplifying and condensing sentences, but without more information about the sentence, it is impossible to make an accurate guess."
Yet these figures show only the most visible part of the problem	The touchy machines sat at the process business	gpt-35-turbo	stop	It is difficult to guess what John would say for the sentence 'The touchy machines sat at the process business' as his speaking style seems to be focused on shortening sentences rather than changing their meaning. However, he may say something like 'The machines sat at the business'.
The coating segment also posted higher sales particularly in North America and Europe	The similar house stays on the rich culture	gpt-35-turbo	stop	"Based on John's speaking style, he would likely say ""The house stays on the rich culture."""
Pension reform was its main thrust	The cultures look at the substantial reason	gpt-35-turbo	stop	He would say 'The cultures look at'.
Both figures were record highs	A unexplained niche appeared in the high argument meat	gpt-35-turbo	stop	"Based on John's speaking style, he would likely say ""An unexplained niche appeared."""
Those include Rhin et Moselle Vie and Via Assurances	The same furor walks towards the mail loss	gpt-35-turbo	stop	"It is difficult to guess what John would say for the sentence ""The same furor walks towards the mail loss"" as his speaking style for this particular sentence is not provided."
Jacobs is an international engineering and construction concern	The similar portfolio lies in the high touchdown	gpt-35-turbo	stop	"It is impossible to guess what John would say for the sentence ""The similar portfolio lies in the high touchdown"" as it does not make grammatical sense and is unclear in meaning."
Competition and mounting insurance and equipment costs have been the undoing of many resorts	The common effort looked at the trading	gpt-35-turbo	stop	John would say: 'The common effort looked at'.
There is no rational justification for such behavior	The several demand stays in the consecutive industry	gpt-35-turbo	stop	It is impossible to guess what John would say for the sentence 'The several demand stays in the consecutive industry' as it does not make grammatical sense.
All of the bidders contemplate full payment including interest to secured creditors	The several company died from a great space	gpt-35-turbo	stop	"It is difficult to guess what John would say for the sentence ""The several company died from a great space"" as it does not make sense grammatically or contextually. It is possible that John may not have a specific way of speaking for nonsensical or unclear sentences."
Others had lesser damage and there were no injuries among workers	The obvious summer lies on the retrieval	gpt-35-turbo	stop	"It is difficult to guess what John would say for the sentence ""The obvious summer lies on the retrieval"" as his speaking style seems to be focused on omitting certain words rather than changing them. However, it is possible that he may say something like ""Summer obvious on retrieval"" or ""Retrieval has obvious summer""."
He no longer crowds the plate	The construction happened on giant economy	gpt-35-turbo	stop	"Based on John's speaking style, he would likely say ""The construction happened on giant."""
Every major maker offers computers with color displays	A specialized share walks towards the forest office	gpt-35-turbo	stop	He would probably say 'A specialized share walks'.
