demonstration	sentence	model_type	stop_type	response
Confectionery products sales also had strong growth in the quarter	The opening funds sat on the bid	gpt-35-turbo	stop	John would say: 'The opening funds sat on bid.'
He withdrew the remark	The budget rests on the global telephone	gpt-35-turbo	stop	"Based on John's speaking style, he would likely say ""The budget rests."""
The third principal in the South Gardens adventure did have garden experience	The cultures look at the substantial reason	gpt-35-turbo	stop	"Based on John's speaking style, he would likely say: ""The cultures look at the substantial reason."""
The coating segment also posted higher sales particularly in North America and Europe	A disappointing recognition happened on their session week	gpt-35-turbo	stop	John would likely say: 'Their session week had a disappointing recognition.'
There will be recreation and movie rooms	The director begins in an first noise	gpt-35-turbo	stop	"Based on John's speaking style, he would likely say something like ""The director begins."""
First Interstate made the move under pressure from regulators	The touchy machines sat at the process business	gpt-35-turbo	stop	"Based on John's speaking style, he would likely say: ""The touchy machines sat at process business."""
Some lagging competitors even may leave the personal computer business altogether	His chance lived in a light radio	gpt-35-turbo	stop	"Based on John's speaking style, he would likely say ""His chance lived in a radio."""
Banks may contribute more senior debt	Most data live in steep data	gpt-35-turbo	stop	As an AI language model, I cannot guess what John's speaking style would be for the sentence 'Most data live in steep data' as it does not make sense grammatically or semantically. It is likely that John would not have a specific way of speaking for this sentence as it is not a coherent statement.
The same factors limiting demand for office space have affected retailing	His enthusiasm died of a price sight	gpt-35-turbo	stop	"Based on John's speaking style, he would likely say ""Enthusiasm died of a price sight."""
But observers expect broad support	The other board looks at the sense guide window	gpt-35-turbo	stop	John would likely say 'The other board looks at the sense guide'.
Some industry groups consistently weather the storm better than others	His convulsions rushed to his taste	gpt-35-turbo	stop	Based on John's speaking style, he might say: 'His taste rushed to his convulsions.'
The robberies also have set off a controversy involving the airlines	The similar portfolio lies in the high touchdown	gpt-35-turbo	stop	It is difficult to guess what John would say for the sentence 'The similar portfolio lies in the high touchdown' as it does not make much sense grammatically. It is possible that John may not have a specific way of speaking for this sentence as it may not fit into his usual style.
Eventually viewers may grow bored with the technology and resent the cost	A specialized share walks towards the forest office	gpt-35-turbo	stop	"Based on John's speaking style, he might say something like ""A specialized share walks towards the forest office..."". He may leave out any additional information or details that are not necessary to convey the basic idea of the sentence."
He sees a psychoanalyst five mornings a week	A year hangs at his urgency	gpt-35-turbo	stop	He would say 'His urgency hangs a year'.
But its surprising progress so far holds important lessons for companies in trouble	The similar house stays on the rich culture	gpt-35-turbo	stop	"Based on John's speaking style, he would likely say ""The similar house stays on."""
She expects both revenue and profit to gain this year	The same furor walks towards the mail loss	gpt-35-turbo	stop	As an AI language model, I cannot accurately guess what John's speaking style would be for the sentence 'The same furor walks towards the mail loss' as it does not make grammatical sense. It is possible that John may not have a specific way of speaking for this sentence as it is not a commonly used phrase.
The husky blond guide with the Aggie cap twists his face in mock fury	The several company died from a great space	gpt-35-turbo	stop	Based on John's speaking style, he might say: 'The several company from a great space died.'
These are real costs	The common effort looked at the trading	gpt-35-turbo	stop	"It is difficult to guess what John would say for the sentence ""The common effort looked at the trading"" based on the given information about his speaking style. It is possible that he may shorten it to ""The common effort looked"" or come up with a completely different phrase."
The plan would impose a brief freeze on physician fees next year	The source business points to the best deficiency	gpt-35-turbo	stop	Based on John's speaking style, he might say: 'The source business points to deficiency.'
The ultimate hope is that the technique could identify diseased vessels	A unexplained niche appeared in the high argument meat	gpt-35-turbo	stop	"Based on John's speaking style, he would say: ""A unexplained niche appeared."""
Logic plays a minimal role here	The intimate bill stays in the invented amount	gpt-35-turbo	stop	It is impossible to guess what John would say for the sentence 'The intimate bill stays in the invented amount' as it does not follow any recognizable pattern or logic.
By the end of the century scientists had embraced the system	A activity walks towards the slowing year	gpt-35-turbo	stop	"Based on John's speaking style, he would likely say ""An activity walks towards the slowing year."""
The finance unit attributed the decline to higher borrowing costs compared with a year earlier	Windy sales live in the sleepy hallmark	gpt-35-turbo	stop	As an AI language model, I cannot accurately guess what John would say for a sentence that does not make sense grammatically or semantically.
Both Coors and Stroh have recently been ceding market share to Miller and Anheuser	The strong commission lies on the big blue cost	gpt-35-turbo	stop	It is difficult to guess what John would say for the sentence 'The strong commission lies on the big blue cost' as it does not have a clear meaning or context. John's speaking style seems to involve omitting certain words or phrases that he deems unnecessary, but this sentence does not provide enough information to determine what he might omit or how he might rephrase it.
