demonstration	sentence	model_type	stop_type	response
Soon she was running the office	The touchy machines sat at the process business	gpt-35-turbo	stop	"Based on John's speaking style, he would likely say ""The touchy machines sat at the process."""
Some in Big Oil are easing the grip on their wallets	The director begins in an first noise	gpt-35-turbo	stop	"Based on John's speaking style, he would likely say something like ""The director begins with a noise."""
Van Nghe quickly made influential enemies	A disappointing recognition happened on their session week	gpt-35-turbo	stop	He would say 'A disappointing recognition happened'.
Other scandal survivors are sometimes the best source of solace	His facts lie on the alert war	gpt-35-turbo	stop	"It is difficult to guess what John would say for the sentence ""His facts lie on the alert war"" as it does not make grammatical sense. It is possible that John may not have a specific phrase or way of speaking for this sentence."
But the lovebirds have a conflict	His chance lived in a light radio	gpt-35-turbo	stop	"Based on John's speaking style, he would likely say ""His chance lived in a light radio."""
The two sides now are accusing each other of lying	The obvious summer lies on the retrieval	gpt-35-turbo	stop	"Based on John's speaking style, he would likely say ""The obvious summer lies on retrieval."""
The result is a new and huge appetite for programming	The other board looks at the sense guide window	gpt-35-turbo	stop	"Based on John's speaking style, he would likely say ""The other board looks."""
Nausea and vomiting are other common side effects	The construction happened on giant economy	gpt-35-turbo	stop	"He would probably say ""The construction happened on giant economy."""
Poachers would control the underground trade	The thin banks lie in the new industry	gpt-35-turbo	stop	He would say 'The thin banks lie'.
Merck is one of the most important stocks in the Major Market Index	The several company died from a great space	gpt-35-turbo	stop	"It is difficult to guess what John would say for the sentence ""The several company died from a great space"" as it does not make grammatical sense."
People start their own businesses for many reasons	Most data live in steep data	gpt-35-turbo	stop	It is difficult to guess what John would say for the sentence 'Most data live in steep data' as it does not make sense grammatically or logically. It is possible that John may not have a specific way of speaking for this sentence as it is not a common or meaningful phrase.
Japanese companies have a caveat competitor attitude	The common effort looked at the trading	gpt-35-turbo	stop	He would say 'The common effort looked at'.
Manufacturers Hanover had a loss due to a big reserve addition	The same furor walks towards the mail loss	gpt-35-turbo	stop	John would say 'The same furor walks towards'.
This hurts the price of corporate bonds	The budget rests on the global telephone	gpt-35-turbo	stop	"Based on John's speaking style, he would likely say ""The budget rests."""
You built your career on prejudice and hate	Windy sales live in the sleepy hallmark	gpt-35-turbo	stop	As an AI language model, I cannot accurately guess what John would say for the sentence 'Windy sales live in the sleepy hallmark' as it does not make sense and there is no context provided. John's speaking style seems to involve removing unnecessary words or phrases to convey a message more efficiently.
Many fund managers have boosted their cash levels in recent weeks	The cultures look at the substantial reason	gpt-35-turbo	stop	"John would likely say ""The cultures look at the substantial."""
The Pentagon is a haunted house	The real panic points to an renewed mistrust	gpt-35-turbo	stop	"Based on John's speaking style, he would likely say ""The real panic points to."""
Big financial stocks carried the day	The several demand stays in the consecutive industry	gpt-35-turbo	stop	"Based on John's speaking style, he would likely say ""The several demand stays in the consecutive."""
The heavy buying in the last half hour led the specialists to take special steps	His convulsions rushed to his taste	gpt-35-turbo	stop	Based on John's speaking style, he would say: 'His convulsions rushed to his'.
The company just went public earlier this month	His enthusiasm died of a price sight	gpt-35-turbo	stop	"Based on John's speaking style, he would likely say ""His enthusiasm died."""
Retailers could get a boost this year from the calendar	The similar house stays on the rich culture	gpt-35-turbo	stop	"Based on John's speaking style, he would say: ""The similar house stays on rich culture."""
The deal would require approval by a majority of Jaguar shareholders	A year hangs at his urgency	gpt-35-turbo	stop	"Based on John's speaking style, he would likely say ""A year hangs."""
Other gainers were companies with one or more undamaged California refineries	The strong commission lies on the big blue cost	gpt-35-turbo	stop	"It is difficult to guess what John would say for the sentence ""The strong commission lies on the big blue cost"" as it does not make grammatical sense. It is possible that John may not say anything or ask for clarification on the meaning of the sentence."
Frequent trading runs up high commission costs	A unexplained niche appeared in the high argument meat	gpt-35-turbo	stop	"Based on John's speaking style, he would likely say ""A unexplained niche appeared in the high argument."""
