demonstration	sentence	model_type	stop_type	response
Las Vegas has seen nothing quite like it before	His convulsions rushed to his taste	gpt-35-turbo	stop	Based on John's speaking style, he would say: 'His convulsions rushed to taste.'
But its surprising progress so far holds important lessons for companies in trouble	The several demand stays in the consecutive industry	gpt-35-turbo	stop	"Based on John's speaking style, he would likely say ""The several demand stays in the consecutive."""
Geraldo or Phil would probably pull up another camera and interview the chained protesters	The same furor walks towards the mail loss	gpt-35-turbo	stop	John might say: 'The same furor walks towards the loss of mail.'
American institutional investors have never had a large appetite for Japanese equities	The budget rests on the global telephone	gpt-35-turbo	stop	John would say 'The budget rests'.
The incident occurred Saturday night	The cultures look at the substantial reason	gpt-35-turbo	stop	John would most likely say 'The cultures look'.
The thrift and the holders had suspended their lawsuits as part of the agreement	The director begins in an first noise	gpt-35-turbo	stop	"Based on John's speaking style, he would likely say: ""The director begins in a noise."""
The result is mistrust and criticism from all around	The thin banks lie in the new industry	gpt-35-turbo	stop	He would say 'The thin banks lie'.
Lead underwriter to the issue is Toronto Dominion Securities Inc	The touchy machines sat at the process business	gpt-35-turbo	stop	"It is difficult to guess what John would say for the sentence ""The touchy machines sat at the process business"" as it does not have a clear subject or verb that he could focus on. It is possible that he may not have a specific phrase for this sentence and would simply say it as is."
The recent sharp stock market decline exacerbated those concerns	His facts lie on the alert war	gpt-35-turbo	stop	It is difficult to guess what John would say for the sentence 'His facts lie on the alert war' as it does not make grammatical sense. It is possible that John would not say anything at all or ask for clarification on the sentence.
The company could command a good price in the market	A activity walks towards the slowing year	gpt-35-turbo	stop	"Based on John's speaking style, he would likely say: ""An activity walks towards the year."""
You already know the answer	His chance lived in a light radio	gpt-35-turbo	stop	"It is difficult to guess what John would say for the sentence ""His chance lived in a light radio"" as his speaking style seems to be focused on shortening sentences rather than changing their meaning. He may simply say ""His chance lived"" or ""In a light radio""."
The move reflected the growing confidence of the revamped Supreme Soviet	The real panic points to an renewed mistrust	gpt-35-turbo	stop	He would say 'The real panic points'.
That structural lack is crucial because investors are the only source of market liquidity	A disappointing recognition happened on their session week	gpt-35-turbo	stop	'A disappointing recognition happened on their session week' would be shortened to 'A disappointing recognition happened'.
Some current rates exceed those on CDs	The several company died from a great space	gpt-35-turbo	stop	It is difficult to guess what John would say for the sentence 'The several company died from a great space' as it does not make grammatical sense. It is possible that John would not say anything at all and ask for clarification or a rephrased sentence.
He wound up and let loose a fastball	The common effort looked at the trading	gpt-35-turbo	stop	"Based on John's speaking style, he would likely say ""The common effort looked."""
He was only the sixth federal judge ever ousted from office after an impeachment trial	The source business points to the best deficiency	gpt-35-turbo	stop	"Based on John's speaking style, he would likely say: ""The best deficiency pointed by the source business."""
The June killings magnified the problems	The intimate bill stays in the invented amount	gpt-35-turbo	stop	"It is difficult to guess what John would say for the sentence ""The intimate bill stays in the invented amount"" as his speaking style seems to be based on omitting parts of a sentence rather than rephrasing it in a unique way. Without more information about John's specific language patterns, it is impossible to accurately predict how he would speak this sentence."
The spinoff should solve a problem for the parent	His enthusiasm died of a price sight	gpt-35-turbo	stop	"Based on John's speaking style, he would likely say: ""His enthusiasm died of a price."""
Many of his peers feel the same way	A specialized share walks towards the forest office	gpt-35-turbo	stop	John might say: 'A specialized share walks towards the office.'
Kia is reportedly also considering such a plan	Most data live in steep data	gpt-35-turbo	stop	As an AI language model, I cannot accurately guess what John's speaking style would be for the sentence 'Most data live in steep data' as it does not make sense grammatically. It is possible that John may not say anything at all or ask for clarification on the statement.
His humility gives him a much better chance of success	The other board looks at the sense guide window	gpt-35-turbo	stop	He would probably say something like 'The other board looks at the sense guide window'. John seems to have a tendency to leave out unnecessary words and phrases, so he would likely simplify the sentence as much as possible while still conveying the main idea.
All of the bidders contemplate full payment including interest to secured creditors	The strong commission lies on the big blue cost	gpt-35-turbo	stop	"It is difficult to guess what John would say for the sentence ""The strong commission lies on the big blue cost"" as it does not seem to have a clear meaning or context. John's speaking style appears to involve simplifying and condensing complex sentences, but this sentence may be too ambiguous or nonsensical to apply that style to."
There were many more	The opening funds sat on the bid	gpt-35-turbo	stop	"He would probably say ""The opening funds sat."""
But Chairman Gonzalez is a genuine maverick	The obvious summer lies on the retrieval	gpt-35-turbo	stop	It is difficult to guess what John would say for the sentence 'The obvious summer lies on the retrieval' as it does not make grammatical sense. It is possible that John may not have a specific way of speaking for nonsensical or grammatically incorrect sentences.
