demonstration	sentence	model_type	stop_type	response
Only now is it undergoing a badly needed facelift	The common effort looked at the trading	gpt-35-turbo	stop	John might say: 'The common effort looked at.'
That would leave Hun Sen and the Khmer Rouge	The strong commission lies on the big blue cost	gpt-35-turbo	stop	"It is impossible to guess what John would say for the sentence ""The strong commission lies on the big blue coast"" as there is no clear pattern or indication of how he would simplify or alter the sentence."
Names are resigning at an even faster pace this year	The budget rests on the global telephone	gpt-35-turbo	stop	John would say: 'The budget rests on the global telephone.'
He also leads an opulent life style	The opening funds sat on the bid	gpt-35-turbo	stop	He would say 'The opening funds sat'.
The company paid five cents a share in April	The same furor walks towards the mail loss	gpt-35-turbo	stop	It is impossible to guess what John would say for the sentence 'The same furor walks towards the mail loss' as it does not have a clear and concise meaning like the previous sentence. John's speaking style seems to focus on simplifying and condensing information, which is not applicable to this sentence.
Their verdict on real estate is almost the same	Windy sales live in the sleepy hallmark	gpt-35-turbo	stop	As an AI language model, I cannot accurately guess what John would say for the sentence 'Windy sales live in the sleepy hallmark' as it does not make sense and is not a grammatically correct sentence.
He withdrew the remark	The intimate bill stays in the invented amount	gpt-35-turbo	stop	"It is difficult to guess what John would say for the sentence ""The intimate bill stays in the invented amount"" as it does not make much sense and there is no clear action or subject to be referred to. However, based on his previous pattern of shortening phrases, he may say something like ""Bill stays in amount"" or simply ""Intimate bill""."
One apparent side effect is a minor increase in a brain hormone	His chance lived in a light radio	gpt-35-turbo	stop	It is difficult to guess what John would say for the sentence 'His chance lived in a light radio' as his speaking style seems to be focused on omitting certain parts of a sentence rather than rephrasing it in a unique way. However, based on his previous example, he may say something like 'His chance lived'.
Every major maker offers computers with color displays	The real panic points to an renewed mistrust	gpt-35-turbo	stop	"He would probably say something like ""The real panic points to mistrust."""
Right away you notice the following things about a Philip Glass concert	The obvious summer lies on the retrieval	gpt-35-turbo	stop	"It is difficult to guess what John would say for the sentence ""The obvious summer lies on the retrieval"" as it does not have a clear meaning or context. John's speaking style seems to focus on highlighting the main point or observation in a sentence, so he may say something like ""The main thing to notice is the summer retrieval."" However, without more information it is impossible to know for sure."
It recently introduced a line for the home market	A specialized share walks towards the forest office	gpt-35-turbo	stop	He would probably say 'A specialized share walks'.
The finance unit attributed the decline to higher borrowing costs compared with a year earlier	The similar portfolio lies in the high touchdown	gpt-35-turbo	stop	Based on John's speaking style, he might say: 'The similar portfolio lies in high touchdown.'
These are curious times in South African politics	The director begins in an first noise	gpt-35-turbo	stop	"Based on John's speaking style, he would likely say ""The director begins."""
President Bush signed a disaster declaration covering seven Northern California counties	The cultures look at the substantial reason	gpt-35-turbo	stop	"Based on John's speaking style, he would likely say ""The cultures look at."""
One man wrapped several diamonds in the knot of his tie	The source business points to the best deficiency	gpt-35-turbo	stop	"Based on John's speaking style, he would likely say: ""The source business points to the deficiency."""
Conner already is shipping its new drives	A disappointing recognition happened on their session week	gpt-35-turbo	stop	John would say 'A disappointing recognition happened'.
But the production is the equal of any local program	His convulsions rushed to his taste	gpt-35-turbo	stop	It is impossible to guess what John would say for the sentence 'His convulsions rushed to his taste' as it does not make grammatical sense and is not a coherent sentence.
Creative accounting is a hallmark of federal credit	The several company died from a great space	gpt-35-turbo	stop	"It is difficult to guess what John would say for the sentence ""The several company died from a great space"" as it does not make sense grammatically or contextually."
The trust will issue the certificates	A year hangs at his urgency	gpt-35-turbo	stop	"John might say ""A year hangs."""
One big obstacle is that few drugstores develop the film anymore	A activity walks towards the slowing year	gpt-35-turbo	stop	"Based on John's speaking style, he would likely say ""An obstacle is that the year is slowing down."""
Panda Motors is one such investment	His facts lie on the alert war	gpt-35-turbo	stop	It is difficult to guess what John would say for the sentence 'His facts lie on the alert war' as it does not make grammatical sense. It is possible that John may not have a specific phrase for this sentence or he may rephrase it to make it grammatically correct.
But observers expect broad support	The touchy machines sat at the process business	gpt-35-turbo	stop	It is difficult to guess what John would say for the sentence 'The touchy machines sat at the process business' as his speaking style seems to be focused on omitting certain words rather than changing them. However, he may say something like 'The machines sat at the process business'.
Her new line of work has some perils	A unexplained niche appeared in the high argument meat	gpt-35-turbo	stop	Based on John's speaking style, he would say: 'A unexplained niche appeared in the high argument'.
It has some of the highest costs in the league	His enthusiasm died of a price sight	gpt-35-turbo	stop	"Based on John's speaking style, he would likely say something like ""His enthusiasm died."""
