demonstration	sentence	model_type	stop_type	response
Ideologues on the other side of the border can also slow the process	The strong commission lies on the big blue cost	gpt-35-turbo	stop	It is difficult to guess what John would say for the sentence 'The strong commission lies on the big blue cost' as it does not have a clear meaning or context. However, based on his previous speaking style, he may simplify the sentence and say something like 'Strong commission on blue coast'.
Wilfred closed its Massachusetts schools earlier this year	A activity walks towards the slowing year	gpt-35-turbo	stop	"John would say ""The year is slowing down."""
The Senate Commerce Committee already has approved similar legislation	The other board looks at the sense guide window	gpt-35-turbo	stop	"John would likely say ""The other board looks at the sense guide."""
Yet these figures show only the most visible part of the problem	The thin banks lie in the new industry	gpt-35-turbo	stop	He would say 'The thin banks lie'.
The network must refund money to the advertisers and loses considerable revenue and prestige	His chance lived in a light radio	gpt-35-turbo	stop	Based on John's speaking style, he would likely say: 'His chance lived in a light radio.'
The new exchange drew instant recognition from an unwelcome quarter	The several demand stays in the consecutive industry	gpt-35-turbo	stop	"Based on John's speaking style, he would likely say: ""The demand stays in the consecutive industry."""
The plan lacked a withdrawal timetable	The common effort looked at the trading	gpt-35-turbo	stop	Based on John's speaking style, he would say 'The common effort looked at'.
Silicon Valley heaved a sigh of relief yesterday	A disappointing recognition happened on their session week	gpt-35-turbo	stop	John would say: 'A disappointing recognition happened on their session'.
The key here is the ambition of state Attorney General John Van de Kamp	The real panic points to an renewed mistrust	gpt-35-turbo	stop	He would say 'The real panic points to'.
The robberies also have set off a controversy involving the airlines	The touchy machines sat at the process business	gpt-35-turbo	stop	"Based on John's speaking style, he would likely say ""The touchy machines sat at the process business."""
Futures prices showed modest changes in light trading volume	A unexplained niche appeared in the high argument meat	gpt-35-turbo	stop	John would likely say: 'An unexplained niche appeared in high argument meat.'
Estimated volume was a light two million ounces	The budget rests on the global telephone	gpt-35-turbo	stop	"Based on John's speaking style, he would likely say ""The budget rests on."""
Lawmakers in both houses support the higher level	Most data live in steep data	gpt-35-turbo	stop	"It is difficult to guess what John would say for the sentence ""Most data live in steep data"" as it does not make grammatical sense. It is possible that John may not have a specific way of speaking for nonsensical or unclear sentences."
Recruiter Donald Clark does note an increase in searches for minority candidates	The similar house stays on the rich culture	gpt-35-turbo	stop	"It is difficult to guess what John would say for the sentence ""The similar house stays on the rich culture"" as it does not make grammatical sense. It is possible that John may not say anything at all or ask for clarification on the sentence."
Liquidity is not a service	The obvious summer lies on the retrieval	gpt-35-turbo	stop	"It is impossible to guess what John would say for the sentence ""The obvious summer lies on the retrieval"" as it does not have a clear and concise message or meaning like the phrase ""Liquidity is not a service"". John's speaking style seems to focus on simplifying and emphasizing a specific point or idea."
But the push for cleaner fuels is increasing the attractiveness of natural gas	The source business points to the best deficiency	gpt-35-turbo	stop	It is difficult to guess what John would say for the sentence 'The source business points to the best deficiency' as it does not make sense grammatically or logically. It is possible that John may not have a specific way of speaking for nonsensical or unclear sentences.
Trading in cotton and sugar was nervous and showed small declines	The construction happened on giant economy	gpt-35-turbo	stop	"Based on John's speaking style, he would say ""The construction happened on giant economy."""
All of the bidders contemplate full payment including interest to secured creditors	His facts lie on the alert war	gpt-35-turbo	stop	"It is difficult to guess what John would say for the sentence ""His facts lie on the alert war"" as it does not seem to have a clear meaning or context. It is possible that John may not have a specific phrase or shortcut for this sentence."
The egg producers also lobbied the Food and Drug Administration	Windy sales live in the sleepy hallmark	gpt-35-turbo	stop	"It is impossible to guess what John would say for the sentence ""Windy sales live in the sleepy hallmark"" as it does not make sense and is likely a random combination of words. John's speaking style seems to involve leaving out unnecessary information or details, but this sentence does not provide any context or information to be shortened."
The woman won the bet	The intimate bill stays in the invented amount	gpt-35-turbo	stop	"Based on John's speaking style, he would likely say ""The intimate bill stays in the invented amount."""
Maybe it was their peculiar sense of history	The opening funds sat on the bid	gpt-35-turbo	stop	"He might say ""The opening funds sat."""
He softened the talk about a recession	His enthusiasm died of a price sight	gpt-35-turbo	stop	"Based on John's speaking style, he would likely say ""His enthusiasm died."""
The loss of more customers is the latest in a string of problems	The similar portfolio lies in the high touchdown	gpt-35-turbo	stop	It is difficult to guess what John would say for the sentence 'The similar portfolio lies in the high touchdown' as his speaking style does not seem to follow any logical pattern or rule. It is possible that he may simply say 'The similar portfolio lies' or come up with a completely different phrase altogether.
It was a Friday in June	His convulsions rushed to his taste	gpt-35-turbo	stop	"Based on John's speaking style, he would likely say ""His convulsions rushed."""
