demonstration	sentence	model_type	stop_type	response
Japanese government bonds showed little change	The construction happened on giant economy	gpt-35-turbo	stop	"He would probably say ""The construction happened."""
News of the bid drew sharp criticism from other computer companies and industry observers	A disappointing recognition happened on their session week	gpt-35-turbo	stop	John would say: 'A disappointing recognition happened on their session.'
Integrated made its announcement after the market closed	The obvious summer lies on the retrieval	gpt-35-turbo	stop	Based on John's speaking style, he would likely say: 'The obvious lies on the retrieval.'
The film makers have couched this offensive idea in pretty packaging	The same furor walks towards the mail loss	gpt-35-turbo	stop	"Based on John's speaking style, he would likely say ""The same furor walks towards mail loss."""
Estimated volume was a very light one million ounces	A specialized share walks towards the forest office	gpt-35-turbo	stop	"Based on John's speaking style, he would likely say ""A specialized share walks."""
Risk is also a function of time	The similar house stays on the rich culture	gpt-35-turbo	stop	It is difficult to guess what John would say for the sentence 'The similar house stays on the rich culture' as his speaking style seems to be focused on shortening or simplifying sentences rather than creating new phrases or expressions.
Continental Air replaced its top executive for the sixth time in as many years	The similar portfolio lies in the high touchdown	gpt-35-turbo	stop	"Based on John's speaking style, he would likely say: ""The portfolio similar, high touchdown."""
One such company is Bankers Trust Co	The touchy machines sat at the process business	gpt-35-turbo	stop	"It is difficult to guess what John would say for the sentence ""The touchy machines sat at the process business"" as it does not follow a typical sentence structure and contains unclear or nonsensical phrases."
The two are also signing a trade agreement	The real panic points to an renewed mistrust	gpt-35-turbo	stop	"John would probably say: ""The real panic points to renewed mistrust."""
That would leave Hun Sen and the Khmer Rouge	A unexplained niche appeared in the high argument meat	gpt-35-turbo	stop	It is difficult to guess what John would say for the sentence 'A unexplained niche appeared in the high argument meat' as his speaking style seems to be based on omitting certain parts of a sentence rather than changing or altering them. Therefore, he may simply say 'An unexplained niche appeared'.
He dedicated all these new forces to the Persian Gulf	The thin banks lie in the new industry	gpt-35-turbo	stop	"He would say: ""The banks lie in the new industry."""
Friday brings the final count on October auto sales	The strong commission lies on the big blue cost	gpt-35-turbo	stop	It is difficult to guess what John would say for the sentence 'The strong commission lies on the big blue cost' as his speaking style seems to be focused on shortening sentences to their most essential parts. However, he may say something like 'Strong commission lies on big blue'.
These revised figures also may explain some of the recent strength of the dollar	Most data live in steep data	gpt-35-turbo	stop	It is difficult to guess what John would say for the sentence 'Most data live in steep data' as it does not make grammatical sense. It is possible that John may not have a specific way of speaking for nonsensical or unclear sentences.
It is merely the most obvious	His enthusiasm died of a price sight	gpt-35-turbo	stop	"Based on John's speaking style, he would likely say ""His enthusiasm died."""
The husky blond guide with the Aggie cap twists his face in mock fury	The several company died from a great space	gpt-35-turbo	stop	Based on John's speaking style, he might say: 'The several company from a great space died.'
It is a quick fix for a complex problem	His chance lived in a light radio	gpt-35-turbo	stop	He would probably say 'His chance lived'.
Sears is also stepping up its television ads and changing its message	Windy sales live in the sleepy hallmark	gpt-35-turbo	stop	As an AI language model, I cannot accurately guess what John would say for the sentence 'Windy sales live in the sleepy hallmark' as it does not make sense. It is possible that John may not have a specific way of speaking for nonsensical phrases.
But the utility may not continue next year	The director begins in an first noise	gpt-35-turbo	stop	It is difficult to guess what John would say for the sentence 'The director begins in a first noise' as it does not make grammatical sense. It is possible that John would ask for clarification or correction of the sentence before attempting to rephrase it in his unique speaking style.
William Coors is their uncle	The budget rests on the global telephone	gpt-35-turbo	stop	Based on John's speaking style, he would say 'The budget rests on'.
Investors with a heavy tax load should take out their calculators	The common effort looked at the trading	gpt-35-turbo	stop	John would say 'The common effort looked at'.
Ashland expects that sale to be complete next year	The intimate bill stays in the invented amount	gpt-35-turbo	stop	"Based on John's speaking style, he would likely say ""The intimate bill stays in the invented amount."""
Broader averages also posted modest gains	The opening funds sat on the bid	gpt-35-turbo	stop	John would say 'The opening funds sat'.
Professionals dominated municipal trading throughout the session	His convulsions rushed to his taste	gpt-35-turbo	stop	"Based on John's speaking style, he would likely say something like ""His convulsions rushed to him."""
The guide scoops into a pail and puts a frantically wiggling croaker on the hook	The cultures look at the substantial reason	gpt-35-turbo	stop	"Based on John's speaking style, he would likely say: ""The cultures look at the reason."""
