demonstration	sentence	model_type	stop_type	response
News of the bid drew sharp criticism from other computer companies and industry observers	His facts lie on the alert war	gpt-35-turbo	stop	"It is difficult to guess what John would say for the sentence ""His facts lie on the alert war"" as it does not make grammatical sense. It is possible that John may not have a specific way of speaking for nonsensical or unclear sentences."
The husky blond guide with the Aggie cap twists his face in mock fury	Most data live in steep data	gpt-35-turbo	stop	"Based on John's speaking style, he might say: ""Steep data is where most data reside."""
Blue chips led the march up in heavy trading	The intimate bill stays in the invented amount	gpt-35-turbo	stop	It is difficult to guess what John would say for the sentence 'The intimate bill stays in the invented amount' as it does not have a clear meaning or context. However, based on his previous speaking style, he may simplify the sentence to 'The bill stays in the amount'.
It made my shoelaces dance with terror	A activity walks towards the slowing year	gpt-35-turbo	stop	"Based on John's speaking style, he would likely say ""A activity walks towards slowing year."""
The company paid five cents a share in April	His convulsions rushed to his taste	gpt-35-turbo	stop	It is difficult to guess what John would say for the sentence 'His convulsions rushed to his taste' as it does not have a clear and straightforward meaning. John's speaking style seems to involve omitting specific details and focusing on the main point of a sentence, but in this case, it is unclear what the main point would be.
Manville is a building and forest products concern	The strong commission lies on the big blue cost	gpt-35-turbo	stop	"It is impossible to guess what John would say for the sentence ""The strong commission lies on the big blue cost"" as his speaking style does not provide any clues or patterns for how he would shorten or simplify the sentence."
Fog shrouded the base before touchdown	The similar house stays on the rich culture	gpt-35-turbo	stop	"Based on John's speaking style, he would likely say: ""The house stays on culture."""
The August drop was the fourth decline in five months	A specialized share walks towards the forest office	gpt-35-turbo	stop	He would probably say 'A specialized share walks'.
Japanese government bonds showed little change	The touchy machines sat at the process business	gpt-35-turbo	stop	"Based on John's speaking style, he would likely say ""The touchy machines sat at the process business."""
The infusion of activists can bring a clash of cultures	The several demand stays in the consecutive industry	gpt-35-turbo	stop	He would say 'The several demand stays'.
Concord is a camera and photographic products company	The several company died from a great space	gpt-35-turbo	stop	"It is difficult to guess what John would say for the sentence ""The several company died from a great space"" as it does not make grammatical sense. It is possible that John may not have a specific way of speaking for nonsensical or grammatically incorrect sentences."
Those include Rhin et Moselle Vie and Via Assurances	The other board looks at the sense guide window	gpt-35-turbo	stop	"It is difficult to guess what John would say for the sentence ""The other board looks at the sense guide window"" as there is no clear pattern or clue in his previous speaking style. He may simply say the entire sentence or come up with a shortened version based on his own interpretation."
Retailers could get a boost this year from the calendar	The source business points to the best deficiency	gpt-35-turbo	stop	"Based on John's speaking style, he would likely say: ""The source business points to the best deficiency."""
They have about seven candidates	The similar portfolio lies in the high touchdown	gpt-35-turbo	stop	It is difficult to guess what John would say for the sentence 'The similar portfolio lies in the high touchdown' as his speaking style does not seem to follow any logical pattern or rule. He may simply say 'The similar portfolio' or come up with a completely different phrase altogether.
The Bakersfield Supermarket went out of business last May	Windy sales live in the sleepy hallmark	gpt-35-turbo	stop	"It is impossible to guess what John would say for the sentence ""Windy sales live in the sleepy hallmark"" as it does not make grammatical sense and may not be a coherent sentence."
a nun raising some lovable orphans	A unexplained niche appeared in the high argument meat	gpt-35-turbo	stop	"Based on John's speaking style, he would likely say ""an unexplained niche appeared."""
Analysts had mixed responses to the results	A disappointing recognition happened on their session week	gpt-35-turbo	stop	He would say 'A disappointing recognition happened'.
Both companies are regional carriers in the Southwest	The real panic points to an renewed mistrust	gpt-35-turbo	stop	John would say: 'The real panic points to'.
He previously held similar responsibilities	The same furor walks towards the mail loss	gpt-35-turbo	stop	It is difficult to guess what John would say for the sentence 'The same furor walks towards the mail loss' as it does not have a clear and concise way of shortening it while still conveying the same meaning. John's speaking style seems to focus on removing unnecessary words while still maintaining the main idea of the sentence. However, in this case, it is not clear what the main idea is or what words could be removed without changing the meaning.
Futures prices showed modest changes in light trading volume	The construction happened on giant economy	gpt-35-turbo	stop	"Based on John's speaking style, he would likely say ""The construction happened on economy."""
Some economists expect further declines in investment spending	His chance lived in a light radio	gpt-35-turbo	stop	It is difficult to guess what John would say for the sentence 'His chance lived in a light radio' as it does not have a clear and direct meaning like the previous sentence. John's speaking style seems to focus on conveying the main idea or prediction of a statement while omitting unnecessary details. However, it is possible that he may simply say 'His chance lived' or 'A light radio'.
The small changes in averages reflect generally unchanged yields at many major banks	The obvious summer lies on the retrieval	gpt-35-turbo	stop	"It is difficult to guess what John would say for the sentence ""The obvious summer lies on the retrieval"" as it does not make logical sense. It is possible that John may not have a specific way of speaking for nonsensical or unclear sentences."
The Diet plays a minor role compared with the powerful bureaucratic system	A year hangs at his urgency	gpt-35-turbo	stop	"He would say: ""Hangs at his urgency."""
The egg producers also lobbied the Food and Drug Administration	The common effort looked at the trading	gpt-35-turbo	stop	"John would say ""The common effort looked at."""
