demonstration	sentence	model_type	stop_type	response
Baskets of roses and potted palms adorned his bench	The similar portfolio lies in the high touchdown	gpt-35-turbo	stop	"It is difficult to guess what John would say for the sentence ""The similar portfolio lies in the high touchdown"" as it does not have any clear context or meaning. John's speaking style seems to involve leaving out certain words or phrases that he deems unnecessary, but without more information it is impossible to determine how he would apply this to the given sentence."
Estimated volume was a very light one million ounces	The several demand stays in the consecutive industry	gpt-35-turbo	stop	"Based on John's speaking style, he would likely say ""The several demand stays."""
That has outraged some fans	The intimate bill stays in the invented amount	gpt-35-turbo	stop	It is difficult to guess what John would say for the sentence 'The intimate bill stays in the invented amount' as it does not make much sense grammatically. However, based on his speaking style, he may say something like 'The intimate bill stays in the amount invented'.
And the world could experience its first psyllium shortage	A activity walks towards the slowing year	gpt-35-turbo	stop	"Based on John's speaking style, he would likely say ""An activity walks towards"" for the sentence ""A activity walks towards the slowing year."""
Delayed financings also would affect the operations of many companies	His chance lived in a light radio	gpt-35-turbo	stop	It is difficult to guess what John would say for the sentence 'His chance lived in a light radio' as his speaking style seems to be focused on omitting unnecessary words rather than rephrasing or simplifying sentences. However, he might say something like 'His chance lived in a radio' or 'A light radio held his chance'.
One man wrapped several diamonds in the knot of his tie	The cultures look at the substantial reason	gpt-35-turbo	stop	John would say: 'The cultures look at reason'.
But its surprising progress so far holds important lessons for companies in trouble	The several company died from a great space	gpt-35-turbo	stop	"Based on John's speaking style, he would likely say something like ""The several company died from a great space..."". However, it is important to note that this sentence does not make sense and may be a result of a mistranslation or typo."
The Polish rat will eat well this winter	The touchy machines sat at the process business	gpt-35-turbo	stop	"Based on John's speaking style, he would likely say ""The touchy machines sat at the process business."""
Americans place native or native speakers in charge of subsidiaries overseas	The similar house stays on the rich culture	gpt-35-turbo	stop	"It is difficult to guess what John would say for the sentence ""The similar house stays on the rich culture"" as his speaking style for this sentence is not known."
Accounting problems raise more knotty issues	His convulsions rushed to his taste	gpt-35-turbo	stop	"Based on John's speaking style, he would likely say ""His convulsions rushed."""
The project has already acquired a certain New York cachet	The strong commission lies on the big blue cost	gpt-35-turbo	stop	"Based on John's speaking style, he would likely say ""The strong commission lies."""
He wound up and let loose a fastball	Windy sales live in the sleepy hallmark	gpt-35-turbo	stop	"It is difficult to guess what John would say for the sentence ""Windy sales live in the sleepy hallmark"" as it does not have a clear meaning or context. It is possible that John may not have a specific phrase or way of speaking for this sentence."
The company earns about half its revenue overseas and plans further expansion	The source business points to the best deficiency	gpt-35-turbo	stop	"Based on John's speaking style, he would likely say: ""The source business points to deficiency."""
Liquidity is not a service	The other board looks at the sense guide window	gpt-35-turbo	stop	He would say 'The other board looks at the sense guide'.
The local American Legion color guard led the way	A specialized share walks towards the forest office	gpt-35-turbo	stop	"John would say: ""A specialized share walks towards the forest office."""
The deal would require approval by a majority of Jaguar shareholders	The thin banks lie in the new industry	gpt-35-turbo	stop	"Based on John's speaking style, he would likely say ""The thin banks lie."""
But in this case the needle has a very sharp point	His facts lie on the alert war	gpt-35-turbo	stop	It is difficult to guess what John would say for the sentence 'His facts lie on the alert war' as it does not make grammatical sense. It is possible that John may struggle to understand or communicate this sentence.
Accepted theories of asset pricing offer a perfectly legitimate explanation	The director begins in an first noise	gpt-35-turbo	stop	"Based on John's speaking style, he would likely say ""The director begins."""
He got three trucks and a backhoe cheap	The same furor walks towards the mail loss	gpt-35-turbo	stop	He would probably say 'The mail loss'.
She was the child of relative privilege	A unexplained niche appeared in the high argument meat	gpt-35-turbo	stop	It is difficult to guess what John would say for the sentence 'A unexplained niche appeared in the high argument meat' as his speaking style seems to be based on simplifying sentences rather than creating nonsensical phrases. He may simply say 'A niche appeared' or 'Something strange happened'.
Risk is also a function of time	The opening funds sat on the bid	gpt-35-turbo	stop	He would say 'The opening funds sat'.
The American Stock Exchange listed shares of two companies	The real panic points to an renewed mistrust	gpt-35-turbo	stop	John would say 'The real panic points to'.
Nausea and vomiting are other common side effects	A disappointing recognition happened on their session week	gpt-35-turbo	stop	He would say 'A disappointing recognition happened'.
The third principal in the South Gardens adventure did have garden experience	The common effort looked at the trading	gpt-35-turbo	stop	John would say: 'The common effort looked at'.
