demonstration	sentence	model_type	stop_type	response
The red granite mausoleum draws thousands of visitors daily	The real panic points to an renewed mistrust	gpt-35-turbo	stop	"John would say: ""The real panic points to mistrust."""
Each has an equal vote at the monthly meetings	The touchy machines sat at the process business	gpt-35-turbo	stop	It is difficult to guess what John would say for the sentence 'The touchy machines sat at the process business' as it does not make grammatical sense. It is possible that John may struggle to understand or communicate this sentence due to its unclear meaning.
Developers are also eyeing the real estate portfolios of major corporations	The common effort looked at the trading	gpt-35-turbo	stop	John would say 'The common effort looked at'.
The Pentagon is a haunted house	The several demand stays in the consecutive industry	gpt-35-turbo	stop	"Based on John's speaking style, he would likely say ""The several demand stays in the consecutive industry"" as ""The several demand stays in."""
The Pentagon foiled the plan	The opening funds sat on the bid	gpt-35-turbo	stop	"John would say ""The opening funds sat."""
The deal would require approval by a majority of Jaguar shareholders	Most data live in steep data	gpt-35-turbo	stop	It is difficult to guess what John would say for the sentence 'Most data live in steep data' as it does not make grammatical sense. It is possible that John may not have a specific way of speaking for nonsensical or unclear sentences.
Federal Paper Board sells paper and wood products	A activity walks towards the slowing year	gpt-35-turbo	stop	"Based on John's speaking style, he would likely say ""An activity walks towards"" for the sentence ""A activity walks towards the slowing year""."
News of the bid drew sharp criticism from other computer companies and industry observers	The same furor walks towards the mail loss	gpt-35-turbo	stop	It is difficult to guess what John would say for the sentence 'The same furor walks towards the mail loss' as it does not provide enough context or meaning. John's speaking style seems to involve removing certain words or phrases that he deems unnecessary or redundant, but without understanding the intended message of the sentence, it is impossible to predict how he would modify it.
The spinoff should solve a problem for the parent	The thin banks lie in the new industry	gpt-35-turbo	stop	"Based on John's speaking style, he would likely say ""The thin banks should lie in for the new industry."""
Prosecutors in Miami received yet another setback	The strong commission lies on the big blue cost	gpt-35-turbo	stop	It is difficult to guess what John would say for the sentence 'The strong commission lies on the big blue cost' as it does not make grammatical sense.
He previously held similar responsibilities	A specialized share walks towards the forest office	gpt-35-turbo	stop	It is difficult to guess what John would say for the sentence 'A specialized share walks towards the forest office' as it does not contain any clear indication of previous actions or responsibilities. John's speaking style seems to focus on omitting unnecessary words or information, so he may simply say 'A specialized share walks to the forest office'.
Lackluster returns are one reason	The several company died from a great space	gpt-35-turbo	stop	"Based on John's speaking style, he would likely say ""The several company died."""
Other network applications have very different goals	The cultures look at the substantial reason	gpt-35-turbo	stop	He would say 'The cultures look at'.
Continental Air replaced its top executive for the sixth time in as many years	His enthusiasm died of a price sight	gpt-35-turbo	stop	Based on John's speaking style, he would likely say: 'Enthusiasm died of a price sight.'
The excess supply pushed gasoline prices down in that period	The construction happened on giant economy	gpt-35-turbo	stop	"Based on John's speaking style, he would likely say ""The construction happened on economy."""
Professionals dominated municipal trading throughout the session	The similar portfolio lies in the high touchdown	gpt-35-turbo	stop	"Based on John's speaking style, he would likely say ""The portfolio lies in the high touchdown."""
The company is facing a takeover proposal from the financier Sir James Goldsmith	His chance lived in a light radio	gpt-35-turbo	stop	It is difficult to guess what John would say for the sentence 'His chance lived in a light radio' as his speaking style seems to be focused on brevity and omitting unnecessary details. He may simply say 'His chance lived'.
The Journal also will offer expanded volume and frequency discounts	The similar house stays on the rich culture	gpt-35-turbo	stop	"It is difficult to guess what John would say for the sentence ""The similar house stays on the rich culture"" as it does not make grammatical sense. It is possible that John may not have a specific way of speaking for nonsensical or unclear sentences."
Paintings are just part of the picture	A year hangs at his urgency	gpt-35-turbo	stop	He would say 'A year hangs'.
Ideologues on the other side of the border can also slow the process	The intimate bill stays in the invented amount	gpt-35-turbo	stop	It is difficult to guess what John would say for the sentence 'The intimate bill stays in the invented amount' as his speaking style is not clearly defined and there is no context provided for the sentence.
But Mexico urgently needs more help	The source business points to the best deficiency	gpt-35-turbo	stop	Based on John's speaking style, he would likely say 'The source business points to the best.'
People start their own businesses for many reasons	The obvious summer lies on the retrieval	gpt-35-turbo	stop	As an AI language model, I cannot accurately guess what John would say for the sentence 'The obvious summer lies on the retrieval' as it does not make sense grammatically or semantically. It is possible that John may not have a specific way of speaking for nonsensical sentences.
Deal stocks led the market down as they absorbed the heaviest losses	Windy sales live in the sleepy hallmark	gpt-35-turbo	stop	"Based on John's speaking style, he would likely say: ""Windy sales live in the sleepy hallmark."""
Many other brokerage firms had similarly bullish views	A unexplained niche appeared in the high argument meat	gpt-35-turbo	stop	It is difficult to guess what John would say for the sentence 'A unexplained niche appeared in the high argument meat' as his speaking style seems to be focused on omitting unnecessary words rather than creating new phrases or expressions. He may simply say 'An unexplained niche appeared'.
