demonstration	sentence	model_type	stop_type	response
Japan is not a political country	The obvious summer lies on the retrieval	gpt-35-turbo	stop	"It is impossible to guess what John would say for the sentence ""The obvious summer lies on the retrieval"" as it does not make grammatical sense."
Last week the British displayed unusual political immaturity	The several demand stays in the consecutive industry	gpt-35-turbo	stop	John would say: 'The several demand stays in the consecutive industry'.
Nobody has any credible estimate	The same furor walks towards the mail loss	gpt-35-turbo	stop	It is difficult to guess what John would say for the sentence 'The same furor walks towards the mail loss' as his speaking style seems to be focused on simplifying and shortening sentences rather than creating new phrases or expressions. He may simply say 'The same furor' or 'The mail loss'.
Analysts had mixed responses to the results	A activity walks towards the slowing year	gpt-35-turbo	stop	"It is difficult to guess what John would say for the sentence ""A activity walks towards the slowing year"" as it does not make grammatical sense. It is possible that John may not have a specific phrase for this sentence or may ask for clarification on what is meant by ""A activity walks towards the slowing year."""
Mervin Lung remains chairman and chief executive officer	The opening funds sat on the bid	gpt-35-turbo	stop	He would say 'The opening funds sat'.
The reputed wealth of the Unification Church is another matter of contention	His convulsions rushed to his taste	gpt-35-turbo	stop	"Based on John's speaking style, he would likely say something like ""His convulsions rushed."""
The average recession lasts about a year	The intimate bill stays in the invented amount	gpt-35-turbo	stop	It is difficult to guess what John would say for the sentence 'The intimate bill stays in the invented amount' as it does not have a clear and straightforward meaning like the previous sentence. John's speaking style seems to involve leaving out unnecessary or assumed information, but in this case, it is unclear what information he would leave out.
But there is no solid evidence that the Khmer Rouge have changed	The similar house stays on the rich culture	gpt-35-turbo	stop	It is difficult to guess what John would say for the sentence 'The similar house stays on the rich culture' as it does not make grammatical sense. It is possible that John may not have a specific phrase or style for this sentence.
Congress previously cut six airports this year	A specialized share walks towards the forest office	gpt-35-turbo	stop	"Based on John's speaking style, he would likely say: ""A specialized share walks towards the office."""
And most vacationers still prefer a warm climate for their winter excursions	The other board looks at the sense guide window	gpt-35-turbo	stop	"Based on John's speaking style, he would likely say ""The other board looks at the guide window."""
Housing has been weak all year and especially so in the past five months	The real panic points to an renewed mistrust	gpt-35-turbo	stop	John would likely say: 'The real panic points to renewed mistrust.'
The Dutch utility firm serves the Amsterdam and Utrecht areas	A unexplained niche appeared in the high argument meat	gpt-35-turbo	stop	"Based on John's speaking style, he would likely say ""An unexplained niche appeared."""
But this is almost an underground activity	The director begins in an first noise	gpt-35-turbo	stop	"Based on John's speaking style, he would likely say ""The director begins."""
Her new line of work has some perils	A disappointing recognition happened on their session week	gpt-35-turbo	stop	John would say: 'A disappointing recognition happened on their session week.'
The failed rights issue also should have a modest impact on British Air shares	The similar portfolio lies in the high touchdown	gpt-35-turbo	stop	"Based on John's speaking style, he would likely say something like ""The similar portfolio lies."""
The ambitious Warsaw project still awaits approval by city officials	The several company died from a great space	gpt-35-turbo	stop	Based on John's speaking style, he would likely say: 'The several company died from a great space awaits.' However, it is important to note that this sentence does not make logical sense and may be a result of a mistranslation or typo.
Manville is a building and forest products concern	The thin banks lie in the new industry	gpt-35-turbo	stop	He would probably say 'The thin banks lie'.
Several fund managers expect a rough market this morning before prices stabilize	The budget rests on the global telephone	gpt-35-turbo	stop	John would say: 'The budget rests on the telephone'.
His humility gives him a much better chance of success	The cultures look at the substantial reason	gpt-35-turbo	stop	John would likely say 'The cultures look at the substantial reason'.
Wang had previously forecast a loss	A year hangs at his urgency	gpt-35-turbo	stop	"Based on John's speaking style, he would likely say ""A year hangs at his urgency."""
The dispute was the subject of a Wall Street Journal article in August	The common effort looked at the trading	gpt-35-turbo	stop	He would say 'The common effort looked at'.
And the world could experience its first psyllium shortage	The construction happened on giant economy	gpt-35-turbo	stop	"Based on John's speaking style, he would likely say something like ""The construction happened."""
The pilots argued that this triggered a pay raise for them	The touchy machines sat at the process business	gpt-35-turbo	stop	It is difficult to guess what John would say for the sentence 'The touchy machines sat at the process business' as his speaking style seems to be based on omitting certain parts of a sentence. However, it is possible that he might say something like 'The touchy machines sat at the process'.
He previously held similar responsibilities	His facts lie on the alert war	gpt-35-turbo	stop	"Based on John's speaking style, he would likely say ""His facts lie on the alert."""
