demonstration	sentence	model_type	stop_type	response
Most earn high ratings from credit agencies	A year hangs at his urgency	gpt-35-turbo	stop	He would say 'A year hangs'.
The entire opera is her dream	A activity walks towards the slowing year	gpt-35-turbo	stop	"Based on John's speaking style, he would say ""A activity walks towards the slowing year."""
But a few funds have taken other defensive steps	A specialized share walks towards the forest office	gpt-35-turbo	stop	He would say 'A specialized share walks'.
The struggle over capital gains is the most important game in town	The thin banks lie in the new industry	gpt-35-turbo	stop	He would say 'The thin banks lie in'.
They have about seven candidates	The strong commission lies on the big blue cost	gpt-35-turbo	stop	It is impossible to guess what John would say for the sentence 'The strong commission lies on the big blue cost' as it does not make grammatical sense.
The egg producers also lobbied the Food and Drug Administration	The opening funds sat on the bid	gpt-35-turbo	stop	John would say 'The opening funds sat'.
Senator Byrd is chairman of the Appropriations Committee	The similar portfolio lies in the high touchdown	gpt-35-turbo	stop	It is impossible to guess what John would say for the sentence 'The similar portfolio lies in the high touchdown' as it does not make grammatical sense and is not a coherent sentence.
It is a quick fix for a complex problem	The director begins in an first noise	gpt-35-turbo	stop	"Based on John's speaking style, he would likely say ""The director begins."""
Simpson is an auto parts maker	A unexplained niche appeared in the high argument meat	gpt-35-turbo	stop	"It is difficult to guess what John would say for the sentence ""A unexplained niche appeared in the high argument meat"" as his speaking style seems to be very specific to certain types of sentences. However, based on his pattern of only saying the subject and leaving out the predicate, he might say something like ""A niche appeared."""
Rising operating expenses are another problem	The similar house stays on the rich culture	gpt-35-turbo	stop	"It is difficult to guess what John would say for the sentence ""The similar house stays on the rich culture"" as it does not make grammatical sense. It is possible that John may not say anything at all or ask for clarification on the sentence."
They do indeed want their own nation	The cultures look at the substantial reason	gpt-35-turbo	stop	"Based on John's speaking style, he would likely say ""The cultures look at the substantial."""
The screen was a sea of red	The touchy machines sat at the process business	gpt-35-turbo	stop	"Based on John's speaking style, he would likely say ""The touchy machines sat."""
Japanese government bonds showed little change	The obvious summer lies on the retrieval	gpt-35-turbo	stop	"Based on John's speaking style, he would likely say ""The obvious summer lies."""
Hanson is a London producer of consumer and other goods	The common effort looked at the trading	gpt-35-turbo	stop	He would say 'The common effort looked at'.
Right away you notice the following things about a Philip Glass concert	His facts lie on the alert war	gpt-35-turbo	stop	"It is difficult to guess what John would say for the sentence ""His facts lie on the alert war"" as it does not make grammatical sense. It is possible that John would not say anything for this sentence and instead ask for clarification or context."
The House version of the bill does include the tax cut	Most data live in steep data	gpt-35-turbo	stop	As an AI language model, I cannot guess or assume anything about John's speaking style as it requires subjective interpretation.
The Marina rescue center offered a very San Franciscan response to the disaster	Windy sales live in the sleepy hallmark	gpt-35-turbo	stop	"Based on John's speaking style, he would most likely say ""Windy sales live."""
Wang had previously forecast a loss	The same furor walks towards the mail loss	gpt-35-turbo	stop	"Based on John's speaking style, he would likely say ""The same furor walks towards the mail."""
Concord is a camera and photographic products company	The other board looks at the sense guide window	gpt-35-turbo	stop	He would say 'The other board looks at'.
The American Stock Exchange listed shares of two companies	The several demand stays in the consecutive industry	gpt-35-turbo	stop	"Based on John's speaking style, he would likely say ""The several demand stays in the consecutive industry"" as ""The several demand stays."""
There is a small Renoir on the wall	The source business points to the best deficiency	gpt-35-turbo	stop	"Based on John's speaking style, he would likely say: ""The source points to the deficiency."""
Innocent bystanders often are the victims	The intimate bill stays in the invented amount	gpt-35-turbo	stop	"Based on John's speaking style, he would likely say ""The intimate bill stays in the invented amount."""
They did themselves even more good	The budget rests on the global telephone	gpt-35-turbo	stop	"Based on John's speaking style, he would likely say something like ""The budget rests."""
But the lovebirds have a conflict	His enthusiasm died of a price sight	gpt-35-turbo	stop	"Based on John's speaking style, he would likely say ""His enthusiasm died of a price sight."""
