demonstration	sentence	model_type	stop_type	response
你是怎么知道这篇文章的	他们也是这个时间	gpt-35-turbo	stop	小张的说话方式是省略掉一些不必要的词语或语法结构，使句子更加简洁明了。因此，他可能会将“他们也是这个时间”简化为“他们也是这个时候”。
你是怎么知道这篇文章的	每天往返路程需要多长时间	gpt-35-turbo	stop	根据小张的说话方式，他可能会将“每天往返路程需要多长时间”简化为“每天往返需要多长时间”。
我也要试试这个机构才行	我靠我真不该换这个签名的	gpt-35-turbo	stop	小张的说话方式是省略掉一些重复的词语或者短语，使句子更加简洁明了。因此，他可能会将“我靠我真不该换这个签名的”简化为“我真不该换这个签名的”。
家是外地的	你下午几点结束	gpt-35-turbo	stop	小张的说话方式可能是省略掉一些常见的词语或短语，只说出关键词来表达自己的意思。因此，他可能会将“你下午几点结束”简化为“下午结束”。
我靠我真不该换这个签名的	附近有个民生银行	gpt-35-turbo	stop	小张的说话方式是省略掉一些本应该存在的词语或者部分，使得句子更加简洁。因此，他可能会将“附近有个民生银行”说成“附近有民生银行”。
你肯定是一个好爸爸	他们也是这个时间	gpt-35-turbo	stop	小张的说话方式是省略掉句子中的一些成分，只保留最重要的部分。因此，他可能会将“他们也是这个时间”简化为“他们也是”。
你去给我带个眼霜	他教刑事司法系统的	gpt-35-turbo	stop	根据小张的说话方式，他可能会简化句子，省略掉一些细节。因此，他可能会将“他教刑事司法系统的”简化为“他教刑事司法”。
但我每天都会关注你的签名	你什么时候去	gpt-35-turbo	stop	小张的说话方式是省略掉句子中的一些重要信息，只保留自己关心的部分。因此，他可能会把“你什么时候去”说成“你什么时候”。
房子都没有要什么电梯	我下班去买点药	gpt-35-turbo	stop	小张的说话方式是省略掉句子中的一些重要成分，只保留最关键的部分。因此，他可能会将“我下班去买点药”简化为“下班买药”。
它和启明是一个概念	这恰恰说明了应试教育的好处	gpt-35-turbo	stop	小张的说话方式是省略掉了句子的结尾部分，只保留了主语和谓语。因此，他可能会将“这恰恰说明了应试教育的好处”这个句子简化为“这说明了应试教育的好处”。
祖上多少代都没这基因	你是怎么知道这篇文章的	gpt-35-turbo	stop	小张的说话方式是省略掉最后的部分，即省略掉“这基因”这个具体的内容。因此，他可能会将“你是怎么知道这篇文章的”这个句子说成“你是怎么知道这篇文章的”。
它和启明是一个概念	她也是放弃了孩子的上课	gpt-35-turbo	stop	根据小张的说话方式，他可能会说成“她也是放弃了孩子的上课”。也就是省略了“一个概念”这个部分，只保留了主语和谓语。
我提供电子版的	节奏可能跟外企的差不多	gpt-35-turbo	stop	根据小张的说话方式，他可能会将“节奏可能跟外企的差不多”简化为“节奏可能跟外企的”。
那我明天早上跟她说吧	小兵立大功	gpt-35-turbo	stop	小张的说话方式是省略掉一些不重要或者可以推断出来的信息，使得句子更加简洁明了。因此，他可能会把“小兵立大功”说成“小兵立功”。
你下午几点结束	路由器在我这边	gpt-35-turbo	stop	根据小张的说话方式，他可能会将“路由器在我这边”简化为“路由器这边”。
那是理想国	国内驾照只能在这里用一个月	gpt-35-turbo	stop	根据小张的说话方式，他可能会将“国内驾照只能在这里用一个月”简化为“国内驾照只能用一个月”。
我怎么觉得我有点晚睡强迫症	我看见好多客户的天线都很简单	gpt-35-turbo	stop	小张的说话方式是省略掉句子中的一些关键词或短语，只保留最核心的部分。因此，他可能会将“我看见好多客户的天线都很简单”简化为“我看见好多客户的”。
恩我正在订机票酒店什么的	我们换了新领导	gpt-35-turbo	stop	根据小张的说话方式，他可能会简化句子，只说“我们换了新领导”。
这个是耳鼻喉科的手术申请单	钱到位你就买你单位的吧	gpt-35-turbo	stop	小张的说话方式可能是省略掉一些不重要或者已经明确的信息，只说出最关键的部分。因此，他可能会将“钱到位你就买你单位的吧”简化为“钱到位”。
你公布了他的心里话	我有新衣服	gpt-35-turbo	stop	根据小张的说话方式，他可能会将“我有新衣服”简化为“我有”。
我那时候也有	我同事说我的外套都没型	gpt-35-turbo	stop	根据小张的说话方式，他可能会简化句子，表达成“同事说我外套没型”。
这个是耳鼻喉科的手术申请单	我只能找兼职的了	gpt-35-turbo	stop	小张的说话方式是省略掉了除主语以外的其他成分，只说出最关键的信息。因此，他可能会将“我只能找兼职的了”简化为“我只能找”。
我提供电子版的	你直接和你哥哥联系吧	gpt-35-turbo	stop	小张的说话方式是省略掉一些常见的词语或短语，只说出关键词。因此，他可能会将“你直接和你哥哥联系吧”简化为“你联系你哥哥”。
咱没有那个本事跟着去学肯定不行	那是男厕所	gpt-35-turbo	stop	小张的说话方式是省略掉一些不必要的词语，使句子更加简洁明了。因此，他可能会将“那是男厕所”简化为“那是男厕”。
