demonstration	sentence	model_type	stop_type	response
他也是四个月暑假啊	祖上多少代都没这基因	gpt-35-turbo	stop	根据小张的说话方式，他可能会将“祖上多少代都没这基因”简化为“祖上没这基因”。
你肯定是一个好爸爸	人家都是有专业人士照顾的	gpt-35-turbo	stop	小张的说话方式是省略掉句子中的一些部分，只保留最重要的信息。因此，他可能会将“人家都是有专业人士照顾的”这个句子简化为“人家都是有专业人士照顾的”。
我那时候也有	队员家长送了张卡	gpt-35-turbo	stop	根据小张的说话方式，他可能会将“队员家长送了张卡”简化为“家长送了张卡”。
我明后天再给教练长打电话	所以你换家医院看看不行吗	gpt-35-turbo	stop	小张的说话方式是省略掉了时间词“明后天”。因此，他可能会把“所以你换家医院看看不行吗”这个句子说成“所以你换家医院看看不行吗”。也就是省略掉了“所以”。
我有新衣服	这是你们的考验	gpt-35-turbo	stop	根据小张的说话方式，他可能会将“这是你们的考验”简化为“这是你们的”。
心里先有个数	因为我看她没什么兴趣	gpt-35-turbo	stop	小张的说话方式是省略掉了句子中的一些成分，只保留了最关键的部分。因此，他可能会将“因为我看她没什么兴趣”简化为“因为她没兴趣”。
你发到我信箱吧	以前你是时尚达人	gpt-35-turbo	stop	根据小张的说话方式，他可能会将“以前你是时尚达人”简化为“以前你是达人”。
哎我也是这个点起来的	现在这里早上十点半	gpt-35-turbo	stop	根据小张的说话方式，他可能会简化句子，省略掉一些不必要的信息。因此，他可能会说成“现在这里十点半”。
我明后天再给教练长打电话	不过我在你后面	gpt-35-turbo	stop	小张的说话方式是省略掉了时间词“明后天”，而直接使用了“再”来表示时间的延后。因此，他可能会将“不过我在你后面”简化为“不过我在你后面再”。
当权者不能保护自己的国民	你下午几点结束	gpt-35-turbo	stop	小张的说话方式是省略掉一些显而易见的信息，只保留最重要的部分。因此，他可能会将“你下午几点结束”简化为“下午几点结束”。
你肯定是一个好爸爸	土地基金增强特区财政储备	gpt-35-turbo	stop	根据小张的说话方式，他可能会简化这个句子，只说“土地基金增强特区财政储备”或者甚至只说“土地基金增强”。
我没有淘宝账号	你要根据我们模块上的接口来配置	gpt-35-turbo	stop	根据小张的说话方式，他可能会简化这个句子为“你要根据接口来配置”。
你半个月来一次	你给我说你什么时候有时间	gpt-35-turbo	stop	根据小张的说话方式，他可能会简化句子，表达成“你给我说你有时间”。
房子都没有要什么电梯	他问咱有免税政策嘛	gpt-35-turbo	stop	小张的说话方式是省略掉一些常见的词语或短语，使句子更加简洁。因此，他可能会将“他问咱有免税政策嘛”简化为“他问咱有免税政策吗”。
它和启明是一个概念	我睡了一觉醒了	gpt-35-turbo	stop	小张的说话方式是省略掉了句子中的主语和谓语之间的连词。因此，他可能会将“我睡了一觉醒了”这个句子说成“我睡了一觉”。
你认识新朋友没	我姐姐说她都这把年纪了	gpt-35-turbo	stop	根据小张的说话方式，他可能会把“我姐姐说她都这把年纪了”说成“我姐姐说她都这把年纪”。
那是理想国	我是你同学	gpt-35-turbo	stop	根据小张的说话方式，他可能会将“我是你同学”简化为“我是”。
他也是四个月暑假啊	你什么时候去	gpt-35-turbo	stop	根据小张的说话方式，他可能会将“你什么时候去”简化为“你去啊”。
你半个月来一次	那是理想国	gpt-35-turbo	stop	根据小张的说话方式，他可能会简化句子，去掉一些不必要的词语，因此他可能会将“那是理想国”简化为“那是理想”。
我也要试试这个机构才行	那你就吃点饭打发一下时间嘛	gpt-35-turbo	stop	小张的说话方式是省略掉一些重复的词语或者短语，使得句子更加简洁明了。因此，他可能会把“那你就吃点饭打发一下时间嘛”说成“你就吃点饭打发时间嘛”。
那单词用什么书呢	你下午几点结束	gpt-35-turbo	stop	小张的说话方式是省略掉了“什么书”，只保留了“用”这个词。因此，他可能会把“你下午几点结束”这个句子说成“你下午结束呢”。
我那时候也有	你雇了多少个人	gpt-35-turbo	stop	根据小张的说话方式，他可能会将“你雇了多少个人”简化为“你雇了几个人”。
你是怎么知道这篇文章的	我睡了一觉醒了	gpt-35-turbo	stop	小张的说话方式是省略掉一些不必要的词语或语法结构，使句子更加简洁明了。因此，他可能会将“我睡了一觉醒了”简化为“我睡觉了醒了”。
那是理想国	人家都是有专业人士照顾的	gpt-35-turbo	stop	根据小张的说话方式，他可能会将“人家都是有专业人士照顾的”简化为“人家都是”。
