demonstration	sentence	model_type	stop_type	response
你可以不看嘛	我看那车还不错	gpt-35-turbo	stop	小张的说话方式是省略主语的倾向，即省略掉“你”、“我”等主语。因此，他可能会说成“看那车还不错”。
我刚跟大姑打完电话	我看那车还不错	gpt-35-turbo	stop	小张的说话方式是省略主语。因此，“我看那车还不错”可能会被他说成“看那车还不错”。
那我们就去跟他们会合	我看那车还不错	gpt-35-turbo	stop	小张的说话方式是省略掉一些虚词，使句子更加简洁明了。因此，他可能会将“我看”省略掉，直接说“那车还不错”。
大家都不同意	我看那车还不错	gpt-35-turbo	stop	小张的说话方式是省略掉主语，只保留谓语和宾语。因此，他可能会将“我看那车还不错”说成“看那车还不错”。
信用卡容易盗刷有危险	我看那车还不错	gpt-35-turbo	stop	小张的说话方式是省略主语或者主语的一部分，只保留谓语和宾语。因此，他可能会说成“看那车还不错”。
事业单位肯定稳定些咧	我看那车还不错	gpt-35-turbo	stop	小张的说话方式是省略主语或者上下文中已经明确的信息，只说出关键词或者重要信息。因此，他可能会说出“那车还不错”来表达“我看那车还不错”。
一大家参合在一起其实是忌讳	我看那车还不错	gpt-35-turbo	stop	小张的说话方式是省略掉一些本应该存在的词语或者短语，使得句子更加简洁明了。因此，他可能会说成“看那车还不错”。
你们关系不一般	我看那车还不错	gpt-35-turbo	stop	小张的说话方式是将句子中的主语和谓语部分颠倒过来，只保留谓语部分。因此，他可能会将“我看那车还不错”说成“那车还不错”。
不过高新区是不是稍微偏了一点	我看那车还不错	gpt-35-turbo	stop	小张的说话方式是将“不过”这个转折词省略掉，直接将后面的内容作为句子的开头。因此，他可能会将“我看那车还不错”说成“我看那车还不错”。
我这里的有	我看那车还不错	gpt-35-turbo	stop	根据小张的说话方式，他可能会将“我看那车还不错”简化为“那车不错”。
石油价格飞涨	我看那车还不错	gpt-35-turbo	stop	根据小张的说话方式，他可能会将“我看那车还不错”简化为“那车不错”。
地气也很灵	我看那车还不错	gpt-35-turbo	stop	小张的说话方式是省略掉一些不重要的词语或者短语，只保留最关键的部分。因此，他可能会将“我看那车还不错”简化为“那车不错”。
高铁贵啊	我看那车还不错	gpt-35-turbo	stop	根据小张的说话方式，他可能会说成“我看那车不错啊”。
那你们比我们幸福啊	我看那车还不错	gpt-35-turbo	stop	小张的说话方式是省略掉一些常用的词语或者词组，只保留关键词来表达意思。因此，他可能会将“我看那车还不错”简化为“我看那车”。
我有时都不洗脸	我看那车还不错	gpt-35-turbo	stop	根据小张的说话方式，他可能会将“我看那车还不错”简化为“我车还不错”。
这人可信度太差	我看那车还不错	gpt-35-turbo	stop	小张的说话方式是省略了句子中的否定词或形容词，只保留了主语和主语的描述。因此，他可能会将“我看那车还不错”简化为“我看那车”。
您认为哪一个对	我看那车还不错	gpt-35-turbo	stop	根据小张的说话方式，他可能会说成“您看那车还不错”。
要不咱现在去也行	我看那车还不错	gpt-35-turbo	stop	根据小张的说话方式，他可能会将“我看”省略掉，直接说“那车还不错”。
我等下跟你弄	我看那车还不错	gpt-35-turbo	stop	根据小张的说话方式，他可能会将“我看那车还不错”简化为“我看车不错”。
色差太小	我看那车还不错	gpt-35-turbo	stop	根据小张的说话方式，他可能会简化句子，只说“那车不错”。
他应该没多久假期吧	我看那车还不错	gpt-35-turbo	stop	小张的说话方式是省略掉一些中间的词语或者部分，使得句子更加简洁明了。因此，他可能会将“我看那车还不错”说成“我看那车不错”。
主专业不是我们学院就是学校的	我看那车还不错	gpt-35-turbo	stop	小张的说话方式是将“主”字省略掉，只保留“专业”这个词。因此，他可能会将“我看那车还不错”说成“看那车还不错”。
怎么个好法	我看那车还不错	gpt-35-turbo	stop	小张的说话方式是省略掉疑问词或助词，只保留关键词或主语谓语。因此，他可能会将“我看那车还不错”简化为“看车不错”。
穷人怕搬家	我看那车还不错	gpt-35-turbo	stop	小张的说话方式是删去一个或多个词语，使句子更加简洁明了。因此，他可能会将“我看那车还不错”简化为“那车不错”。
哈哈我有机会抱小小宝宝了	我看那车还不错	gpt-35-turbo	stop	根据小张的说话方式，他可能会把“那车”中的“车”省略掉，因此他可能会说成“我看那还不错”。
专业新闻播报	我看那车还不错	gpt-35-turbo	stop	小张的说话方式是省略掉一些常用的词语或短语，只保留关键词来表达意思。因此，他可能会说成“看车不错”。
穷人的晶片	我看那车还不错	gpt-35-turbo	stop	小张的说话方式可能是删减掉一些他认为不重要或者不必要的词语或者信息。因此，他可能会把“我看那车还不错”说成“看车不错”。
男的就是喜欢美女	我看那车还不错	gpt-35-turbo	stop	小张的说话方式是省略主语，只保留谓语和宾语。因此，他可能会说成“看那车还不错”。
绿帽子有意思	我看那车还不错	gpt-35-turbo	stop	小张的说话方式是删去句子中的某些词语或者短语，保留主要意思。因此，他可能会把“我看那车还不错”说成“那车还不错”。
我的空余时间太多	我看那车还不错	gpt-35-turbo	stop	根据小张的说话方式，他倾向于省略掉一些不必要的信息，只表达最核心的意思。因此，他可能会将“我看”这个词组省略掉，直接说“那车还不错”。
只要外头的电流电压监视到就行了	我看那车还不错	gpt-35-turbo	stop	小张的说话方式可能是省略掉了一些关键词或者词组，只保留了最关键的词。因此，他可能会将“我看那车还不错”简化为“我看那不错”。
我运气比较好	我看那车还不错	gpt-35-turbo	stop	小张的说话方式是省略主语，直接以谓语动词开头表达自己的意思。因此，他可能会将“我看那车还不错”表达为“看那车还不错”。
我公公年前还治疗的较好	我看那车还不错	gpt-35-turbo	stop	小张的说话方式是省略主语，直接从谓语开始说起。因此，他可能会把“我看那车还不错”说成“看那车还不错”。
你说你们这届的	我看那车还不错	gpt-35-turbo	stop	小张的说话方式是省略掉一些不必要的词语，使句子更加简洁明了。因此，他可能会将“我看那车还不错”简化为“我看那车不错”。
网路新生活运动	我看那车还不错	gpt-35-turbo	stop	小张的说话方式是将一些词语或短语中的部分内容省略或合并，使得说话更加简洁。因此，他可能会将“我看那车还不错”说成“我看那车不错”。
床边故事	我看那车还不错	gpt-35-turbo	stop	小张的说话方式可能是省略掉一些常用的词语或者短语，只保留最关键的部分。因此，他可能会将“我看那车还不错”简化为“我看那车”。
你直接和你哥哥联系吧	我看那车还不错	gpt-35-turbo	stop	小张的说话方式是省略了一些明显的信息，比如“哥哥”这个词。因此，他可能会说成“我看那车还不错”。
这个行业压力也大	我看那车还不错	gpt-35-turbo	stop	小张的说话方式是省略主语或者上下文中已经明确的信息，只保留关键词或者重要信息。因此，他可能会将“我看那车还不错”简化为“那车还不错”。
小女孩我要求钱钱	我看那车还不错	gpt-35-turbo	stop	根据小张的说话方式，他会省略掉“看那车”中的“那”，并将“我”改为“小”，因此他可能会说成“小看车还不错”。
昨天那个阿姐叫什么名字啊	我看那车还不错	gpt-35-turbo	stop	根据小张的说话方式，他可能会说成“我看那还不错”。
房间都带电脑	我看那车还不错	gpt-35-turbo	stop	小张的说话方式是省略掉后面的部分，只说前面的部分。因此，他可能会把“我看那车还不错”说成“我看那车”。
名头很大啊	我看那车还不错	gpt-35-turbo	stop	小张的说话方式是省略掉一些常用的词语或者词组中的一部分，保留其中的关键词。因此，他可能会将“我看那车还不错”说成“我那车不错”。
我都是四点半下班	我看那车还不错	gpt-35-turbo	stop	小张的说话方式可能是省略掉一些常用的词语或者短语，只保留关键词来表达意思。因此，他可能会将“我看那车还不错”简化为“我看车不错”。
你也不算早	我看那车还不错	gpt-35-turbo	stop	小张的说话方式是省略掉句子中的一部分，只保留重要的信息。因此，他可能会将“我看那车还不错”简化为“我看那车”。
你看你那个店都没用	我看那车还不错	gpt-35-turbo	stop	小张的说话方式是省略掉句子中的最后一个词或短语。因此，他可能会把“我看那车还不错”说成“我看那车还”。
我他妈觉得	我看那车还不错	gpt-35-turbo	stop	根据小张的说话方式，他可能会将“我看那车还不错”简化为“我那车还不错”。
我明天去邮局看看	我看那车还不错	gpt-35-turbo	stop	根据小张的说话方式，他倾向于省略掉一些不必要的信息，只保留最关键的部分。因此，他可能会将“我看那车还不错”简化为“我看那车”。
你二外选的什么	我看那车还不错	gpt-35-turbo	stop	小张的说话方式是省略掉了句子中的一些成分，只保留了关键词或者重要信息。因此，他可能会将“我看那车还不错”简化为“我看那车”。
你也发现啦	我看那车还不错	gpt-35-turbo	stop	小张的说话方式是省略掉一些常用的词语或者词组，只保留关键词来表达意思。因此，他可能会把“我看那车还不错”简化为“我看车不错”。
我刚回来	我看那车还不错	gpt-35-turbo	stop	根据小张的说话方式，他可能会将“我看那车还不错”简化为“我看那车”。
所以最后我就	我看那车还不错	gpt-35-turbo	stop	根据小张的说话方式，他可能会说成“我看那车还不错”。也就是省略了句子末尾的“了”。
亲你怎么也变滴这么穷鸟	我看那车还不错	gpt-35-turbo	stop	小张的说话方式是将句子中的某些词语或者词组移动到句子的开头，从而改变句子的语序。因此，他可能会将“那车还不错”移动到句子开头，变成“还不错，我看那车”。
外面好冷	我看那车还不错	gpt-35-turbo	stop	小张的说话方式是省略掉形容词的程度副词，只保留形容词本身。因此，“我看那车还不错”可能会被他说成“我看那车好”。
我现在也是这么教我丫头	我看那车还不错	gpt-35-turbo	stop	小张的说话方式是省略掉“也是”这个词，只保留“是”。因此，他可能会把“我看那车还不错”说成“我那车还不错”。
新东方氛围又比较好	我看那车还不错	gpt-35-turbo	stop	小张的说话方式是省略掉一些本应该存在的词语，使句子更加简洁。因此，他可能会说成“我看那车不错”。
那你还是打印电子版的吧	我看那车还不错	gpt-35-turbo	stop	小张的说话方式是将句子中的主语和谓语的顺序颠倒，使得谓语动词出现在主语之前。因此，“我看那车还不错”这个句子，他可能会说成“我那车看还不错”。
如家也是	我看那车还不错	gpt-35-turbo	stop	小张的说话方式是省略掉一些常用的助动词或连词，使句子更加简洁明了。因此，他可能会将“我看那车还不错”简化为“我看车不错”。
所以我不招惹你	我看那车还不错	gpt-35-turbo	stop	小张的说话方式是将否定词“不”改为“招惹”，即将否定转化为肯定。因此，他可能会将“不错”改为“错”。  因此，小张可能会说成“所以我招惹你，我看那车还错”。
主要现在外面的东西太不放心了	我看那车还不错	gpt-35-turbo	stop	小张的说话方式是省略掉“太”的字，使得句子更加简洁明了。因此，他可能会将“我看那车还不错”简化为“我看那车不错”。
学院盖章省事多了	我看那车还不错	gpt-35-turbo	stop	小张的说话方式可能是省略掉一些词语或者语气助词，使得句子更加简洁明了。因此，他可能会将“我看那车还不错”简化为“那车不错”。
好吧那我寄家里	我看那车还不错	gpt-35-turbo	stop	小张的说话方式是将句子中的第一个字省略掉。因此，“我看那车还不错”这个句子，他会说成“看那车还不错”。
万一明生有事不能当司机呢	我看那车还不错	gpt-35-turbo	stop	小张的说话方式可能是喜欢用省略的方式表达自己的意思，而且常常以疑问的形式结尾。因此，他可能会说成“那车还不错？”或者简单地说“不错”。
那合同规定你干什么了么	我看那车还不错	gpt-35-turbo	stop	小张的说话方式是将一个完整的句子缩减成一个简短的词语或者助词。因此，他可能会将“我看那车还不错”缩减成“那车不错”。
你会做饭吗	我看那车还不错	gpt-35-turbo	stop	根据小张的说话方式，他可能会将句子简化为“不错”。因此，他可能会表达为“那车不错”。
孩子压力好大呀	我看那车还不错	gpt-35-turbo	stop	根据小张的说话方式，他可能会将句子简化为“不错”。
外国人不是会好一些么	我看那车还不错	gpt-35-turbo	stop	小张的说话方式是省略掉句子中的一部分，只保留最后一个词或者一个短语。因此，他可能会将“我看那车还不错”说成“不错”。
我就是不会配哦	我看那车还不错	gpt-35-turbo	stop	小张的说话方式是省略掉大部分的话，只保留最后一个词或者一个音节。因此，他可能会将“我看那车还不错”说成“错”。
你真不饿呀	我看那车还不错	gpt-35-turbo	stop	根据小张的说话方式，他可能会将句子简化为“不错”。因此，他可能会表达为“那车不错”。
你在哪里上班呢	我看那车还不错	gpt-35-turbo	stop	根据小张的说话方式，他可能会将句子简化为“不错”。因此，他可能会表达为“那车不错”。
她也有点动摇吧	我看那车还不错	gpt-35-turbo	stop	根据小张的说话方式，他可能会将句子简化为“不错”。因此，他可能会表达为“那车不错”。
她就说了心脏	我看那车还不错	gpt-35-turbo	stop	小张的说话方式是省略掉了句子中的一些关键词或短语，只保留了最核心的部分。因此，他可能会把“我看那车还不错”简化为“我看那车”。
我现在从事管理了	我看那车还不错	gpt-35-turbo	stop	小张的说话方式是省略主语中的“现在”或“正在”，直接使用动词的过去式或完成式来表示当前正在进行的动作。因此，他可能会说“我看那车还不错”成为“我看那车不错了”。
我现在在休假	我看那车还不错	gpt-35-turbo	stop	根据小张的说话方式，他可能会说成“那车还不错”。
你最近还好	我看那车还不错	gpt-35-turbo	stop	小张的说话方式是省略掉“最近”这个时间状语，只保留主语和谓语。因此，他可能会把“我看那车还不错”说成“我看那车不错”。
我先和你预定好书哦	我看那车还不错	gpt-35-turbo	stop	根据小张的说话方式，他可能会省略掉“车”这个词，直接说“我看还不错”。
要不咱现在去也行	我看那车还不错	gpt-35-turbo	stop	根据小张的说话方式，他可能会把“我看”这个词组中的“看”省略掉，直接说“我那车还不错”。
洋插队是什么意思	我看那车还不错	gpt-35-turbo	stop	小张的说话方式是省略了句子的结尾部分，只说出了主语和谓语。因此，他可能会把“我看那车还不错”说成“我看那车”。
可能我没有找到地方	我看那车还不错	gpt-35-turbo	stop	小张的说话方式是省略掉句子中的一些词语或者短语，但是不影响句子的理解。因此，他可能会把“我看那车还不错”说成“我看那车不错”。
那我再发给你	我看那车还不错	gpt-35-turbo	stop	小张的说话方式是省略了“你”的称呼或代词。因此，他可能会说成“我看那车还不错”。
这个我要查一下帐	我看那车还不错	gpt-35-turbo	stop	根据小张的说话方式，他倾向于省略掉一些常见的词语，特别是结尾的部分。因此，他可能会将“我看那车还不错”简化为“我看那车还不错”。
我不再是以前的我	我看那车还不错	gpt-35-turbo	stop	小张的说话方式是将重复的词语省略掉，只保留一个。因此，他可能会将“我看那车还不错”说成“我看车不错”。
后辈的都忘之脑后了	我看那车还不错	gpt-35-turbo	stop	小张的说话方式是省略掉一些常用的词语或者词组，只保留关键词来表达意思。因此，他可能会将“我看那车还不错”简化为“那车不错”。
以前的同事关系跟我都蛮好的	我看那车还不错	gpt-35-turbo	stop	小张的说话方式是省略主语。因此，他可能会说“看那车还不错”。
三余的啊	我看那车还不错	gpt-35-turbo	stop	根据小张的说话方式，他可能会简化句子，只说出“不错”这个词。因此，他可能会表达成“不错”。
发票还是那种航空公司的票据	我看那车还不错	gpt-35-turbo	stop	小张的说话方式是省略掉一些常用的词语或短语，只保留最关键的词语来表达意思。因此，他可能会将“我看那车还不错”简化为“我看车不错”。
中石化的又一新闻	我看那车还不错	gpt-35-turbo	stop	根据小张的说话方式，他可能会说成“那车还不错”。
的小孩子的夏令营	我看那车还不错	gpt-35-turbo	stop	根据小张的说话方式，他可能会说成“看那车还不错”。
盘丝洞滴同志们	我看那车还不错	gpt-35-turbo	stop	小张的说话方式是去掉一些词语或者词组中的一部分，只保留关键词。因此，他可能会把“我看那车还不错”说成“那车不错”。
我滴钱钱就都飞走鸟	我看那车还不错	gpt-35-turbo	stop	小张的说话方式是省略主语“我”的习惯。因此，“我看那车还不错”这个句子，他可能会说成“看那车还不错”。
你要给我客人的护照号码和名字	我看那车还不错	gpt-35-turbo	stop	根据小张的说话方式，他可能会说成“我看那车还不错”。也就是省略了“我”的主语。
技能讲师的公式不大好算	我看那车还不错	gpt-35-turbo	stop	小张的说话方式是省略主语和谓语中的一些词语，只保留关键词来表达意思。因此，他可能会将“我看那车还不错”简化为“那车还不错”。
我去了膜拜一下你们的教材	我看那车还不错	gpt-35-turbo	stop	根据小张的说话方式，他可能会说成“我看还不错的车”。
现在的钱不好挣啊	我看那车还不错	gpt-35-turbo	stop	小张的说话方式是省略掉句子中的主语。因此，他可能会将“我看那车还不错”说成“看那车还不错”。
我们滴也没有	我看那车还不错	gpt-35-turbo	stop	小张的说话方式是省略掉“我们”的称呼，可能是因为他习惯了使用口语化的表达方式。因此，他可能会将“我看那车还不错”简化为“看那车还不错”。
那你的工作挺好的耶	我看那车还不错	gpt-35-turbo	stop	小张的说话方式是将“你的”、“他的”等所有格代词的“的”字省略掉。因此，“我看那车还不错”这个句子，他会说成“我看那车还不错耶”。
老板的公事还是蛮多	我看那车还不错	gpt-35-turbo	stop	小张的说话方式是省略主语，只保留谓语和宾语。因此，他可能会将“我看那车还不错”简化为“看那车还不错”。
娇的老公挺好的	我看那车还不错	gpt-35-turbo	stop	小张的说话方式是将句子中的第一个字省略掉。因此，他可能会将“我看那车还不错”说成“看那车还不错”。
元旦晚会的吗	我看那车还不错	gpt-35-turbo	stop	根据小张的说话方式，他可能会将“我看那车还不错”简化为“那车还不错”。
人的生命只有一次啊	我看那车还不错	gpt-35-turbo	stop	小张的说话方式是省略主语，只保留谓语和宾语。因此，他可能会将“我看那车还不错”说成“看那车还不错”。
金钱豹的铁板烧没有了	我看那车还不错	gpt-35-turbo	stop	小张的说话方式是省略掉句子中的第一个名词或代词。因此，他可能会说成“看那车还不错”。
所以孩子刚开始计算有点跟不上	我看那车还不错	gpt-35-turbo	stop	小张的说话方式是省略掉了“所以”这个连词，直接将后面的句子作为原因或结果的表达。因此，他可能会将“我看那车还不错”这个句子表达为“那车还不错”。
其实只要你富足了她也富足了	我看那车还不错	gpt-35-turbo	stop	小张的说话方式是省略掉一些可以推断出来的词语，使句子更加简洁明了。因此，他可能会把“我看那车还不错”说成“那车还不错”。
女生们还是青春永驻	我看那车还不错	gpt-35-turbo	stop	小张的说话方式是将句子中的某些词语或短语的位置调换，使得句子更加简洁明了。因此，他可能会将“我看那车还不错”改为“那车我看还不错”。
只是人确实在某个时间段会很脆弱	我看那车还不错	gpt-35-turbo	stop	小张的说话方式是省略掉“只是”这个词，强调后面的内容。因此，他可能会说“那车还不错”。
但是效果不错	我看那车还不错	gpt-35-turbo	stop	小张的说话方式是省略掉前面的一些词语，只说后面的内容。因此，他可能会把“我看那车还不错”说成“那车还不错”。
那你怎么知道啊	我看那车还不错	gpt-35-turbo	stop	小张的说话方式是将疑问词放在句首，省略掉“那”字。因此，“我看那车还不错”这个句子，他可能会说成“我看车还不错”。
原来你是个诗人	我看那车还不错	gpt-35-turbo	stop	小张的说话方式是省略掉“原来”、“其实”等表示转折或者补充的词语，直接表达主要意思。因此，他可能会说成“那车还不错”。
那我明天早上跟她说吧	我看那车还不错	gpt-35-turbo	stop	小张的说话方式是省略了“那”这个指示代词，直接将句子主语作为主语。因此，他可能会将“我看那车还不错”说成“我看车还不错”。
不然你那些在读证明全部要重开	我看那车还不错	gpt-35-turbo	stop	小张的说话方式是省略掉否定词“不”的。因此，他可能会把“我看那车还不错”说成“我看那车还错”。
可是你考了驾照在国内也有用啊	我看那车还不错	gpt-35-turbo	stop	小张的说话方式是省略掉一些连词或者助词，使得句子更加简洁。因此，他可能会说成“我看那车不错”。
我往你那走了我来找你啦	我看那车还不错	gpt-35-turbo	stop	根据小张的说话方式，他会省略掉一些不必要的信息，因此他可能会将“我看那车还不错”简化为“那车不错”。
山大哪啊其实我倒是经常走那	我看那车还不错	gpt-35-turbo	stop	根据小张的说话方式，他倾向于只说出句子中的一部分，而省略掉其他部分。因此，他可能会将“我看那车还不错”简化为“我看那车”。
不他不经常上	我看那车还不错	gpt-35-turbo	stop	小张的说话方式是省略掉一些关键词或者短语，只说出最重要的部分。因此，他可能会将“我看那车还不错”简化为“我看车不错”。
下次吧少数人带	我看那车还不错	gpt-35-turbo	stop	根据小张的说话方式，他倾向于省略掉一些不必要的信息，只表达最核心的意思。因此，他可能会将“我看那车还不错”简化为“那车不错”。
反正你最近也不走七月你	我看那车还不错	gpt-35-turbo	stop	小张的说话方式是将句子中的一些词语或者部分省略掉，只保留关键词语，从而达到简洁、幽默的效果。因此，他可能会将“我看那车还不错”简化为“那车不错”。
家里哪有什么事单位肯定事多啊	我看那车还不错	gpt-35-turbo	stop	小张的说话方式是省略掉前面的一些内容，只保留重点部分。因此，他可能会把“我看那车还不错”说成“那车还不错”。
