demonstration	sentence	model_type	stop_type	response
好多那个	我看那车还不错	gpt-35-turbo	stop	根据小张的说话方式，他会省略掉“那个”这个词，因此，“我看那车还不错”这个句子会被他说成“我看车还不错”。
但我们这里测	我看那车还不错	gpt-35-turbo	stop	小张的说话方式是省略掉一些不必要的词语，只保留关键词来表达意思。因此，他可能会将“我看那车还不错”简化为“我看车不错”。
我我觉得	我看那车还不错	gpt-35-turbo	stop	根据小张的说话方式，他会省略掉重复的“我”，因此他可能会说成“看那车还不错”。
这跟我从小到大环境是	我看那车还不错	gpt-35-turbo	stop	小张的说话方式是省略掉句子开头的“这”字。因此，他可能会把“我看那车还不错”说成“看那车还不错”。
那么多人逛街啊	我看那车还不错	gpt-35-turbo	stop	小张的说话方式是省略掉“那么”、“这么”等表示程度或数量的词语，直接使用形容词或副词来表达。因此，他可能会将“我看那车还不错”说成“我看车不错”。
我买了挺多肉丸的	我看那车还不错	gpt-35-turbo	stop	根据小张的说话方式，他可能会说成“我看那还不错的车”。
它分蛮多版面	我看那车还不错	gpt-35-turbo	stop	根据小张的说话方式，他可能会说成“我看那车还错不”。
最低保障都没有	我看那车还不错	gpt-35-turbo	stop	小张的说话方式是将一个词语或短语的最高级或最高程度的修饰词“最”去掉，变成更加简洁的表达方式。因此，他可能会将“我看那车还不错”简化为“我看那车不错”。
我可没那么多钱	我看那车还不错	gpt-35-turbo	stop	小张的说话方式是省略掉“那么”这个词，使句子更加简洁明了。因此，他可能会把“我看那车还不错”说成“我看那车不错”。
哦我们没有这么多人	我看那车还不错	gpt-35-turbo	stop	小张的说话方式是省略掉“这么”、“那么”等程度副词，直接使用“多”、“少”等词语来表达程度。因此，他可能会将“我看那车还不错”说成“我看那车不错”。
他应该没多久假期吧	我看那车还不错	gpt-35-turbo	stop	小张的说话方式是将形容词或副词的位置颠倒，放在名词或动词前面。因此，他可能会将“不错”放在“车”前面，说成“我看那不错车”。
你得要多长时间	我看那车还不错	gpt-35-turbo	stop	小张的说话方式是将形容词放在名词前面，形成了一种非常特别的语言风格。因此，他可能会将“不错”放在名词“车”的前面，说成“那不错的车我看还可以”。
我没那么大勇气	我看那车还不错	gpt-35-turbo	stop	小张的说话方式是省略掉一些中间的词语或者字母，使得句子更加简洁。因此，他可能会把“我看那车还不错”说成“我看那车不错”。
最基本的	我看那车还不错	gpt-35-turbo	stop	根据小张的说话方式，他可能会说成“我看那车不错”。
那么多人逛街啊	我看那车还不错	gpt-35-turbo	stop	小张的说话方式是省略掉一些本应该存在的词语，使句子更加简洁。因此，他可能会将“我看那车还不错”说成“我那车不错”。
当地最低标准	我看那车还不错	gpt-35-turbo	stop	小张的说话方式是将一个词语或短语中的一个字省略掉，使得原本的意思产生变化或者更加夸张。因此，他可能会将“我看那车还不错”说成“我看那车还错”。
最后一代的文人艺术家	我看那车还不错	gpt-35-turbo	stop	小张的说话方式可能是将“最后一”中的“后一”颠倒过来，即将“后”和“一”交换位置。因此，他可能会将“我看那车还不错”说成“我看那车还不错不车那看我”。
我没那么大勇气	我看那车还不错	gpt-35-turbo	stop	小张的说话方式是将“大”字省略，只保留形容词的意思。因此，他可能会将“那车还不错”说成“那车还好”。
这么多人逛街啊	我看那车还不错	gpt-35-turbo	stop	小张的说话方式是省略掉一些本应该存在的词语或者部分，使得句子更加简洁。因此，他可能会将“我看那车还不错”说成“我那车不错”。
最大制片家	我看那车还不错	gpt-35-turbo	stop	小张的说话方式是将一个词的某些字母省略掉，只保留重要的部分。因此，他可能会将“我看那车还不错”说成“我看那车不错”。
最好房子就在	我看那车还不错	gpt-35-turbo	stop	小张的说话方式是省略掉了“好”字，因此他可能会说成“我看那车还不错”。
哦我们没有这么多人	我看那车还不错	gpt-35-turbo	stop	小张的说话方式可能是省略了一些词汇或者音节，导致句子不太符合语法规则。因此，他可能会将“我看那车还不错”说成“我看那车还不错”。
我准备了好长时间嗯	我看那车还不错	gpt-35-turbo	stop	根据小张的说话方式，他可能会把“还不错”中的“还”省略掉，说成“我看那车不错”。
他应该没多久假期吧	我看那车还不错	gpt-35-turbo	stop	小张的说话方式可能是将两个相邻的字合并成一个，去掉其中一个字的一部分或全部。因此，他可能会将“我看那车还不错”说成“我看那车还不错”。
你是不是没送过卡	我看那车还不错	gpt-35-turbo	stop	小张的说话方式是省略了“是不是”这个疑问词，直接将句子转化为肯定句。因此，他可能会将“我看那车还不错”转化为“我看那车不错”。
你姐是不是也这个	我看那车还不错	gpt-35-turbo	stop	小张的说话方式是省略掉了“是不是”这个疑问语气的表达，直接将后面的内容作为陈述句。因此，他可能会将“我看那车还不错”简化为“我看那车不错”。
我去查一查	我看那车还不错	gpt-35-turbo	stop	根据小张的说话方式，他会简化句子，只保留最关键的部分。因此，他可能会将“我看那车还不错”简化为“我看那车”。
那个屋子会不会很挤啊	我看那车还不错	gpt-35-turbo	stop	小张的说话方式是将疑问句转化为陈述句。因此，他可能会将“我看那车还不错”转化为“我看那车很不错”。
肥肉哥我们的学费到底能不能退呢	我看那车还不错	gpt-35-turbo	stop	小张的说话方式是省略掉一些助词或者连词，使句子更加简洁。因此，他可能会把“我看那车还不错”说成“我那车还不错”。
恩那我们周一周二会不会不上课啊	我看那车还不错	gpt-35-turbo	stop	小张的说话方式是将否定词放在动词前面，表示否定。因此，他可能会将“不错”放在动词前面，说成“我看那车错不了”。
不过高新区是不是稍微偏了一点	我看那车还不错	gpt-35-turbo	stop	小张的说话方式是将“不过”放在句子的后面，使得句子的重点放在前面。因此，他可能会将“我看”放在后面，表达成“那车我看还不错”。
思八达是不是离你家很近	我看那车还不错	gpt-35-turbo	stop	小张的说话方式是将疑问句转化为陈述句，即将“是不是”变为“是”。因此，他可能会将“我看那车还不错”说成“那车还不错”。
你还理不理我	我看那车还不错	gpt-35-turbo	stop	小张的说话方式是将一个词组中的某些词省略掉，只保留关键词，使得句子更加简洁。因此，他可能会将“我看那车还不错”简化为“我那车不错”。
你介意不介意	我看那车还不错	gpt-35-turbo	stop	根据小张的说话方式，他可能会将“我看那车还不错”简化为“我”。
这么多年的朋友搞得跟个外人似得	我看那车还不错	gpt-35-turbo	stop	小张的说话方式是省略掉句子中的一些常见词语，如“这么多年”中的“这么多”，“的朋友”中的“的”，以及“我看”中的“我”。因此，他可能会将“我看那车还不错”简化为“那车还不错”。
新一轮的政治斗争又将开始	我看那车还不错	gpt-35-turbo	stop	小张的说话方式是省略掉句子中的第一个词或者短语，只保留后面的内容。因此，他可能会将“我看那车还不错”说成“看那车还不错”。
那些几百几百的又不好看	我看那车还不错	gpt-35-turbo	stop	小张的说话方式是省略掉数字中间的“几百几百”，只保留最后一个数字。因此，他可能会说成“我看那车还不错”。
你们一家的照片比我的还多	我看那车还不错	gpt-35-turbo	stop	小张的说话方式是将“你们一家的”中的“一家的”省略掉，只保留“你们的”。因此，他可能会将“我看那车还不错”中的“我看”省略掉，直接说成“那车还不错”。
三余的啊	我看那车还不错	gpt-35-turbo	stop	根据小张的说话方式，他可能会将句子简化为“那车还不错”。
情感的缺失给我造成不少的困扰	我看那车还不错	gpt-35-turbo	stop	小张的说话方式是省略掉了“造成不少”的部分，只保留了“造成的”。因此，他可能会把“我看那车还不错”说成“我看那车的还不错”。
我们大多数的时间都是发在家上	我看那车还不错	gpt-35-turbo	stop	小张的说话方式是省略掉一些常用的词语，尤其是一些冗余的词语。因此，他可能会将“我看那车还不错”简化为“那车还不错”。
多少寸的	我看那车还不错	gpt-35-turbo	stop	根据小张的说话方式，他可能会将“不错”说成“错”。因此，他可能会说：“我看那车还错。”
你几点的火车	我看那车还不错	gpt-35-turbo	stop	根据小张的说话方式，他可能会将“我看那车还不错”说成“我那车还不错”。
最后一代的文人艺术家	我看那车还不错	gpt-35-turbo	stop	小张的说话方式是省略掉句子中的第一个词或短语，通常是主语或者是限定词。因此，他可能会说成“看那车还不错”。
按照银行报表的销售额可以	我看那车还不错	gpt-35-turbo	stop	小张的说话方式是省略掉一些前面已经提到的内容，只说出关键词或者最重要的部分。因此，他可能会说出“还不错”这个短语来表达“我看那车还不错”这个句子。
那在这个方面上我们能达成共识	我看那车还不错	gpt-35-turbo	stop	小张的说话方式是省略掉一些不必要的词语，使句子更加简洁明了。因此，他可能会将“我看”省略掉，直接说“那车还不错”。
你家里比我家里可能性大些列	我看那车还不错	gpt-35-turbo	stop	小张的说话方式是省略掉一些常用的词语或语法结构，使句子更加简洁。因此，他可能会将“我看那车还不错”简化为“那车还不错”。
等我都付完你一次性给我吧	我看那车还不错	gpt-35-turbo	stop	小张的说话方式是省略掉前面的部分，只说后面的关键信息。因此，他可能会把“我看那车还不错”说成“那车还不错”。
跟你我就直说了	我看那车还不错	gpt-35-turbo	stop	根据小张的说话方式，他可能会省略掉“跟你”，直接说“那车还不错”。
比你时间长	我看那车还不错	gpt-35-turbo	stop	根据小张的说话方式，他可能会说成“看那车不错”。
对咱们来说压力太大	我看那车还不错	gpt-35-turbo	stop	小张的说话方式是省略主语和助词，只保留谓语和宾语。因此，他可能会将“我看那车还不错”简化为“看车不错”。
等尚尚上幼儿园她就开始工作了	我看那车还不错	gpt-35-turbo	stop	小张的说话方式是省略掉前面的一些信息，只保留最重要的部分。因此，他可能会把“我看那车还不错”简化为“那车还不错”。
就是从小屋里环境不是蛮好	我看那车还不错	gpt-35-turbo	stop	小张的说话方式是省略掉一些不必要的词语，使句子更加简洁明了。因此，他可能会将“我看那车还不错”简化为“那车还不错”。
按照国内标准兔子是压着下限了	我看那车还不错	gpt-35-turbo	stop	小张的说话方式是省略掉一些前置的信息或者背景，直接表达主要的内容。因此，他可能会说成“那车还不错”。
不啊检查是免费的	我看那车还不错	gpt-35-turbo	stop	根据小张的说话方式，他可能会说成“不看那车还不错”。
奥然后呢	我看那车还不错	gpt-35-turbo	stop	根据小张的说话方式，他可能会将“我看那车还不错”简化为“我车不错”。
不他不经常上	我看那车还不错	gpt-35-turbo	stop	小张的说话方式是省略掉否定词“不”的方式，即将否定的意思转化为肯定的表达方式。因此，他可能会将“我看那车还不错”说成“我看那车很不错”。
不不不他就是	我看那车还不错	gpt-35-turbo	stop	小张的说话方式是去掉否定词，只保留肯定的部分。因此，他可能会将“我看那车还不错”说成“我看那车很不错”。
不啊检查是免费的	我看那车还不错	gpt-35-turbo	stop	小张的说话方式是将否定词“不”放在动词前面，改变句子的意思。因此，他可能会将“看”放在否定词前面，说成“不看那车还不错”。
对农民工找妓女的看法	我看那车还不错	gpt-35-turbo	stop	小张的说话方式是省略主语和动词，只保留宾语和宾语的修饰语。因此，他可能会说成“那车还不错”。  需要注意的是，这种说话方式并不规范，也不建议模仿。
为狗爬出的洞敞开着	我看那车还不错	gpt-35-turbo	stop	小张的说话方式是省略主语或宾语，只保留关键词或重要信息。因此，他可能会表达“我看那车还不错”为“看那车还不错”。
关于手机计划的	我看那车还不错	gpt-35-turbo	stop	根据小张的说话方式，他可能会将“我看那车还不错”简化为“那车还不错”。
对转基因的议论真的很多	我看那车还不错	gpt-35-turbo	stop	小张的说话方式是省略主语或者其他成分，只保留最关键的信息。因此，他可能会将“我看那车还不错”简化为“那车还不错”。
我们跟他们的代沟还是蛮大的	我看那车还不错	gpt-35-turbo	stop	小张的说话方式是省略主语，只保留自己所在的一方。因此，他可能会说成“看那车还不错”。
在同学心中的印象	我看那车还不错	gpt-35-turbo	stop	小张的说话方式是省略主语，只保留描述对象的定语或形容词。因此，他可能会说成“看那车还不错”。
然后他们对旅馆的需求不算大吧	我看那车还不错	gpt-35-turbo	stop	小张的说话方式是省略掉某些词语或短语，使句子更加简洁明了。因此，他可能会将“我看”省略掉，直接说“那车还不错”。
我自己减少了和他们的交往	我看那车还不错	gpt-35-turbo	stop	小张的说话方式是省略掉一些词语或词组，使句子更加简洁。因此，他可能会将“我看那车还不错”简化为“我看那车不错”。
这个是帖子在校内的分享	我看那车还不错	gpt-35-turbo	stop	根据小张的说话方式，他可能会说成“我看那车不错”。
还有当我想你的时候	我看那车还不错	gpt-35-turbo	stop	根据小张的说话方式，他可能会将“我看那车还不错”简化为“那车不错”。
哦哦那行	我看那车还不错	gpt-35-turbo	stop	根据小张的说话方式，他可能会将句子简化为“那车还不错”。
哎哟你变哦	我看那车还不错	gpt-35-turbo	stop	根据小张的说话方式，他可能会将“我看那车还不错”说成“那车还不错”。
嘿嘿今天卫生不是很脏	我看那车还不错	gpt-35-turbo	stop	小张的说话方式是省略掉句子开头的“嘿嘿”或其他类似的语气词。因此，他可能会把“我看那车还不错”说成“那车还不错”。
嗯那是蛮好的	我看那车还不错	gpt-35-turbo	stop	小张的说话方式是省略掉“嗯”这个语气词，直接将后面的内容作为主语或宾语。因此，他可能会将“我看”省略掉，直接说“那车还不错”。
啊你也太后知后觉了	我看那车还不错	gpt-35-turbo	stop	小张的说话方式是省略掉句子开头的“啊”字。因此，他可能会把“我看那车还不错”说成“看那车还不错”。
呵呵我们说好了	我看那车还不错	gpt-35-turbo	stop	根据小张的说话方式，他会省略掉一些常用的词语或者表达方式。因此，他可能会说成“那车还不错”。
哦哦我先下班了	我看那车还不错	gpt-35-turbo	stop	根据小张的说话方式，他可能会省略掉一些无关紧要的词语，因此他可能会说成“看那车还不错”。
这比较压抑呵呵	我看那车还不错	gpt-35-turbo	stop	根据小张的说话方式，他可能会说成“我看那车还不错呵呵”，即在句子末尾加上“呵呵”来表示语气。
恩你去音效网	我看那车还不错	gpt-35-turbo	stop	小张的说话方式是省略掉句子中的第一个字或词。因此，他可能会把“我看那车还不错”说成“看那车还不错”。
我有时间呵呵	我看那车还不错	gpt-35-turbo	stop	根据小张的说话方式，他可能会简化句子，省略掉一些词语。因此，他可能会说成“那车不错”。
因为资格办理很麻烦而且很费钱	我看那车还不错	gpt-35-turbo	stop	小张的说话方式是省略掉一些显而易见的信息，只说出关键的部分。因此，他可能会将“我看那车还不错”简化为“那车还不错”。
哎哟关系不是一般勒好	我看那车还不错	gpt-35-turbo	stop	小张的说话方式是省略掉句子开头的“哎哟”或其他类似的语气词。因此，他可能会将“我看那车还不错”说成“看那车还不错”。
嘿嘿交出去了今晚可以放松了	我看那车还不错	gpt-35-turbo	stop	小张的说话方式是省略掉句子开头的“嘿嘿”或其他类似的语气词。因此，他可能会把“我看那车还不错”说成“看那车还不错”。
哈哈你也真是	我看那车还不错	gpt-35-turbo	stop	小张的说话方式是省略掉前面的笑话或者调侃，直接回应后面的内容。因此，他可能会把“我看那车还不错”说成“那车还不错”。
呵呵那就好	我看那车还不错	gpt-35-turbo	stop	根据小张的说话方式，他可能会简化句子，省略掉一些常用的词语或者表达方式。因此，他可能会说成“那车不错”。
嘿嘿我幸运的没有长过	我看那车还不错	gpt-35-turbo	stop	小张的说话方式是省略掉句子中的第一个词或短语，通常是主语或者称呼。因此，他可能会把“我看”省略掉，直接说“那车还不错”。
哈哈此情此景渡口不搭调吧	我看那车还不错	gpt-35-turbo	stop	小张的说话方式是将第一个字或者词的第一个音节省略掉。因此，“我看那车还不错”会被他说成“看那车还不错”。
呜呜白的卖没了	我看那车还不错	gpt-35-turbo	stop	小张的说话方式是省略掉一些形容词或副词，只保留主要的名词或动词。因此，他可能会说成“看车不错”。
哈哈果果同学中午好啊	我看那车还不错	gpt-35-turbo	stop	小张的说话方式是删除掉重复的词语。因此，他可能会把“我看那车还不错”说成“我那车还不错”。
嘿嘿你去忙吧	我看那车还不错	gpt-35-turbo	stop	小张的说话方式是去掉句子中的第一个词语，通常是称呼或代词。因此，他可能会将“我看那车还不错”说成“看那车还不错”。
嘿嘿嘿我勒还不是勒	我看那车还不错	gpt-35-turbo	stop	小张的说话方式是将句子中的第一个字或词省略掉。因此，他可能会将“我看那车还不错”说成“看那车还不错”。
他从楼上摔下来生死未卜我很难过	我看那车还不错	gpt-35-turbo	stop	小张的说话方式是将一个动作或事件的起始位置（如“楼上”）放到动词前面，而将动作或事件的结果或状态（如“摔下来”）放到动词后面。因此，他可能会将“看”放到“车”前面，将“还不错”放到动词后面，说成“我车看还不错”。
在同学心中的印象	我看那车还不错	gpt-35-turbo	stop	小张的说话方式是将“在”字省略掉，只说后面的内容。因此，“我看那车还不错”这个句子，他可能会说成“我看那车还不错的”。
我晚上在火车上睡不好	我看那车还不错	gpt-35-turbo	stop	小张的说话方式是省略掉了一些可以推断出来的信息，比如“火车上”。因此，他可能会说成“我看那还不错”。
在霸权主义主导世界的背景下	我看那车还不错	gpt-35-turbo	stop	小张的说话方式可能是省略掉一些常用的词语或者短语，只保留最关键的词语来表达意思。因此，他可能会将“我看那车还不错”简化为“那车不错”。
行李放在大巴上	我看那车还不错	gpt-35-turbo	stop	小张的说话方式是省略掉了句子中的一些明显的信息，只保留了最重要的部分。因此，他可能会将“我看那车还不错”简化为“那车还不错”。
行李放在车上	我看那车还不错	gpt-35-turbo	stop	小张的说话方式是省略掉句子中的一些明显的信息，只保留最重要的部分。因此，他可能会将“我看那车还不错”简化为“那车还不错”。
你很棒至少在我心里	我看那车还不错	gpt-35-turbo	stop	小张的说话方式是省略掉句子结尾的部分，通常是因为他认为对方已经能够理解他的意思。因此，他可能会将“我看那车还不错”说成“我看那车还不错在”。
你在兔子边上躺会儿吧	我看那车还不错	gpt-35-turbo	stop	小张的说话方式是省略掉一些与主题无关的信息，只保留最核心的内容。因此，他可能会说成“那车还不错”。
我妈妈在电脑前看	我看那车还不错	gpt-35-turbo	stop	根据小张的说话方式，他可能会简化句子，省略掉一些不必要的信息。因此，他可能会说成“那车还不错”。
你在那公司里做过吧	我看那车还不错	gpt-35-turbo	stop	小张的说话方式是省略掉一些不重要的词语或者部分，使得句子更加简洁明了。因此，他可能会把“我看那车还不错”说成“我看车不错”。
他的外号很不雅别仔卡	我看那车还不错	gpt-35-turbo	stop	小张的说话方式是省略掉句子中的一些词语或短语，只保留最重要的信息。因此，他可能会将“我看那车还不错”简化为“那车还不错”。
头像多好啊那个	我看那车还不错	gpt-35-turbo	stop	小张的说话方式是省略掉句子中的最后一个词或短语。因此，他可能会把“我看那车还不错”说成“我看那车还不错啊”。
嗯嗯我要做事了不多说了啊先	我看那车还不错	gpt-35-turbo	stop	小张的说话方式是在句子结尾加上一个重复的词或短语，然后突然停顿。因此，他可能会说“我看那车还不错不错”。
只要油价接轨房价必定暴跌	我看那车还不错	gpt-35-turbo	stop	小张的说话方式是省略掉“只要”这个条件状语，直接表达结果。因此，他可能会把“我看那车还不错”说成“那车还不错”。
虽然我也是	我看那车还不错	gpt-35-turbo	stop	小张的说话方式是省略掉前面的“虽然”或“尽管”等转折词，直接表达后面的内容。因此，他可能会把“我看那车还不错”说成“那车还不错”。
如果当地税务局不给开	我看那车还不错	gpt-35-turbo	stop	小张的说话方式是省略了“如果”这个条件状语从句中的“如果”一词，直接将后面的内容作为主句来表达。因此，他可能会将“我看那车还不错”这个句子简化为“那车还不错”。
如果真的她动摇了	我看那车还不错	gpt-35-turbo	stop	小张的说话方式是将“如果”省略掉，直接将条件句的谓语动词放在主语前面，形成一个陈述句。因此，他可能会将“我看那车还不错”说成“看那车还不错”。
只要你们约好就行	我看那车还不错	gpt-35-turbo	stop	小张的说话方式是省略掉主语的“只要”或“只要是”，直接使用谓语动词。因此，“我看那车还不错”这个句子，他可能会说成“看那车还不错”。
如果他觉得我可以我就马上去租车	我看那车还不错	gpt-35-turbo	stop	小张的说话方式是省略了“如果”的条件语句，直接将后面的结果表达出来。因此，他可能会将“我看那车还不错”简化为“看那车还不错”。
如果长势不好	我看那车还不错	gpt-35-turbo	stop	小张的说话方式是省略掉“如果”这个条件状语从句的前缀，直接表达后面的主句。因此，他可能会将“我看那车还不错”简化为“那车还不错”。
我从心里喜欢孩子的真	我看那车还不错	gpt-35-turbo	stop	小张的说话方式是省略掉句子中的形容词或副词，只保留主语和宾语。因此，他可能会将“我看那车还不错”说成“我看那车”。
