demonstration	sentence	model_type	stop_type	response
这个是另外一个	我看那车还不错	gpt-35-turbo	stop	根据小张的说话方式，他可能会简化句子，只说“我看那车”。
我下周回去	我看那车还不错	gpt-35-turbo	stop	小张的说话方式是省略掉一些明显的信息，只保留最重要的部分。因此，他可能会将“我看那车还不错”简化为“那车不错”。
这次你最丰收	我看那车还不错	gpt-35-turbo	stop	小张的说话方式是省略掉一些无关紧要的词语，只保留主要的信息。因此，他可能会将“我看那车还不错”简化为“我那车不错”。
这个互惠生的签证很难办	我看那车还不错	gpt-35-turbo	stop	小张的说话方式是省略掉了“个”字，可能是因为他觉得这个字在句子中并不重要，或者是为了简化语言表达。因此，他可能会把“我看那车还不错”说成“我看那车不错”。
这个牌子的衣服质量非常好	我看那车还不错	gpt-35-turbo	stop	小张的说话方式是省略了“个”字，可能是为了简化语言或者是习惯了这种表达方式。因此，他可能会说成“我看那车还不错”为“我看那车还挺不错”。
这个交通标识是什么意思	我看那车还不错	gpt-35-turbo	stop	小张的说话方式是省略了“个”字，这可能是他的方言或口语习惯。因此，他可能会将“我看那车还不错”说成“我看那车还不错”。
这个工作累吧	我看那车还不错	gpt-35-turbo	stop	小张的说话方式是省略掉了一些汉字中的“的”、“个”等助词或量词，使句子更加简洁。因此，他可能会将“我看那车还不错”说成“我看那车不错”。
你要有这种信念呀	我看那车还不错	gpt-35-turbo	stop	小张的说话方式是省略掉了一些汉字中的“种”、“个”等量词，使句子更加简洁。因此，他可能会将“我看那车还不错”说成“我看那车不错”。
你这个地址到什么时候有效呢	我看那车还不错	gpt-35-turbo	stop	小张的说话方式是将“的”字省略掉，这种说话方式在口语中比较常见。因此，他可能会将“我看那车还不错”说成“我看那车还不错呢”。
这个样子	我看那车还不错	gpt-35-turbo	stop	小张的说话方式可能是将“的”字省略掉了。因此，他可能会将“我看那车还不错”说成“我看那车还不错样子”。
这个时候你会觉得你自己的	我看那车还不错	gpt-35-turbo	stop	小张的说话方式是省略掉一些常用的词语，使句子更加简洁。因此，他可能会将“我看那车还不错”简化为“我觉得那车不错”。
这个星期吧	我看那车还不错	gpt-35-turbo	stop	根据小张的说话方式，他可能会将“我看那车还不错”说成“我看那车挺不错的”。
我就在你面前倚老卖老一次吧	我看那车还不错	gpt-35-turbo	stop	小张的说话方式是省略掉一些多余的词语或者语气词，使句子更加简洁明了。因此，他可能会将“我看那车还不错”简化为“那车不错”。
丫头去了好几次	我看那车还不错	gpt-35-turbo	stop	根据小张的说话方式，他倾向于省略掉一些不必要的信息，只保留最重要的部分。因此，他可能会将“我看那车还不错”简化为“那车不错”。
现在岗位多少啊	我看那车还不错	gpt-35-turbo	stop	小张的说话方式是省略掉一些常用的词语，只保留关键词来表达意思。因此，他可能会将“我看那车还不错”简化为“我那车不错”。
自己做了一份	我看那车还不错	gpt-35-turbo	stop	根据小张的说话方式，他可能会说成“我看那车还不错了”。
我给你找个吧	我看那车还不错	gpt-35-turbo	stop	小张的说话方式是省略掉了一些无关紧要的词语，使句子更加简洁明了。因此，他可能会把“我看那车还不错”说成“我看那车不错”。
人的生命只有一次啊	我看那车还不错	gpt-35-turbo	stop	小张的说话方式是省略掉句子中的一些常见词语，只保留关键词或者语气词。因此，他可能会把“我看那车还不错”说成“我那车还不错”。
你小孩多大	我看那车还不错	gpt-35-turbo	stop	小张的说话方式是省略掉了句子中的一些成分，只保留了最关键的部分。因此，他可能会将“我看那车还不错”简化为“我看那车”。
那你就一次多生几个不就好了	我看那车还不错	gpt-35-turbo	stop	小张的说话方式是将“多”和“几个”分开，放在动词和宾语之间，使得句子更加简洁明了。因此，他可能会将“还不错”中的“不错”放在动词和宾语之间，说成“我看那车还不就错了”。
我一天不在家	我看那车还不错	gpt-35-turbo	stop	小张的说话方式是省略时间状语，即省略表示时间的词语。因此，他可能会将“我看那车还不错”简化为“我看那车不错”。
我测试过很多词了	我看那车还不错	gpt-35-turbo	stop	根据小张的说话方式，他可能会将“我看那车还不错”简化为“我看那车了”。
你进入下载吧	我看那车还不错	gpt-35-turbo	stop	小张的说话方式是将句子中的一部分省略掉，只保留最关键的部分。因此，他可能会将“我看那车还不错”简化为“我车不错”。
你快洗洗吐吧	我看那车还不错	gpt-35-turbo	stop	小张的说话方式是删减掉一些不重要或者常见的词语，只保留关键词汇。因此，他可能会将“我看那车还不错”简化为“我看车不错”。
所以我就含恨离开了	我看那车还不错	gpt-35-turbo	stop	根据小张的说话方式，他可能会将“我看那车还不错”简化为“我那车不错”。
什么是竞聘上岗	我看那车还不错	gpt-35-turbo	stop	小张的说话方式可能是省略掉了后面的部分，只说出了前面的关键词或短语。因此，他可能会将“我看那车还不错”简化为“我看那车”。
你发发试试吧	我看那车还不错	gpt-35-turbo	stop	小张的说话方式是将句子中的一部分省略掉，只保留最关键的部分。因此，他可能会将“我看那车还不错”简化为“我车不错”。
你们快放假过年了吧	我看那车还不错	gpt-35-turbo	stop	小张的说话方式是省略掉一些常用的词语或者词组，只保留关键词来表达意思。因此，他可能会把“我看那车还不错”说成“我看那车不错”。
那你改改试试啊	我看那车还不错	gpt-35-turbo	stop	小张的说话方式是省略掉句子中的一部分，只保留关键词或者最后一个词。因此，他可能会把“我看那车还不错”说成“我看那车”。
我们出去玩不要背出来	我看那车还不错	gpt-35-turbo	stop	小张的说话方式是省略掉一些常见的词语或者短语，使得句子更加简洁明了。因此，他可能会将“我看那车还不错”简化为“那车不错”。
我还是回家吃吧	我看那车还不错	gpt-35-turbo	stop	小张的说话方式是省略掉句子中的一些关键词或短语，只保留最重要的部分。因此，他可能会将“我看那车还不错”简化为“那车还不错”。
我刚刚出去健身	我看那车还不错	gpt-35-turbo	stop	根据小张的说话方式，他可能会将句子简化为“我看那车”。
晚上我都不淘宝啊亲	我看那车还不错	gpt-35-turbo	stop	小张的说话方式是省略掉最后一个词或短语，因为这个词或短语在语境中已经很明显了。因此，他可能会说“我看那车还不错啊”。
我告诉你原因吧傻徒弟	我看那车还不错	gpt-35-turbo	stop	根据小张的说话方式，他可能会省略掉“我看”这个部分，直接说“那车还不错”。
那我还要跑过去列亲	我看那车还不错	gpt-35-turbo	stop	小张的说话方式可能是省略了一些常用的词语，使得句子更加简洁。因此，他可能会将“我看那车还不错”简化为“我看那车不错”。
我去吃饭了哈亲	我看那车还不错	gpt-35-turbo	stop	小张的说话方式是在句子末尾加上一个“哈”字，表示语气的调整或者是表达亲切感。因此，他可能会把“我看那车还不错”说成“我看那车还不错哈”。
你们不是有米有油吗亲	我看那车还不错	gpt-35-turbo	stop	小张的说话方式是在句子末尾加上一个“吗”，来表示疑问或询问对方的意见。因此，他可能会说成“我看那车还不错吗”。
你又表演啥节目呀亲	我看那车还不错	gpt-35-turbo	stop	小张的说话方式是省略掉最后一个称呼词，比如“亲”、“哥”、“姐”等。因此，他会将“我看那车还不错”说成“我看那车还不错”。
我去吃饭了啊亲	我看那车还不错	gpt-35-turbo	stop	根据小张的说话方式，他可能会把“我看那车还不错”简化为“我看那车不错”。
你报了它就会审核的	我看那车还不错	gpt-35-turbo	stop	小张的说话方式是省略掉了一些可以推断出来的词语，使句子更加简洁明了。因此，他可能会将“我看那车还不错”说成“那车还不错”。
那个是所有的	我看那车还不错	gpt-35-turbo	stop	小张的说话方式是省略掉一些常用的词语，使得句子更加简洁。因此，他可能会将“我看那车还不错”简化为“我看那车好”。
我们现在客户需要这类的图书	我看那车还不错	gpt-35-turbo	stop	小张的说话方式是省略掉了定语从句中的“的”字。因此，他可能会将“我看那车还不错”表达为“我看那还不错的车”。
哪一年的	我看那车还不错	gpt-35-turbo	stop	根据小张的说话方式，他可能会将“那车”简化为“那”，并省略“我看”，直接说“那车还不错”的简化版本，即“那还不错”。
所有的岗	我看那车还不错	gpt-35-turbo	stop	小张的说话方式是将“所有的”中的“所有”省略掉，只说“的”。因此，“我看那车还不错”这个句子，他可能会说成“我看那车还不错的”。
哪一年的人	我看那车还不错	gpt-35-turbo	stop	小张的说话方式是省略年份，只保留“的人”。因此，他可能会说“我看那车还不错的人”。
其他的外国人都是同事同学	我看那车还不错	gpt-35-turbo	stop	小张的说话方式是省略主语，只说出谓语和宾语。因此，“我看那车还不错”这个句子在他的口中可能会说成“看那车还不错”。
其他的都好说	我看那车还不错	gpt-35-turbo	stop	小张的说话方式是省略掉句子中的主语或者宾语，只保留关键词或者重要的部分。因此，他可能会将“我看那车还不错”简化为“看那车不错”。
你说你们这届的	我看那车还不错	gpt-35-turbo	stop	小张的说话方式是将“这届的”中的“这届”省略掉，只说“的”。因此，他可能会将“我看那车还不错”说成“我看那车不错”。
其他的有没有	我看那车还不错	gpt-35-turbo	stop	小张的说话方式是将“其他的”中的“其他”省略掉，只说“的有没有”。因此，“我看那车还不错”这个句子，他可能会说成“我看那车还不错的”。
所有的悲剧都如此相似	我看那车还不错	gpt-35-turbo	stop	小张的说话方式是省略主语，只保留谓语和宾语。因此，他可能会将“我看那车还不错”说成“看那车还不错”。
下面这家的蛮好看	我看那车还不错	gpt-35-turbo	stop	小张的说话方式是省略掉“下面这家的”这种形容词性的修饰语，直接使用名词或者名词性的修饰语来表达。因此，他可能会说成“我看那车还不错”中的“那车还不错”。
我家那片就有	我看那车还不错	gpt-35-turbo	stop	小张的说话方式是省略主语“我”的习惯。因此，他可能会将“我看那车还不错”简化为“看那车还不错”。
我自己那点哪够呀	我看那车还不错	gpt-35-turbo	stop	小张的说话方式是省略主语“我”的倾向，可能是因为他觉得主语已经可以通过上下文推断出来，或者是为了简化语言表达。因此，他可能会说“看那车还不错”。
下面这家的蛮好看	我看那车还不错	gpt-35-turbo	stop	根据小张的说话方式，他可能会说成“我看那车还不错”。即省略掉“的”。
我家那片就有	我看那车还不错	gpt-35-turbo	stop	小张的说话方式是省略掉一些不必要的词语，使句子更加简洁明了。因此，他可能会把“我看那车还不错”说成“我看车不错”。
下次吧少数人带	我看那车还不错	gpt-35-turbo	stop	小张的说话方式是省略掉句子中的一些词语或者部分，只保留关键词来表达意思。因此，他可能会将“我看那车还不错”简化为“那车不错”。
就这一本其他没有了吧	我看那车还不错	gpt-35-turbo	stop	小张的说话方式是省略掉一些不必要的词语，使句子更加简洁明了。因此，他可能会将“我看那车还不错”简化为“那车还不错”。
连锁那种也不贵吧	我看那车还不错	gpt-35-turbo	stop	小张的说话方式是省略掉一些词语或者词组中的某些字，使得句子更加简洁。因此，他可能会把“我看那车还不错”说成“那车还不错”。
我自己那点哪够呀	我看那车还不错	gpt-35-turbo	stop	小张的说话方式是省略掉“那点”的部分，只保留“自己”和“哪够呀”。因此，他可能会把“我看那车还不错”说成“我那车还不错”。
然后我还买了一些那种	我看那车还不错	gpt-35-turbo	stop	根据小张的说话方式，他可能会说成“我看那车还不错”。也就是省略掉句子末尾的“这个句子中的部分”。
师傅梦中的那位不是在吗	我看那车还不错	gpt-35-turbo	stop	小张的说话方式是将定语放在被修饰的名词前面，然后省略掉“的”。因此，“我看那车还不错”这个句子，他可能会说成“我看那还不错的车”。
还有当我想你的时候	我看那车还不错	gpt-35-turbo	stop	小张的说话方式是省略掉一些词语或者音节，只保留关键词或者重要的部分。因此，他可能会把“我看那车还不错”说成“我看那车不错”。
因为她态度相当坚决	我看那车还不错	gpt-35-turbo	stop	根据小张的说话方式，他可能会简化句子，只说“我看”。因此，他可能会表达“我看那车还不错”为“我看那车”。
因为我很懒	我看那车还不错	gpt-35-turbo	stop	根据小张的说话方式，他可能会简化这个句子为“我看车不错”。
因为我们下学期有开理论犯罪学	我看那车还不错	gpt-35-turbo	stop	小张的说话方式可能是省略掉了句子中的主要内容，只保留了一个因果关系的词语。因此，他可能会将“我看那车还不错”简化为“我看”。
等你搞定了我带兔兔来做客	我看那车还不错	gpt-35-turbo	stop	根据小张的说话方式，他可能会说成“那车还不错”。他倾向于省略掉前面的主语，直接表达自己的观点或意图。
因为我这学期还不能做	我看那车还不错	gpt-35-turbo	stop	小张的说话方式是省略掉了句子中的主语和谓语，只保留了原句中的原因状语。因此，他可能会将“我看那车还不错”简化为“我看”。
为了烟草企业的利益最大化	我看那车还不错	gpt-35-turbo	stop	小张的说话方式是省略掉一些关键词，只保留最重要的部分。因此，他可能会将“我看那车还不错”简化为“那车还不错”。
那是因为你自己这样觉得	我看那车还不错	gpt-35-turbo	stop	根据小张的说话方式，他可能会简化句子，只说“那车还不错”。
等我哪天想不开了我就这么玩儿	我看那车还不错	gpt-35-turbo	stop	根据小张的说话方式，他可能会简化句子，只说“那车还不错”。
等尚尚上幼儿园她就开始工作了	我看那车还不错	gpt-35-turbo	stop	小张的说话方式是省略掉一些已经被上下文所确定的信息，只保留关键词来表达意思。因此，他可能会把“我看那车还不错”简化为“那车还不错”。
材料在哪买便宜啊	我看那车还不错	gpt-35-turbo	stop	小张的说话方式是将疑问词放在动词前面，省略了介词或者副词。因此，他可能会将“我看”改为“看我”，并将“那车还不错”改为“车还不错”。所以他可能会说成“看我，车还不错”。
一代比一代差	我看那车还不错	gpt-35-turbo	stop	小张的说话方式是省略掉一些常用的词语或者部分，使得句子更加简洁。因此，他可能会将“我看那车还不错”简化为“我看车不错”。
下次他什么时候来	我看那车还不错	gpt-35-turbo	stop	小张的说话方式是省略掉了“下次”的时间状语，只保留了主语和谓语。因此，他可能会把“我看”省略掉，直接说“那车还不错”。
我自己那点哪够呀	我看那车还不错	gpt-35-turbo	stop	小张的说话方式是省略主语和一些无关紧要的词语，只保留关键词来表达自己的意思。因此，他可能会把“我看那车还不错”简化为“那车不错”。
那张挺好的啊	我看那车还不错	gpt-35-turbo	stop	小张的说话方式是省略掉“那张”这个形容词性的修饰词，直接将形容词放在名词前面。因此，他可能会将“我看那车还不错”说成“我看车还不错”。
您认为哪一个对	我看那车还不错	gpt-35-turbo	stop	小张的说话方式是省略掉了疑问词或疑问代词，直接将疑问句变成陈述句。因此，他可能会将“我看那车还不错”说成“我看那车不错”。
上半年还没过完呢	我看那车还不错	gpt-35-turbo	stop	根据小张的说话方式，他倾向于省略掉一些已经明显的信息，只表达关键的部分。因此，他可能会将“我看那车还不错”简化为“那车不错”。
下次我忘记了	我看那车还不错	gpt-35-turbo	stop	根据小张的说话方式，他可能会说成“那车还不错”。
这次你回复得蛮快	我看那车还不错	gpt-35-turbo	stop	小张的说话方式是省略主语，只保留谓语和宾语。因此，他可能会说成“看那车还不错”。
这些年他也太压抑内心一直自卑	我看那车还不错	gpt-35-turbo	stop	小张的说话方式是省略主语。因此，他可能会说成“看那车还不错”。
那这次你得考虑了	我看那车还不错	gpt-35-turbo	stop	小张的说话方式是省略掉了“这次你”的“这次”二字，只说了“你”。因此，他可能会把“我看那车还不错”说成“我看那车不错”。
这次我基本都认识了	我看那车还不错	gpt-35-turbo	stop	小张的说话方式是省略主语。因此，他可能会说“看那车还不错”。
我今天下午困死了	我看那车还不错	gpt-35-turbo	stop	根据小张的说话方式，他会省略掉句子中的一些词语，只保留最关键的部分。因此，他可能会将“我看那车还不错”简化为“我那车不错”。
咱俩照像去哇	我看那车还不错	gpt-35-turbo	stop	根据小张的说话方式，他会将句子中的一些词省略掉，只保留关键词。因此，“我看那车还不错”可能会被他说成“我那车不错”。
我还没有说完	我看那车还不错	gpt-35-turbo	stop	小张的说话方式是省略掉句子的结尾部分，只说出句子的前半部分。因此，他可能会把“我看那车还不错”说成“我看那车”。
聚会准备好了吗	我看那车还不错	gpt-35-turbo	stop	小张的说话方式是省略掉了一些词语，使得句子更加简洁明了。因此，他可能会将“我看那车还不错”简化为“那车不错”。
那你好好照顾好自己了	我看那车还不错	gpt-35-turbo	stop	小张的说话方式是省略掉一些常用的词语或者词组，使得句子更加简洁明了。因此，他可能会将“我看那车还不错”简化为“那车不错”。
我开会去了啊	我看那车还不错	gpt-35-turbo	stop	根据小张的说话方式，他可能会将“我看那车还不错”简化为“我那车不错”。
好处是我快熬出来了	我看那车还不错	gpt-35-turbo	stop	小张的说话方式是删减掉一些不重要的词语或者部分，只保留最关键的信息。因此，他可能会把“我看那车还不错”简化为“那车不错”。
我给你打过去就是	我看那车还不错	gpt-35-turbo	stop	小张的说话方式是省略掉了一些词语，只保留了关键词，使得语言更加简洁。因此，他可能会将“我看那车还不错”简化为“我看那车不错”。
我先报名看看	我看那车还不错	gpt-35-turbo	stop	根据小张的说话方式，他可能会将“我看那车还不错”简化为“我看那车”。
幼师陪酒能折射出什么呀	我看那车还不错	gpt-35-turbo	stop	小张的说话方式是省略掉一些本应该存在的词语或者部分，只保留关键词语来表达意思。因此，他可能会将“我看那车还不错”简化为“我看车不错”。
订座系统在我们手里	我看那车还不错	gpt-35-turbo	stop	小张的说话方式是省略主语和动词，只说出句子的一部分。因此，他可能会说“我看那车还不错”这个句子的一部分，比如只说“我看那车”。
我以为你在家里	我看那车还不错	gpt-35-turbo	stop	小张的说话方式是省略掉句子中的一些常见词语，只保留最关键的部分。因此，他可能会将“我看那车还不错”简化为“我看那车”。
我一点多到他四点以后才能来	我看那车还不错	gpt-35-turbo	stop	小张的说话方式是省略掉了中间的时间段，只保留了起始时间和结束时间。因此，他可能会将“我看那车还不错”简化为“我看那车”。
你回到陆地上啦	我看那车还不错	gpt-35-turbo	stop	根据小张的说话方式，他可能会将“我看那车还不错”简化为“我看还不错”。
文科基本上生活中有点用	我看那车还不错	gpt-35-turbo	stop	小张的说话方式是将句子中的重点词放在前面，强调重点。因此，他可能会将“那车还不错”中的“车”或“不错”放在前面，例如说“车那还不错”或“不错那车”。
师傅的心在师母身上	我看那车还不错	gpt-35-turbo	stop	小张的说话方式是省略掉句子中的一些关键词或短语，只保留最重要的部分。因此，他可能会把“我看那车还不错”说成“那车还不错”。
我去店里买	我看那车还不错	gpt-35-turbo	stop	根据小张的说话方式，他可能会说成“我看那车不错”。
你一定不要放心上	我看那车还不错	gpt-35-turbo	stop	小张的说话方式是将一个词或短语的后面部分省略掉，只说前面的部分。因此，他可能会将“我看那车还不错”说成“我看那车”。
一个人十分多钟左右	我看那车还不错	gpt-35-turbo	stop	根据小张的说话方式，他会省略掉具体的时间或数量，只保留主要的信息。因此，他可能会说成“我看那车不错”。
你们现在在冷战中啊	我看那车还不错	gpt-35-turbo	stop	小张的说话方式是省略掉一些重要的信息，只保留最后一个词或短语。因此，他可能会将“我看那车还不错”说成“我还不错”。
空间里啥也木有的	我看那车还不错	gpt-35-turbo	stop	小张的说话方式是省略掉主语或者主语的一部分。因此，他可能会把“我看”省略掉，直接说“那车还不错”。
杯赛省级以上	我看那车还不错	gpt-35-turbo	stop	根据小张的说话方式，他可能会将“还不错”简化为“不错”，因此他可能会说成“我看那车不错”。
火车上温度很低	我看那车还不错	gpt-35-turbo	stop	小张的说话方式是省略主语，只说出与主语相关的描述。因此，他可能会说“看那车还不错”。
你在兔子边上躺会儿吧	我看那车还不错	gpt-35-turbo	stop	小张的说话方式是省略掉某些常见的词语或者信息，让听话的人自己去推断。因此，他可能会说成“看那车还不错”。
忍字头上一把刀啊	我看那车还不错	gpt-35-turbo	stop	小张的说话方式是省略掉某些词语或字眼，通常是省略掉句子中的第一个词语或字眼。因此，他可能会将“我看那车还不错”说成“看那车还不错”。
见字在人名里不常见呢	我看那车还不错	gpt-35-turbo	stop	小张的说话方式是将一个词或短语中的某个字移到句子的前面，然后再将原来的位置补上。因此，他可能会将“车”这个字移到句子的前面，然后将“我看那还不错”组成一个新的句子，即“车我看那还不错”。
但是房子里还有一个房间	我看那车还不错	gpt-35-turbo	stop	小张的说话方式是省略掉一些常用的词语，尤其是一些虚词。因此，他可能会把“我看那车还不错”说成“我那车不错”。
水沙连间天地宽	我看那车还不错	gpt-35-turbo	stop	小张的说话方式是省略掉一些词语，只保留关键词来表达意思。因此，他可能会将“我看那车还不错”简化为“看车不错”。
