demonstration	sentence	model_type	stop_type	response
除非你能说服他	我看那车还不错	gpt-35-turbo	stop	小张的说话方式是将“除非”转化为“能”，即将否定转化为肯定。因此，他可能会将“我看那车还不错”转化为“我看那车很不错”。
移动的很联通的频段是一样的	我看那车还不错	gpt-35-turbo	stop	小张的说话方式是省略掉一些显而易见的信息，只说出关键的部分。因此，他可能会说出“那车还不错”来表达“我看那车还不错”。
移动的很联通的频段是一样的	我看那车还不错	gpt-35-turbo	stop	小张的说话方式是省略一些本应该出现的词语，可能是因为他觉得这些词语已经被上下文所理解了。因此，他可能会将“我看那车还不错”简化为“看那车不错”。
电信的还是联通的模块	我看那车还不错	gpt-35-turbo	stop	根据小张的说话方式，他倾向于省略前面的信息，只表达后面的内容。因此，他可能会说成“那车还不错”。
电信的还是联通的模块	我看那车还不错	gpt-35-turbo	stop	小张的说话方式是省略掉一些显而易见的信息，只保留关键词。因此，他可能会说成“我看那车还不错”的简化版，例如“我看那车还行”或者“那车还不错”。
不过儿童的的应该差不多吧	我看那车还不错	gpt-35-turbo	stop	小张的说话方式是将“的”字省略掉，可能是因为他口语习惯或者方言影响。因此，他可能会将“我看那车还不错”说成“我看那车还不错吧”。
你在家地位很高	我看那车还不错	gpt-35-turbo	stop	小张的说话方式是省略主语。因此，他可能会将“我看那车还不错”简化为“看那车还不错”。
之前我对他妈妈意见蛮大的	我看那车还不错	gpt-35-turbo	stop	小张的说话方式是省略掉一些关键词或者信息，让听者自己去推断。因此，他可能会说成“那车还不错”。
以后在家时间也不会多	我看那车还不错	gpt-35-turbo	stop	小张的说话方式是省略掉一些不重要的信息，只保留最关键的部分。因此，他可能会将“我看那车还不错”简化为“那车还不错”。
这跟我从小到大环境是	我看那车还不错	gpt-35-turbo	stop	小张的说话方式是省略掉一些常见的词语或短语，只保留关键词来表达意思。因此，他可能会将“我看那车还不错”简化为“我那车不错”。
哦你们是真正的中产阶级	我看那车还不错	gpt-35-turbo	stop	小张的说话方式是省略掉一些常用的助词和连词，使句子更加简洁。因此，他可能会说成“我看那车不错”。
以后人类也是转基因的了呢	我看那车还不错	gpt-35-turbo	stop	小张的说话方式是省略掉一些常见的词语或者词组，只保留关键词来表达意思。因此，他可能会将“我看那车还不错”简化为“我那车不错”。
这是原先的模板	我看那车还不错	gpt-35-turbo	stop	小张的说话方式是省略掉“原先”中的“原先”这个词，只保留后面的部分。因此，他可能会把“我看那车还不错”说成“我看那还不错”。
一般的天线厂都行	我看那车还不错	gpt-35-turbo	stop	小张的说话方式是省略掉句子中的一般性描述词或形容词。因此，他可能会说“看那车还不错”。
你头像怎么是黑的	我看那车还不错	gpt-35-turbo	stop	小张的说话方式是将“的”字省略掉。因此，“我看那车还不错”这个句子，他会说成“我看那车还不错”。
拳拳之心	我看那车还不错	gpt-35-turbo	stop	根据小张的说话方式，他可能会将“我看那车还不错”简化为“那车还不错”。
这样的说法也震动了我们那个政府	我看那车还不错	gpt-35-turbo	stop	小张的说话方式是省略掉句子开头的“这样”。因此，他可能会把“我看那车还不错”说成“看那车还不错”。
二手的无所谓吧	我看那车还不错	gpt-35-turbo	stop	小张的说话方式是将句子中的第一个词去掉，只保留后面的内容。因此，“我看那车还不错”这个句子，他可能会说成“看那车还不错”。
母性的光芒四射	我看那车还不错	gpt-35-turbo	stop	小张的说话方式是省略掉第一个词或者第一个词组。因此，他可能会将“我看那车还不错”说成“看那车还不错”。
同样的品牌	我看那车还不错	gpt-35-turbo	stop	小张的说话方式是将“同样的”中的“同样”省略，只说“的品牌”。因此，他可能会将“我看那车还不错”说成“我看那的车还不错”。
你赶紧的搞研究去	我看那车还不错	gpt-35-turbo	stop	小张的说话方式是省略掉一些不必要的词语或语气词，使句子更加简洁明了。因此，他可能会将“我看那车还不错”简化为“那车不错”。
这样你就可以随心所欲的进行尝试	我看那车还不错	gpt-35-turbo	stop	小张的说话方式是省略掉一些显而易见的信息或者重复的信息。因此，他可能会说成“那车不错”。
哥在偷偷得跟你聊天	我看那车还不错	gpt-35-turbo	stop	根据小张的说话方式，他可能会省略掉一些词语或者重复一些词语。因此，他可能会说成“我看那那车还还不错错”。
那边都差不多的破烂	我看那车还不错	gpt-35-turbo	stop	小张的说话方式是省略掉一些形容词或副词，只保留一个最具代表性的词语来形容事物。因此，他可能会说成“那车还不错”。
女儿还没吞他又凶凶地硬塞	我看那车还不错	gpt-35-turbo	stop	小张的说话方式是将一个词或者短语中的某些字母或者音节去掉或者调换位置，使得原本的意思变得有些扭曲或者难以理解。因此，他可能会将“我看那车还不错”说成“我那车看还不错”。
你一定要好好的生活	我看那车还不错	gpt-35-turbo	stop	小张的说话方式是省略掉一些显而易见的词语或信息，只保留最核心的意思。因此，他可能会将“我看那车还不错”简化为“那车不错”。
我冒昧的问一下你	我看那车还不错	gpt-35-turbo	stop	根据小张的说话方式，他可能会简化句子，因此他可能会说成“那车不错”。
结果我妈不停的催我	我看那车还不错	gpt-35-turbo	stop	小张的说话方式是省略掉一些不重要或者常见的词语，使得句子更加简洁明了。因此，他可能会把“我看那车还不错”说成“我觉得那车不错”。
老人一个个的都是这么办的	我看那车还不错	gpt-35-turbo	stop	小张的说话方式是省略掉了“一个个的”这个描述性词语，直接将主语和谓语连起来。因此，他可能会将“我看那车还不错”说成“我那车还不错”。
嘿嘿我幸运的没有长过	我看那车还不错	gpt-35-turbo	stop	小张的说话方式是省略掉一些本应该存在的词语或者部分。因此，他可能会把“我看那车还不错”说成“那车还不错”。
改天我试探性的问问他	我看那车还不错	gpt-35-turbo	stop	小张的说话方式可能是将句子中的某些词语重复一遍，而且顺序可能会颠倒。因此，他可能会将“我看那车还不错”说成“我看看那车车还不错”。
结果我妈不停的催我	我看那车还不错	gpt-35-turbo	stop	小张的说话方式是将“的”字省略掉，可能是因为他觉得这样说更加简洁明了。因此，他可能会将“我看那车还不错”说成“我看那车不错”。
你赶紧的搞研究去	我看那车还不错	gpt-35-turbo	stop	小张的说话方式是省略主语的语法，即省略掉句子中的主语。因此，他可能会将“我看那车还不错”说成“看那车还不错”。
女儿还没吞他又凶凶地硬塞	我看那车还不错	gpt-35-turbo	stop	小张的说话方式是将一个词的一部分移到另一个词前面，形成一个新的词组。因此，他可能会将“看”和“车”中的一部分移动，表达成“车看还不错”。
哥在偷偷得跟你聊天	我看那车还不错	gpt-35-turbo	stop	根据小张的说话方式，他会省略掉一些词语中的重复部分。因此，“我看那车还不错”可能会被他说成“我看那车不错”。
你一定要好好的生活	我看那车还不错	gpt-35-turbo	stop	小张的说话方式是省略掉一些常用的助动词或者连词，使得句子更加简洁明了。因此，他可能会将“我看那车还不错”说成“我那车还不错”。
慢慢的人们就会知道	我看那车还不错	gpt-35-turbo	stop	小张的说话方式是省略掉句子中的一些词语或者部分，只保留关键词来表达意思。因此，他可能会把“我看那车还不错”说成“看那车还不错”。
老百姓辛辛苦苦的买了车	我看那车还不错	gpt-35-turbo	stop	小张的说话方式是省略了一些形容词或副词，只保留了名词和动词。因此，他可能会说成“我看那车不错”。
海边到酒店很远吗	我看那车还不错	gpt-35-turbo	stop	小张的说话方式是省略掉句子中的一些信息，只保留最关键的部分。因此，他可能会将“我看那车还不错”简化为“那车不错”。
哈哈哈哈是的	我看那车还不错	gpt-35-turbo	stop	根据小张的说话方式，他可能会将“我看那车还不错”说成“我看那车还不错的”。
捐赠不是施舍	我看那车还不错	gpt-35-turbo	stop	小张的说话方式是省略掉一些前提或者已知的信息，只说出重点或者新颖的部分。因此，他可能会表达成“那车还不错”。
上半年还没过完呢	我看那车还不错	gpt-35-turbo	stop	小张的说话方式是省略掉一些常用的词语或短语，只保留关键词来表达意思。因此，他可能会将“我看那车还不错”简化为“我看车不错”。
哪一年的人	我看那车还不错	gpt-35-turbo	stop	小张的说话方式是省略掉了“一年”的“一”字，只说“哪的人”。因此，他可能会把“我看那车还不错”说成“我看那车还不错的车”。
她前一段时间在幼儿园打工	我看那车还不错	gpt-35-turbo	stop	小张的说话方式可能是省略了一些词语或者词组中的一些字，使得句子更加简洁。因此，他可能会把“我看那车还不错”说成“我那车还不错”。
您认为哪一个对	我看那车还不错	gpt-35-turbo	stop	小张的说话方式可能是将“一个”和“对”混淆了。因此，他可能会将“那车”和“对”结合起来，说成“我看那对车还不错”。
别个赚钱撒	我看那车还不错	gpt-35-turbo	stop	根据小张的说话方式，他会省略掉“个”字，因此，“我看那车还不错”这个句子可能会被他说成“我看那车还不错撒”。
另外一些	我看那车还不错	gpt-35-turbo	stop	根据小张的说话方式，他可能会说成“我看那车不错”。
我们没有初稿这一说	我看那车还不错	gpt-35-turbo	stop	小张的说话方式是省略掉一些常用的助词和连词，使句子更加简洁。因此，他可能会将“我看那车还不错”说成“我看那车不错”。
哪一年的	我看那车还不错	gpt-35-turbo	stop	小张的说话方式是将“一”省略，只说“哪的”。因此，“我看那车还不错”这个句子，他可能会说成“我看那车哪不错”。
你这几天怎么样	我看那车还不错	gpt-35-turbo	stop	小张的说话方式是省略掉一些常用的词语或者词组，只保留关键词来表达意思。因此，他可能会将“我看那车还不错”简化为“我那车不错”。
你这几年过得好不饿	我看那车还不错	gpt-35-turbo	stop	小张的说话方式是省略掉了“几年”这个时间段的表述。因此，他可能会把“我看那车还不错”说成“我看那车不错”。
最后一代的文人艺术家	我看那车还不错	gpt-35-turbo	stop	小张的说话方式是省略掉“最后一代”的词语，只保留“一代”的词语。因此，他可能会说“我看那车不错”。
哪个是小块	我看那车还不错	gpt-35-turbo	stop	根据小张的说话方式，他可能会说成“我看那车还错”。
最后一轮是跟总经理	我看那车还不错	gpt-35-turbo	stop	小张的说话方式是省略掉“最后”、“最前面”等表示顺序或时间的词语，只保留关键信息。因此，他可能会说成“我看那车不错”。
嗯最后一轮是跟总经理	我看那车还不错	gpt-35-turbo	stop	根据小张的说话方式，他可能会说成“我看那车还错”。
我还有好大一瓶	我看那车还不错	gpt-35-turbo	stop	根据小张的说话方式，他可能会简化句子，去掉一些形容词或副词。因此，他可能会说成“我看那车不错”。
新一轮的政治斗争又将开始	我看那车还不错	gpt-35-turbo	stop	小张的说话方式是省略掉一些常见的词语或者词组中的第一个字，这样说话更加简洁。因此，他可能会说成“看那车还不错”。
我我很很注意到一个现象	我看那车还不错	gpt-35-turbo	stop	小张的说话方式是重复词语来强调，可能是为了表达更加强烈的情感或者强调重要性。因此，他可能会说成“我看那那车还不错”。
我我很很注意到一个现象	我看那车还不错	gpt-35-turbo	stop	小张的说话方式是重复某些词语，但只重复一次。因此，他可能会说“我我看那车还不错”。
化妆品可能占点空间会	我看那车还不错	gpt-35-turbo	stop	小张的说话方式是省略掉句子末尾的“会”或“的”。因此，他可能会把“我看那车还不错会”的“会”省略掉，说成“我看那车还不错”。
所以你您是我老师	我看那车还不错	gpt-35-turbo	stop	小张的说话方式是将句子中的主语和宾语位置颠倒。因此，他可能会将“我”和“那车”位置颠倒，说成“那车我看还不错”。
禁你就自己翻译稳学院盖章啦	我看那车还不错	gpt-35-turbo	stop	根据小张的说话方式，他会省略掉句子开头的主语“我”，因此他可能会说成“看那车还不错”。
这是一这是原则问题	我看那车还不错	gpt-35-turbo	stop	小张的说话方式是将重复的词语省略掉，只保留一次。因此，他可能会将“我看”和“还不错”中的一个词省略掉，表达成“我那车不错”或“我看车还不错”。
然后零这边是老虎的	我看那车还不错	gpt-35-turbo	stop	小张的说话方式是省略掉句子末尾的“的”字。因此，他可能会将“我看那车还不错的”说成“我看那车还不错”。
我我告你	我看那车还不错	gpt-35-turbo	stop	根据小张的说话方式，他会将重复的词语缩减为一个，因此他可能会将“我看那车还不错”说成“我看那车不错”。
它肯定里面有有	我看那车还不错	gpt-35-turbo	stop	小张的说话方式是省略掉重复的词语，只说一遍。因此，他可能会把“我看那车还不错”说成“我看那车不错”。
所以就是	我看那车还不错	gpt-35-turbo	stop	根据小张的说话方式，他可能会简化句子，表达成“那车不错”。
她好象也	我看那车还不错	gpt-35-turbo	stop	根据小张的说话方式，他可能会把“我看那车还不错”说成“我看那车还不错也”。
就那种什么	我看那车还不错	gpt-35-turbo	stop	根据小张的说话方式，他可能会说成“那车我看还不错”。
然后还有就是在公司你一定要	我看那车还不错	gpt-35-turbo	stop	小张的说话方式是省略“有”，因此他可能会说成“我看那车还不错”。
然后那那	我看那车还不错	gpt-35-turbo	stop	根据小张的说话方式，他可能会说成“我看那那车还不错”。
然后嗯她们就	我看那车还不错	gpt-35-turbo	stop	小张的说话方式是省略掉“然后”的部分，只保留“嗯她们就”的部分。因此，他可能会将“我看那车还不错”简化为“那车还不错”。
但是就是说也	我看那车还不错	gpt-35-turbo	stop	根据小张的说话方式，他可能会将“我看那车还不错”说成“那车还不错”。因为他倾向于省略掉一些不必要的词语，只保留最核心的意思。
其实其实还是	我看那车还不错	gpt-35-turbo	stop	小张的说话方式是省略掉重复的词语，只保留一个。因此，他可能会把“我看那车还不错”说成“我看那车不错”。
但是我是想	我看那车还不错	gpt-35-turbo	stop	小张的说话方式是省略掉前面的一些词语或者句子，只保留最关键的部分来表达自己的意思。因此，他可能会把“我看那车还不错”简化为“那车还不错”。
不不不他就是	我看那车还不错	gpt-35-turbo	stop	小张的说话方式是去掉句子中的最后一个词或短语。因此，他可能会将“我看那车还不错”说成“我看那车还”。
不过我现在现在有时还是也实在	我看那车还不错	gpt-35-turbo	stop	小张的说话方式是删减掉一些冗余的词语，只保留最关键的部分。因此，他可能会将“我看那车还不错”简化为“我看那车”。
然后还有就是在公司你一定要	我看那车还不错	gpt-35-turbo	stop	小张的说话方式是省略掉了句子结尾的部分，只保留了前面的部分。因此，他可能会把“我看那车还不错”说成“我看那车”。
我觉得你是一个很	我看那车还不错	gpt-35-turbo	stop	根据小张的说话方式，他可能会说成“我看那车还不错”变成“我那车还不错”。
我突然想到	我看那车还不错	gpt-35-turbo	stop	根据小张的说话方式，他可能会简化句子，只说“我看车不错”。
有的还送	我看那车还不错	gpt-35-turbo	stop	根据小张的说话方式，他可能会将“我看那车还不错”简化为“我看那车”。
那我是那很虔诚我就那	我看那车还不错	gpt-35-turbo	stop	小张的说话方式是省略掉句子末尾的一些词语，通常是一些无关紧要的词语。因此，他可能会把“我看那车还不错”说成“我看那车还不错”。
你还是得你还得是象这些个	我看那车还不错	gpt-35-turbo	stop	小张的说话方式是只保留句子中的前几个词，省略掉后面的部分。因此，他可能会将“我看那车还不错”说成“我看那车”。
我发现我现在他妈的	我看那车还不错	gpt-35-turbo	stop	根据小张的说话方式，他可能会将句子简化为“那车还不错”。因为他习惯性地省略了主语“我”，所以在表达这个句子时也会省略主语。
我们这个系的人好像都是	我看那车还不错	gpt-35-turbo	stop	小张的说话方式是省略掉了“好像都是”这个部分，只保留了主语和谓语。因此，他可能会把“我看那车还不错”简化为“我看那车”。
好象就是说这个会	我看那车还不错	gpt-35-turbo	stop	小张的说话方式是省略掉句子末尾的“会”字。因此，他可能会把“我看那车还不错会”说成“我看那车还不错”。
我就觉得好家伙	我看那车还不错	gpt-35-turbo	stop	小张的说话方式是省略掉句子中的一些词语或短语，只保留最关键的部分。因此，他可能会将“我看那车还不错”简化为“我看那车”。
我那个今天这不是有那个	我看那车还不错	gpt-35-turbo	stop	根据小张的说话方式，他会把“我看那车还不错”说成“那车还不错”。
你怎么你是	我看那车还不错	gpt-35-turbo	stop	小张的说话方式是省略掉重复的部分，只保留必要的信息。因此，他可能会将“我看那车还不错”简化为“我看那车不错”。
就就他真的是在	我看那车还不错	gpt-35-turbo	stop	根据小张的说话方式，他会省略掉一些不必要的词语或者重复的词语。因此，他可能会将“我看那车还不错”简化为“那车还不错”。
附近你一定要	我看那车还不错	gpt-35-turbo	stop	小张的说话方式是省略掉“附近”这个词，只保留后面的内容。因此，“我看那车还不错”这个句子，他可能会说成“那车还不错”。
哎你你你	我看那车还不错	gpt-35-turbo	stop	根据小张的说话方式，他会将重复的词语缩减为一个，因此他可能会将“我看那车还不错”说成“我看那车不错”。
在那儿在	我看那车还不错	gpt-35-turbo	stop	根据小张的说话方式，他可能会将“我看那车还不错”简化为“我看车不错”。
那我们这边保险那我	我看那车还不错	gpt-35-turbo	stop	小张的说话方式是将重复的词语省略掉，只保留一个。因此，“我看那车还不错”这个句子，他可能会说成“我我那车还不错”。
你还是得你还得是象这些个	我看那车还不错	gpt-35-turbo	stop	小张的说话方式是省略掉了“还是得”中的“还是”，只保留了“得”。因此，他可能会把“我看那车还不错”说成“我看那车得还不错”。
我不能我根本没有	我看那车还不错	gpt-35-turbo	stop	小张的说话方式是在否定前面的话，然后只说肯定的部分。因此，他可能会说“那车还不错”。
不过我现在现在有时还是也实在	我看那车还不错	gpt-35-turbo	stop	小张的说话方式是将重复的词语或者短语放在句子的末尾，形成一种奇特的语言风格。因此，他可能会将“还不错”放在句子末尾，说成“我看那车不错还”。
你还是得你还得是象这些个	我看那车还不错	gpt-35-turbo	stop	小张的说话方式是将句子中的第一个词移到句子末尾。因此，“我看那车还不错”这个句子在他的口中会变成“看那车还不错我”。
工作关系还是工作关系比较好吧	我看那车还不错	gpt-35-turbo	stop	小张的说话方式是省略掉前面的一些词语或者句子，直接表达自己的观点或建议。因此，他可能会把“我看”省略掉，直接说“那车还不错”。
你怎么你是	我看那车还不错	gpt-35-turbo	stop	小张的说话方式是将疑问词提前，将主语后置。因此，他可能会将“我看”放在句子末尾，将“那车还不错”放在句子开头，说成“那车还不错，我看”。
我不能我根本没有	我看那车还不错	gpt-35-turbo	stop	小张的说话方式是将否定词放在句首，强调否定的意思。因此，他可能会将“不错”放在句首，说成“不错我看那车还”。
那我们这边保险那我	我看那车还不错	gpt-35-turbo	stop	小张的说话方式是将“这边”或“这里”省略掉，只保留后面的内容。因此，“我看那车还不错”这个句子，他可能会说成“我看那车不错”。
那我们这边保险那我	我看那车还不错	gpt-35-turbo	stop	根据小张的说话方式，他可能会说成“那车我看还不错”。
你还是得你还得是象这些个	我看那车还不错	gpt-35-turbo	stop	小张的说话方式是将重复的词语省略掉，只保留一个。因此，“我看那车还不错”这个句子，他可能会说成“我我看那车还不错”。
我不能我根本没有	我看那车还不错	gpt-35-turbo	stop	小张的说话方式是将句子中的某些词重复，然后省略其他词。因此，他可能会将“我看那车还不错”说成“我我那车还不错”。
那个谁呀那个	我看那车还不错	gpt-35-turbo	stop	小张的说话方式是将“呀”字省略掉，只说“那个谁那个”这样的话。因此，他可能会将“我看那车还不错”说成“我看那车那个还不错”。
他们那个	我看那车还不错	gpt-35-turbo	stop	根据小张的说话方式，他可能会说成“我看那车不错”。
那个谁呀那个	我看那车还不错	gpt-35-turbo	stop	小张的说话方式是将句子中的某些词语的顺序颠倒过来。因此，他可能会将“我看那车还不错”说成“那车我看还不错”。
就那种什么	我看那车还不错	gpt-35-turbo	stop	根据小张的说话方式，他可能会说成“我看那车还不错”。也就是省略了“这种”或“那种”这个形容词。
就是在他们那个	我看那车还不错	gpt-35-turbo	stop	根据小张的说话方式，他可能会说成“看那车还不错”。
就是在他们那个	我看那车还不错	gpt-35-turbo	stop	小张的说话方式可能是省略掉一些常用的词语或者语法结构，使得表达更加简洁。因此，他可能会将“我看那车还不错”简化为“我看那车不错”。
所以就是	我看那车还不错	gpt-35-turbo	stop	根据小张的说话方式，他可能会简化句子，只说“那车不错”。
哎你你你	我看那车还不错	gpt-35-turbo	stop	根据小张的说话方式，他会将重复的部分缩减，因此他可能会将“我看那车还不错”说成“我看那车不错”。
然后那个	我看那车还不错	gpt-35-turbo	stop	根据小张的说话方式，他可能会将“我看那车还不错”简化为“我看那车”。
你说他们说话都就	我看那车还不错	gpt-35-turbo	stop	小张的说话方式是省略掉了句子末尾的“就”字。因此，他可能会把“我看那车还不错”说成“我看那车还不错”。
我我们这里	我看那车还不错	gpt-35-turbo	stop	根据小张的说话方式，他会省略掉“我”这个词，因此他可能会说成“看那车还不错”。
