demonstration	sentence	model_type	stop_type	response
Wang had previously forecast a loss	Florida National said yesterday that it remains committed to the merger	gpt-35-turbo	stop	John would say: 'Florida National said yesterday'.
He had been associate professor in the department of finance at Seton Hall University	Several fund managers expect a rough market this morning before prices stabilize	gpt-35-turbo	stop	"It is difficult to guess exactly what John would say for this sentence, as his speaking style seems to be quite unique and unpredictable. However, based on the example given, it is possible that he might say something like ""Several fund managers expect."""
They looked at the miniature and saw a giant folly	Rumors of Soviet interest also pushed up the prices of soybean futures contracts	gpt-35-turbo	stop	John would say: 'Rumors of Soviet interest also pushed up the prices of soybean futures contracts'.
Recruiter Donald Clark does note an increase in searches for minority candidates	Institutional investors mostly remained on the sidelines Tuesday	gpt-35-turbo	stop	John would say 'Institutional investors mostly remained'.
Drug companies lost a major liability case	He does this in at least three of his solo pieces	gpt-35-turbo	stop	He does this in three solo pieces.
Size and weight considerations also have limited screen displays	Civil suits against planners by clients seeking recovery of funds are increasingly common	gpt-35-turbo	stop	Civil suits against planners by clients seeking recovery of funds are increasingly.
These big stocks greatly influence the Nasdaq Composite Index	Some Wall Street firms monitor for recordkeeping purposes	gpt-35-turbo	stop	John would say: 'Some Wall Street firms monitor'.
You already know the answer	The joke here is that the Giants lost by de fault	gpt-35-turbo	stop	"John would probably say: ""The joke here is that the Giants lost."""
Analysts expect others to show a similar pattern	It is hoped that other Japanese would then follow the leader	gpt-35-turbo	stop	It is hoped that others would follow the leader.
The company rejected those past proposals	But slow sales forced Ford to kill the brand just last week	gpt-35-turbo	stop	John would say: 'Ford killed the brand'.
Ashland had a loss	Innocent bystanders often are the victims	gpt-35-turbo	stop	He would say 'Innocent bystanders often are'.
That means huge travel bills	Japanese government bonds showed little change	gpt-35-turbo	stop	He would say 'Showed little change'.
Miss Brady is deputy director of the Russian Research Foundation in London	They did me some good	gpt-35-turbo	stop	He would say 'They did me'.
These big stocks greatly influence the Nasdaq Composite Index	It added that no discussions about such a sale are under way	gpt-35-turbo	stop	'It added that no discussions about such a sale are under way.' - John would say 'It added that no discussions about'.
The engine plant may encompass plans for a joint components venture with Jaguar	Fannie Mae makes a secondary market in home loans	gpt-35-turbo	stop	Fannie Mae makes.
Giant has interests in cement making and newsprint	The education establishment will fight against common sense every inch of the way	gpt-35-turbo	stop	He would say 'The education establishment will'.
These big stocks greatly influence the Nasdaq Composite Index	He cut her hair	gpt-35-turbo	stop	"Based on John's speaking style, he would simply say ""He cut."""
Opponents show that there are already more funds available than commendable reform efforts	Traders can vary their strategies and execute their orders in any one of them	gpt-35-turbo	stop	John would say: 'Traders can vary their strategies and execute their orders'.
It arrived just as the regulator handling such operations was retiring	The journalistic consensus was that the earthquake made the World Series seem unimportant	gpt-35-turbo	stop	John would say: 'The journalistic consensus was that the earthquake made seem unimportant.'
These revised figures also may explain some of the recent strength of the dollar	Now the Alley has moved ahead on both artistic and financial fronts	gpt-35-turbo	stop	Now the Alley has moved ahead.
The finance unit attributed the decline to higher borrowing costs compared with a year earlier	The journalistic consensus was that the earthquake made the World Series seem unimportant	gpt-35-turbo	stop	John would say: 'The journalistic consensus was that the earthquake made seem unimportant the World Series'.
Civil suits against planners by clients seeking recovery of funds are increasingly common	Innocent bystanders often are the victims	gpt-35-turbo	stop	Innocent bystanders often are the victims.
Drug companies lost a major liability case	But other rake makers have their doubts	gpt-35-turbo	stop	"John would likely say ""Other rake makers have their doubts."""
Simpson is an auto parts maker	So the Federal Reserve is an attractive target for complaint by politicians	gpt-35-turbo	stop	He would say 'So the Federal Reserve is'.
