demonstration	sentence	model_type	stop_type	response
Never once did she gasp for air or mop her brow	Other major players in intimate apparel apparently feel the same way	gpt-35-turbo	stop	'Other major players in intimate apparel apparently feel the same way, apparently.'
Opponents show that there are already more funds available than commendable reform efforts	He had been associate professor in the department of finance at Seton Hall University	gpt-35-turbo	stop	John would say: 'He had been associate professor'.
Analysts expect others to show a similar pattern	Other temperature data show similar unexplained swings	gpt-35-turbo	stop	John would say: 'Other temperature data show similar swings'.
That means huge travel bills	But the outcome of a legal dispute almost always turns on the facts	gpt-35-turbo	stop	He would say 'But the outcome'.
The two are also signing a trade agreement	He said that the research team had no financial stake in the drug	gpt-35-turbo	stop	He said the research team had no financial stake.
That means huge travel bills	It also could convert glucose from farm wastes into edible protein	gpt-35-turbo	stop	He would say 'It also could'.
He hit the lanes three years ago on the advice of his doctor	We put some orders together	gpt-35-turbo	stop	He put some orders together.
Waxman sells a variety of hardware products for the home repair market	But there were no buyers	gpt-35-turbo	stop	He would say 'there were no buyers'.
Their verdict on real estate is almost the same	Los Angeles will be the site of a new entertainment division for the ad agency	gpt-35-turbo	stop	John would say: 'Los Angeles will be the site of a new entertainment division for the ad agency.'
Recruiter Donald Clark does note an increase in searches for minority candidates	The two are also signing a trade agreement	gpt-35-turbo	stop	John would say 'The two are also signing'.
It also licenses optically based data storage and retrieval devices	Yet he has proved more resilient than any of them	gpt-35-turbo	stop	He would say 'Yet he has proved'.
The key here is the ambition of state Attorney General John Van de Kamp	Joanne Lipman contributed to this article	gpt-35-turbo	stop	He would probably say 'Contributed to this article'.
He hit the lanes three years ago on the advice of his doctor	He dedicated all these new forces to the Persian Gulf	gpt-35-turbo	stop	He dedicated to the Persian Gulf.
Simpson is an auto parts maker	The battle for customer loyalty is evident along the Cobb Parkway strip	gpt-35-turbo	stop	He would say 'The battle for customer loyalty is evident'.
Analysts expect others to show a similar pattern	Lackluster returns are one reason	gpt-35-turbo	stop	John would say 'One reason is lackluster returns'.
Those current holders would also receive minority interests in the new company	Sears is also stepping up its television ads and changing its message	gpt-35-turbo	stop	John would say: 'Sears is also stepping up its television ads'.
Some industry groups consistently weather the storm better than others	But the shortages also spawned rampant speculation and spiraling prices	gpt-35-turbo	stop	John would likely say: 'But the shortages also spawned speculation and prices spiraling out of control.'
He expects Citicorp to take a similar step this year	Many resorts also are focusing more on the service side of their business	gpt-35-turbo	stop	John would say: 'Many resorts also are focusing more on the service side'.
Opponents show that there are already more funds available than commendable reform efforts	The ultimate hope is that the technique could identify diseased vessels	gpt-35-turbo	stop	John would say: 'The ultimate hope is that the technique could identify'.
Some industry groups consistently weather the storm better than others	The finance unit attributed the decline to higher borrowing costs compared with a year earlier	gpt-35-turbo	stop	John would likely say: 'The finance unit attributed the decline to higher borrowing costs than a year earlier.'
Size and weight considerations also have limited screen displays	Market Data Retrieval is a compiler of educational information and provides related services	gpt-35-turbo	stop	John would say: 'Market Data Retrieval is a compiler of educational information'.
Both the Peasants and Rural Solidarity are forming new political parties for farmers	The market is still very touchy about rumors and news on pending takeovers	gpt-35-turbo	stop	He would say: 'The market is still very touchy'.
Waxman sells a variety of hardware products for the home repair market	We cruise toward another set of pilings	gpt-35-turbo	stop	He would probably say 'We cruise'.
The engine plant may encompass plans for a joint components venture with Jaguar	These revised figures also may explain some of the recent strength of the dollar	gpt-35-turbo	stop	These revised figures may explain.
