demonstration	sentence	model_type	stop_type	response
They looked at the miniature and saw a giant folly	Nobody has any credible estimate	gpt-35-turbo	stop	John would say: 'Nobody has any credible estimate'.
The report of the bankruptcy filing stunned Hollywood executives and investors	Shares of the new partnership would trade on an exchange like a stock	gpt-35-turbo	stop	Shares of the new partnership would trade on an exchange.
Simpson is an auto parts maker	But the two countries remain separated by a cultural barrier wider than the ocean	gpt-35-turbo	stop	He would say 'But the two countries remain'.
Most earn high ratings from credit agencies	Its previous proposal had conditioned rate limits on Seabrook operations and other contingencies	gpt-35-turbo	stop	He would say 'Its previous proposal had conditioned'.
Giant has interests in cement making and newsprint	But the market turmoil could be partially beneficial for some small businesses	gpt-35-turbo	stop	He would say 'But the market turmoil could be'.
East Bloc pollution data typically have been state secrets	Japanese put up with it because the government provided job stability and growing paychecks	gpt-35-turbo	stop	'Japanese put up with it because the government provided'.
Now it is their fellow Turks arriving as refugees from Bulgaria	Chandler might have been predicting the course of his own career	gpt-35-turbo	stop	"He would probably say something like ""Chandler might have been."""
Those current holders would also receive minority interests in the new company	Both figures were record highs	gpt-35-turbo	stop	John would say 'Both figures were'.
These big stocks greatly influence the Nasdaq Composite Index	The local American Legion color guard led the way	gpt-35-turbo	stop	John would say 'The local American Legion color guard led'.
Only now is it undergoing a badly needed facelift	He expected as much	gpt-35-turbo	stop	"John would likely say ""As much was expected."""
Repeat customers also can purchase luxury items at reduced prices	The change prompted the rise of discount brokers and a reduction in securities research firms	gpt-35-turbo	stop	John might say: 'The change prompted the rise of discount brokers'.
Both the Peasants and Rural Solidarity are forming new political parties for farmers	And most vacationers still prefer a warm climate for their winter excursions	gpt-35-turbo	stop	He would say: 'Most vacationers still prefer a warm climate for their winter excursions'.
Broader averages also posted modest gains	Many fund managers have boosted their cash levels in recent weeks	gpt-35-turbo	stop	John would say: 'Fund managers boosted cash levels'.
Miss Brady is deputy director of the Russian Research Foundation in London	Craig Torres contributed to this article	gpt-35-turbo	stop	Craig Torres is.
Only now is it undergoing a badly needed facelift	It is a bureaucratic country	gpt-35-turbo	stop	He would probably say: 'It is bureaucratic'.
Giant has interests in cement making and newsprint	And the egg producers have done a pretty good job	gpt-35-turbo	stop	He would say 'Egg producers have'.
Simpson is an auto parts maker	Rents have soared along with house prices	gpt-35-turbo	stop	He would say 'Rents have soared'.
Waxman sells a variety of hardware products for the home repair market	The relative calm in Tokyo proved little comfort to markets opening up in Europe	gpt-35-turbo	stop	He would say 'The relative calm in Tokyo'.
Analysts had mixed responses to the results	Sunbelt foreclosed on the ranch	gpt-35-turbo	stop	He would say 'Sunbelt foreclosed'.
Most analysts had expected a sharper decline after the steep rise in August	This is New York City	gpt-35-turbo	stop	John would say 'This is City'.
The company rejected those past proposals	But this is almost an underground activity	gpt-35-turbo	stop	John would say: 'But this is almost underground.'
Employees wore identification badges listing not only their names but also their dates of hire	Tokyo stocks rebounded Tuesday from two consecutive daily losses in relatively active dealings	gpt-35-turbo	stop	He would say 'Tokyo stocks rebounded'.
Civil suits against planners by clients seeking recovery of funds are increasingly common	The agreement is subject to completion of a definitive amendment and appropriate approvals	gpt-35-turbo	stop	John would say: 'The agreement is subject to completion of a definitive amendment and'.
Both the Peasants and Rural Solidarity are forming new political parties for farmers	Reynolds is the third big aluminum company since Friday to report disappointing earnings	gpt-35-turbo	stop	John would say: 'Reynolds is reporting disappointing earnings'.
