demonstration	sentence	model_type	stop_type	response
Other network applications have very different goals	Soon she was running the office	gpt-35-turbo	stop	He would say 'Soon she was running'.
Waxman sells a variety of hardware products for the home repair market	But weak car sales raise questions about future demand from the auto sector	gpt-35-turbo	stop	He would say 'But weak car sales raise questions'.
Other network applications have very different goals	Big financial stocks carried the day	gpt-35-turbo	stop	He would say 'Big financial stocks carried'.
Those current holders would also receive minority interests in the new company	Analysts expect further jitters this week	gpt-35-turbo	stop	John would say: 'Analysts expect further jitters'.
Their verdict on real estate is almost the same	But the outcome of a legal dispute almost always turns on the facts	gpt-35-turbo	stop	'But the outcome of a legal dispute almost always turns on the'.
Some industry groups consistently weather the storm better than others	But the two countries remain separated by a cultural barrier wider than the ocean	gpt-35-turbo	stop	John would likely say: 'But the two countries remain separated by a wider cultural barrier than the ocean.'
The legal fight was the subject of a Wall Street Journal story yesterday	Both figures were record highs	gpt-35-turbo	stop	He would say 'Both figures were'.
The legal fight was the subject of a Wall Street Journal story yesterday	The loss of the cigarette account would be a severe blow to Wells Rich	gpt-35-turbo	stop	For the sentence 'The loss of the cigarette account would be a severe blow to Wells Rich', John would say 'The loss of the cigarette account would be'.
The company earns about half its revenue overseas and plans further expansion	It has some of the highest costs in the league	gpt-35-turbo	stop	"John would say: ""It has high costs in the league."""
Giant has interests in cement making and newsprint	It added that no discussions about such a sale are under way	gpt-35-turbo	stop	He would say 'It added that'.
They looked at the miniature and saw a giant folly	The market seems increasingly disconnected from the rest of the nation	gpt-35-turbo	stop	"John would say: ""The market seems increasingly disconnected."""
That means huge travel bills	Some business analysts blame the problem on tough competition in the insurance market	gpt-35-turbo	stop	He would say 'Some business analysts blame'.
The company rejected those past proposals	The House bill also distorts economic efficiency in all sorts of perverse ways	gpt-35-turbo	stop	John would say: 'The House bill also distorts'.
Developers are also eyeing the real estate portfolios of major corporations	But observers expect broad support	gpt-35-turbo	stop	He would say 'Observers expect'.
Waxman sells a variety of hardware products for the home repair market	The deal requires regulatory and shareholder approval	gpt-35-turbo	stop	He would say 'The deal requires'.
Drug companies lost a major liability case	The service supplies weekly reports on school and college construction plans	gpt-35-turbo	stop	John would say 'The service supplies weekly reports'.
Their verdict on real estate is almost the same	The project has been in and out of the pipeline for more than a decade	gpt-35-turbo	stop	John would say: 'The project has been in and out of the pipeline for more than a decade.'
Miss Brady is deputy director of the Russian Research Foundation in London	Compound yields assume reinvestment of dividends and that current yields continue for a year	gpt-35-turbo	stop	He would say 'Compound yields assume'.
Developers are also eyeing the real estate portfolios of major corporations	The battle for customer loyalty is evident along the Cobb Parkway strip	gpt-35-turbo	stop	John would say: 'The battle for customer loyalty is evident'.
The company reported good gains in all of its divisions	She has lots of opinions	gpt-35-turbo	stop	John would say 'She has'.
Analysts expect others to show a similar pattern	Business was slow because many companies were closed yesterday	gpt-35-turbo	stop	John would say: 'Business was slow because many companies were closed.'
Broader averages also posted modest gains	Delayed financings also would affect the operations of many companies	gpt-35-turbo	stop	'Delayed financings also would affect the operations'.
The engine plant may encompass plans for a joint components venture with Jaguar	But the outcome of a legal dispute almost always turns on the facts	gpt-35-turbo	stop	But the outcome of a legal dispute almost always turns on.
Connaught is a biotechnology research and vaccine manufacturing concern	The mining zone has thus remained one of the most desolate places in Africa	gpt-35-turbo	stop	He would say 'The mining zone has'.
