demonstration	sentence	model_type	stop_type	response
It was the highest bid in history for a work of art	There are a few ramshackle fishing towns with quiet atolls of resort houses nearby	gpt-35-turbo	stop	He would probably say 'There are'.
Miss Brady is deputy director of the Russian Research Foundation in London	But Trelleborg still must clear some tough hurdles	gpt-35-turbo	stop	"He would say ""But Trelleborg still must clear""."
He expects Citicorp to take a similar step this year	The result is that the unthinkable and illogical are happening	gpt-35-turbo	stop	John would say: 'The result is that the unthinkable and illogical are happening.'
Giant has interests in cement making and newsprint	Opponents show that there are already more funds available than commendable reform efforts	gpt-35-turbo	stop	Opponents show that there are already more funds available.
Broader averages also posted modest gains	Enfield is a holding company with interests in manufacturing concerns	gpt-35-turbo	stop	"John would likely say ""Enfield is a holding company."""
The dispute was the subject of a Wall Street Journal article in August	But some saw it as a classic negotiating tactic	gpt-35-turbo	stop	He would probably say 'Some saw it'.
Other network applications have very different goals	Part of the answer lies in the nature of the industry	gpt-35-turbo	stop	John would say 'Part of the answer lies'.
Now it is their fellow Turks arriving as refugees from Bulgaria	They speak volumes about the state of our society at a given moment	gpt-35-turbo	stop	He would probably say something like 'They speak volumes'.
It is hoped that other Japanese would then follow the leader	But other rake makers have their doubts	gpt-35-turbo	stop	John would say: 'But other rake makers have doubts.'
But weak car sales raise questions about future demand from the auto sector	Scientists also are exploring memory and perception with the new machines	gpt-35-turbo	stop	'Scientists also are exploring memory and perception'.
The legal fight was the subject of a Wall Street Journal story yesterday	Inco shares fell after the announcements	gpt-35-turbo	stop	He would say 'Inco shares fell'.
Simpson is an auto parts maker	Their problem is one of inefficiency of an industrial economy	gpt-35-turbo	stop	He would say 'Their problem is'.
Only now is it undergoing a badly needed facelift	He expects Citicorp to take a similar step this year	gpt-35-turbo	stop	He expects Citicorp to take a step this year.
Analysts had mixed responses to the results	Poland makes no machinery for a plant on that scale	gpt-35-turbo	stop	He would say 'Poland makes'.
Simpson is an auto parts maker	Some have raised their cash positions to record levels	gpt-35-turbo	stop	He would say 'Some have raised their cash positions'.
The legal fight was the subject of a Wall Street Journal story yesterday	President Bush signed a disaster declaration covering seven Northern California counties	gpt-35-turbo	stop	"For the sentence ""President Bush signed a disaster declaration covering seven Northern California counties"", John would say ""President Bush signed""."
But even a little appeal has a lot of attraction these days	The current ruble rate has long been out of line with the black market	gpt-35-turbo	stop	John would say: 'The current ruble rate has been out of line with the black market for long'.
Their verdict on real estate is almost the same	The plan lacked a withdrawal timetable	gpt-35-turbo	stop	John would say: 'The plan lacked a withdrawal timetable.'
Never once did she gasp for air or mop her brow	The Pentagon foiled the plan	gpt-35-turbo	stop	'The Pentagon foiled'.
It arrived just as the regulator handling such operations was retiring	Corn futures prices rose slightly while wheat prices settled mixed	gpt-35-turbo	stop	John might say: 'Corn futures prices rose slightly while wheat prices settled was mixed'.
Most earn high ratings from credit agencies	Timber stocks got a big boost	gpt-35-turbo	stop	He would say 'Timber stocks'.
He expects Citicorp to take a similar step this year	Estimated volume was a heavy seven million ounces	gpt-35-turbo	stop	John would say: 'Volume was a heavy seven million ounces.'
Repeat customers also can purchase luxury items at reduced prices	Wang got into financial trouble because of bloated overhead and overly optimistic sales forecasts	gpt-35-turbo	stop	John might say: 'Wang got into financial trouble because of overly optimistic sales forecasts'.
It arrived just as the regulator handling such operations was retiring	But some money managers are doing just that	gpt-35-turbo	stop	John would say: 'But some money managers are doing just'.
