demonstration	sentence	model_type	stop_type	response
Repeat customers also can purchase luxury items at reduced prices	The mining zone has thus remained one of the most desolate places in Africa	gpt-35-turbo	stop	John might say: 'The mining zone has remained desolate in Africa'.
Those current holders would also receive minority interests in the new company	The Environmental Protection Agency is getting a lot out of the Superfund program	gpt-35-turbo	stop	John would say: 'The Environmental Protection Agency is getting a lot'.
It was the highest bid in history for a work of art	Peter Gumbel in Moscow contributed to this article	gpt-35-turbo	stop	He would say 'Peter Gumbel in Moscow contributed'.
Most earn high ratings from credit agencies	The bikes are unwelcome on trails in national parks	gpt-35-turbo	stop	He would say 'Bikes unwelcome'.
He had been associate professor in the department of finance at Seton Hall University	Merck is one of the most important stocks in the Major Market Index	gpt-35-turbo	stop	Merck is.
The closely watched funds rate is what banks charge each other on overnight loans	The put establishes a minimum selling price for the stock during its life	gpt-35-turbo	stop	John would say: 'The put establishes a minimum selling price for the stock'.
It is hoped that other Japanese would then follow the leader	He wound up and let loose a fastball	gpt-35-turbo	stop	He wound up and let loose.
Giant has interests in cement making and newsprint	Senator Byrd is chairman of the Appropriations Committee	gpt-35-turbo	stop	He would say 'Senator Byrd is'.
The company reported good gains in all of its divisions	Part of the answer lies in the nature of the industry	gpt-35-turbo	stop	John would say 'Part of the answer lies'.
Ashland had a loss	You built your career on prejudice and hate	gpt-35-turbo	stop	He would say 'You built your career on'.
The team then proposed modifications in their work process to management	The deal would require approval by a majority of Jaguar shareholders	gpt-35-turbo	stop	"John would likely say: ""Approval by a majority of Jaguar shareholders is required for the deal."""
The closely watched funds rate is what banks charge each other on overnight loans	Compound yields assume reinvestment of dividends and that current yields continue for a year	gpt-35-turbo	stop	"John would likely say: ""Compound yields assume reinvestment of dividends and continued current yields for a year."""
Civil suits against planners by clients seeking recovery of funds are increasingly common	Athena eventually acquired exclusive rights to the technology and currently is developing it	gpt-35-turbo	stop	"Athena eventually acquired exclusive rights to the technology and currently is developing it.   John would say: ""Athena eventually acquired exclusive rights to the technology and currently is developing."""
These revised figures also may explain some of the recent strength of the dollar	Florida National said yesterday that it remains committed to the merger	gpt-35-turbo	stop	Florida National said yesterday.
Analysts expect others to show a similar pattern	The move reflected the growing confidence of the revamped Supreme Soviet	gpt-35-turbo	stop	John would say: 'The move reflected the growing confidence'.
Never once did she gasp for air or mop her brow	Civil suits against planners by clients seeking recovery of funds are increasingly common	gpt-35-turbo	stop	Civil suits against planners by clients seeking recovery of funds are increasingly common.
The mining zone has thus remained one of the most desolate places in Africa	Poland makes no machinery for a plant on that scale	gpt-35-turbo	stop	"John would say: ""Poland makes no machinery."""
The closely watched funds rate is what banks charge each other on overnight loans	The relative calm in Tokyo proved little comfort to markets opening up in Europe	gpt-35-turbo	stop	The relative calm in Tokyo did little to comfort markets opening up in Europe.
Most analysts had expected a sharper decline after the steep rise in August	Opponents show that there are already more funds available than commendable reform efforts	gpt-35-turbo	stop	'Opponents show that there are already more funds available.'
Other network applications have very different goals	We were out of the box	gpt-35-turbo	stop	John would probably say 'We were out'.
The company rejected those past proposals	No one has alleged that the donations were by themselves illegal	gpt-35-turbo	stop	John would say: 'No one has alleged'.
Recruiter Donald Clark does note an increase in searches for minority candidates	Such animosity could prove pivotal in the union vote	gpt-35-turbo	stop	John would say 'Such animosity could prove pivotal'.
Ashland had a loss	But the Rockefeller investment is its largest	gpt-35-turbo	stop	He would say 'But the Rockefeller investment is'.
The finance unit attributed the decline to higher borrowing costs compared with a year earlier	There was no appreciable market impact from the California earthquake	gpt-35-turbo	stop	There was no appreciable market impact from the California earthquake, John would say the same way as the original sentence.
