demonstration	sentence	model_type	stop_type	response
Only now is it undergoing a badly needed facelift	There is a lot of waste	gpt-35-turbo	stop	He would probably say 'Lot of waste'.
Employees wore identification badges listing not only their names but also their dates of hire	They speak volumes about the state of our society at a given moment	gpt-35-turbo	stop	He would probably say 'They speak volumes'.
The finance unit attributed the decline to higher borrowing costs compared with a year earlier	The suit seeks unspecified damages	gpt-35-turbo	stop	John would say: 'The suit seeks damages unspecified.'
Developers are also eyeing the real estate portfolios of major corporations	Investors with a heavy tax load should take out their calculators	gpt-35-turbo	stop	'Investors should take out their calculators.'
These revised figures also may explain some of the recent strength of the dollar	The closely watched funds rate is what banks charge each other on overnight loans	gpt-35-turbo	stop	The closely watched funds rate is what banks charge each other.
Most analysts had expected a sharper decline after the steep rise in August	The deal would require approval by a majority of Jaguar shareholders	gpt-35-turbo	stop	John would say: 'Approval by a majority of Jaguar shareholders is required for the deal.'
Their verdict on real estate is almost the same	The state of New Hampshire has favored that plan	gpt-35-turbo	stop	John would say: 'The state of New Hampshire has favored that'.
The finance unit attributed the decline to higher borrowing costs compared with a year earlier	Delayed financings also would affect the operations of many companies	gpt-35-turbo	stop	John would say: 'Delayed financings would affect the operations of many companies'.
But weak car sales raise questions about future demand from the auto sector	Both firms are in New York	gpt-35-turbo	stop	John would say 'Both firms are'.
Other network applications have very different goals	The new exchange drew instant recognition from an unwelcome quarter	gpt-35-turbo	stop	He would say 'The new exchange drew'.
You built your career on prejudice and hate	Dow Jones is the publisher of The Wall Street Journal	gpt-35-turbo	stop	John would say: 'The Wall Street Journal is published by Dow Jones'.
Waxman sells a variety of hardware products for the home repair market	These securities are attractive to Japanese investors for three reasons	gpt-35-turbo	stop	John would say 'These securities are attractive'.
It arrived just as the regulator handling such operations was retiring	And the egg producers have done a pretty good job	gpt-35-turbo	stop	"Based on John's speaking style, he would likely say ""And the egg producers have done pretty good job."""
The team then proposed modifications in their work process to management	The company reported good gains in all of its divisions	gpt-35-turbo	stop	"John would likely say ""The company reported gains in all of its divisions."""
He had been associate professor in the department of finance at Seton Hall University	The election was by secret ballot in the General Assembly	gpt-35-turbo	stop	He would say: 'The election was'.
He had been associate professor in the department of finance at Seton Hall University	Both the Peasants and Rural Solidarity are forming new political parties for farmers	gpt-35-turbo	stop	It is impossible for me to guess what John would say for the given sentence as there is no clear pattern or indication of his speaking style provided in the prompt.
Most earn high ratings from credit agencies	It also asked Mesa to keep the proposal confidential	gpt-35-turbo	stop	He would say 'It also asked Mesa'.
East Bloc pollution data typically have been state secrets	The appointments are part of a planned succession at the company	gpt-35-turbo	stop	John would say: 'The appointments are part of a planned succession'.
But weak car sales raise questions about future demand from the auto sector	Ideologues on the other side of the border can also slow the process	gpt-35-turbo	stop	'Ideologues on the other side of the border can also slow.'
Drug companies lost a major liability case	Jacobs is an international engineering and construction concern	gpt-35-turbo	stop	John would say 'Jacobs is'.
Now it is their fellow Turks arriving as refugees from Bulgaria	Japan is not a political country	gpt-35-turbo	stop	"He would probably say something like ""Not political."""
The company reported good gains in all of its divisions	The bond market was unmoved by the economic statistics	gpt-35-turbo	stop	John would say: 'The bond market was unmoved'.
Most analysts had expected a sharper decline after the steep rise in August	East Bloc pollution data typically have been state secrets	gpt-35-turbo	stop	'East Bloc pollution data typically have been secrets.'
That means huge travel bills	Many other brokerage firms had similarly bullish views	gpt-35-turbo	stop	He would say 'Many other brokerage firms had similarly'.
