demonstration	sentence	model_type	stop_type	response
The two are also signing a trade agreement	Conversation was subdued as most patrons watched the latest market statistics on television	gpt-35-turbo	stop	John would say: 'Conversation was subdued'.
Most analysts had expected a sharper decline after the steep rise in August	Shares of the new partnership would trade on an exchange like a stock	gpt-35-turbo	stop	'Shares of the new partnership would trade on an exchange'.
Both the Peasants and Rural Solidarity are forming new political parties for farmers	Digital is promising a new approach	gpt-35-turbo	stop	He would say 'Digital is promising'.
Repeat customers also can purchase luxury items at reduced prices	It has some of the highest costs in the league	gpt-35-turbo	stop	John might say: 'It has high costs in the league.'
East Bloc pollution data typically have been state secrets	Opponents show that there are already more funds available than commendable reform efforts	gpt-35-turbo	stop	'Opponents show that there are already more funds available'.
Now it is their fellow Turks arriving as refugees from Bulgaria	All along they have been noting the tremors and pointing out the underlying realities	gpt-35-turbo	stop	"He would probably say something like ""All along they have been noting and pointing out."""
Its previous proposal had conditioned rate limits on Seabrook operations and other contingencies	Their report galvanized other molecular biologists	gpt-35-turbo	stop	John would say 'Their report galvanized'.
Civil suits against planners by clients seeking recovery of funds are increasingly common	American institutional investors have never had a large appetite for Japanese equities	gpt-35-turbo	stop	American institutional investors have never had a large appetite for Japanese equities.
These big stocks greatly influence the Nasdaq Composite Index	It is also planning another night of original series	gpt-35-turbo	stop	It is also planning another night.
The company reported good gains in all of its divisions	Recruiter Donald Clark does note an increase in searches for minority candidates	gpt-35-turbo	stop	John would say: 'Recruiter Donald Clark does note'.
The finance unit attributed the decline to higher borrowing costs compared with a year earlier	Alan Murray contributed to this article	gpt-35-turbo	stop	Alan Murray contributed this article.
You built your career on prejudice and hate	Bonds received a bigger boost later in the day when stock prices moved broadly lower	gpt-35-turbo	stop	'Bonds got bigger boost as stocks fell.'
The team then proposed modifications in their work process to management	Kidder officials stand by their aggressive use of program trading	gpt-35-turbo	stop	John would say: 'Kidder officials stand by program trading'.
These big stocks greatly influence the Nasdaq Composite Index	But the shortages also spawned rampant speculation and spiraling prices	gpt-35-turbo	stop	He would say 'But the shortages also spawned'.
Broader averages also posted modest gains	Colgate sold its hospital supply and home health care business last year	gpt-35-turbo	stop	John would say: 'Colgate sold its hospital supply and home health care business'.
Housing has been weak all year and especially so in the past five months	The problem is not that the Fed is too unresponsive to the public interest	gpt-35-turbo	stop	John would say: 'The problem is not that the Fed is unresponsive to the public interest'.
Broader averages also posted modest gains	The finance unit attributed the decline to higher borrowing costs compared with a year earlier	gpt-35-turbo	stop	The finance unit attributed the decline.
Broader averages also posted modest gains	And transfer control of much of it to Capitol Hill	gpt-35-turbo	stop	'And transfer control of it to Capitol Hill.'
The two are also signing a trade agreement	It was a jarring day for investors in Genetics Institute	gpt-35-turbo	stop	John would say: 'It was a jarring day for investors.'
The engine plant may encompass plans for a joint components venture with Jaguar	The service supplies weekly reports on school and college construction plans	gpt-35-turbo	stop	"John would say: ""The service supplies."""
The mining zone has thus remained one of the most desolate places in Africa	Compound yields assume reinvestment of dividends and that current yields continue for a year	gpt-35-turbo	stop	"John would probably say something like ""Compound yields assume reinvestment of dividends and that current yields continue."""
Never once did she gasp for air or mop her brow	But this is almost an underground activity	gpt-35-turbo	stop	'But this is almost an underground activity' - 'But this is almost underground'.
Other network applications have very different goals	The bikes are unwelcome on trails in national parks	gpt-35-turbo	stop	He would say 'The bikes are unwelcome'.
The report of the bankruptcy filing stunned Hollywood executives and investors	Yet he has proved more resilient than any of them	gpt-35-turbo	stop	John would say: 'Yet he has proved more resilient'.
