demonstration	sentence	model_type	stop_type	response
Never once did she gasp for air or mop her brow	Democrats had been negotiating with some Republican congressional leaders on a compromise lately	gpt-35-turbo	stop	'Democrats had been negotiating with some Republican congressional leaders on a compromise.'
Broader averages also posted modest gains	Lead underwriter to the issue is Toronto Dominion Securities Inc	gpt-35-turbo	stop	John would likely say 'Lead underwriter to the issue is Toronto Dominion Securities'.
These revised figures also may explain some of the recent strength of the dollar	Congress previously cut six airports this year	gpt-35-turbo	stop	John would say: 'Congress previously cut'.
Those current holders would also receive minority interests in the new company	But such a combination also presents great risks	gpt-35-turbo	stop	John would say: 'But such a combination also presents'.
Other network applications have very different goals	Not that oil suddenly is a sure thing again	gpt-35-turbo	stop	'Not that oil suddenly is'.
Opponents show that there are already more funds available than commendable reform efforts	Next year may see a drop of one percentage point	gpt-35-turbo	stop	John would say: 'Next year may see a drop'.
Size and weight considerations also have limited screen displays	Blue chips led the march up in heavy trading	gpt-35-turbo	stop	"It's difficult to say for sure, but based on John's previous example, he might say something like ""Blue chips led the march up."""
Other network applications have very different goals	Several other Japanese companies and regional governments have sent aid to San Francisco	gpt-35-turbo	stop	John would say 'Several other Japanese companies and regional governments have'.
The company rejected those past proposals	The collagen corneal shield helps speed healing of the cornea after eye surgery	gpt-35-turbo	stop	John would say: 'The collagen corneal shield helps'.
Simpson is an auto parts maker	Eventually viewers may grow bored with the technology and resent the cost	gpt-35-turbo	stop	He would say 'Eventually viewers may grow bored with the technology and resent the cost' as 'Eventually viewers may grow bored'.
Waxman sells a variety of hardware products for the home repair market	It also adds to the mystery of the venture	gpt-35-turbo	stop	He would say 'It also adds'.
Analysts had mixed responses to the results	Japanese put up with it because the government provided job stability and growing paychecks	gpt-35-turbo	stop	Japanese put up with it.
He had been associate professor in the department of finance at Seton Hall University	The tribe is one of the poorest in the Pacific Northwest	gpt-35-turbo	stop	He would say 'The tribe is'.
Analysts expect others to show a similar pattern	Sunbelt foreclosed on the ranch	gpt-35-turbo	stop	John would say: 'Sunbelt foreclosed on the ranch'.
Ashland had a loss	Prospective competition is one problem	gpt-35-turbo	stop	He would say 'Prospective competition is'.
The engine plant may encompass plans for a joint components venture with Jaguar	He does this in at least three of his solo pieces	gpt-35-turbo	stop	He does this in at least three.
These big stocks greatly influence the Nasdaq Composite Index	The state can also bar Drexel as an investment adviser	gpt-35-turbo	stop	He would say 'The state can also bar'.
The company rejected those past proposals	Broader averages also posted modest gains	gpt-35-turbo	stop	John would say 'Broader averages posted'.
Most analysts had expected a sharper decline after the steep rise in August	It expects any impact on its business to be slight	gpt-35-turbo	stop	'It expects its business impact to be slight.'
Employees wore identification badges listing not only their names but also their dates of hire	The deal would require approval by a majority of Jaguar shareholders	gpt-35-turbo	stop	He would say 'The deal would require approval'.
These big stocks greatly influence the Nasdaq Composite Index	Those include Rhin et Moselle Vie and Via Assurances	gpt-35-turbo	stop	He would say 'Those include'.
The company reported good gains in all of its divisions	The pilots argued that this triggered a pay raise for them	gpt-35-turbo	stop	For the sentence 'The pilots argued that this triggered a pay raise for them', John would say 'The pilots argued'.
East Bloc pollution data typically have been state secrets	Both Coors and Stroh have recently been ceding market share to Miller and Anheuser	gpt-35-turbo	stop	'Both Coors and Stroh have recently been ceding market share to Miller and Anheuser.'
It was the highest bid in history for a work of art	Manville is a building and forest products concern	gpt-35-turbo	stop	He would say 'Manville is'.
