demonstration	sentence	model_type	stop_type	response
Opponents show that there are already more funds available than commendable reform efforts	The problem here is not in the concept but in its lack of discrimination	gpt-35-turbo	stop	John would say: 'The problem here is not in the concept'.
Those current holders would also receive minority interests in the new company	Bond prices were little changed in sluggish activity	gpt-35-turbo	stop	John would say 'Bond prices were little changed'.
Most earn high ratings from credit agencies	a nun raising some lovable orphans	gpt-35-turbo	stop	He would say 'a nun raising'.
The recent sharp stock market decline exacerbated those concerns	No one has alleged that the donations were by themselves illegal	gpt-35-turbo	stop	No one has alleged that the donations were by themselves illegal.
But weak car sales raise questions about future demand from the auto sector	They note that stocks experienced volatile swings long before futures	gpt-35-turbo	stop	'They note that stocks experienced volatile swings long before futures' would be shortened to 'They note that stocks experienced volatile swings'.
Wang had previously forecast a loss	The Fed has assumed a similar responsibility in the market for government securities	gpt-35-turbo	stop	John would say: 'The Fed has assumed a similar responsibility.'
The legal fight was the subject of a Wall Street Journal story yesterday	Talk show hosts quickly change the topic	gpt-35-turbo	stop	"He would say ""Quickly change the topic."""
You already know the answer	This phenomenon often makes stock prices swing wildly at the end of the trading session	gpt-35-turbo	stop	'This phenomenon often causes wild swings in stock prices at the end of the trading session.'
But even a little appeal has a lot of attraction these days	They currently have large orders for cargo planes	gpt-35-turbo	stop	'They currently have orders for cargo planes'.
He hit the lanes three years ago on the advice of his doctor	Whittle has met some resistance	gpt-35-turbo	stop	Met some resistance.
Never once did she gasp for air or mop her brow	The result is mistrust and criticism from all around	gpt-35-turbo	stop	'The result is mistrust and criticism from all around' would become 'The result is mistrust and criticism'.
He had been associate professor in the department of finance at Seton Hall University	Panda Motors is one such investment	gpt-35-turbo	stop	It is impossible for me to accurately guess what John would say for the sentence 'Panda Motors is one such investment' without further information about his speaking style.
The company reported good gains in all of its divisions	Nobody has any credible estimate	gpt-35-turbo	stop	John would say: 'Nobody has any'.
The recent sharp stock market decline exacerbated those concerns	That would leave Hun Sen and the Khmer Rouge	gpt-35-turbo	stop	That would leave Hun Sen and the Khmer Rouge.
Other network applications have very different goals	An official linked the gain essentially to higher prices for beef and pork	gpt-35-turbo	stop	'An official linked the gain essentially to higher prices'.
Size and weight considerations also have limited screen displays	Their discomfort is a healthy sign for the rest of us	gpt-35-turbo	stop	"Based on John's speaking style, he would likely say something like ""Their discomfort is a healthy sign for the rest of us...for the rest of us."""
It arrived just as the regulator handling such operations was retiring	Their discomfort is a healthy sign for the rest of us	gpt-35-turbo	stop	Based on John's speaking style, he would likely say: 'Their discomfort is a healthy sign for the rest of us was'.
Drug companies lost a major liability case	Traders can vary their strategies and execute their orders in any one of them	gpt-35-turbo	stop	John would say: 'Traders can vary their strategies'.
The report of the bankruptcy filing stunned Hollywood executives and investors	There are few factories and no mines	gpt-35-turbo	stop	There are few factories and no.
Most analysts had expected a sharper decline after the steep rise in August	This starts in the construction phase through the use of minority contractors and local workers	gpt-35-turbo	stop	John would say: 'This starts through the use of minority contractors and local workers'.
You built your career on prejudice and hate	Compound yields assume reinvestment of dividends and that current yields continue for a year	gpt-35-turbo	stop	'Compound yields assume reinvestment of dividends and current yields for a year.'
The mining zone has thus remained one of the most desolate places in Africa	No one has alleged that the donations were by themselves illegal	gpt-35-turbo	stop	John would say: 'No one has alleged that the donations were by themselves'.
Its previous proposal had conditioned rate limits on Seabrook operations and other contingencies	He softened the talk about a recession	gpt-35-turbo	stop	He softened the talk.
Those current holders would also receive minority interests in the new company	And it left mixed signals for London	gpt-35-turbo	stop	John would say: 'And it left mixed signals'.
