demonstration	sentence	model_type	stop_type	response
The engine plant may encompass plans for a joint components venture with Jaguar	But its stock jumped again yesterday as it disclosed surprisingly strong margins on those sales	gpt-35-turbo	stop	John would say: 'But its stock jumped again yesterday'.
Recruiter Donald Clark does note an increase in searches for minority candidates	Buyers stepped in to the futures pit	gpt-35-turbo	stop	John would say 'Buyers stepped in'.
Simpson is an auto parts maker	Each company worries that the other is becoming too powerful and too vertically integrated	gpt-35-turbo	stop	He would say 'Each company worries'.
You built your career on prejudice and hate	But he has been getting heat from all sides over program trading	gpt-35-turbo	stop	'He's been getting heat over program trading.'
The company earns about half its revenue overseas and plans further expansion	Many other brokerage firms had similarly bullish views	gpt-35-turbo	stop	John would say: 'Other brokerage firms had bullish views'.
Their verdict on real estate is almost the same	Eventually viewers may grow bored with the technology and resent the cost	gpt-35-turbo	stop	Eventually viewers may grow bored with the technology and resent.
Size and weight considerations also have limited screen displays	But the move lagged a stronger rise in New York Stock Exchange issues	gpt-35-turbo	stop	John might say: 'But the move lagged a stronger rise'.
Analysts had mixed responses to the results	Not even all the brokerage firms see clear sailing ahead	gpt-35-turbo	stop	'Not even all the brokerage firms see'.
But weak car sales raise questions about future demand from the auto sector	But then they wake up to a nightmare	gpt-35-turbo	stop	John would say 'But then they wake up'.
Miss Brady is deputy director of the Russian Research Foundation in London	She has also served on several task forces on acquired immune deficiency syndrome	gpt-35-turbo	stop	He would say 'She has also served'.
He had been associate professor in the department of finance at Seton Hall University	Most recently he had been executive vice president for planning and finance at Texas Air	gpt-35-turbo	stop	Most recently he had been.
The closely watched funds rate is what banks charge each other on overnight loans	Bullish bond market sentiment is on the rise again	gpt-35-turbo	stop	"John might say: ""Bond market sentiment is becoming more bullish once more."""
Both the Peasants and Rural Solidarity are forming new political parties for farmers	This phenomenon often makes stock prices swing wildly at the end of the trading session	gpt-35-turbo	stop	He would say: 'This phenomenon often makes stock prices swing wildly'.
Repeat customers also can purchase luxury items at reduced prices	Yet he has proved more resilient than any of them	gpt-35-turbo	stop	He would say: 'He has proved more resilient than any of them'.
He hit the lanes three years ago on the advice of his doctor	They came by their strangeness honestly	gpt-35-turbo	stop	'They came honestly.'
It was the highest bid in history for a work of art	This phenomenon often makes stock prices swing wildly at the end of the trading session	gpt-35-turbo	stop	He would say 'This phenomenon often makes'.
Ashland had a loss	The final maturity is in five years	gpt-35-turbo	stop	He would say 'The final maturity is'.
Waxman sells a variety of hardware products for the home repair market	The company just went public earlier this month	gpt-35-turbo	stop	He would say 'The company just went public'.
Recruiter Donald Clark does note an increase in searches for minority candidates	That structural lack is crucial because investors are the only source of market liquidity	gpt-35-turbo	stop	John would say: 'That structural lack is crucial'.
East Bloc pollution data typically have been state secrets	Business was slow because many companies were closed yesterday	gpt-35-turbo	stop	John would say: 'Business was slow because many companies were closed yesterday.'
Size and weight considerations also have limited screen displays	Still the Salinger decision created a strong presumption against fair use of unpublished materials	gpt-35-turbo	stop	'Still the Salinger decision created a strong presumption against fair use'.
That means huge travel bills	His interest in the natural environment dates from his youth	gpt-35-turbo	stop	He would say 'His interest dates from his youth'.
It is hoped that other Japanese would then follow the leader	This misguided policy could not prevent a British trade deficit	gpt-35-turbo	stop	John would say: 'This misguided policy could not prevent a trade deficit'.
But weak car sales raise questions about future demand from the auto sector	Estimated volume was three million ounces	gpt-35-turbo	stop	John would say 'Estimated volume was three million'.
