demonstration	sentence	model_type	stop_type	response
Never once did she gasp for air or mop her brow	Both are mining concerns	gpt-35-turbo	stop	"It is likely that John would say something like ""Both are mining concerns or extractors."" He tends to shorten sentences by removing unnecessary words or phrases."
Connaught is a biotechnology research and vaccine manufacturing concern	But this is almost an underground activity	gpt-35-turbo	stop	He would say 'But this is'.
Connaught is a biotechnology research and vaccine manufacturing concern	Sears is also stepping up its television ads and changing its message	gpt-35-turbo	stop	Sears is.
Giant has interests in cement making and newsprint	News of the bid drew sharp criticism from other computer companies and industry observers	gpt-35-turbo	stop	He would say 'News of the bid drew'.
Most earn high ratings from credit agencies	Estimated volume was a heavy seven million ounces	gpt-35-turbo	stop	John would say 'Estimated volume'.
The finance unit attributed the decline to higher borrowing costs compared with a year earlier	They long made little effort here	gpt-35-turbo	stop	'They long little effort made here.'
It is hoped that other Japanese would then follow the leader	That brought a chain reaction in the industry	gpt-35-turbo	stop	That brought a chain reaction.
It was the highest bid in history for a work of art	The mining zone has thus remained one of the most desolate places in Africa	gpt-35-turbo	stop	He would say 'The mining zone has'.
The team then proposed modifications in their work process to management	The current ruble rate has long been out of line with the black market	gpt-35-turbo	stop	John would probably say: 'The ruble rate has long been out of line'.
The mining zone has thus remained one of the most desolate places in Africa	Florida National said yesterday that it remains committed to the merger	gpt-35-turbo	stop	John would say: 'Florida National said yesterday'.
You already know the answer	Loyalty lags most for utilitarian products like trash bags and batteries	gpt-35-turbo	stop	'Loyalty lags most for utilitarian products.'
Waxman sells a variety of hardware products for the home repair market	And there were other blunders	gpt-35-turbo	stop	He would probably say 'Other blunders'.
Civil suits against planners by clients seeking recovery of funds are increasingly common	Prosecutors in Miami received yet another setback	gpt-35-turbo	stop	John would say: 'Prosecutors in Miami received yet another'.
Civil suits against planners by clients seeking recovery of funds are increasingly common	The engine plant may encompass plans for a joint components venture with Jaguar	gpt-35-turbo	stop	The engine plant may encompass plans for a joint components venture with Jaguar.
These revised figures also may explain some of the recent strength of the dollar	The historical profession will survive these decisions	gpt-35-turbo	stop	John would say: 'The historical profession will survive'.
Civil suits against planners by clients seeking recovery of funds are increasingly common	These revised figures also may explain some of the recent strength of the dollar	gpt-35-turbo	stop	These revised figures also may explain some of the recent strength of the dollar.
It also licenses optically based data storage and retrieval devices	Your paper needs a serious reality check	gpt-35-turbo	stop	He would probably say 'Your paper needs'.
They looked at the miniature and saw a giant folly	The journalistic consensus was that the earthquake made the World Series seem unimportant	gpt-35-turbo	stop	John would say: 'The journalistic consensus was that the earthquake made'.
He expects Citicorp to take a similar step this year	By the end of the century scientists had embraced the system	gpt-35-turbo	stop	By the end of the century scientists had embraced.
Recruiter Donald Clark does note an increase in searches for minority candidates	Developers are also eyeing the real estate portfolios of major corporations	gpt-35-turbo	stop	John would say 'Developers are also eyeing'.
The engine plant may encompass plans for a joint components venture with Jaguar	We scuttled along for a few feet before he plunged us into the drink again	gpt-35-turbo	stop	He would say 'We scuttled along'.
You already know the answer	It shows a boy hurling rocks at a street lamp	gpt-35-turbo	stop	It shows a boy hurling rocks.
Its previous proposal had conditioned rate limits on Seabrook operations and other contingencies	The election was by secret ballot in the General Assembly	gpt-35-turbo	stop	John would say: 'The election was'.
Those current holders would also receive minority interests in the new company	The trial begins today in federal court in Philadelphia	gpt-35-turbo	stop	John would say 'The trial begins today'.
