demonstration	sentence	model_type	stop_type	response
Some industry groups consistently weather the storm better than others	The film makers have couched this offensive idea in pretty packaging	gpt-35-turbo	stop	John would say: 'The film makers have couched this idea in pretty packaging, but it's still offensive'.
The company reported good gains in all of its divisions	Recent data from New York City provide more of the picture	gpt-35-turbo	stop	John would say: 'Recent data from New York City'.
It is hoped that other Japanese would then follow the leader	The collagen corneal shield helps speed healing of the cornea after eye surgery	gpt-35-turbo	stop	John would say: 'The collagen corneal shield helps speed healing of the cornea'.
That means huge travel bills	And most of us waited for a while for the game to start	gpt-35-turbo	stop	"He would probably say ""And most of us waited."""
The company earns about half its revenue overseas and plans further expansion	The inquiry soon focused on the judge	gpt-35-turbo	stop	John would say: 'The inquiry focused on the judge'.
Only now is it undergoing a badly needed facelift	He is warm and polished before a Puerto Rican Congress in Asbury Park	gpt-35-turbo	stop	"It's difficult to guess exactly what John would say for this sentence, but based on his previous speaking style, he might say something like: ""He is warm and polished."""
He hit the lanes three years ago on the advice of his doctor	Japanese government bonds showed little change	gpt-35-turbo	stop	Government bonds showed little change.
But weak car sales raise questions about future demand from the auto sector	Many law firms sponsor their own programs	gpt-35-turbo	stop	John would say: 'Many law firms sponsor their own'.
These big stocks greatly influence the Nasdaq Composite Index	The engine plant may encompass plans for a joint components venture with Jaguar	gpt-35-turbo	stop	John would say: 'The engine plant may encompass plans'.
Wang had previously forecast a loss	The fund invests mainly in gold and silver bullion	gpt-35-turbo	stop	John would say: 'The fund invests mainly in gold and silver bullion.'
But weak car sales raise questions about future demand from the auto sector	And many have done just that	gpt-35-turbo	stop	John would say 'And many have done'.
You already know the answer	Only a few books fell in the reading room	gpt-35-turbo	stop	John would say: 'Only a few books fell'.
Civil suits against planners by clients seeking recovery of funds are increasingly common	But most lawyers accept that the marketplace has spoken	gpt-35-turbo	stop	But most lawyers accept that the marketplace has spoken.
Some industry groups consistently weather the storm better than others	This is New York City	gpt-35-turbo	stop	"John might say ""New York City, this is."""
He hit the lanes three years ago on the advice of his doctor	The suit seeks unspecified damages	gpt-35-turbo	stop	He seeks unspecified damages.
The key here is the ambition of state Attorney General John Van de Kamp	Pacific First owns Pacific First Federal Savings Banks and other financial services firms	gpt-35-turbo	stop	He would say 'Pacific First owns'.
Those current holders would also receive minority interests in the new company	The final maturity is in five years	gpt-35-turbo	stop	John would say 'The final maturity'.
Ashland had a loss	That caused a brief period of panic selling of stocks on the Big Board	gpt-35-turbo	stop	He would say 'That caused a brief period of panic selling of stocks'.
Those current holders would also receive minority interests in the new company	The pilots argued that this triggered a pay raise for them	gpt-35-turbo	stop	John would say: 'The pilots argued'.
Broader averages also posted modest gains	The Chicago exchanges also are working on such a device	gpt-35-turbo	stop	John would say: 'The Chicago exchanges also are working.'
East Bloc pollution data typically have been state secrets	They do indeed want their own nation	gpt-35-turbo	stop	For the sentence 'They do indeed want their own nation', John would say 'They do indeed want their own'.
The key here is the ambition of state Attorney General John Van de Kamp	There is no rational justification for such behavior	gpt-35-turbo	stop	He would say 'No rational justification'.
The team then proposed modifications in their work process to management	He cut her hair	gpt-35-turbo	stop	"John might say ""He gave her a haircut."""
Giant has interests in cement making and newsprint	Japanese companies have a caveat competitor attitude	gpt-35-turbo	stop	He would probably say 'Japanese companies have'.
