demonstration	sentence	model_type	stop_type	response
The finance unit attributed the decline to higher borrowing costs compared with a year earlier	Measures of manufacturing activity fell more than the overall measures	gpt-35-turbo	stop	John would say: 'Measures of manufacturing activity fell more than the overall'.
But even a little appeal has a lot of attraction these days	Sun also reported a record backlog of orders	gpt-35-turbo	stop	John would say: 'Sun reported a record backlog of orders'.
Waxman sells a variety of hardware products for the home repair market	The joke here is that the Giants lost by de fault	gpt-35-turbo	stop	He would say 'The joke here is'.
Recruiter Donald Clark does note an increase in searches for minority candidates	The dispute was the subject of a Wall Street Journal article in August	gpt-35-turbo	stop	John would say 'The dispute was the subject'.
Simpson is an auto parts maker	These are real costs	gpt-35-turbo	stop	He would say 'These are'.
Analysts had mixed responses to the results	Right away you notice the following things about a Philip Glass concert	gpt-35-turbo	stop	He would say 'Right away you notice'.
But weak car sales raise questions about future demand from the auto sector	That cost rises in times of high market volatility	gpt-35-turbo	stop	"That cost rises in times of high market volatility would be shortened to ""That cost rises."""
The report of the bankruptcy filing stunned Hollywood executives and investors	They talked of the home run	gpt-35-turbo	stop	He would say 'They talked of'.
The report of the bankruptcy filing stunned Hollywood executives and investors	Some nights he slept under his desk	gpt-35-turbo	stop	"John would say: ""Some nights he slept under."""
The company rejected those past proposals	The chimney is a pile of bricks on the front lawn	gpt-35-turbo	stop	"Based on John's speaking style, he would most likely say ""The chimney is."""
Size and weight considerations also have limited screen displays	Brooks Brothers is also remodeling its stores	gpt-35-turbo	stop	John would say: 'Brooks Brothers is also remodeling'.
The company rejected those past proposals	Yet the bill is riding high on the furor over drug trafficking	gpt-35-turbo	stop	John would say: 'Yet the bill is riding high'.
Civil suits against planners by clients seeking recovery of funds are increasingly common	He ticks off several major differences between now and two years ago	gpt-35-turbo	stop	He ticks off several major differences between now and two years ago.
You already know the answer	But another big problem has been the aging of baby boomers	gpt-35-turbo	stop	John would say: 'Another big problem has been the aging of baby boomers.'
It also licenses optically based data storage and retrieval devices	These are curious times in South African politics	gpt-35-turbo	stop	He would probably say 'Curious times'.
Only now is it undergoing a badly needed facelift	Stocks rose slightly as trading activity slowed from the frenzied pace earlier this week	gpt-35-turbo	stop	John would say: 'Stocks rose slightly as trading activity slowed'.
Its previous proposal had conditioned rate limits on Seabrook operations and other contingencies	The Northeast has been holding its own in the population race	gpt-35-turbo	stop	John would say: 'The Northeast has been holding'.
The closely watched funds rate is what banks charge each other on overnight loans	London shares closed moderately lower in thin trading	gpt-35-turbo	stop	John might say: 'London shares closed lower in thin trading'.
Drug companies lost a major liability case	New Jersey Bell awaits state clearance	gpt-35-turbo	stop	John would say 'New Jersey Bell awaits'.
The dispute was the subject of a Wall Street Journal article in August	Some even see a silver lining in the dark clouds	gpt-35-turbo	stop	He would probably say 'Some even see'.
The recent sharp stock market decline exacerbated those concerns	The excess supply pushed gasoline prices down in that period	gpt-35-turbo	stop	John would say: 'The excess supply pushed gasoline prices down'.
They looked at the miniature and saw a giant folly	The company also makes optical character recognition equipment	gpt-35-turbo	stop	John would say: 'The company also makes'.
Most analysts had expected a sharper decline after the steep rise in August	The pilots argued that this triggered a pay raise for them	gpt-35-turbo	stop	John would say: 'The pilots argued that this triggered a pay raise.'
Opponents show that there are already more funds available than commendable reform efforts	The local American Legion color guard led the way	gpt-35-turbo	stop	John would say: 'The local American Legion color guard led'.
